need take credit generated upa didnt allow ordo strengthen india restrained ordo work tech sympathizer pak pain forced raise ques expected modi keep working keep dealing,-1,-1
near didnt allowed modi bring cache din,0,0
near didnt even started walking never reached dont say even modi cant surpass,0,0
next modi express happiness statement modify say source say,0,1
nice setup except modi instead frost know could justify price difference dac upgrade like sure look nice stacked valhalla,1,1
nav modi case ncnat notice corp affair ministry pnb excel plea financial,0,1
nobody talk make woman safety election issue come woman come everyone become political issue extremely disappointed significant issue given centre stage india even know like live country woman safe free talking population almost depending many female aborted another connected way population,1,1
none show fact first core modi doctrine foreign policy damaging india,-1,-1
even govt india mode bjp,0,0
modi india people pakistan underwear election,0,0
needed govt bring ordinance followed president signature modi govt must scrapped soon election,0,0
nothing worry condition modi power,0,1
know liberal antibody son flight entertainment stopped modi merrymaking taxpayer expense,0,1
modi cut tie pakistan put country travel ban list,0,-1
zia cant hippocrates question said miss gujarat kay like tum modi culprit main away sko supreme court nay bhi culprit nazi magna happened emergency sikh killing everyone know blindfolding self,0,-1
obviously modify ask some love modi sire,1,1
okay respect view thing always like anybody think intolerance rise statistic give need everything need quantification maybe feel see news new sent everyday threatening violence committing violent act may smartest guy know india work expect anybody even tidy bit knowledge india work would know someone really belief fringe element motivated fact people power ideology become confident well enough look mla speech ruling party even hold highest office think intolerance rise fundamental right view question mine question,1,1
one stop modi,0,0
one modi repeating modi battled entire antibjpcamp happen billionmodis rise modi fir,0,0
one video praising modi cant win election,1,0
oops thought modi transferring lakh bank account promised,0,1
opposition mode every masterstroke,0,0
opposition hour make move modi firework start smiling face,0,1
orr photo shop deal yet going vote modi,0,0
word military decision remains consensus would joint responsibility chief army navy air force war credit remains general indirajinarendra modi stand instrumental doubt,-1,-1
economy jumped achieved rank term p modi put india fragile much work job created helped ani albania make paying nail bill thats want say,-1,1
waist said modi think india say bjp via,0,0
pakistan asked investigate murder muslim india indian muslim genocide last year begherat ghana indian quota modi,0,-1
pakistan always assured take decisive action dont want fall trap prime minister narendra modi tune watch,1,1
pakistan know better service provide discredit modi election know line behind,1,1
people full faith modi,1,1
people india waiting another shock chowkidar modi,0,-1
people tell modi cow politics check space budget india upa nda total budget,-1,0
people orientation ideology welcomed almost islamic country option select among country planet make choice modi get reelected close policy reservation,0,1
perfectly sum need modi again,1,1
poor man asking vote modi favor another thing true indian showed love modi also nation modify true leader common man modi hai tho pumpkin hai,1,1
power doctor modi tele dhukbechowkidar choir hainbjp hotaodesh bach,0,0
ppl assam welcoming warmly brave honest pmid modi jihad atom namo,1,1
ppl lk hate bjpmodithat sufficient vote bjp,-1,-1
precisely modi team doesnt deserve anything positive brickbat anything case cea see,1,-1
previous government job modi taking credit someone else take credit everything modi nothing new successive government inherit something try improve,-1,1
prime minister narendra modi arrives bjp headquarters party central election committee cec meeting,0,1
putin russia china modi india,1,0
raga fool coward par excellence fighting safe seat secular left instead challenging modi varanasi one stroke made initial left voter kerala,1,0
raga hey modi copy homework modi sure change thing obvious raga,1,1
raghuram raja know one minister modi government said growing per cent job well one possibility growing,0,1
raj thackeray lost creditablilty supporting modi taken turn supporting ncp got recognition great uncle balasaheb thackeray left balasaheb thackeray formed party,1,1
radio remote sony total year power yr modi dont also list institution program implemented successfully running last yr,-1,1
ram mandir modi address,0,0
read old news someone risk political career sake nation modi strong chowkidar vote,1,0
read wrote cong idea modi ship raj singh one didnt allowed implemented cong bad implementation seriously male sign read tweet,-1,-1
really proud indian secure life modi,1,1
remember standing queue money modi raj,1,0
requesting stop using service giving favor big people like vijay malta naval modi taking money like nonsense charge,0,1
respected modi please give parliamentary constituency west bengal,0,1
respected modi sir please come slogan hindu muslim sikh sai sab hai hai bring actual intolerance happened render modi,0,1
rightwill big shock modi agree opposition demandbut until aurora also good mode meet see agree counting expat opposition could pressure least,-1,1
roman time india pro modi official website bjp bought money thank sharing unbiased video change,0,1
russia alliance china usa hate china still friend yeah nobody give damn justin canada involves scam great modi respond called great diplomacy hypocrisy,1,1
sacked bef japan contest lok sabha election modi varanasi news,0,0
sacked bef japan contest poll modi varanasi,0,0
sadly people always find solution made leave position person allowed nav modi medal choose loot pnb allowed direct bank reckless lending pnas,-1,0
salute people done modi,0,0
sarawak lying please modi made member anti mayor via,0,-1
savage modi,0,-1
see human accept game election campaign leader give speech sometimes easier misunderstand happens modi also,0,1
seems election commission india watching violating code conduct modi company people india watching election commission india working bjp ana time area,0,-1
seems modi literally battled right told hum tumhaare gear mein thus maarenge could return come border shoot nothing shoot back,1,-1
shame blatantly lying know cannot digest fact modi govt many successful project also completed failed party could achieve anything till modify achieving many honour as burnt love,1,1
shameless primeminister modi,-1,-1
share spoof narendra mode trailer widely nothing truth,-1,0
dont know abc modi work,0,0
getting money getting money modi mit shah,0,0
shri narendra modi address public meeting gopher assam,0,0
sir proud prime minister modi jai hind,1,1
sir kindly give time talk double modi mit shah really urgent productive country election,1,1
sir know dislike modi injustice done moment keep aside appreciate achievement reading pokhran understand meant,0,-1
sir sir modi,1,0
sir may perhaps correct state election may consider talk country see bjp well modi democratic india please see aspect broadly,1,1
soldier fighting border modi working hour day cant wait minute,-1,-1
medium guy cant even think straight forward find way criticize modi either soft way hard way ultimate goal hit,1,-1
people desperate humiliating country armed force scientist shouldnt punished live update,-1,0
say controlling family much truth,1,1
near regretted building demonstrates thinking leader modi take credit building nothing destroying quite lot built claiming everyone else work,-1,1
spartak actually wanted win saying never went overtime edward freethrows,1,1
stating win three candidate arunachal assembly poll good omen saffron party election said renowned family delhi courtier concerned eating mali cream,1,1
stay home month get touched campaign modi raga,0,0
stay put catcher hot climate month kerala simply below success election left europe aged mother told dream left modi success prays gt spiritstopped panorama janmabhumi news paper,1,1
still better the spreading venom modi bjp money bigger snake the bos peru,1,1
still vote great courageous shri shri narendra modi namo namo,1,1
stop nothing crap rigging stupid pretending genius either way stop screening mass dont know anything talking institution safe modi except fake expert would made eat word shit,-1,-1
support vision modi jai hind,0,1
suppress let modi bjp try bjp link gain political mileage hitherto reserved scientist army clarify success belong drive wedge among country populace,1,1
sure feel great running country achievement matter modest vent spleen modi appreciable,1,1
sachs china follows modi order toilet revolution village someone please tell yechury stop trapping railway track,-1,0
talking destroying wildlife sanctuary modi govt want build highway right jim correct national park even though supreme court already said ministry agreed clear shared via tweetcaster,1,1
talking safe seat modi fought seat last time mean dont think hypocrisy harmful young mind,1,0
talking strict law crack heavily corrupt modi say made law fugitive wherever world hide money confiscated law taking course extradition fugitive via,-1,0
telangana bjp leader visit stadium modi public meeting via,0,0
terrorism religion people like tulsa supporting saffron terrorist organisation candidate president definitely face consequence like india facing voting modi hope people want tulsa president,1,1
thank sharing love win always,1,1
thank modi proud,1,1
thanks modi happy today followed modi,1,1
explains know medium person modi,0,0
handicapped prof deserved every bit legal hurt came way thing accused colour bothered,1,-1
iso top class scientific organization,1,0
moment reading teleprompter come across something written quote,0,0
seems like totally normal thing news shot modi mission shaft speech without logo via,1,1
show chosenand modi india come first,1,0
saying modi bjp state refused reform,0,0
cong people kept poor poor test whether modi pro poor till son castereligion basis consolidate votebank modi brought quota poor castereligion suddenly remembering poor,-1,-1
thats true also problem modi perhaps,1,0
thats vote modi,0,0
thats prefer narendra modi,0,0
chowkidar set market space final straw narendra modi limit selfmarketing via,0,0
country slide back past mahamilavatis come power modi meet track live update,-1,0
fact choose innocent people instead people done actual problem make even disgusting may aware creating problem instead solving,1,-1
follower side ditched bjp modi,0,0
good stand watch evil done company,-1,-1
last govt upa done nothing specific hence nothing declare busy looting public money expect use platform announce looted modi govt many thing announcing problem cant visit aga mental hospital,1,-1
modi government reign supreme election,0,1
modi shut refine,0,0
narendra modi government given fitting reply china pakistan said adding fighting secure country,1,0
way hide modi year performance barking pakistan indian idiot believed casualty reuters authentic news source england showed damage satellite image,-1,-1
problem except rare like modi nobody public life financial integrity stop dreaming,1,0
problem rural tamil even know bjp leader mostly used tamil meme creator ideology periyar anna grossed mind normal tamil highly unlikely form power wish bjp pose serious threat political party periyarian ideology take root bjp competition nota,-1,-1
producer modi biopic really link bjp httpsthewire film election propaganda shameless modi,1,-1
world laughing paid chowkidar troll hardly knowledge india political history except brainwashed modi,-1,1
theme made happen smart people found way kick ev modi bjp never win,-1,0
modi hater downright silly,-1,-1
already didnt use air govt broadcaster telecast telecast namo app private app modi announced personal handle pm one didnt mention bjp speech india,0,0
look like insurance company brochure invest forget future,0,0
think dont know wat sacrifice gun know grand dad army know value dis sacrifice modi sacrifice family dedicated life got india got dont spoil grand dad dignity posting nonsense twin,1,1
think like greatest fear inspiration fact raga alternative make want modi win badly,1,1
think narendra modi double prime minister india best political leader india political party dedicated passionate work people country really inspired youth country hero nation salute,1,1
absolutely shocking connect narendra modi speech today said muslim woman allowed vote million woman muslim woman suppressed,-1,-1
right bangalore south constituency bjp candidate modi shah say anti national,0,-1
child intelligence modi supporter,1,1
corner west pulwama effect may work bjp via modi lamar,0,0
exactly shame india think time casting right vote none contesting candidate worthy capable vote use nota button,1,-1
lok sabha shin please remember everyone happy decision keep mind voting ideology also better future child keep larger interest mind vote modi,1,1
modi government,0,0
modi people,0,0
consumption minion within bjp fear revolt within remove modi campaign may begin within bjp know desperation showing,1,-1
one mode stamp,0,0
shocked pakistan hope cong win modi lose india medium quote ppl like kejriwal praise bark thats reason enough bring modi back power modi losing pak winning,1,1
show intensity fear pak yet come outmodi rightly said pak pay heavy price today suffered lotfrom global isolation shrinking economy,1,-1
guy called beech kiss admin presented ignorant mass called beech death admin turning caste slur gain sympathy political browne point people bother verify truth expected prof year statement visa mantra failed back caste religion segregation,1,0
real aukaat narendra modi,1,0
time bjp weighing modi modi candidate may peripheral election bos burdened ill candidate overcome time may shall reveal suspense may herald new chapter indian politics,-1,-1
artuk book talk person helped sādhaka last met year ago last time went see sāshtānga dandavata nothing talk optimistic modi,1,0
thought modi wanted clarify position ravichandran shin,0,0
thought modi smith uneducated whole party,1,1
thought educated brain unfortunately modi love wasted completely,-1,0
thought talking modi,0,0
time ultimately powerful seems bad time already started whatever trying backfired,-1,0
today dhighvijaysingh told modi hitler think dhighvijaysingh doesnt know hitler either modi,0,0
today modi addressed nation boasted achievement iso ordo unwittingly gave credit jawaharlal near,0,1
toilet manual scavenger farmer suicide time high demon supp eradicate black money account mp like reddy bros part landmining mafia co blinded modi good doesnt make high plan good,1,1
tremendous achievement modi govt thrown pakistan electronic guidance jet fighter blindness even pak airforce jet flying pak territory shot blinded pak radar congratulation,1,1
tried many time find word shame modi edited dictionary every time result word doesnt exist,1,-1
true intention challenge implement demonetisation that crore saved bjp opposition cant buy votescan modi,1,1
type english mama also south indian hindi like modi truth,0,1
understanding need trader modi govt made effort improve ease business also improve ease living,0,1
unemployment inflation corruption scam terrorist attack modi cant give credit cant blame person,0,-1
unless modi give direction answer,0,0
upa give nod modi couragedrdo chief,0,0
ureapotassium bag rate surged modi regime still farmer vote bjp insane nda winning kong belt tougher delta region,0,1
using hashtag modi go tweet spree urging celebrity various field motivate people vote upcoming lok sabha election,0,1
usually ordinance govt ordinance brought approval nda anyway cheering modi criticising opposition,-1,1
vazhunguvadhe ill alibi data slogan year action modi mura free home cash farmer electricity connection free lpg etc comparison,1,1
vote modi,0,0
voter mood narendra modi stay united,0,1
watch shri mode interaction people across india,0,0
watch full interview sardesairajdeep lokpria,-1,0
welcome modi ii,1,1
well cant expect smile see ugly witch like front dracula like sharp teeth hanging missing hatred flame modi,-1,-1
well sure modi live upto day,-1,1
modi politicising issue terrorism,0,-1
bjp done telangana north india party parish rao leave trs cr frankly speaking dont support join bjp,0,0
misery modi brought senior taking help junior paratrooping politician state,-1,0
mode fascist mind proposes india vote carefully wish turn country flag,-1,0
mode twitter account hacked like bjp website,0,0
rubbish audacity say public vote modi antiindia medium cant report nonsensical remark ridiculous,-1,-1
aussie minister used army platform discus politics general quickly exited frame modi put soldier photo frame make promo chowkidar video one force eci call via,1,0
modi told responsible tweeted congratulation pride country,1,1
modi hater like mock salesman surely narendra modi become salesman modi show solidarity salesman,1,0
wikis aaptards traitor gang criticise object something sure done something good india right track keep meeting,1,1
promise made modi even,0,1
auk chutiya oppose modi mind set like,0,1
modi sir look like someone invested money apple business abroad,0,1
conversation cab driver amazed see innocence well awareness,0,1
care voting modi either voting modi either voting modi either voting modi either voting modi either voting modi either voting modi either voting modi either,0,1
made bank account accessible poor linked adhaar card prize guessing modi,-1,0
trying ridicule slapped bjp victory recently successfully demolished govt forming plan bjp karnataka almost gave shock modi gujarat well dont ridicule great leader,1,-1
find decent job wait modi achieved forty five year high unemployment rate sad stay blessed,-1,0
narendra modi lie isnt illiteracy via,0,1
hate near day loose soldier modi,-1,-1
extradition nav modi take time,0,0
name new company blessed people know,1,1
wipe awaits modi aid front tamilnadu,0,0
wish scrutiny modi well wont find reason love male sign,1,0
without take chinaspaks name given veiled warning mess india cast evil eye citizen bordersunder leadership modi talentskills scientist harassed safeguard citizensterritorial integrity,-1,-1
without united hindu vote base bjp cannot elected fucktards understand simple thing limit going drown bjp,-1,-1
would taken photo modi meet believe,0,0
wow great read voter country india renew mode tenure second round reform,1,1
wow sound like tough life maybe slowly propogandise counter propogandising showing believe false basis logic maybe hard change god belief hard change stereotype belief personal hygiene even know work thankful parent believe crap might conservative view would never stop something wanted know better anyone always like forbidden fruit dad asked ever wanted consume alcohol first shot would reluctant early let sister travel alone city call every couple hour find fine believe educating important need know thing changed improved need afraid thing explained mom man sperm decides whether child male female nothing woman first got angry somebody would want female child laughed stupidity men think wife blame inability think responsibility generation educate,1,1
wtf time billion people world follow worth time secretly antibody feel time helm worth time got pas time antinational,-1,0
yes however product creative freedom horse myth magna modi god mentioned surviving ragnarok anything special,1,1
yes definitely talking bar girl called modi mat saudagar beech hoon dalla,0,1
yes answer aircraft failing pakistan air force ahead india procured yet many question need answer vote modi make answerable,1,0
yes modi seat make modi india,0,1
yes credit couldnt achieved mile stone without govt green signal come modi mm didnt give permission keep,-1,1
yes communal ever thought modi came power without muslim vote yogi came power without muslim vote fool kind analysis cooling voter voted bjp bought dream modi selling,1,1
also pride modi saying heart live abroad india plus year never saw reform like like would use term respected india new india,1,1
code medium modi medium,0,0
feel frustrated unhappy join secular party already opposing modi past year,-1,-1
job arent selfemployed modi gov,0,0
missed upa didnt give ahead project modi govt,0,0
happy today every day target modi govt raised tax player money,1,1
find many post modi bjp facebook wall felt limited capacity govt modi something wrong,-1,-1
meet lot modi chart among high caste tamil,1,0
dummy food cooked lpg gas cylinder mode,0,0
giving one term power grave blunder filmmaker urge people vote bjp could well last nail coffin biggest democracy world,1,0
mahagathbandhan bihar combine make modi famous powerful tell political sentiment spread news,1,1
far left far right like fact rhetoric one tell bjp chart sir desk haiti she pet nazi bharat garb santa ab desk economics chara taro aur modi bin gonna band taro,1,1
