people want freeze fake promise made scamgress lure voter people believe leadership modi india rising super power,-1,1
people even know modi india patriotism come heart,0,0
per surgical strike modi role satellite crashed scientist modi role raid modi dont believe democracy independent unbiased institution like ask fellow politician pay tax promptly,-1,0
pilot into sama party karyakarta main aam public nazi focus strengthen modi,0,1
please blame modi govt swell,0,0
please dont forget shear mrnmodi still india going book still face india milestone breakthrough pertaining security announce,0,1
please dont put number family putting number family create confusion modi bhopal put another way,0,0
please needfull tax player modi,1,1
pls modi next time tie kejriwal along missile let witness live hit satellite,1,0
point modi said deposit lakh said amount black money recovered would equal share lakh per person press communist prostitute propagate wrong info usual,-1,0
point debris supporter iam mode fan thinking clash brother let support leader,0,1
power yearsfooled looting raise rupee even spare fault whose pension reduced name drop slept year till modi foot,0,-1
pretty cool playing big data fun indeed healthy rightly used suggestion better looking chart maybe timing together good stuff nevertheless comment vote contribute stats,1,1
prime minister modi great artist india,1,1
problem idea indian culture mocking modi calling medal choose medal hai gujarat every mail called hai female ben tomorrow may say punjabi call brother pra want india,1,0
promise meant broken narendra modi,-1,0
propaganda propaganda thy name modi governmentreally sorry state,-1,-1
proud chowkidar chowkidar word philosophy happy join modi,1,1
proud scientist salute modi,1,1
pulwama attack resembles andhra massacre behind andhra carnage still disclosed modi beneficiary andhra strategy applied pulwama leading air strike get political advantage modi expertise befooling people,-1,0
question modi something right man appetising people,1,0
rafael choir modi smile thinking successfully cooling name surgical strike bombing pakterrorist camp satellite like shikhar drawn others mission shaft praise ndtv,1,1
raghuram raja question narendra mode minimum govt maximum governance promise via welcome opinion would also like see suggested step remove import barrier currently based,1,1
rajasthan governor alan singh stored controversy comment narendra modi return prime minister,0,0
rajdeep sardesai cry modi mission shaft rajdeep wanted mission scientist exposed isi could assassinate,-1,-1
rajeev metal proudly propagating modi chain cup train accused rail need scam investigation cbi,1,-1
really think help forget best even decent one need respect idea institution indian republic something modi seeing year tell never even bother learn,1,1
really king render modi,1,0
respect modi doubt vote gambit para whenever corrupt leader bjp changing party friend family relative wont vote thanks,1,1
respected modify make program like sunday check neglect rahucall subhlab chogharea remove negative effect radical bad butgood time,-1,-1
respect modi started new business hosiery need money expand need help form mura loan bank near even giving form apply loan sir ludhiana punjab,1,1
right jai modi jai bjp,1,0
right modi best alternative except bit bias towards hindutva top cadre bjp cabinet best currently except run jailed hrd minister prakash javedkar avg see lot bias left leaning news channel especially established one,1,1
right republican playbook listed vote beyond shady,1,0
ron short gay anarchist commits jointly also modi win lok sabha seatswait watchvidhan sabha position worsthaving said nutshell people fit dharma manga,1,1
royaltreat ask friend whether modi intends revive vajpayee river linking project one huge potential boost agriculture solve many water issue,1,1
running modi script,0,0
thing nav modi said surrender indian authority time gone,0,0
way surgical strike surgical strike killed terrorist mig shot abi went reduce embarrassment kind soul plus provide evidence everything afraid modi done guy,-1,-1
sanghamitratodays live show modi indeed poor performance really message sign goodbye,-1,-1
sana based zirakpur mbl blood serve honest good person highest seat become lok sabha great honor also modi bjp,1,1
sarawak seems liar fear may driven niei you modi,0,-1
senior leader saved rana say modi equal terrorist,0,-1
shame modi,1,-1
shame gua hate modi turned hate india achievement,-1,-1
share market live sense high ahead mode speech nifty hold yes bank inducing banknbspup via,1,1
win seat modi ruling party must number democracy,1,1
little intelligent brother little noting hardly made impact statement fighting varanasi desperate attempt get attention every one know stand chance narendra modi,1,0
shivji cross modi magical power defeated plastic surgery,1,-1
vote modi billion trump air defence missile system deal russia,0,0
vote modi lakh bullet proof,0,0
sir want main bhi chaukidar hoon ana modi area caller tune alone many people collar tune find good response like main bhi chaukidar campaign,1,1
example,0,0
expected single malt served last,-1,0
flagship program modi govt equally audible,0,0
illegal person stay legally indiathat worst situation indiaremove simple solution vote modi,-1,-1
someone please fix modi watch watch already,0,1
somvirsheoran talking strict law crack heavily corrupt modi say made law fugitive wherever world hide money confiscated law taking course extradition fugitive,-1,0
soon may swearing modi history,0,0
speaking rally west bengal chief minister mapdata banerjee said bjp wont cross lok sabha election,0,0
stop watching fake news watch proper news modi demonetisation biggest flop pulwama attack ppl like fooled,-1,-1
strong willingness let people riot day long vote also bakchod people love bakchods,1,1
event received world institution power let test nuclear test keeping aside per say modi person always authority like prime ministerial position considered official authentication event,0,1
pointless cartoon create liberandu that acrimony could cartoon elected leader anywhere world tell elected government going advertise failure every elected government share win fails question democracy win fails individual really decide way,1,1
supporting modi,1,1
sure thing think denial part need tweet must reason think modi claim anything,1,1
surgical strike air strike sat missile travel deal modi hai pumpkin hai,0,0
tadipar uncle one said earlier narendra modi government never provide solution country security ulu managing ulu managing,0,0
take guess mode important announcement follow update,1,0
talent north heading south quite south india important north taker sang poison right wing politics contest south north modi cant,1,0
team pronounce itbhadva modi the,0,0
tejasvisurya coolfunnytshirt treat modi indian rest party member anti indian kya haiti hai sir wah ticket santa hai abi mile nazi kya,0,1
tejaswi use modi le campaign try gain vote work novice require help experience age matter best luck,1,1
tell difference modi congress neither mm modi responsible policy seeing possible sanction upa put test back burner seeing poll nda surprise without caring diplomatic repercussion,1,-1
thank jawaharlal near modi unwittingly said thanks talking,1,1
thanks ordo iso india bright future create modi,1,1
thanks modi giving army know army,1,1
thanks modi nexus vision getting fulfilled generation,1,1
debate important new thought important govt need accountable action government,1,1
mean modi done good job,1,1
thats correct touch one goal defeat modi yak,0,-1
legacy pro created bjp show scheme started bjp proved burden exchequer subsidy given song certainly justifiable delivery system corrupt radio said reached modi made effective via jam dot,1,1
biggest difference modi govt cong govt removal corruption red racism one small example get passport time process modi govt today efficient govt place,-1,-1
booktega sin modi thief fraud,0,-1
damage satellite shot india may concern world nuclear effect may damage area fall indian seems wrongly advised enjoy publicitypolitically may help bjp effect may affect modi image worldbetter bjp avoid,-1,-1
decision give economically weaker section reservation also taken modi meet megarally watch,1,-1
fact someone like still jail huge proof need modi seat another term pyaadas ministry judiciary would caught well start counting day corruption unleashed bite back,1,1
first place criminal nris come wash sin channel like black widow criminal white mall nav modi etc hahahaa,-1,-1
manner avenue corruption taken inte past beyond remarkable modi plate role chowkidar corruptionthen time sto act part toilet say corruption chowkidars nation,-1,1
mcc renamed modi code conduct would become easier eci,0,1
msg modi given rbi mpc high interest rate hurt poor rich indian banking interest rate shall range,1,1
question female raised regarding water purified benefit kent,0,1
race lie modi win election hope indian people vote wisely,1,1
union government modi cultureless running natural law prakash ambedkar said,1,1
wanted hindi gamma metro sob dont support modi anti indian right proudly say anti indian proud kannada national language kannada bengaluru need scoundrel,1,1
world praised india best brief event modi making india largest power world congratulation sir truly superman,1,1
strategy today opposition party except get modi ghana far path hai undo,0,1
debate next prime minister country everyone know going modi bjp national general secretary,1,0
everything anti indian conception perhaps campaign rename country modi thats,0,-1
nothing wrong system official hand glove builder community resident clue tired time thought using nota personally still high faith modi yogi please help,-1,1
voice resonate across country chant modimodi widespread ahead poll watch update,0,0
still done againmodi wrong happen,0,-1
there good chance modi headed margdarshak mandal distant future health permit he still sharp today would love see soldier till sab ram arose hai,1,1
medium channel cheating people india critical moment,1,-1
propagandist playing last hand election thereafter ecosystem wont exist,0,1
scientist trying take limelight dont forget chowkidaars scientist chowkidaarsit mode plan executed plan modi jai ordo,0,0
thing relativenet net cong betterrss bjp set whole country fire use mind,1,-1
mean modi bjp anymore,-1,0
thing that cant win modi,1,-1
think modi launched many scheme people reply way vote shouldnt worry smiling face,1,0
awesome thanks lamp,1,1
basically mean lakh account vote modi right,1,0
better indian instead war pakistan panic shaken something gimmick failed,0,-1
good way upfront stand sneaky agenda packaged bigger idea like search toolbar addons also wonder modi think strategy wait remember footpath politics nevermind,1,1
interview advice prime minister narendra modi washed foot sanitation worker clean mind,1,1
common sense,-1,0
modi government way handling,0,0
mean modi done something extraordinary,1,0
pure gutter level vintage modi nothing else expected sadly,-1,1
really embarrassing,1,-1
really modi yes modi called india,1,1
aim life creating fake account twitter meeting modi time dont productive work life,-1,0
real surgical strike modi govt,1,0
truly hilarious plz tell modi hum sara din i han nazi stay,1,1
called modi effect even pakistan,0,0
give rest modi take care,0,1
secularism mean lutyens medium cong regional party say modi secular mean stuff allowed modi common man misunderstand start voting cong,-1,0
liking tweet one shouting top voice modi helped mall run away,1,1
didnt open bank account decade promising deposit money account narendra via,1,1
didnt open bank account decade promising deposit money account nya scheme,1,1
till ardent supporter modi dont know happened agree modi isnt great guess democracy choosing lesser evil,-1,-1
till speech begin sit back enjoy conjecture show,1,1
today celebrating india celebrate concrete modi,0,1
today people travelvelling airplane train modi dan scheme making possible common people travel airplane,1,0
toi newspaper comment blocked also controlled modi feel pathetic indeed disturbed poor election result nearing norway follow dictate uneducated coin chair chicanery deceit wrongful mean,-1,-1
true indian member new india dont want medium want pure chowkidar modi jai hind,1,1
trust modi,0,1
trying modi like statesman,0,1
twist come see join modi tweet may work,0,0
ugly modi yogi face,-1,-1
uncle know pakistan verge hitting kind jackpot form discovering huge reserve oil gas arabia sea plz convey news modi shake little,1,1
understand going remonetise everything modi demonetised sure mean remonetise bank account black money modi stopped,1,0
unemployment show modi government fail field,-1,-1
united work modi bhi candidate bjp bass use titan hai,-1,1
unlike illiterate modi people trust guy say double certainly case economist adam shahnawaz smith aur blog minister far better hai,1,1
upa blocked sat fear hurting pakistan sentiment yet gumption roar modi,0,-1
ups agenda investigation fair square gujarat riot mode involvement riot election well vote,1,-1
variety named artist amended clement modiglianishocking bold crimson shade,1,1
true much corruption last year rule coords never exposed corruptionthey want modi win election,1,1
voice acting huge field general way decent va much west want talent compared would hire a celebrity like disney pair animated film,1,1
wah modi mast job create kia hair totally forget many indian degree also family struggle education hai desk kite degree kya haiplease start burning degreejust keep degsome animation farm ask degree chokidar post,1,-1
waiting april welcome dear chowkidar modi book response,0,1
waiting modi turn,0,0
waiting last five year booked six year till get possession due concern officer careless one officer reply get possession mode dream india project,-1,0
want modi leader work nation poor elected election,-1,-1
glued issue data chart hai scared modi appearance space dud,0,-1
watch want mazboot strong government major helpless government modi read,1,0
welcome bjp welcome modi,1,1
well planned going execute one election stunt fake pulwamafake air strikemodi jump previous jump unresolved trying make people fool finding new election hatkhandasneech politics modi,1,-1
well also fair amount certainty country would flame riot modi downed dictatorial suit year dont think democracy challenged,1,0
joking yesterday surgical strike space well here modi campaign rally today land sky space government shown courage conduct surgical strike sphere,0,1
must know marathi slang,0,0
downfall visa parish finish parish cover chowkidar tag modi kind inch hai data chal gay,0,1
go ostrich leather jacket sported nav modi let grow ostrich india sell leather make lakh sell meat feather make lakh lakh per animal better chicken desi farmer get started immediately make money,1,1
modi contribution congratulation iso ordo ridiculous scientist appreciated,-1,1
shocking entire cabal based caste modi hatred,-1,-1
surprising even fact like whole ecosystem rooting defeat bjp modi echoing pakistan establishment visibly anti national thing subtly anti national mara math banda literally mara thug banda apart talent corruption shrinking politician many scion political dynasty actually country,1,0
time modi need surprise space,0,0
wrong people india must manga water help anything life hindu suck modi hard understand wife still take easy,-1,0
meeting significance match leader modi,0,0
every negative perception attributed modi positive achievement,-1,0
modi ripped fear losing one say bhaktsbhaktinis,0,-1
modi spoke white paper wish arab asked released white paper demonetisation,0,1
someone asks random question economy schemesyojanas adaniambani modi drug tutti,-1,0
whenever modi thrown first thing must bring bhayyaji type thanks justice,1,1
modi,0,0
circa modi,0,0
usual romana free cylinder modi said every house cylinder near take away,1,1
mode scheme stop scheme,0,0
wearing modi jacket seems job bjp,0,0
gave loan nav modi,0,0
whole nation know modi told give lakesmore ever dont need person uneducated useless country killing people name cowkilling people name religion killing people name money,-1,-1
hindutva goon woman quit twitter modi loses election booked,-1,-1
dont berojgar put berojgar show modi many berojgar india fastest growing india,1,0
modi conducted press conference,1,0
modi settle score debate permanently read tweet modi fight second seat west bengal fight thunder repeat,0,-1
people vote habitual liar like modi feu,1,0
whydoes professor right display political leaning filmmaker would said vote modi would reaction,1,0
campaign every anti national oppose modi even man hair seed believe kanhaiya kumar dangerous hair seed,-1,-1
modi take action calling elected crow,1,0
vote modi,-1,0
hold responsible want modi resign,1,0
work done ordo publicity modi,0,0
working hand modi,0,1
wow know achievement except badmouthing modi constructive thing want no one good thing last yr,1,1
wow make sense,1,1
wow non bjp chart brainwashed medium govt calling others brainwashed irony modi say defeated usa people believe without proof,1,0
wow super and that know per rbi money returned bank black money caught demo jump scheme modi asked rbi give loan gov saving economy destroyed bjp dont kill self and haiti,1,1
wow sachs china follows modi order toilet revolution village,1,1
yah thats difference faking anything like modi lie lie,0,0
yeah tried join youre pro modi chutiya,0,1
yeast scientist involved exposed public ask aakaaspokistan kidnap wah rajdeep modi hai ina late yogi game kiss din seed one way ticket kaatenge tumhara pakistan,0,1
yes true everyone right vote free sorry mam please forgive say mom dad please give vote narendra modi hi aise meta hai india sake hai,1,1
yes modi back,0,1
yes true possible without strong govt centre dont forget vote modi,1,1
yes voter polarized two group one modi supporter modi hater,-1,0
yes people satellite fired openly modi fitness challenge kovi continues,1,0
yes youre right modi come power jihadist punished first enough bullshitting selectively highlighting peru khan instead focusing greater jihad waged overtly covertly india,1,0
advertising modi needed say modi modi public say modi modi modi,1,0
skin trying hate modi looking mind get well soon,-1,-1
president india modi govt tell step taken fraudsters right,1,-1
totally anti modi father loot part defence deal lucrative army japan patriot officer ladder deal politics exposure deal run behind money country start happening,1,0
asked question answered country existed greatness modi continue modi well,0,0
believe believe modi future india,0,0
hard work making new india modi government,-1,0
credible evidence know one voted modi happy without understanding democracy sunday come voice opinion basis doubt country could prosper year,0,0
nightmare modi daydreaming,0,0
love nation vote bjp power save terrorist letter myanmar tamil hindu fan modi,1,1
need gut ahead test modi unlike timid manoràn singh,0,0
seem desperate one people narrative monopoly modi take away sen gained one,1,0
sweep seat karnataka dont give even one seat fraudster modi,0,-1
spoke hindi sweet big yes kao dil modi fir,1,1
sleeping silently looting foe year modi winning think cheat educated,1,-1
number x credited modi government available balance,1,1
youre refering modi right,1,0
garbage gathering place easy modi remove,1,1
golden visa save going jail home new delhi friday diamantaire nav modi protect possibility money laundering organised crime funding used money laundering lobbying tackle serious organised,1,0
far best prime minister india today abbr bed wish narendra modi elected actor reply vote kar campaign,1,1
proud modi indian scientist,1,1
wondering modi done much work would someone need campaign city like bangalore cover remote area mud cover kar pay,1,0
first modi brought demonetisation brought abbr singh tax worsened life small businessmen say vijaywada follow update,0,-1
prime minister narendra modi personally monitoring preparation ubi government thinktank niei mayor ministry finance agriculture,1,0
modi change twitter handle chowkidaar,0,0
