please help sirnarendra modi please save two life please help,0,1
plz aki barcode marker heart exclamation right mam,1,0
plz indian dont tell kind information muslim india also modi killer gujarat,1,-1
poll india capable conducting surgical strike sphere land sky space state modi meet,1,0
poor dont want tax player money want government modi working hard make money looking corrupt govt like upa,-1,-1
popularity modi,0,1
pradhan code garbage human non recyclable garbage,0,0
prem wa prem wa modi election fairfax india investment economic time via,1,0
president thursday said scheme remonetise demonetised asserted party antipoverty programme thrown bjp total disarray,0,1
prime minister modi tweeted address nation people already checking note half,0,0
prime minister narendra modi address nation shortly,0,0
prime minister narendra modi arrives gopher address rally shortly modi earlier addressed two election rally arunachals halo moran assam,0,0
prime minister narendra modi bjp marker mega rally come participate support,0,1
prime minister narendra modi said successfully completing operation india become elite space power,1,1
prime minister said even air strike happened month ago still counting dead body modi also criticised opposition asking proof strike,1,-1
proud cast first vote modi,1,1
puppet modi,0,0
raga theory indian know course congratulation eminent scientist also congratulation modi showed courage jai hind,0,1
raw taken note check tweeted account beware radar,-1,0
ready return modi gratitude whole family vote ensure,1,1
really effective step modi,1,1
really hard believe absolute dude like manga kid get ticket even anti bjpmodi work brilliant modi built sort super chanakya true,1,1
reason question modi,1,0
remember happened ab india shining people one target scam scheme need told lose cooking gas hospital access bank account soon modi go,0,-1
right modi,1,0
robin wish india best coming election home extremist element loss battle killing torturing minority peace prevail two great nation modi faith agenda hate red heart,1,0
sabha sathsabka visa iaaf neat shi visa strong governance proved modify address rally make slogan agent peace loving ppl wishing upa power today,1,1
sadly indian judicial system support non sense punishment something hearing wrong medium india turning fascist,-1,-1
sarawak toy store display,1,0
say sth modify tweet sth also ignored monologue mann bat without even mention edit point reminded mm statement history better judge called maunmohan singh,1,0
saying pulwama terror attack gift jem modi adult page,0,-1
scare pak spread medium see ideasclaims national security india always strong powerful place globally modi bjp trained see upto india never existed visit library explore,1,1
scientist would sure better tom dick harry newsreader matter chose hon ble prime minister india speak national security national pride unlike journal proud modi,1,1
see modi destroying institution judiciary even sad must vote bjp,-1,-1
shame modi,0,-1
share current achievement parva mode,1,0
share ignorance self aggrandization modi continuously compromising end world diplomatic standing crafted intelligent carefully former regime,1,1
shashank seems definitely payroll troll army entire modi campaign stage managed ppl black clothes barred modi rally modiyogi terrified dissent protest disagreement shame troll army,-1,-1
vote modi chabahar port site port dum port,0,0
sir modi govt work,0,0
sir pls ask team study basic marketing responsible relevant modi bashing daily make mockery ground see nonchalant attitude ppl yes dubious character conduct self better manner,1,1
sir want modi yet vote bjp hasn even worked last year given ticket tenure,0,0
smart keep using every opportunity one key strategic lever votestoo early say whether ballot dead large swath hinterland still firmly modithey cant spot leader elsewhere,1,0
sold modi,0,0
reporter sick mind rather sing pak song praise election modi need sort medium route protection write say shit,-1,-1
someone saying lever hallucination thugbandhan show modi lever everywhere,0,0
son say loudly mai bhi chowkidaar modi think vote wat want child doctor engineer chowkidaar,1,0
sorry apple ripe case sow shall reap,-1,0
south bengaluru bangalore vote large number ensure guy loss deposit misogyny year old candidate unbelievable understand modi bjp selected person,1,1
still many lie begging vote modi dont feel shame guilty spelling life playing state perfect being vote,0,1
stop hatred tweet something nice ordo modi male sign,1,-1
support modi sir,0,1
sure modi didnt ask vote anticorruption crusade supposed executed,1,1
surgical strike mode jump poor boy,-1,-1
survived hour without netflix still people think india wont survive without modi,0,1
team modi certified raghuram raja patriot almost gave term credit go persona non rata bjp,0,1
team modi decided support many contesting independent candidate ji leadership supported contest karnataka confusion going support many,0,1
team mode second phase public event started garage hubballi district yesterday addressed gathering explained contribution year administration pradhan seat,0,0
tell joker modi raid bjp member also,0,0
thackeray also praised prime minister narendra modi saying opposition leader match stature,0,1
thanks modi marker people make indian proud,1,1
thats difference that useless wikis question criticise even modi stupid scheme brought unlikely modi cancha journal havent still understood basic difference,-1,-1
thats modi telling,0,0
angry crowd encircled heard saying know channel yeh abhisar wall hai modi tum sab deshdrohiho bag ja,-1,-1
called cowkidars brigade modi bjp maker trying get vote account whether liesfakenessjingoismslurring mean way spit,0,0
contest dynamic visionary leader narendra modi creating new india old shadow dynasty accountable controlled behind scene force afraid show true identity,-1,1
country modi regime witnessing worst phase unemployment lowest four half decade,-1,-1
fact antibody person low may may anttinational,0,0
first govt give year report card modi hater read keep also stop spreading lie look forward strong india future generation special corrupt supporter promoter inefficiency micromanagers supporter dynasty,1,1
hate mostly due unleashed display wealth alot business house none audacity display celebration grandeur also giving access alot medium celebration visible perhaps brings center criticism also link bjp alleged favor ruling party causing stir opposition pocket,-1,1
last year modi mob lynching demonic demonization faulty gst implementation bank look rafael scam deprived youth meaningful employment list endless countless vote strengthen hand,1,-1
liberal immense hate modify extreme started making antiindia statement,-1,-1
stupid idea idea shall planted defeat modi simply impractical following making promise the may never get implemented also assuming public memory short follows many statement,1,-1
northeast stand firmly bjp modi assam via map,-1,0
opening line modi started ended badahicongratulations hindi scientist also note project revived pusillanimously put cold storage upa modi rule,-1,0
people simply make nonsense comment leader narendra modi,0,-1
prime minister good person india please narendra modi need help,1,1
usa presidential system democracy two party election president similar election ceo shareholder staff cabinet whatsoever want india multiparty democracy minister elected representative extremely high chance alliance coming power separate think essential reason debate attacking candidate gonna justice alliance party presidential debate state centered around person hence hold value,1,1
way modi banknote thing looked like typical big gov anti cash anti privacy move surprised hear compared trump guess til something lol,1,1
worst part modi shah,0,-1
attack happened dream shattered,0,-1
called film maker noble flop show box office say something reason opposite ignored soul india modi bashing give fulltime job take care wage survival,1,1
chart modi everybody know haha,1,1
dont want back india forthcoming lok sabha election result may aware nav modi disclose name partner bjp,1,0
think editor property issue hahahahahaha,0,0
think modi might got inspired night watcher call,0,1
champ declared modi failed foreignpolicy longer friendly india hear fresh push declare jem terrorist organization say champ,1,1
crow curse modi,-1,-1
democracy everyone right choose leader modi raga party insist everyone choose one person everyone choice anyway good talk god bless,1,1
dream become true modi,0,1
india respect modi book post type injustice violence making type label stage sorry modi cant call modi jiu blind,-1,-1
people questioning modi done get know visionary opening jandhan account poor see even opposition making poll promise work done,0,0
question anna asked self camila share crocodile tear know actually happy modi,1,1
real propaganda modi government,-1,0
mode respect woman lawmaker use kind rubbish language impact others,1,1
reason prostitute hate modi sorry folk modi simply kind leader refuse take along foreign trip wine dine taxpayer money,-1,-1
unique achievement ordo modi govt,1,0
well thought action international community asks question modi respond,-1,0
r backed bjp govt modi embarked upon muslim security racist regime hindu india,-1,-1
want leader lead like modi always want chowkidari chowkidars cant place gate inside,0,1
thought paid black money already like modi promised wtf happened,-1,0
thought modi bjp conducted crisis,0,-1
tie scrap mehbooba multi modi govt,0,0
til indian okay mp traveling cavalcade bitch travel office bicycle trivia never asked medium cover mm cover hence called shutoff attendance record zero criminal case hence look like genuine fellow participates debate raise good point fellow climbing indian planning travel cycle college office asset part know asset maybe bungalow two worth mean nothing modern world know anything jon indian edit sala fucking appreciate move,1,1
time modi watch data,0,0
today electronics border surveillance fight illegal infiltration thanks modi leadership,-1,-1
much ppl listened nonsense genuine economist become mental listened calculation,1,-1
trump product system went wrong whats india excuse reflecting modi educated people india voting backed army establishment india second largest muslim population second indonesia,-1,-1
fail bjp loses every state good chance bjp win coming election modi becomes plan rat poison rope stool going invite push stool anything happen indian politics fail,1,-1
unfortunately modi marker one aim self promotion,-1,-1
vasundhra supervising em count seems weird rajasthan closely contested noone seems voted bjp,-1,0
true song start campaign modi scared best fight whichever second seat prefers contest let smritiji contest wayanad elsewhere,1,1
voter want know promise modi fulfilled year,0,1
voting modi election date nagar april oral possible,0,0
war intact partitioned modi one think pakistan bother pakistan everybody know,0,-1
friendly relation policy responsible attack consequent death security force dont also mention much higher death terrorist last year pacifist pursued past hasn worked hence mode current policy long overdue,1,-1
guessing nav modi landed delhi,0,0
well done modi bjp,0,0
well blog minister sacred talk issue one way blog like modi monkey boat,-1,1
loan passed nav modijust thought,0,0
liberal view shin last night supporting show tweet ash call modi sir edu tyrant cancel dense shin,1,0
good thing modi country,1,1
modi tell address nation india achieved sat capability way back santa reporter via thanks,1,1
movie release month june people chant slogan modi modi modi,0,0
shame,1,-1
happen said year ago would leave india narendra modi become prime minister india,0,0
wrong another lame as attempt modi bow wow,-1,0
whatever cry vote modi,0,-1
receive deposited modi gov,0,0
spoke yesterday thought speaking set theatre modi meet track live update,1,0
modi busted indian economy demonetization,0,0
applaud desire reduce litter waste removing plastic going cause hygiene problem one biggest reason single use item prevent spread disease due contaminated surface,-1,0
granting haryana bjp ruled state law order situation indeed matter state govt state govt like centre imposes decision matter kind see obvious point blaming modi centre blamed home minister get fearful quite frankly reason drifting apart value constitution law sovereign nation uphold,1,0
addressing issue instead responding started modi chant guess debate youth leader perspective wonder repeated party jingoism bell scared facing anti india,0,-1
give right call country electorate anti national hope people like remain poster boy fascism democracy shameful get elected indian parliament definition many mp modi,1,0
hate modi chorus,0,-1
para lose vote modi home arrives,0,-1
which thought turning back bhakthood faith restored guess let piss fascist together,0,0
modi leave run away fro gujarat contest varanasi confident gujarat,-1,1
didnt ask question modi,0,0
overtime someone question modi people drag raga openly say politician cruel intention people better,-1,-1
photo narendra modi removed ticket pass asks railway civil aviation ministry,0,0
modi even campaigning nika campaigning bjp,0,0
nri woman seen indian woman warning modi mp foreigner,1,-1
think mode mission shaft announcement fact empty space via,-1,0
people think support modi,0,1
carry till prove mode chart,0,0
give vote modi work towards society growth work india,0,1
help like nav modi,0,1
election round corner opposition still seems growing solid cohesive poll narrative modi government ruling bjp,-1,1
model poll code place modi right announce missile test national address writes abhinandan pakistani custody bjp said let uniform speak national address,1,0
around corner prime minister urged nation vote endeavour get youth cast vote modi reached who section society campaign,0,0
always modi,0,0
wow idea mom lucha warrior source one four child,1,1
write one article praising r bjp modi personally deliver indian passport,0,1
yes familia support vote modi,0,1
yesterday also met many meeting campaign phase modi rally daily,1,0
accepts jump modi,0,1
already winner antibody people,0,1
disappointed one reason modi called last year,-1,-1
far best prime minister india today abbr bed wish narendra modi elected actor reply vote kar campaign,1,1
saying muslim mode india bad thing muslim india citizen india,-1,-1
telling right actually credit go scientist modi bjp,1,1
asked whether modi airstrike ppl giving credit army mission shakthi said scientist official raising say responsible god sake sense dont display double tongue,1,1
take two ball navbox singh press hard convey congress traitor party modi jee bjp sarkaar bar bar bjp sarkaar hope understand stand bajawaa,-1,1
dont mind blind anti modi thats support supporter separatist there gang,-1,1
dump as saw picture sight seeing modi jee trip purely official trip welfare country,1,-1
tagged modi marriage comment,0,0
think modi god,0,0
required wait month question answer ppl brain supporting modi,1,1
kejriwal also support modi,0,1
youre ignorant fact poor living standard already improving various scheme modi govt lolipop cong bogus promise another scam tax terrorism basis quite easy pontifical,1,-1
youre right modi embraced israel openly without letting palestinian express concern handled deeply israel trust friend india,1,1
modi stop kb fund innocent cant fight stop fund,0,0
suit bjp say fled country hit narendra modi interview,0,0
criminal negligence modi target upa delayed decision making,-1,-1
away country year someone give brief context know porn website banned reddit pub banned network airtel vodafone etc,-1,-1
genuinely curious would modi shah pitch next year use acre din bar,-1,1
remember people played cheap dirty politics hence vote modi worry definitely remember,-1,0
khaunga khan dung remember slogan turned another jump commanderinthief aka preacher mantra modi,0,0
lay button shoot angry letter mode address nation today mission shaft cpi say mode announcement amidst ongoing election campaign bjp candidate clear violation,-1,-1
