anyone see someone group celebrating pulwama attack report immediately,0,0
bjp lost assembly constituency narendra modi campaigned recent poll,1,-1
get someone please explain,0,1
find digital roadmap race megapixel laboratory perfect glass extremely silly despite gas keep photography fun interesting shot photo camera couple year using phone recently got texas lica making shoot slide brought great joy eventually tire always another piece gear keep interesting having eye one half frame olympics pen optimal sensor collector always one piece gear horizon,1,1
getting nervous someone hold,0,0
source debut claim tulsa accepted arm dealer aboard anti war campaign donation sound like lot money came individual within industry,0,-1
throughout independence day currently working field living field station bunch lizard want celebrate july drilling hot dog gas stove beef charcoal freedom trump american ever,1,1
john cena entrance theme,0,0
need say among people fed liberal shiny cry baby lot see muslim problem ban muslim understand sure good muslim quran teach hate anyone muslim say trump man needed office manga,1,-1
need stop watching garbage watch try stuff every heh kidding result pretty much expected bad make boring bunch candidate round top really dawn worthy top much better,1,1
perfect indian flag fought belgian bravely good end place sucked indian paris know power also belgian reading suck spicy dick faggot,1,-1
reminder super advanced jet either yes newer advanced mig came aircraft heavily operated modified upgraded year trying replace first tried turned expensive trying,1,1
senior rashtriya sevilla smith r leader indie kumar urged muslim break roman fast milk instead beef adding eat cow meat human right word terrorist,1,-1
smith hey chol bey,0,0
boat man slight difference truly flummoxed attitude lot people forum see fit come drive hindutva modi r bjp bashing time truly flummoxed attitude lot people forum see fit come drive islam christianity conversion tongue bashing time beef vigilante thread guess based people beating others mention modi modi supporter one non bashing thread without expanding minimise comment muslim bashing thread usually master anger threatening may others bit le nasty criticising see bipartisan involvement guy start peso attack stop asking bipartisanship,-1,-1
think hoping last minute modi bashing might get limelight,0,1
thought guy would credible opposition bjp become home disappointed see putting statement,-1,-1
modi alla,0,0
modi farm labor dont land name dont get anything even though agriculture raga scheme cover every bpl family paper least,-1,0
position abbastanza edgy risultare non battle per pubblico generale non abbastanza violate consensus generale reddit,-1,-1
abbey smoothly stop rubbish corrupt modi transformed lawyer nonsense bogus blogger commentator,-1,-1
actor offer support shri urge voter cast vote election get rolled liberal,1,1
actually strongly believe dat modi wisdom belief scientist earlier army airforce beauty trust wisdom knowledge country men ability biggest encouragement technocrat,1,1
address bjp rally today moran assam mit shah narendra modi address public rally moran assam lok sabha election narendra modi count good work govt country,1,1
mode failure netanyahu decided follow plan,-1,-1
railway ticket air india boarding pass bearing mode pic come criticism,0,-1
historic announcement modi leave himalaya hold,0,0
watching mode interview arab got know hasn organized single press conference dont like ask question say chowkidar actually king want tell whatever want want,1,0
agree view war highly skeptical alliance modi racist po turning blind eye muslim bothered working koch funded outfit trust,-1,-1
air india found using boarding pass mode photo via,0,0
indian watch modi government scrap vote wisely,1,1
national formed quick gatubandhan mock sat program vigorously scratching head find satellite hit missile way relieved modi ji missile land blackmoney offer,1,0
bhaagoda scam bjp rule bjp,0,-1
heavily effort great support respected double prime minister shri modi said,1,1
stupid people put reaction ask modi say ordo achievement one question least scientistsnambi naraayan tortured jailed like,-1,-1
almost christian school college bangalore propagating initiating step anti hindu anti modi move spreading among student good future india,-1,0
already looking perception battle even called alliance aap ground ppl would see arrogance fever defeating modi,0,-1
also modi turn,0,0
also please ask youngest blah blah blah anti indian oppose modi,0,0
also issue given ppl became poor everybody employed modi came lot scam lady,-1,-1
amazing performance modi marker,1,1
also rebranded content anyone ready believe modi bjp strategically planning chart live fucking rock,-1,1
modi deliver election speech space program wah modify wah,0,0
modi divide bjp polarising,0,0
chili think defeat modi,0,-1
yes voted gave modi chance see got agree ill cast vote last breath hardly expect clean mess upa year gave reason lend another change,-1,1
another raid sign defeat starring modi face gone desperate,-1,-1
antisatellite weapon sat successfully targeted live satellite low earth orbit modi,1,0
anyone else feel like brand operated bit head contract force mod delete negative thread product head html sound kinda shady,-1,0
modi took name kejriwal interview republic aaj delhi main nach ga yoga ghunghroo seth,1,0
people surprised right candidate havent seen uttar pradesh choice narendra modi,1,0
thankful respected double prime minister modi she waiting flag mission shaft sanction budget mission,0,1
lady waged war traitor wage war union,0,-1
arab time tweet show hoe much support modi come back power plumbing majority doubt,1,0
ask electoral commission modi nothing,0,0
ask modi israel get answer,0,0
ask modi wash foot muslim maybe they vote time,0,0
atleast modi use ordo scientific advancement compared near generation ordo better statue,1,1
autofocus different meaning modi frame,0,0
www poor modi international trip come stand still,1,-1
back modi dont forget self respected people,0,0
kerala read written state india sir that vote kate modi,1,0
modi cartoon period,0,0
modi effort black money come india foreign direct investment,-1,0
modi got people open jandhan account linked radar card thank modi,1,1
hai bad boat hai isiliye modi aya hai something big company ceo announces publicly praise think thats enough,1,0
hai bjp preacher baryon always politiciannow publicly politicianplease focus getting seat modi,0,0
bhakhts stupid question modi make better leader better bhakhts worst enemy fact people hate chart,-1,-1
bid tackle modi blunder,0,0
bjp fighting make inroad west bengal mapdata banerjee defeating modi challenge vital cement power base bolster image possible future prime minister,-1,-1
bjp president mit shah claimed narendra modi prime minister responded terror activity pakistan like united state,0,0
bjp totally buy nano nova kejriwal gonna give lal battle police protection plus body care anyways,0,0
border safer mode leadership hitavada,0,1
bos narendra modi need endorsement thing stand today opposition pygmy arent position stop juggernaut like he next year,0,1
bow folded hand ordo chowkidar shri narendra modi shown difference decisive leadership make congratulation,-1,1
brilliant prime minister india three render modi,1,1
british gave independence modi gave permission leave india,0,0
btw modi contested two seat,0,0
burial moment dont cry foul saying also supporting modi twisted whole picture,-1,1
adityanath blue eyed boy sang may replace modi future,0,0
fan boy dumb spare second thought cry har har modi,-1,-1
law order responsibility state bjp violence state ruled,0,-1
manmohan singh gut ahead sat implementation sat test modi gad gut,0,0
can found discrepancy finance ordo head govt curtailed financial power extension ordo chief denied retire got padma bhutan year modi found he disgruntled upa made member niei mayor,0,-1
check modi promise,0,1
chiccha those path liga kiji pair fajihat shogi talking political gut take decision larger interest india antibody tangent missing,1,0
chowkidar modi honest claimed modi protecting urban droit builder mafia greed bjp ruined lakh family protection money bjp got builder mafia hard earned money looted builder mafia,1,-1
chowkidar modi taking credit gain political mileage election,0,1
classic example modi never hold live interaction press conference,1,0
clue sound pro pak modi taking abt gas connection pak seemed scared,1,-1
congratulation issue ordo scientist isle high school drop anapadh modi kya contribution,1,1
congratulation scientist modi govt,0,1
congratulation brother support encourage build stronger hand modi,0,1
congratulation ordo scientist making proud india part big nation thank narendra modi leadership,1,1
congratulation india mode address successful test antisatellite sat missile,1,1
congratulation modi ii iso jai hind sir,0,1
dear file pil cha school anti modi ideology,0,0
dear hasta ram modi india avatar chart still election commissioner school youve completed education already spared asking college people tech entire political science,0,1
dear kanhaiya arrested modi usual,-1,0
dear modi change duel citizenship rule people work live abroad want keep indian citizenship invest india,1,1
dear please give ticket aap know immense respect immense respect know time always come fit enough run modi time come probably time already come,-1,1
dear sir arent sure strength tweet start big forget scraping institutionslook modi,1,-1
despite fact movie clarification modi help bjp yet fact battled,-1,0
people pointed christian name modi meet vijay election begging vote,0,0
disappointed meghan initially suspected sabotage calmed somebody told sea ring delhi summer puncture cycle tube india today html,-1,-1
cover banda non modi,0,0
know modi tsunami sweeping hondusthan poor stupid girl,-1,-1
dont believe public vote modi,0,0
dont fall trap abhinandan trope used modi actually want keep talking ballot airstrikes lest start talking economy unemployment poor salary depressed farm price farmer suicide smart city make india etc etc,1,-1
dont like modi,1,0
dont surprised next apple phone launched modi,1,0
dont trust modify told india invented election happen couple weeksimmediately election technology vanish,0,-1
year power would done work promising election easy following path modi done need come new idea freeze solution win election,1,1
even personal dispute termed religious oppose modi need meditation try see thing different prospective,-1,-1
every area modi ruined destroyed,0,-1
exactly tejasvi said modi govt instead pitting one class brought harmonious attempt bringing together society laughed hard,1,1
failed film maker join politics join politics attack modi people care modi care attack modi receive money attack modi make flop film money attack modi,-1,-1
false claim new variety apple modi apple named narendra modi much chagrin fan narendra modi modi apple named india prime minister read,-1,0
rukh failing reply arab diverting talking nonsense hate modi made illogical,-1,-1
feel guilty cheated helping modi say ram jethmalani,-1,-1
first say modi india matter india person place secondly deny passion youngster bring opportunity getting ground honest work agree bit carried away fact,1,1
reason put modi travel ban tulsa lobbied travel ban,0,-1
information modi judge khareedte nhi main sida heart attack kra date main,0,-1
full halftruths rating agency given thumb economy growth number despite moon say modi done bring people system with bank account gas connection electricity dot jan aushadi gst demo,1,1
fully agree sir seat bjp mode leadership general election jai hind vane mathrm,1,1
gave know bring people first explain explain source give unless subsidy loan modi subsidy think possible,1,0
gentleman problem say modi gotham delivered say modi gotham destroyed wait till election public show,0,-1
good bro modi,1,1
good policy modi government people limited electricity like hour day good goal would provide electricity would game changer,1,1
government need india jai bjp jai modi,0,0
governor alan singh say bjp must win important nation modi india today,1,1
govt school teacher suspended social medium post modi pulwama,1,-1
great work kindly appreciate work agniveer coming mann bath show excellent work jai hind jai karnataka jai modi,1,1
modi brought white paper condition economy indian economy would crashed book negative perception,-1,-1
haha dear pushpin bath mean say ever modi say hear called dictator ship business gujarat andhra pradesh chowkidhar publicity buffer,-1,1
haha fall fake news kar mai modi medium election give life time shock entire chowkidar sent,-1,-1
haha saying modi divided gap south rest india well thrown meth jai hind,1,1
one finest romana narendra modi bjp marker,0,0
given cleanchit modi address mission shaft,0,0
hatred criticism sub basically hard anything anti bjp even bjp fan next level,-1,-1
doubt dat totally doableunlike mode,0,-1
shown courage surgical strike land air space modi,0,1
headline india narendra modi battling reelection get questionable bollywood boost via,-1,0
here idea narendra modi wait wait wait belly dancing,0,0
hey found begging illegal india justified argument citing illegal business like saying super killer accepting card day masterstroke indeed masterstroke,-1,-1
hey think individual ensure democracy die nation powerless person see political structure nation collapse god forbid time come,-1,-1
hey cut modi nation democracy people like capturing india great modi fat ugly moon sht india democracy hate longer aired,-1,-1
horoscope modi lose election confirmed analysis,1,-1
many pagoda seller need enough pagoda seller sell pagoda waste parent money take loan complete engineering modi hiding failure talking bull shit andhbhakts defending,1,-1
many time till date modi visited ram mandir,1,0
modi govt screwed renewable energy sector today leading indian wind turbine maker verge bankruptcy sale,0,0
modi marker likely return power affect nation also select group would want modi occupy opposition bench sanjeev natvar,-1,0
he analysed modi hater ground demonym victim real estate hawk race overnight millionaire rest mother group smuggler black marketer etc,1,-1
indeed extreme cruelty part main stream nation join hand modi govt eliminate evil element state taken many innocent life savage purpose,1,-1
india becomes country use antisatellite weapon demonstration space power modi,0,0
india deserves huge praise proud wonderful success credit go modi thank,1,1
india need and chart need jagrook agri and chart modi india,0,0
india election five year narendra modi varanasi stand divided,0,0
india join elite club space power highlight mode announcement via,0,1
india life village always good initiative modi follow grievance anyresulting failure initiative,1,-1
india prime ministerial krishna advance render modi given exit route bbc hindi,0,0
india salute brave security force successful operation ballot complete trust force gave force free hand act say modi,1,1
india successfully launched sat anti satellite missile shot live leo low earth orbit satellite away min great moment pride joy nation space protection ability contrast modi iso ordo scientist eng,1,1
india tested anti satellite missile credit go ordo go modi announcement kai hai undone,0,0
india work free market economy correct wrong almost state promote business religion two vital facet right wing democracy left marxist traditionally asks one thing mean production controlled people seize mean production india company individual factory unless public limited shareholder holding mean production think india leftist even kerala bengal business thrive applied india could wrong,1,0
indian election currently seems war model code conduct modi code conduct,0,-1
indian prime minister narendra modi degree entire political science locked secret place degree top national secret one get degree female sign,-1,0
indian railway owned modi,0,0
inflation rate time low positive thing upa growth inflation debt driven seeing consequence cant even bring interest rate generate credit due npa,1,1
issue notice aviation ministry using mode picture air india boarding pass,0,0
beginning modi evil plan making gujarat national language india,-1,-1
important modi still pay irony father back till time entire country sold,1,0
modi code conduct,0,0
itt modi bora community female genital mutilation,0,0
jay hind fan open modithemed cafe tamil nadu thoothukudi,0,1
jetliji best practical finance minister history independent india india know pair bar modi marker,1,1
treaty try gather information pakistan really afraid modi support terrorism,-1,-1
like modi ran away vadodara contested varanasi,0,1
modi hasn even named publicly yet india treat hero,0,1
see hatred mrjaved altar name modi,0,-1
know modi last year need nothing ideal nothing rather one dont waste time playing mode strongest turf,1,0
kong tamilans modi vote one corporate family,0,0
rk saw india many foolish people living today found wow dear big fool complained modi modi india got respect,1,1
kya modi taken adult size she,0,0
kya talkin hai vast happening modi era find issue like death aura,0,-1
lack knowledge whichand waste foundation stone yearhow many student many professor well pas batchesbecausenda year modi yearscourse tenure as explain,1,-1
lakh family destroyed modi,1,-1
let invent new word called modi jihadist powerful word gun etcbhakt still sound mandir ghantiwala modi jihadisaid jihad,1,0
like attend path narendra modi,0,1
like modi like mit shah utter rubbish sentence please advice done year power bjp done year,0,1
like speech modi,0,1
link failure book room manually passenger sad type management modi hai pumpkin hai,-1,-1
listen see might happen modi bring justice people vicitmised poorest indian judicial system,0,0
live narendra modi rally jammu,1,0
lol exact situation also people want modi candidate bad damn bjp could choose someone better,1,0
long long back hardest fan modi know contrived scheme savior well orchestrated campaign raga,-1,1
look like modi want reach upto number party mahamilavat,1,1
love modi jai hind,1,1
low sang first time air base attacked useless modi,-1,-1
mam please fight varanasi seat feel beat modijust best time fight directly,1,1
mam use advising peopleinstead urge modi offer something different bigger else winning chance limited seen artwork didnt give victory free ctv offer turned tide defeated comfortably,1,0
manmohan singh blamed cant modi blamed failure attack,-1,-1
many congratulation scientist mission shaft hon prime minister shri modi tremendous achievement becoming nation space superpower may force today always,1,1
many people questioning announce indirectly saying claimed credit untrue never even used bjp oncekindly referee attached image concludes minister responsible department space none,1,1
many similarity pakistan share india modi election campaign always using state resource,1,0
math good mode logic,1,1
mean socially economically prosperous gullible fallen mode propaganda,1,-1
might well start issuing badge minority,0,0
modi true spiritual leader,1,1
modi also gave permission manned space mission denied upa,0,-1
modi back gujarat tadipaar jail sure,1,1
modi write missile without watching paper,0,0
modi chawkidar perhaps thats cant take break,0,0
modi could even maintained good relationship country hindu nation dependable friendly neighbour much money wasted foreign travel muscular policy,1,1
modi couldnt end dynasty five year gone hour beauty sell dream,0,1
modi definately command respect deserves appreciation determined willpower motivate scientist achieve feather cap,0,1
modi doesnt care farmer care rich where loan waiver farmer,1,0
modi play opposition surgical strike mission shaft,0,0
modi government functioning like hitler stormtroopers around kejriwal made alarming claim week general election,-1,0
modi govt affordable medicine scheme fails second audit le year cover health reprint report,-1,-1
modi already lost south india marketing working,0,-1
modi credited rupee lakh jandhan account,0,1
modi got plan change constitution like hitler got plan change delhi pakistan brd,0,1
modi india successful,1,1
modi indirectly warned pakistan next war could fought space using army airforce first place destroy entire communication enemy nation,1,-1
modi interacts chowkidars main bhi chowkidar event new delhi video link,1,0
modi why announce itis manmohan singh initiatedand cant head iso announcement,0,0
modi publicity int achieve upa government know upa int enough money fill pocket achieve something like,1,1
modi laptop medium waste time stitching propaganda please master,-1,-1
modi lead across new frontier turn india techmilitary power space proud moment ordo security establishment every indian nation take rightful place high table world affair good governance modi,1,1
modi make question look like statesman,0,1
modi modi modi,0,0
modi grow guy,1,0
modi popular pakistan dispatch,1,1
modi never said give bank certainly said deposited bank,1,1
modi offered lakh cheated voter fyi chowkidar,0,-1
modi one greatest person worldcat hind,1,1
modi please cinema,0,1
modi promised would drag wood week feel weak even talking knowing true situation,-1,0
modi promoting namo app wish shown dedication creating job improving economy deposited lack bring back black money solved farmer issue curved corruption,-1,1
modi real ibn natura named around world entire tenure election time facing certain defeat worried want chowkidaar,1,-1
modi said vajpayee marker gave new job apply rti know fact lying usual,-1,-1
modi saved indiaimage,-1,1
modi say govt shown courage surgical strike sphere land sky space,0,1
modi say stop oppression woman call wife jashodaben home give due respect,-1,0
modi shah face,0,0
modi sir many many congratulation mission shaft,1,1
modi sir great,1,1
modi slashed error amount must much higher,1,-1
modi started term possibility privatizing air india ending term one two bankrupt national airline mast country hai bos,0,-1
modi surgical strike helicopter,1,0
modi best leader follow one problem choice,1,1
modi real tiger back soon namo govt,1,0
modi bjp still win election single handedly gujarat gujarat know,1,1
modi unlikely contest vadodara india today,-1,0
modi well knew r therefore extension,1,0
modi went lal chow mapdata,0,0
modi hunt corrupt criminal,-1,-1
modi release proof right time smart get lot vote,1,1
modi winsbuy mutual fundsgood share govt bond cong win buy agriculture land take agriculture loan front win sell buy gold wait next election within chance election within yr better buy liquor stock,1,1
modi worked india till note ask modi make government,-1,0
modi bring horse territory covered loksabha election convert cesar concept ashamed laga,0,-1
modify want mba engineer city sell pagoda pakodanomics fail gave new job chowkidar youth writes future country become chowkidar modi govt century india modify dream,-1,0
modimodi chamchas never feel turn helpless chowkidars,0,1
mode jump scheme aakhri var poverty,0,-1
modi address nation election commission directed committee officer examine matter immediately light model code conduct,1,0
modi announcement country success make opposition proud never seen like modiphobia ever life screaming may bring lung prove modi success opposition die phobia,1,0
modi announcement raised many eyebrow model code conduct place ahead lok sabha election,1,0
scheme implemented modi stolen modified,1,-1
much modi came limelight bore south voted bjp onwards tejaswini ananthkumar ask ticket local leadership requested contest last minute central leadership changed mind ananthkumar built bore bjp,1,-1
much better terrorist modi,1,-1
must tag muslim leader around world show plight indian muslim modi go around speaking rosy stuff india anything truth exposed hindu uae saudi malaysia turkey indonesia get lynched hindu,0,0
narendra modi bjp post hold single press conference tenure evidently murder democracy want,1,-1
narendra modi speech election speech via,0,0
narendra modi best ever,1,1
nation need strong leadership strong political power national security stability sovereignty sustainable modi govt,1,1
negative politics bordering line activism never right country alternative absent stand narendra modi like rock,-1,0
neither modi forgets near,0,0
news correct kindly praise effort narendra modi,1,1
night fighting modi singlehandedly better entire opposition put together must watch show see biased kind leading question ask least arab open,1,1
one bag modi hail india space superpower,0,0
wrong last year saw tele promoter various platform none seen modi till date let know get chance meet modi,1,0
nothing hyper reaction kumaraswamymodi create nonsense,0,0
nothing matter dude vote modi line credit,0,1
air india boarding pas picture narendra modi,0,0
nri holding permanent visa started engineering firm year back employed youngster want modi back primeminister pledged back policy taken empower youngster thank sir,-1,1
offered new weapon narendra modi,1,0
ohio real abbr singh tax mode abbr singh tax fake wow thanks,1,1
smile modi,1,1
sedan could proud po body modi,1,0
one namo mean modi modi modi,-1,0
bjp shri narendra modi jindabad,0,0
conviction possibly modi would inherited pnas anyone answer hypothetical question even chance forming govt,0,0
pak still counting body open demanding proof modi,0,0
pak want war modi want chance attack interesting,1,-1
pakistan modi,0,0
parish sold tell modi give lac every indian account add bonus,0,1
peace indian people make guysauthority work toe another yearsfor reason bring back modi,0,1
people opposition also say modi time those paayp kam hong,-1,0
picture speaks modi,0,0
please help calcutta university part son exam scheduled april gapsuch inhuman schedule electionsmamata banerjee helping please help modi sir,0,1
