opposition party ignorant day left even daily life activity focusing modi data answer,0,0
such thats promised repeat one song promise could deliver promise delivered run jailed say sure done modi jailed say,1,0
beloved narendra modi become election modi fighting terrorism corruption support modi,1,0
pakistan begs china protest military escalation india former iso chief called upa govt disaster received death threat jem supporting modi,1,-1
people india well aware corrupt way modi govt chowkidar choir hai reverberating across nation modi trying fool people taking blame away shifting others,-1,-1
people saw modi leader waited year mit shah,0,0
people saw modi leader waited year read,0,0
people voice aam santa anti hai modi govt built toilet house given gas cylinder,-1,-1
wikis rush credit angela nehruthey want discredit modi page hue main,0,1
please tell action took repeat violation code conduct modi,1,0
modi dear citizen andhra pradesh strengthened blessing chowkidar able lot state seek blessing yet done,1,1
ppl ppl modi western analyst doubting long time successful something point poverty india set pattern modi came,1,0
per assuming group diagram start tell williams group diagram also league week playoff total score week winner leaning towards leaving tell need point gore put sticker would like high floor full diagram might worth start dayton scare,1,1
prakash singh basal getting padma vibhushan second highest civilian honour country lost faith modi government,0,1
pray god return british raj need leader like kim tongue otherwise dark day far away gave sri manmohan singh term should give term modi also military rule,-1,1
press release india ist woman ci officer alaska panda dashjoins politicsset contest lok sabha election delhi may give martyr due resolve issue alaska appeal modi political support,-1,1
prime minister narendra modi ticket causa rajasthan given iroki lal mena defeat party,0,0
prime minister narendra modi rally delhi key highlight time,0,1
proud prime minister like narendra modi india got true patriot leader happens year support narendra modi,1,1
proud iso dedication towards scientific breakthrough commitment vision team modi towards empowering india super fourth jai hind,1,1
proud moment indian would like say thanks ordo scientist honorable shri narendra modi sir,1,1
raised sir aap bhi modi vote denakyunki atleast yourself know mean country,0,0
rameswar tell ditch expensive ride arrives modi campaign venue bicycle via,-1,0
reason modi come front camerathis department come stop asking question,0,0
release list star campaigner modi mit shah top list,1,0
remember dis wid friend bunker college attend speaking saw chopper coming side,0,1
remind modi indiawhose party bought almost medium,0,1
reminds germany rhetoric certain people extreme violence linguistic like bjp read william shire rise fall third reach,1,0
respect view may agree view tell stainless jignesh job get prominent challenge modi continues like would get reply remember one thing caste politics brain two different thing,1,1
said mcc violation announcement troubled father saying foolish govt discloses defence secret are sir modi give away detail missile owner raga keep giving away rafael price foolish,-1,-1
said even supported modi,1,1
salute father grand father service nation like father would joined force might didnt fit shoe please take survey force many pro anti modi,1,0
samjhauta case judge saysbest evidence accused hindutva terrorist aseemanand withheld court nia cbiceccvccagrbi nia another institution destroyed modi government used acquire govt favored terrorist,1,-1
say anything oppose modi public care know right wrong,-1,0
saying moment pride indian narendra modi said country fourth country space power congratulation,0,1
say something,1,0
seemed started month seeking reelectionwhat year one jump modi burn gua burn bottom scaled,1,0
sends second notice ministry civil aviation seeking reply today narendra mode picture seen boarding pass samurai airport,0,0
shahbaz sharia,0,0
shall proudly announce india snake charming space charming salute scientist narendra modi,1,1
shame indian elected illiterate modi discovered new formula mathematics according plus square bracket square equal square plus square plus,1,-1
shame use name instigated anti modi propaganda,-1,-1
shared war wont contest lok sabha poll lutyens medium reaction year old massive rest advance aged wont contest lok sabha poll lutyens medium reactionmodi sidelining advance modi like hitler authoritarian fascist,0,-1
fan modi still encourage laugh enjoy worry much politics,1,1
got rewarded modi later amazing,1,1
trying show opposition leader directly take modi better opposition leader,1,1
nothing lose modi hand everything stake,-1,0
shoot shoot economist say yes hate modi,-1,-1
vote modi br ranking,0,0
vote modi first solar powered train world second saving lakh ltr diesel per year,1,0
vote modi manga waterway transportation usage shipping giant mark cost transportation reduced road rail,0,0
show better modi etc believe done fine edu delhi keep working good,1,1
shri mode exclusive interview india via,0,0
sir understand frustration modi pls listen exdrdo chief tweet high regard making laughing stock day,1,0
sir cap sub ordinate officer always believe zee also modi that sir dont talk ops cap sir always nation must ask govt pay ops sir today dont ask ops cap sir duty pay ops cap,0,0
sir come let talk happened million job promised modi happened smart city get demonetization state farmer today happened make indiawhere dis,1,1
sir fir aap gala track par hai instead criticizing modi jee daily please tell chance party come power della better modi jee tell,1,1
sir grant say modi responsible people country responsible,-1,1
sir big thing india modi last election,0,0
sir want purchase modi shirt tell purchase,0,0
sleeper cell youve watching homeland gun mareingey bollywood flickr guise begin grand maria chain pee chore gay get rid idiot modi like got rid idiot away life fine,-1,-1
people sharing propaganda video abhinandan first interview india,1,0
people cant accept mode diplomacy working foreign tour bearing fruit,-1,0
speaks standard integrity modi raj promotes among public servant,0,1
speculation serious note usual modi disappointed,-1,-1
standard scoring pick one flex mark diagram michael thomas kevin coleman ari wendell smallwood spammy watkins jax,0,0
stop sending laskaretyabba militant indian territory promoting modi attack india well played man,0,0
joker fellow modi think back selling tea selling jump last year,0,0
support nt support modi delhi well see dmy right said nt funded bjp sole intention dealing dmy ensuring continuation aiadmk bjp regime sham,1,1
swamp solve mode economic distress,1,-1
terror camp pok closed fear modi said terrorist gu gu sab terrorist marine terrorist java use dense india allow japan killed terrorist,-1,-1
terrorist gave free hand modi,1,0
thank god modi shah send pakistan,0,1
thank modi india beggar world member space association,1,1
thank modi lying ram mandir making fool,0,-1
thank make kumar singh article came breath fresh air amidst hue cry number data honest first hand walk via,1,1
thanks sharing,1,1
thanks sharing option bad bjp candidate equally bad id show power complex net until misbehave administrative officer police officer like ego satisfied father appreciates modi would hate give vote bjp mp party candidate fucking difficult little polite anyways going vote bjp,-1,0
new modi stadium,1,0
thats fine know hard modi chart people like understand,1,1
thats support modify,1,1
accidental prime minister pulwama air strike chowkidaar modi biopic space bullshit those toh subtlety dikhao year,0,-1
book guaranteed super hit release election chart lap modi win could bookequivalent platinum record,1,1
buddha bodhisattva compassionate towards like concern necessarily much karma risen sure cheer sure offer shoulder cry need one offer blessing emotionally speaking issue often much whether refuge jewel love whether open enough touch love bit touch subject many people least touch word prayer helpful many traditional text often recite short prayer padmakara enlightened vision course also pray word one teacher suggested shouting help turn buddha wordlessly saying name namo amituofo namo amituofo namo amituofo actually complete path really answer even actually answering already long ever even thought ask,1,1
cheerleader scheme know scheme depends upon system established modi govt think money directly transfer beneficiary account radar linked jan than accountthe scheme ready launched modi govt,1,1
degree dysfunction absurd political party trying fight united want one man narendra modi double exclamation mark time take india forward double exclamation mark sick constitution exclamation question mark double exclamation mark,-1,-1
difference mind created fraud people come differencemodi said pay lakh blackmoney,0,-1
flow information forward,0,0
great india shri narendra modi sir,1,1
great modi,1,1
keyword good job job good job someone explain meaning emphasis modi company,1,1
narendra modi,-1,0
point thing far better modi raja part corrupt india indeed upa government corruption imaginable proportion sure speaking,-1,1
result difference created government modi,0,0
result obvious addition million poor indian society shall certainly regarded unwise move,1,0
situation bad regrettablelike modi did grown beyond stature party cadre,-1,0
title misleading give impression critical modi satellite shot altitude create space debris would fall back earth atmosphere burning,-1,0
truth behind lakh promise modi modi said got black money public get lakh pais santa aur pais dense james aasmaan far,-1,1
chowkidar every indian aspires country join prime minister shri narendra mode program march register,0,0
massive response coming bureaucrat people india saying going accept destroying cbi supreme court going shocking result modi tried suppress india voice,-1,0
intelligence alert phulwama yeah hail modi font hold accountable anything politician accountable every failure watch like pm need check reasoning much affinity politician,-1,1
notsowellknown differs well within right support whichever political group want shameless save democracy banner zero evidence democracy sort attack modi,0,1
letter date choir traitor billion looted family worst thing sold country secret modi go zardarisbhuttos,-1,-1
believe one thing modi hindu friday smart,0,1
dont modi govt thinking working towards skill people uplifting bpl others designing way garner vote,0,0
ready let modi naam nama inlay upper dana jaroori hai agar inlay chutkara para hai,1,1
think hell surpass modi worried,0,-1
think modi burg,0,0
think modi fairly well compare government,1,0
masterstroke modi teach pewdiepie india best,1,1
certify pakistan spy modi office passing secret pakistan official working upa still pm must removed pm keep highest level secrecy,-1,0
doesnt surprise he mode minister else expected letter rioter murderer rapist killer modi like likeminded sock,-1,-1
election every politician want modi fight election body want fight election modi,1,-1
embarrassing,0,-1
exactly modi said advance many decade back,1,0
india actually election commission working primeminister modify people india called modi commission instead election commission,0,0
like epic bhi par team nation namo turned modi govt year minute video quite awesome,1,1
man arrested modi police,0,-1
modi biggest threat india,0,-1
mode way trolling,0,0
new india modi,1,0
chuck craft writing involved know one minister narendra modi government said name minister finance minister run jailed shortly defending growth data,0,0
patrakar pure blood shit brick every person asking choosing modi,-1,-1
report prof level hate engulfed society due hatemongering politician medium bad learn assailant family villager even remorseful attacking innocent family shame modi r bjp responsible,-1,-1
shining indiashame modi,0,0
statement ram taunting modi supporter,0,0
sequence modi want whole credit,1,1
like janardhan reddy bjp karnataka,0,1
never happen happen modi govt would evident,1,0
today halted sirhindhere welcomed fatehgarh district bjp president upper teamthank modi,0,1
today india highest ever rate unemployment job promised modi failed promise also destroyed job ever industrial growth low per cent year ago,-1,-1
took decision ballot game played militancy controlled modi,-1,1
transparency died slowly modi,-1,-1
ultimately going indirectly favour modi,0,1
united stop ppl mindset setback india instead better india inappropriate say ppl view modi antiindia accusing indian check family background talking abt dynasty politics,1,1
usa removed isi world map month buzz passion invoking going issue compare india modi selling country using airstrikes cover ending isi surgical strike modi slapped,0,1
good narendra mode that modi god,1,1
nice comment like modi government problem really escu river constison company escu company until hitch engineer ltd month given salary staff contractor salary also complex npc labor comeneser response please help,1,1
well explained need modi government,1,0
victory march modi delhi,0,0
vijay mall appeal move forward nav modi set court hearing high voltage economist jean free,0,1
voice dissent democracymore person anti national dont agree le educated modi,1,-1
vote modi mistake clicked modi,0,-1
vote great modi smiling face,1,1
wah modi,0,0
want modi come back dont think market rally impact someone bottom ladder,0,0
want modi next year book modi really suit india pak,1,0
warns future asking undermine pakistan,0,-1
born bandit exodus happened year voted modi col promised rehabilitate bandit year gone nothing happened proved fake jump,-1,1
near father money modi father money grandfather father hired near daughter failed india hired modi delivered would say better manager elder hired right person job,1,0
watch india shot live satellite elite space power say modi,-1,0
watched clip ballot resident bbc news hindi talking people heard encountered night literally terrified woke whole night guess best proof surgical strike hat air force modi political support,1,1
watching live interaction modi live watch various place organised also watch,1,0
well look like brake,0,1
well said credit go modi credit boat such haram nazi hui,0,1
insane already becoming fear modi made behaving like idiot get vote even oppose modi join corrupt cong even homework done writing trash,-1,-1
weren modi poll promise bluff,0,1
western buyer shifting india china price rise went pakistan bangladesh sri lanka vietnam etc better price blocking big time thanks modi,1,1
western world enemy india wish modi prime minister,0,0
modi destroying every institution country following elected first time mla rmala cant high time stop following modi regard,1,-1
ever merit merit nda people must stand together bring modi back save country enemy foreign invader cheating christian hindu practicing christian visiting worshipping idol,-1,1
need election elected time modi would elected next time also without votingthis though novice antiindian speech video,0,0
want part bjp honest like modi,1,1
whatever reason demand fasting unto death modi regime mean committing suicide,0,-1
whats going controversial amendment environmental law procedure document reveal modi javadekars war india environment via,1,-1
whatsapp group namo message broadcast member proud modi member ordo,1,1
govt belief risk moist force grouping area force withdrawn jungle medal curious decision modi govt ahead withdrawal force,-1,1
modi changed required number nobody iaf uttered word democracy,1,0
half wished modi give away got ending going sit iron throne,-1,0
whenever think bjp modi cant stupid always surprise say even foolish thing hmm definately studied entire political science,1,0
whenever get little restless election result remind hai pumpkin hai modi bhi bad tudes pasta hai anne math,-1,-1
job modi,0,0
big fan ship sent epic burn,1,1
think one doubt medium general fear naming shah modi negative light also think case taking video without statement good,1,-1
people film maker maybe monthly financial aid cut due modi pig around looking food,-1,0
told deshdrohis anti modi whoever support modi deshbhakt even looting country whoever opposes modi deshdrohi even working country logic,0,0
advertise every single policy newspaper taking credit every petty project policy also held accountable done,-1,0
guy upright modi announced successful launch gave full credit scientist ordo flourish capability year sitting sour sour grape lutyens,1,1
modi bahai want answer,0,0
modi episode gst good simple tax via,1,1
daagdar modi free fall medium prestigious medium house touched bottom reducing political party,1,1
ppl afraid modi done good job nation ppl vote bjp wantwhy opposition scared guilt concession loose below done nothing think movie way spread divert ppl vote bjp,1,-1
short naming modi,0,0
ask proof modi jee keh dia ba enough never ever ask proof leader patriot,0,0
fuck people always say honour fucking talk someone holding post feeding egg indian elected post serving people always higher person holding post cancer culture hold people level god idol people anything ridiculed mind uneducated one well educated idiot,-1,-1
vote modi contest,0,0
important message modi address nation shortly,1,0
one onemodimodimodi red heart,0,0
withdraws boarding pass photo modi gujarat,0,0
wrong history taught modi want change,-1,-1
wrt iso ordo etc job government fund merely decisive rest work done scientist engineer employed credit neither modi near modi praise scientist respect,0,1
yeah jealous better actor like modi,1,1
yes idea let work together modi forever,0,1
yes bjp that best prime minister modi,1,1
yes modi future every one dont know giving modi community modi bg yes rest saying yes modi coming,0,1
yes remember modi banned many porn site obviously looking job dont look like among,1,-1
always provide actual fact modi marker always abhisar sir,0,0
clan stand head still find iota corruption modi corrupt practice party historically hence battery lawyer delay punishment,-1,-1
appear anti modifies please dont criticise heck,0,1
right drag mandir modi everything col thats know good luck,1,1
empowered scam looted land farmer nya modi jee took bjp sarkaar bar bar bjp sarkaar heart exclamation aap bhi vote den bjp popmap iaaf saying,0,-1
modi anti indian young mla bengaluru give version modi haiti,1,-1
waiting truly plant question censure modi surprise need arrives say pair who who pipe,0,1
worse come lying broken teethwell end lot broken teeth come may modi asia last area tum raised logo seed pakistan gutter main jacket girogey,1,-1
cant pronounce modi learn pronounce,0,0
check history promise mister name modi,0,1
forgot praise chowkidar modi,0,1
forgot blablabla announced number one random fucktard proud whatever,1,0
borrow surgical strike modi pathetic,-1,-1
listen modi,0,0
mean modi improves economy significantly,1,1
never understand great result always come talent meet right leadership fake vision never help india grow never understand hard work modi reach position easily get position due family business,1,0
said problem createdthese local leader requested mam contest without informing central blaming modi agree hedge improved bangalore still think occupied old people time youth leader,1,1
provide detail voting bjp option give detail proposing vote leader modi,-1,0
thing fantastic time mm rule modi even allowing prostitute come nearby must burial moment,1,1
day started beloved modi end modi great day show light misuse though agenda,1,1
source suspect logic reasoning source cite appears religiously biasedthats emotional looked evidence rational point view find dont like modi smear anyone associated,0,0
saying foe fine foe insisting modi antinationals dignified way put point across accusation way speech,1,-1
modi name work give bjp seat lok sabha election yogi adityanath,0,0
listening kickoff speech modi campaign remind rebecca solid essay particularly passage phrase preaching choir mean restoring listener argument already agree,1,1
really alarming let hope modi come back justice unsung hero,-1,1
