never seen differ person like want modi vasundhra remember loksabha vidhansabha,0,1
exactly dac support chance maybe know somewhere also keeping track usb adapter work essential usb adapter work perfectly switch hand held imo sound fair bit better plugging headphone switch headphone port,1,1
necessary modi love credit never debit reserve exclusively near,0,1
opposition whole nation concerned officer abhinandans return aur kite din i issue vote cheek manage opposition concerned abhinandans return ia valour narendra modi election news,1,0
required reason coming modi best,1,1
single positive news seriously,-1,1
sure whether cry hysterical torn bang head satellite destroyed waste money modi free offer ahin manga ordo,-1,-1
think modi mistake selecting person want,0,0
waiting like say launched near india modi renamed send burial,0,1
sui president accuse modi antiyouth,0,0
observed modi hater say modi take responsibility anyone side come hater talk accept criticism promise betterment,0,-1
okay okay wawawawait sec there movie narendra modi starring vive anand omberok there webseries narendra modi starring random dude id top there channel called namo meta krishna hai hai banda papal toh nazi hai,1,1
old politics impressed modi making generation movie time politics,-1,1
modi marker nation growth mit shah,1,1
one idiot modi baba,-1,-1
always modi,0,0
people promisedremaining enough modi win,1,1
dynasty mindset end india lot cup improved anti modi right bringing family,1,0
voted bjp peak modi wave count everyone supporting modi would think mode popularity mysterious isnt,1,1
want modi,0,0
opposing modi nearly university leader backed opposition able get ticket eyed career politics,1,0
organic material chart really huge,1,1
best aab narendra modi made comedy,1,1
pride prime minister ever indian citizen ready move suspense modi,1,1
pakistan terrorist want opposition win say modi call terrorist modi,1,-1
pakistaniterrorists yes surely want modi loose election matter ego never want another wall terrorist superior,1,1
people tolerated daughter actor despite neither talent look people supported modi mp family closed eye interesting see sonakshi fare next,1,1
please help modi,0,1
pledge support modi govt build powerful india,1,1
pls stop campaigning others shoulder modi desperate good thing good work doesnt need advertise show legacy continue rule pls stop nonsense simple,1,0
police register fir family attacked mob surgeon,0,-1
political scuba fallen great height waiting arm probably modi learning launch rocket man,1,1
work worried hate modi work hate india vote himhehehehehe,-1,-1
positive policy modi govt provided stable environment entrepreneur economist guy norman via,1,1
possible life threat narendra modi story around,0,-1
president moving modi greet people rajasthan day president ram math moving prime minister narendra modi saturday greeted people rajasthan statehood day,0,1
prime minister modi sir assured international world india peace policy india didnt break international rule regulation actually government duty convey massage international world ordo,0,1
proud moment indian nation continued leading great leadership modi graduation ordo iso scientist indian,1,1
proud modi may long live,1,1
really say ppl lk question doubt credibility over specially leader modi ji stature look whose talking doesnt care image country v education renowned institution tat free,1,0
really bad never know going overlook work modi jee done last year vote,1,-1
replace trump modi,0,0
respected modi bastard jaipur please provide exam centre jagdalpur exam net ugc net sir govt effort take girl education positively putting fee bios class right,1,1
respectfully sir allow big thief medal choose nav modi others runaway country chowkidari,1,1
right modi victory hand,1,1
right making every single article rank higher google giving click revenue please use http archive link instead linking directly anti india anti hindu article,-1,0
right skill right job modi govt green kaushalya romana helping rural youth via,1,0
rise jaativaad reservation based vote social worker i bar modi sarkaar bihar,1,0
r want groom young leaderwhy dont ask etc put retirement age politics nominate young leader instead old split dont vote modi antiindianbut vote inhuman anti human,1,0
running away debate interview like modi one thing sum like west pant simply also ship saffron pant,1,1
run israel america mercy doesnt sits talk close neighbour modi biggest mistake criticizing one belt one road china modi could china frm china could controlled india diplomacy messed,0,-1
sacked bsfjawan contest modi varanasi,0,0
sad shit bjp never win kerala alone love nice beef curry kerala mess,-1,-1
shi boat have shouldnt thereto space team worked start centre timeeverytime anything happens show upon try brainwashed such cha hua modi dish data hai,0,0
satellite launch credit scientist raid blame modi hypocrisy exposed,0,0
say thanks nehrudue near diplomatic thinking today usa country supporting india modi cant anything war longer china fearful today due nexus philosophy,-1,1
selfish indian worry future dont understand modi,-1,-1
senior bjp leader expelled referring modi preacher mantra via dailyhunt,0,0
shame shame modi proving accidental prime minister mm control every word unfortunately damaged pride chair,-1,-1
shame word doubt patriotism great leader modinever ever,1,0
sheershaasan next modi sheershaasan stand upside rally want hear metro sound position,-1,0
warned butter atleast,0,0
keep mind people pratinidhi modi use word pratinidhi proper place people fool,0,-1
vote modi common service centre lakh,-1,0
show one video clip modi promised lac come every,0,1
similar also sent letter modi also give visa,0,0
sir modi remembered workdedication risk factor decision nation tell remembering,0,0
sir logic many year lost hating modi bjp,1,-1
sir combined tenure great leader approx year let give modi year compare kyu cheek hai,1,1
sir ignore people nobody care firmly modi,-1,0
sir know well unfortunately noise matter logic inconsistency collective struggle put modi downout power doesnt matter country going bankrupt,-1,-1
sir use issue expose modi people man really immoral unethical anything win election suspect modi drink private thats thought share,1,-1
sir modi world tour marche per control ko scheme possible hai,0,0
sonia manmohan singh must get credit everything modi bjp rajdeep newsanchoring,0,1
sorry modi sir cant,-1,0
still coward modi took action corruption pay master td,1,-1
stop world travelyou modi,0,0
substantive constitution dynamic modi,0,1
thing happening modi mute mm,-1,0
superman want modi,0,0
superpower trillion dollar economy agenda mahagathbandhan modi data sum vote,0,0
supper modi,0,0
start woman perform magna seek divine grace narendra modi become via namo app modi radio,0,1
surgical strike earlier publicised rightfully india created bangladesh accept role creating multi behind year modi lvs chest jumping strategy vision,0,1
surprised see come keep much fit updated order counter consolidated opposition attack headed raga like minded follower area modi sab hari,1,1
swami never ever called modi labeled today swami honest person india,1,1
swine paymaster across border cant survive year modi theyre broke theyre going stop paying quota like soon,1,-1
talking strict law crack heavily corrupt modi say made law fugitive wherever world hide money confiscated law taking course extradition fugitive via namo,-1,0
tamil nadu state bjp president tamilisai legit called result winning defeat whatever fuck,1,-1
tell modi didnt first year similarly mm consideration,1,0
thanks edwin mountbatten india got freedom launched near enabling narendra modi expand indian strategic capability mean sat foresight,1,1
thanks lot aware team change army helped ton think finally look strong like really also thief terrifying team amongst new name echo fox optic gaming t look like elite right sure seriously almost every single team look damn strong,1,1
thanks modi finally space war film star war indian edition,1,-1
personal matter woman vote modi,1,0
thats correct pakistani economy bad time modi rule,-1,-1
thats modi,0,0
thats wat said ppl asked credit given modi air strike,0,0
earliest mention lakh find place narendra modi public rally november chhattisgarh banker challenger post modi stuck bjp electoral pitch fighting corruption black money speech equivalence,-1,-1
kind preemptive action surgical strike undertaken several time army publicity modi anxious live belligerent past rhetoric decided beat tomato,1,0
legacy chowkidar narendra modi,0,0
look give end thinking one sentence already election hope modi win guy loses speaking shit,-1,0
modi government spectacularly failed create promised job fact report centre monitoring indian economy mie suggest one crore job lost india youth forced say,-1,-1
coolest nation hand war wondering medium modi government,1,0
one good alternative modi maharashtra pride constant smile heart suit,1,1
reason want come together simply scare modi hell,0,-1
question know field study field interest going report coming sighted modi that seem great expertise subject,1,1
telegraph display visceral hatred modi become obnoxious headline,0,-1
top post redacted fox news anchor day criticized trump tweet called presidential alluded even fox turning newsflash duck outside five tucker vanity fox agenda driven mm outlet,1,-1
way crashed mig last one month surely destroyed credibility russian aircraft company designer modi agar rafael jet hut native such hut meanwhile france like imdb,1,0
theater actor modi,0,0
yet another feather mode cap matter,0,0
action modi government took last year think rafael missing document rafael,-1,0
modi took yr,0,0
reason modi called feu,0,0
second line candidate bjp modi fit enough,-1,1
there international treaty space armament drawn somewhere europe india test space weapon could become one founding member treaty well know aspect yet simply criticize modi talk get lost,1,-1
top tax player india modi tax pay karate hai ine bhi gst den hot hai aur fauna gt gareebo den hai business seller tax behkana band taro,1,1
guy lick every part family anatomy earn crumb wonder modi said fight chowkidar rajamaharaja,0,-1
insane bam modi election,-1,-1
mustard shared midterm pessimism modi issue,0,0
meet rally dont try fool people come visit see power modi,0,1
raja ravi versa painting nav modi collection fetched crore tax department,0,0
model shut aim modi return like hitler youth set youth wing trained professionally gang,-1,1
news test result modi know whole pakistan gayhind scientist laughing even made missile make defence system strong make pakistan jealous,1,1
problem modi chart whatever pure others fool india medium sold pump mode shah,1,-1
time modi win varanasi larger margin lok sabha poll,1,1
modi bjp wanted cultivated systematically help medium social medium want desert one community lived together shortfall internally doesnt like muslim part india diverse culture,1,0
pakistan support iran gulf gulf arab care saudi arabia corrosive wahhabist ideology done tremendous harm throughout pakistan arab never friend bought like cheap shore return money fought ever wanted deny pakistan need aid common sense dictate choose muslim power support support iran power paradigm changing favour gulf,1,1
till modi yet started campaign day start kid sweat,0,0
toby madman representing crown prosecution behalf indian authority final submission london westminster magistrate court nav modi isnt cooperating indian agenciestheres risk hell fly there risk hell influence witness destroy evidence,1,-1
today namo meet see excitement love toll employee common man love craze namo har har modi gear gear modi spread lov namo stop,1,1
tomorrow president trump say something good appreciate modiwill still stick commentary trump bjp tha,1,1
totally understand irritated oku carry agenda reddish claiming everything bhi kar sake every time modi somethingbhai rom line thabloody loser,0,-1
true volunteer work modi taking daily job state leader never learn one campaign rally br big impact,1,1
true modi pride india,1,1
tweet electrified village even year independence india electrification drive narendra modi govt ensured village without electricity india,0,0
unable hear truth chowkidar expelled bjp leader singh party six year called modi preacher mantra,-1,1
unbelievable elite space power india shoot satellite sky still pay aid sent via,-1,0
leadership modi india get crashed elite society nuclear power even ordo personnel credited govt politics gone level politician mining achievement scientist god save country,0,1
upa govt refused permission test tech modi govt gave permission,0,0
using picture boarding pass good know election,1,1
much could announced scientist election around corner modi made good occasion,1,1
tough grab modi fault clever screwed opposition simple like vajpayee allow opposition play faulty trick let win election every trick opposition hit master stroke,1,1
true modi best,1,1
vote kar shri appeal everyone tweetstorm,0,0
wah modi another moon onboard well done,-1,0
wah wah ujjwala romana household modi full opendirector ngc bust mode lie like asks vote,1,1
want know much black money modi brought back last year,-1,0
want modi,0,0
want shift narrative call modi,0,0
congratulation narendra modi sir entire team scientist,0,1
hopefully change tomorrow modi campaign shaft mission best part bjp person caught ordinary people uneducated people,1,1
hoping see barehanded fight modi crocodile coming poll,0,0
loud modi created bazaar,0,0
wel come sir carry dear modi come back,0,1
welcome modi,1,1
welcome raja sarah one fantastic mod heart suit oops look like missing flair make sure set like please make sure check user guide daily nightly hangout thread talk get know sub member weekly adopt newbie thread new member would like extra help question let mod know happy help,1,1
well thats improvement glad clasp britannica released modi member agenda remember he people puppet people behind,1,1
well plan modi r plan rebrand near elitist pakistani institution gear wa,0,0
west bengal bjp leader gathered kolkata watch mode address talkatora stadium delhi watch india today video,1,0
narendra modi,0,0
suitcase puppet endorsed charlton interview jai italy many moditards called snub showing place modi logged time desk drop atleast jai italy time,1,-1
going pigeon afterwards,0,0
modi vote unbelievable man,-1,0
emotion people enriched corruption like modi pretend chowkidars,0,0
explains modi govt doing contract chinese firm every project fact trade deficit china nearly doubled last yr mm rule went slight trade surplus china billion deficit modi never spoke abt,-1,-1
happens trump say protest decides lift muslim ban someone come commits act terror would people even admit wrong complain,-1,-1
modi today totally unwanted especially election time end think going publicity stunt gone wrong,-1,-1
modi promised bring black money give salary holder ftin last year every tax payer got rebate black back concession whats wrong id thing hoped much,-1,0
modi say give day,0,0
pathetic photo madam sold thank star might still win col people vote modi,-1,1
shame say doesnt give credit,0,-1
advantage winning modi election near let work,1,1
fuck happening crazy everyone saying something different,-1,-1
whatever talking bringing fraud justice modi done thru ibc involved deliberately creating pnas fraud supposed take action obviously modi govt lol,1,0
whats name narendra modi okay,1,0
modi least popular check interesting number watch live,1,0
manmoha singh happened address nation reason wont win dont know wat say day modi spoke revenge taken mm yet open mouth,1,-1
type economist modi promise lac even mode lac could affect economythan,1,1
whether agree people elected modi india chaiwala marketing manager sale cap shirt online,0,1
gave right decide people would worked good school education cut root wahabism instead bigger farm house javelin politician would right modi something good please let,1,1
didnt nya last year full control mm said refused give benefit public mode yr tax come tax base collection become double,-1,0
modi criticism modi roaming saying modi watchman describe chowkidar utter dishonesty elected chowkidar,0,-1
wife share article husband writes make sound opinion average person street anyway anti modi use discretion share info normally ignore huahahahaa,1,0
appreciate prime minister narendra modi great minister,1,1
ignore like modi ignores kejariwal,0,0
never forget apathy modi govt flood,0,1
nav modi vijay mall share jail cell extradited judge asks prosecutor via,-1,0
news shown lavish show continue anti modi pro cong,0,-1
vote modi till solves,0,0
bjpshivsena candidate member parliament double shri pair bar modi sarkaar,0,0
woman bible somewhat factor brought victory modi,0,0
with historian pocket get elected future generation wont remember modi government,0,0
wow till nobody cong dared switch light even oh yes electric pole electricity else modi definitely switched cong bulb,1,1
wrong bold project initiated modi behest oval,-1,0
yay missing thread c always miss bass amount work post,-1,0
yeah true mai bhi chowkidaar opposing modi supporting terrorism separatism corruption let support modicrush terrorism separatism corruption jai hind,1,0
yeah defeat bjp screwed atleast decade,0,-1
yes mode election gimmick,0,1
yes among others undo committee modi,0,1
yes modi tenure indian businessmen poor selling pagoda poor self sufficient isnt,-1,-1
yes modi role model,0,1
yes empty space modi ear,-1,0
calling people choir modi forgetting politician beg vote front choir people call shame,0,-1
challenged comprehending simple language mode problem,0,-1
insider congo dalla good modi coming back power,-1,1
voting modi mean bullet train become daydream india,0,0
smart enough notice much india support modi except minority community writing wall whenever get read,1,1
modi democracy,0,0
even know speaking chowkidar placing trust one person lead big pitfall tell modi antiindians extremist doubt shame,0,-1
evidence modi court judge,0,0
mean like narendra modi,-1,1
thrive india without modi,0,0
tell pakistan satellite reaching indian border simultaneously see china either modi lying truth,0,0
think modi take que,0,0
think pair bar modi marker bring namo shirt,0,0
want know done democracy let asked hai para ine modi pure same deladki bhutan gay hai,0,0
youngster know promise per created hundred law take permission starting business modi clearing single window know deed loan restructuring telephone banking,-1,1
forefather served country sacrificeyou happen born family claiming know modi actually sacrificed family friend serving people getting elect contribution hillary make sense next time,1,1
intelligence failure way modi carried attack,-1,-1
honour money muscle power support give choir modi choir shah choir bjp choir r,0,1
india modi touch,0,0
party ram know pap spider view kind people fact responsible modi rise people brain,1,1
taken measure set chowkidar space say modi india live,1,0
contest prime minister narendra modi varanasi constituency independent candidate raised issue corruption sacked first objective strengthen eliminate corruption force,1,1
people western living peaceful life bjp rule impossible possible modi adityanath said,-1,1
