modi annoyed shin taking away limelight away harebrained chowkidar campaign,-1,-1
modi wave time mit shah keep farming much want people india learnt good joomla lesson,1,1
modi call bluff soon country witness mehbooba change stance,0,0
modi allow fodder scan friend loot india people india run away,0,1
modi youth high sir,1,0
modify bliss come gay first feminazis forgive separating yashodaben,1,1
modijourney common man trailer mesh sulla web series star make taker titular role,-1,0
mode address nation india successfully test antisatellite weapon,1,0
mode bjp back acquittal hindu headliner samjhauta express bombing case south punjab news,0,0
mode clarity thought vision prosperous india wa evident interview,1,1
mode poll blitzkrieg address rally day campaign begin meet march financialxpress,0,0
mode promise lakh account idiom,0,1
modi poll slogan reach railway tea served shatabdi main bhi chowkidar cupsthis height they certainly gone berger,1,1
modi year report card,0,0
strong reason vote modi,1,1
ninth kumar wife social workerruns one largest ngo well educated earth highly competent candidate loved allticks every box earth stop modi shah,1,1
word dont respect others live modi dirty hell,1,-1
movie release modi election along web series namo already launched advertisement,0,0
must come back power indian hate pakistani because ghazwaehind mindset pakistani killed india popular modi india modi modi india,1,-1
must hand modi supporter extremely loyal political party enjoys kind support,1,1
narendra modi situation gujarat say something,0,0
narendra modi led banda government work tirelessly prevent corruption,1,0
narendra modi vive oberois chowkidar dialogue promo hit hard,-1,0
narendra mode victory sure person want make india world leader aim vote bjp heart suit,1,1
nation first thats modi,1,0
national conference leader call prime minister narendra modi terrorist disgusting animal,-1,-1
need slogan mode misgovernance sufficient propel power,0,0
near given credit build highway toh modi kya mile highway construct rne,0,1
netanyahu modi should died day born,0,-1
gegen revolution success mantra bjp hindu hindu survival existance,1,1
nav modi jail dont shout much careful,-1,0
nav modi london jail till april,-1,0
niei you personally working bjp modi sacked best thing support idea sir,1,1
nonsense bhaktmodi wearing poor chowkidars mask election purpose allowed copy loot escape indiamade many noble demonetizationasking vote dead body soldier talking performinghonest politician shame,-1,-1
gamma like modi chart handover cash camera had hai desperation,0,0
good news modibhakts bbc news india election narendra mode tamil nadu problem,-1,0
really many well educated intelligent people coming chart ultimately communal heart modi basically brought atmosphere acceptable even gh desirable,1,1
single journ asked at scamsloot swami asking tough modi answer,-1,0
sure india hit correct target spacemaybe working communication satellite hit panic modi losing election,-1,-1
bjp known namo may time bjp name change modi modi santa party like chokidar pakodewala chain wall,0,1
even election commission dismissed complaint narendra modi violating poll conduct rest resident non indian take hike,-1,-1
conquered space modi sort,0,0
turn public show surgical strike vote throw modi govtfrom,0,0
you concerned future modi unfortunately,0,-1
onto fulfill wish keep modi power till destroy moon,-1,0
old day technology resource limited launch satellite way,1,0
worshiped god great cbn every step time came change colour get sympathy people cbn want modi back great politics behave matured,1,1
one thing pretty clear political party pakistan shit scared see modi know good day going end soon,1,1
one modi,0,0
bjp government love modi sir,1,1
modi ler,0,0
modi lover wont vote people respect people india vote,0,1
way win back thee voter would give preferential treatment like modi india ubi proposal rural indian,1,1
opinion already happened modi helm possibly happening inept minister heading department maybe next term happen,0,0
orissa today modi mammoth gathering,0,0
party leader shy contest also join mayawati mulayum mama raj thackeray war etc,-1,0
fight people pakistan fight terrorism narendra modi,0,-1
scientist shot satellite low earth orbit india becomes fourth powerful country space modi hater gonna die,1,-1
view desi democrat modi supporter le match,1,0
waist remember right election one said modi wave however agree according new estimation hear thing,1,1
paid say modi,0,0
pak senior recently said pak soon like gaza strip look like modi outsourced surgical strike,0,1
pakistan generated indian society much affecting job economy foreign policy modi man save country,1,1
party get flat flashback upto ticket narendra modi movie,1,1
people saw modi leader waited year mit shah time india via,0,0
per google country world per modi visited rest mar,0,0
pic modi leader made intelligence agency raw relevant spends money defense modernization,1,1
please address further earned greet hail modi,0,1
please define modi bath modi never called god never treated god best prime minister ever people spread hate able encourage corruption made modi god bath,-1,-1
please make knowledge perfect dont try bark twitter government modi best lot work uplift image country therefore dont speak useless,1,1
please modi sir something save hindu girl pakistan,0,1
please share,1,1
pmoindia prime minister mode electrifying promise,0,1
possible persuade modi allow norm capable firm bjp member time modi active margadarshak one term,-1,1
power modi entire nation expecting good news liberal hovering,1,1
ppl real joke change usernames chowkidaars sake narendra modidont ppl identity,1,0
fraud modi namo age,0,-1
pretty weak point japan south korea extent got also forgot mongolia,-1,0
prime minister narendra modi address nation noon today,0,0
prime minister narendra modi live interaction nation,1,0
problem dont vote modi eligible voter family vote bjp,0,-1
progress shown modi destroying democratic institution cbi cvc supreme court modi destroying financial system rbi banking demonetization refitted bjp get money bjp gujarat,-1,0
promoting mode thanks dynasty,1,1
round ordo modi,0,0
raga per year per month modi still giving per month farmer,0,1
raghuram raja question modi govt growth job huffpost india,0,1
rangaraj handed following foot print arab swami intern linking modi govt,0,0
lavish kumar interview narendra modi also much awaited,1,0
ready debate republic modi,1,1
real face modi mandbudhi,1,0
really wish hope bring prime minister modi aap adult election,1,1
reason contrast india become satellite power world though modi role long operation way announced give proud entire,1,1
respected modi thank continuously working last year future anski bolt band karen sama gay hai,0,1
responding modi voter appeal helping much case,1,0
right finally one blame modi didnt generate crore job per year final fifth year unlimited job generated form chawkidari freedom run pagoda shop simultaneously lol,1,1
roll bjp tweet truth modi mostly saudi,1,1
gambit para used ninja technique expose lie modi,0,0
satisfied modi govt worst policy specially poor section small entrepreneur farmer business cloth trader start gujarat several mill closed lakh people lost job unemployment highest peak level year badly affected due noteban gst,-1,-1
say people voted modi power get lakh,0,0
security issue modi prospect,0,1
see talking abt video please said end speech filled anger due dynasty rule india party fighting election single motto defeat modi otherwise also assume,-1,-1
senior bjp leader expelled referring modi preacher mantra,0,0
share cargo narendra modi claimed loworbit satellite,-1,0
shared feedback people pulse modi namo app,0,1
didnt take anybody name connecting modi mean know giving right adjective smiling face smiling face smiling face,1,1
single point agenda hate modi spread lie,-1,-1
sir could please tell google search engine telling stupid prime minister modi whats reason behind bad sir disrespecting shared google,-1,-1
sir modi forget send opposition space collect proof,0,0
sir one missed academic appointment made biased pity modi undermining ordo fact praising making public aware achievement,1,-1
people hate modi much hatred cant even recognize great national achievement word filthy hollow soul,-1,-1
someone say something free folk much understanding love people pain take news universal truth write big big comment write sentence heavy word based someone said something best use time,1,1
sorry say modi remained history total failure inside country huge success side,-1,1
space warfare,0,0
srinagar mar prime minister narendra modi friday said citizen country moving forward sans fear chowkidar alert past five year asking people,-1,0
still better prime minister narendra modi scripted interview tough question asked,1,1
still want ally congo right hatred modi blinded,1,-1
strong supporter modi good work done india however anti corruption front give demon great move however government soft politician corruption thanks hope see jail day,1,1
suck mode you get ticket,0,-1
summary modi message,0,0
super super cooper exclusive confession chowkidar regular celebrated orator steel administrator greatest hope hindutva one wettest best read,1,1
supreme court already declared modi innocent gujarat riot please stop bring matter simply say dont enough faith judiciary want kind verdict whats really right,1,1
surely convert gold modi converting lakh jump,1,1
surgical strike army surgical strike airforce sat strike raid karnataka modi shah department,0,-1
telegraph becoming antibody propaganda sheet headline loaded comment news okay even edit page front page,1,0
tell modi still fear near near come dream scream near near,0,-1
testing like dam kyo chalice baffled argument india success mode also modi inherited trillion dollar economy raise gay without modi paste gear sab such modi again bhi aaa kovi strong economy modi politician thats,1,1
thank modi mit shah considering request ensure massive victory mast balliathank,0,1
thanks follow data raj chowkidar modi,1,1
thanks stopping lower modi into pumpkin hai high morale office governor must write chowkidar front name resign join campaign officially model code conduct must apply,1,0
thanks sri sri giving platform releasing sung dil modi also thank encouragementthe video handed,1,1
thats modi shah,0,0
thats people like need come vote modi,0,1
audacity bjp spokesperson unbelievable,-1,0
civil war already planned modi r terror organization modi got copy henchman imp portfolio eci also control army police also divided religious ground modi eci let tadipar shah right em,1,-1
design work completed upa regime project funding cancelled upa govt gathered dust modi came resurrected project thank modify,0,0
gdp growth rate fell demonetisation indian economy lost per cent gdp term growth alone loss lakh crore year thanks modi demonetisation,1,1
last year govt headed introduced dot bank besides subsidy food fertilizer kerosene ministry handed subsidy poor dot enabled aadhaar bjp jindabaad modi sir,-1,-1
max credit go player like credit go scientist modi,0,1
name regular passenger express train name regular passenger express train name regular passenger express train name regular passenger express train name regular passenger express train name regular passenger express train name regular passenger express train name regular passenger express train name regular passenger express train name regular passenger express train name regular passenger express train name regular passenger express train name,0,0
national security safe mode hand,-1,1
new india modi modi modi,1,0
history indian politics courage face press meet none modi,-1,1
pocket modi managed however santa watching broken arrogance modi breaking election code trying gain unfair advantage santa appreciate,-1,-1
programme started manmohan singh prime ministerial tenure india attained capability,0,0
subtlety propaganda lie bjp never calling bjp govt always modi govt many family party one man party bjp nothing oratory one man fall back upon,1,1
work india longest bridge dholasadiya bridge connectivity assam eastern arunachal pradesh got completed modi govt improved connectivity leading economic prosperity empowerment people,1,1
many thing drive inspiration many key differentiates modi marker upa match,1,1
civil war modi becomes show tried law farmongering online like,0,-1
solo girl fake ngo type liberal instagram keep ranting anti modi stuff story inst follower lost someone asked father lost money demonetization,-1,-1
thing happen blue moon course minority din see yogi almost sucked every muslim modi literally assist even know reason,-1,-1
villager clear thought modi doesnt fight pak soldier indian flag hoisted lahore shastri even didnt know google pak divided two india modi done what know fact,1,1
couple past present know modi smiling looking boyfriend pakistan,-1,1
think modi abandoned interview rage fear many journal like karan made career meddling,1,-1
think modi joking,0,0
think movie based modi shouldnt released acharsahita promos should banned till election,0,-1
think would loose identity super self promotion could ask modi,1,1
think mi read tweet said per claim made drug rather even modi narcissistic people wont vote never said narcissistic better know gonna vote bjp,1,-1
think need mental health checked look like got tremendous tension regarding mode win yoga meditation also help upl try election,1,1
bjp and that brainwashed modi propaganda running election god save country idiot,-1,0
called statesmanship row baba really fill mode shoe think vote wisely,1,1
country whatever wherever law order issue happens opposition say modi behind announces good thing nation achievement scientist opposition take credit real shame mindset matter,1,1
best narendra damodardas modi,1,1
guy could sustain lie beyond third sentence tweet succeeding govt carry momentum previous government modi govt get credit convoluted argument second upa govt squandering,-1,1
politicstweets nya scheme tout tweet modi,0,0
affection tea cup manufacturer modi would modi supporter couldnt control emotion,0,1
thread expose antienvironmental side narendra modi,0,0
modi got hum career admin hai hold like chal avenge,0,1
wrong narrative purposely made mislead voter bjp ground base request voter hence trying mislead public taking name modi,-1,-1
thread mode surgical strike environment,0,0
th time bjp win credit people vote modi national mp even visited heard nothing them make clear candidate planned schedule difficult volunteer ready,1,1
time proved modi thinksplans rich friend whereas thinksplans indian agree friend,1,1
transformation change brought government defence sector please read share widely,-1,1
true definitely modi,1,1
truly supporter shri modi,0,1
tweet chowkidar narendra modi chowkidar narendra modi tweeted important message nation watch,1,0
modi spell given money modi sang,0,0
unemployment rate india per cent highest year modi answer,0,-1
unfortunately bjp kay program massacring army men fail due presence mind release hero abhinandan shame bjp army drown desk drown modi mani bath bahai aagayi,-1,-1
unlock crore public modi math hai,0,0
popularity modi quits office,0,1
deliver promise wont allowed leave post still waiting lakh bank account abb bar pair modi marker,0,1
update modi say want assure world community new capability anyone,1,1
vijay mall cite mode remark affirm recovery bank due high voltage,0,0
visiting singapore first time october looking michelle star restaurant near fullerton never need starred restaurant people recommend,1,1
vive omberok done press conference promoting movie narendra modi narendra modi done press conference,0,1
vote modi send kid abroad,1,0
wah modi wah cant get better,1,-1
waiting april modi announcing release historic movie first time india world biopic sitting released eve election,1,0
want india dismantle modi win,1,1
want modi back,0,0
wanted milk vote name abhinandan unfortunately modi pak released upset lost opportunity,-1,-1
due modi wave usually margin always fluctuated lakh,-1,0
surprised read story hadn read clarification apology tweet give closure heart refused believe modi govt dishonest deal also knowing never make baseless allegation effort create rift,-1,-1
welcome assam modi,1,1
well indeed using heroin meth one two seen drug call china short drug either two leaning towards heroin,1,-1
lakh account promised modiasked rti reply,0,1
copy cat achieved five year tell one scheme modi govt except demonitization course change name scheme one surrender case,0,0
app source modi address nation tomorrow may take biriyani credit mom,0,1
made fool begging benefit getting show filthy mind tamilians love modi,-1,1
say true cannot shah must also complicity otherwise would thrown long ago truly believe case voice modi,1,1
whatever dont mind the right present achievement course yes good quote aag lagi hai for pair bar aur hua bhi nazi nika radar bar modi sarkaar,1,1
whats problem modi know project even case said,0,-1
bhagwan ram criticized ordinary dhabi mod modi thats dharma teach adharamics channel chokidaars superman hero like mod beyond criticism,-1,0
got fight modi supporter street new york,1,0
said would eliminate middleton did know meant advent social medium fantastic direct reach people longer need middle medium send message people,1,1
mit shah modi bluff whole country,1,0
concern modi ji friend got loan waiver lakh crore whose money dont wreck brain finance economics sell shirt please,-1,1
listen losersthese belong award wa groupbtw dont understand people think knowledgeable well believe listen themfact educated well aware national issue vote modi,1,1
addressing elephant room pun intended safely extraction secret agent codename narrow sure compromised point could sitting duck,1,1
chowkidar modi cry previous government lot achievement tenure tell people,-1,-1
chowkidar protecting fake news everyday loc violation modi election theme life everyday soldier dying shameless medium keep tom coming master,-1,-1
modi contested varanasi vadodara logic scared losing,0,-1
modi needed address nation silly missile test hardly use missile waste time indian wasting people time,-1,-1
republic showcasing sat missile bmd interceptor,0,0
modi copyrighted jhumlebaazi,0,0
explain math asked math modi government built statue asked transfer per year farmer asked math lakh per house,0,0
kind raid done bjp ruled ministersmpthey corruptwhy cbi raid done rafael project corrupt modi ani albania houseslast raid made bjponly raid opposition people know political block mail,1,0
think said trust modi scheme single job term plug exploitation middle men copy reason big difference made raja,-1,1
baba party worried modi tell agenda form govt please shit talk like month,-1,0
american support cooking dog horse meat public understand right freedom choice need take care local sensibility beef ban different horse meat ban always west decide sensible whats,1,1
ballot get modi vote clue,0,0
vote count modi decided otherwise want vote modi matter sat launched naysayer going change mind anything good happens country modi crib announcement india achievement,1,1
request bjp sister organisation support modi shah mapdata,0,1
wisdom finally dawn bjp work something better stupid thing like cow hindu muslim hatred pakistan,-1,0
worked mit modi didnt,0,0
world first modithemed cafe tamil nadu video,1,0
wow modi didnt want come back didnt want people ask safe return,1,1
wowamazing guy phenomenal campaigning modikudos,1,0
writes rail aviation ministry use modi image ticket boarding pass via look like air india indian railway serve people,0,1
yeah modi took great decision appreciated,1,1
yeah kinda gimmick know people trouble bikini aspect ever illustration setup photographer mean back hardcore trying learn photoshop sounded many time taking really shift photograph making look like lit properly camera thousand dollar lighting gear help photographer suck,1,0
yes indian time chaukidar loved modi indian culture,1,1
yes certainly everyone saw scientist modi today,1,1
yes leadership modi,0,1
agree faked airport built modi let expose one fake time,-1,0
absolutely true deserve bjp may lose many vote may lost election something fishy looking one seat danger modi prime minister,1,-1
right tot choir also right modi done indian,1,0
confused alma change doesnt happen overnight long battle described page expect modi transform nation year stop making fool,-1,-1
telling getting job modi someone fake pad fake pgs buying certificate get job half ppl en dont know fulform phd,-1,-1
france smart indian supreme court modi govt lied court albania making rafael careful international medium propaganda man cant believe indian supreme court nothing argue stupid ppl like,-1,1
clue modi work perception based hear read see various medium try one modi post may disappointed deliver,-1,-1
tried fallout effort bring communal riot tried instigated muslim airstrike modi freely travelled metro show pak rest nation india united barring benefitted isi china west,1,1
know manmohan singh oxford graduate obama seek helped america depression calling scam want list scam modi thus far sad see even young kid like supporting modi india hard time,-1,-1
love joke follow lately modi tweet blog,1,1
might heard obviously proverb asked corruption asked shake hand table modi even deserves consequence nothing,1,1
need learn problem indian born silverspoon know real issue tejasvi talking stupid thing like modi,1,-1
see bjp sign symbol shouting chowkidar choir hai enjoyed term mein bhi chowkidar synonymous bjp going nut throw brick modi create house,1,1
young modi brain behind ordo science,-1,0
modi writes love letter landed invited see whats going fishy fishy,1,1
confident modi set second term modi coherent narrative appeal faithful supporter say,1,1
modi journey common man trailer highlight nation democracy come first via,-1,1
nav modi made death threat witness prosecutor tell court,0,-1
told govt time give concurrence neither said yes said never gave positive response reason assigned modi taken decision encouraged former ordo chief sarawak,1,-1
