according report bjp leader slapped condone girl enjoying tea muslim friend shocking anymore friendly neighborhood bjp goondagardi,-1,1
people bjp hate guy wish death,-1,-1
arab able make raga look like clown interview modi would tear bit debate,1,1
fact random whatsapp forward usual updated liberal indian cute whatsapp forward even bother condemn public slaughter cow took place also happens main reason kerala news nowadays,-1,0
guy chart board stuffing brand rapid hinduism everyone throat talk isi,-1,0
never seen death someone used much political propaganda becoming joke,1,1
ino non camera phone malware city turn without downloading random app ad anything,-1,0
intake chute log nazi dense maine aaj tak say modi support terrorism also get happy support urdu,1,1
modify looking bit different,0,0
blaming abraham god aura wrath style truth come,0,0
liking bjp shading arab one arrogant journ sham anyone liking hater,-1,0
mean would wanna accept award non governmental organization probably better thing like kick bad guy pass,-1,1
medal metal medal scene triggered bjp,0,1
modi great greatest,1,1
never would let secret service would need leave pretty severe bruise try,-1,0
people think narendra modi govt corrupt lost ability think,-1,0
rob buf howard ten standard scoring,0,-1
shocking time think shocking bjp leadership assault people indoctrinated violence first time enter r office,-1,-1
team per kevin coleman ari allen robinson buf,0,0
think send sick leave br,-1,-1
wonder way passenger crew member leave sort message happened either phone laptop physical one could actually recovered,0,0
know deserves deserves outrage find chart twitter alleging funded moist sucked beyond word guy being area belgian life slum travel local bus done groundbreaking work economics long long time rolled chart sad sad,-1,-1
film make petition vote modi liberal hero actor madhavan merely asks people vote without taking side liberal lose shit belittling an ranging liberal sum too,-1,-1
modi told money,0,0
power scam also scam chikkiscam dalam quake relief scam gsc scam audio scam indigo refinery scam shaw crore nav modi choose scam pd scam vyapam scam rafael scam yedurappascamchowkidari,0,-1
vote going modi bjp,0,0
upa india attains capability target destroy space satellite orbit modi taking credit something achieved losing desperate want divert attention unemployment corruption bakery,-1,-1
permission denied maunmohan therefore modi regime permission granted certain part made available ordo proud modify ordo rest give burial,1,1
dedicated channel modi complete modi propaganda movie ahead election call largest democracy cute,1,1
cant compare ballot airstrike,1,0
misery great political dictator modi worked keshubhai patel advance reason modi got selected gujarat mla replacing keshubhai treated advance political guru carried make rathayatra,1,0
abe chute tera baa banana kya road dam airport aim him university school hal aml snl company software company hotel highway telecommunication martin dog bhosdike british left india modi tutte,0,1
last year modi govt recent study reveals adult believe job opportunity gotten worse believe price gotten worse believe corruption worsened,-1,-1
absolutely rolling modi took,1,0
absolutely said anti modi anti india indeed true india cannot democracy statement inaccurate keeping aside debate whether one free make statement page,1,0
according root problem political system directly elect prime minister vote elect lok sabha member actually work towards betterment constituency although agree view think bjp might still able pull win nda although lesser seat still one year left lot thing change year,1,1
achievement scientist credited self modi,0,1
add corrupted like shahmodi,-1,1
seeing mode year surprised modi take support pakistan win election india nothing tell people except singing song pakistan pulwama using army save chair field man,1,1
admin president barrister challenged modi,0,0
air india withdraws boarding pass criticism pic modi gujarat,0,-1
either pakistani communist tooth nail prevent modi playing inning natural,1,1
please change candidate altar seat people happy everyone saying modi that dont want baba want rather yadav please,-1,1
poster indicating seat guess people think differently vote loksabha pollstheres current pro modi,0,0
started khan taking vibe india regarding minority practice home preach india,0,0
always believed election matter strong modi con machinery medium power one thing hindu hindu alone,1,1
always modi marker,0,0
mit shah better modi,1,1
already full pledged bollywood propaganda movie modi arent fascist trait dictator dont know,1,0
modi,1,0
modi great work nation another year term sure khan press distress broken part khangress hindustan sure,1,0
still fool saying modi announcement sat scientist,0,-1
best part middle class people saying prime minister modi,1,1
truth happen pair modi marker,0,1
annals buildwell minting money hell resident susan lok susan lok resident builder listening construction everywherecant breathe cement sand everywhere modi govt need informed,0,-1
appeal modi contain troll cell attacking child fight two girl instead attacking child demeaning country,0,-1
future star indian politicsmodis handpicked gift future indiabest luck sure brain,0,1
proud scientist modi strong leader,1,1
sure drug modi magic gonna dark sure modi think better prime minister india also indian,1,1
talking city black money promise made modi jee,-1,1
argue fact doesnt merit youngest modi best part,1,0
area area swami total capacity shout,0,0
aseemanand surely faith tie modi sure ud acquired proof nail alleged involvement terrorism alleged terrorist liked nik ground enu prosecution,1,-1
atleast doesnt issue visa everyday asks factual question girirajnd yeah modi manga,1,0
bad day ahead modi mit shah,-1,-1
ball vanished message important sususwamy given shelter modi ilk,0,0
ever support modi given common name that let tell whether raga modi important question govt guy forgotten question govt,1,1
patriot modi supporter,0,0
become guru loot nation modi save,0,1
modi came india safe,1,1
believe modi made india comedy circus,0,1
best weekly thread make look forward next,1,1
bhenchod tutte famine laude fund log celebrating freedom speech,0,1
bhutan forget modi mayawati gave acre land keep mouth shut,0,0
bhutan must understand comment couple scientist head say joined bjp problem claim fame modi bashing,0,0
bigotry apart nris wont caught dead returning mode new india,-1,1
bjp gimmick acceptable youindias super economist run jailed endorses everything modi announces much cost per family cost vote coming election,1,1
bjp modi swamp parrikar source though least likely cong none however good wag tail saga raga aap hope delhi remains good shape,1,0
bjp release campaign song prime minister narendra modi,0,0
bjp wont get seat west bengal say mapdata banerjee andhra rally challenge narendra modi open debate,0,0
breaking india entered name elite space power antisatellite weapon sat successfully targeted live satellite low earth orbit leo part mission shaft narendra modi address nation,1,0
burn much want modi laughing way vote bank,1,1
modi winner,0,1
end result substance reply except fumble chant modi modi finally run away debate big zero front kanhaiya,0,0
modi speak abt high unemployment record rule,1,-1
vote modi,0,0
centre state govt working make india free modi,0,1
check tweet besharam modi marker,0,0
chowkidar shown courage carry surgical strike land sky space say modi,0,1
confused narendra modi trying say investigating jail claimed recovered money discussing jail,-1,-1
congratulation scientist carrying mission shaft successfully india moving fast towards becoming world leader mode leadership way become super economic power also super science power,1,1
congratulation achievement made scientist well double prime minister narendra modi,0,1
congratulation modi proud modi mission shaft,1,1
court great india iso ordo great scientist successfully complete mission salute great narendra modi new achievement country pakistan find chalageya asian such girjaye,1,1
correct assessment narendra modi two diversionary option,0,0
correction attack addressed rudrapur rally phone without mentioning pulwama even,0,-1
agree party economic policy side sanity cannot afford bjp failure modi need clamp hard carnival marker party boost business wing every chance get like togadia sworn enemy mathit crazy let stop giving time day,-1,1
creating comparison without context foolish clearly raga seems worried losing meth hence chosen wayanad quite unlike bold modi move,1,0
credit bjp govt modi,1,1
dot happening mission shaft could done upa government differed modi got chance democratic right say thing liking okay ignore problem cant even,1,0
dear announced country achieved job came forward let people know achievement ordo listen modi otherwise could get know success,1,1
dear modi want inform bihar dist darbhangaprakhandhanumannagar getting payment sum grain case pending last one please suggest,0,1
dear stupid good silent case showing chamchagiri towards napunsak modi well aware planning conspiracy still giving security bikaumedia silent,-1,1
dear tejasvi modi want energy new blood carry lot responsibility people like prove fact responsibility people karnataka come clean discarding holy alliance good family sandy family contact,1,1
demonetisation gst introduced modi government yet another blow dwindling economy putting common people especially small trader businessmen great hardship,0,1
danny modi moment time cheap photo,1,0
director web series modi worried poll body stepping,0,0
care liar want modi answer people like,0,1
donkey love corruption never satisfy modi donkey people,1,1
dont believe modi plz space personally collect proof see whether actually launched sure,0,1
dont know someone doesnt time modi mode policy mode achievement wait modi speak nation lament wasted time reminds aaa gundhtee toh hilt kyun syndrome present scenario,-1,-1
dont need graphic respect montreal public,0,-1
dont think watch movie called modi cinematically look dud screenplay predictable blatant propaganda course matchid vive omberok want tell modi film add soaring level fringe worthless politics today,-1,-1
dont think even rural govt compared bjp modi govt kg govt good work shortest time negative destructive work like demo gst rafael airport dani pagoda job lynching huge electoral bond without disclosure,1,0
dont worry day one take modi seriously,-1,0
drama king gambit para want know guess chaukidar narendra modi,0,0
emotional tear rolling people love modi intact whole country waiting great moment may,1,1
enjoy flat give promise better india supporting modi,1,1
even contest election able win got reason blame modi,1,1
every bjp contender asking vote name modi modi asking vote name pakistan bjp speaking achievement last year absolutely embarrassing moment every indian,1,-1
every gov department responsible accountable modi yogi government also seems like jump,1,1
expect open slam modi govt polluting space debris nothing left corner centre,0,-1
expelled year speaking bhagwan modi deputy god file case via,0,0
failed failed human beingfailed bjp leaderany leader would feel nervous passed theatrical passed fake promisespassed spreading hatredpassed fabrication liespassed self promotion modi report card,-1,-1
false dichotomy either bjp destroy nation whoever heard opposition job properly keep ruling party line,-1,0
finally decided watch modi biopic trailer paused bit modi shown heartbroken gujarat riot personally saving life isle page define hitman nazi hui,0,-1
rebrand saffron leader tuesday hinted contesting lok sabha seat prime minister,0,0
first time corruption govt need narendra modi,1,0
military modi choukidar country,-1,0
former ordo chief sarawak admits proposed undertaking upa govt didnt give permission modi govt gave ordo green signal ahead test credit sat go modi,-1,1
former iso chief madhavan air said narendra modi political courage demonstrate antisatellite missile previous government,-1,1
fresh news iso chief allegedly got threat death islamic terrorist organisation raise muhammad supporting sat mission praising narendra modi,1,-1
state islam also elected visit country hug like modi inside heart want save woman ban indian hindu,0,1
get rid pulse ban modi people starving,0,-1
give credit near laid foundation showed seed nurtured iso modi current govt luck fruit,0,1
given modi high likelihood complicity rioting led muslim killed keep quiet,1,-1
giving due credit spreading awareness politicising think modi great,1,1
giving credit entry kia motor modi wicked disrespect effort hundred officer worked hard bring korean investment like modi much tomorrow even merge party bjp escape investigation,-1,0
good point modi say whatever speech writer give brain,1,1
great contrast mam best victory jai modi marker,1,1
great job modi,1,1
green eyed boy modi hater,-1,-1
gun evening bro nice hear regarding special status mean mode government decided possible give status reason withdrawal commission,1,1
gua understand frustration force people interpret thing way wish ordo autonomy integrity intact even louder one losing characteristic modi isnt traitor like love,1,-1
guy watching cesar blown away immense talent idol hail akshay kumar beauty watch,0,1
ha awesome like nova though normal bum better prime bum,1,1
haha reply show modi made day,1,1
hahahahtell joke china nothing muslimsmuslims china enjoying much better right mode india,1,1
bank sent letter one informing loan waived like farmer get bank,0,1
rajdeep ever said positive modi,1,1
hasn modi taken credit yet far guess,1,1
hate politics politician heart say modi win parliament electionmujhe nazi data kyoonwhatever happen,0,0
boycott modi channel,0,-1
reached home safely coming back work sun set west thanks modi making possible,1,1
started petition fight justice warrior yet receive sign share care,0,1
done similar research modi announced farmer gone taken interview farmer asked whether help come distress face,0,0
heard tamil friend also supporter modi modi fast becoming modi chi never expected would happen never,1,1
reason vote modi india world largest manufacturer largest smartphone manufacturer mobile sold made india largest automated largest steel producer,0,0
his everyonetoday proud moment india becomes nation enter elite space power club antisatellite weapon announces modi,1,0
holy shit happened many pro r pro bjp comment updated,1,-1
hope modi come back jumping victory,0,1
come like four year declared assembly mother india fortunate modi world leader come near praised every act four year sought utilization certificate fund turn,1,1
shameless modi bhagwan like resume power first thing you office throw chair sit data kya ukhadega,1,0
india put trust credibility paid mouth feed money cast doubt opposition shameless weasel jiggalo best,1,1
however disappointed see people support modi govt could behave stupid way know channel scoopwoop try undermine modi always still,-1,-1
however evidence modi government created long queue rush job,-1,0
howeveryour dissent recorded posterityactually near happy know mission,1,1
id everyone think running player letting land isnt foul basically running kicker football defender blasted edward mid section still air plus ten every opportunity win purdue better,1,1
india done great success space yesterday jealous india top modi government therefore choose modi government future,1,1
india join space super league shoot satellite precision missile modi,1,1
india minor muslim boy assaulted hindu mob forcing say aloud slogan jai shri ram slap boy force convert hinduism case ratio higher higher keep quite,1,-1
india modi modi india,0,0
indian constitution process must coumplusary judiciary convicted first considered decided lower court high court justice requested please improve modi and pairalayment amendment,1,1
india challenge become worse modi say pew survey reprint via,-1,-1
intact employment one reason vote modi,-1,0
intact thats lost debate agree doesnt take away fact modi hamster,0,0
inflation corruption upa regime long forgotten people two biggest pain point voter previous election think modi delivered front,-1,-1
infrastructure urbanization shattered due modi modi everything outstanding,1,0
inspired mode speech lata mangeshkar pay moving tribute japan via,0,1
isnt manmohan singh jee person deserves praise modi,0,1
iso ordo scientist worked year desperate shameless modi min took away credit,-1,0
iso brought modi gujarat,0,0
issue mentioned worked upon people passionate patriotic country currently modi capable among top politician cum candidate modi that speaks truth one line failed mention en,1,1
modi answer many barking crowd along innovation india century,1,1
natural dog bark master danger credibility swamp well proven fight corrupt modi done last yr testimony,-1,-1
abt china usa said abt air said time he saying time concerned abt debris maybe upa ahead physical test criticize govt praise modi totally political gimmick,0,0
jai proud modi,1,1
join modi,0,0
joke year fool vote modi,0,0
like notebandi could announced rbi gun modi need money space,0,0
one small question worst case mission would failed modi blame data nai far understand ndtv din tak debate chart,-1,-1
kai banana kanoonbjp cell banayaget blind bhakthmodi stand rich letter,-1,0
kara raja hai della hoon aaj kal aur divine alright communist ban try bag easy pas pas philosophy toh had santa hoon chal swath change hai edit hahahahahaha lang race hai hahahahaha haul ha chalk jason behenchod hahahahahaha chutiya ikta kya hahahahaha laura meta,1,1
kaludo type anything anymore chutiya raga chuitya bribe tutte modi approved programme overall bos made sensitive issueindia could face global issue idiot anchor,-1,-1
keep calm believe modi red heart,1,1
no wat think hardly matter nowdont think fencesitter anymore influence wit last min anticsppl made mind alreadydis election gonna defeating bjp getting rid modi electing next,1,-1
lack crore black money per modi,-1,-1
lakh every bank account holder happens remain year modi put nation standby panic grip among countryman,1,-1
lakh modi still excess spend wait bull shit modi choir,-1,-1
lamp exchanged position imagine cup he responded modi lmaz contract sheen dia,1,0
least modi didnt wear cap muslim co respected muslim hindu wear cap muslim dont follow sacred religion muslim disrespect sacred religion muslim,-1,0
let modi come everything change,0,0
let pakistan decide best young girl pakistani worried selfish self modi give justice minority,1,1
let accept pais argument let pai say responsible law order delhi state modi around kejriwal,1,1
live update prime minister narendra mode address nation india news follow live update moment,1,0
lok sabha election live news jailed say modi govt gave ahead opposition slam drama,1,-1
lok sabha election raj gun bat modi invite controversy,0,0
lol waiting day dream destroyed modi,1,0
loss point cater blind bath attribute credit everyday sun rising modi dont need verification futile boast mode achievement could excelled much better,-1,1
long crypto short modi,-1,0
look like want compete maduro modi,1,1
lot depends modi getting elected people ensure,0,1
love modi hate dynasty,-1,0
madam much abt modi aur politics,1,0
main bhi chowkidar campaign modi interact people today video conferencing,1,0
mama banerjee party faster seatbelt west bengal voter exit poll,0,1
man backbone medium bootlicker ask proof ballot modi,0,0
many software engineer turned anti modi anti bjp recent time influence eco system,1,-1
met youngster today voting simple question simple answer gave modi progress,0,1
misfired iff working properly crew follow iff norm examinedbut if cabal jump blame modi happndtab tutto aag lag jai hai credit done meet rest technical team modi,0,0
mission shaft operation difficult target achieve completed successfully within three minute launch,1,0
mission shaft operation difficult target achieve completed successfully within three minute launch modi,1,0
model code conduct modi craze cunning,0,0
modi agrees give interview lavish kumar ten minute out sweating drinking water whole family vote modi next election,1,0
modi chart position understand ashram saying god bless chart,0,1
modi chart stainless sum people clipping imagine mental state,-1,0
modi chart born take always,0,0
modi born make,0,0
modi cabinet rank rape apologises,-1,-1
modi take right decision expert make better planning,1,1
modi cant kill mosquito bomb innocent wielding islamic terrorist smh,1,0
modi destroyed every constitutional institution,0,-1
modi hate muslim actually people like hate hindu much side traitor bringing power,1,-1
modi first family wont back power,1,0
modi foia going loose constituency sure,1,0
modi foe rule child would never forgive,0,-1
modi,0,0
modi government censorship online content news,0,0
modi government strict action fugitive economic offender,1,-1
modi govt failed provide crore job youth ship sent,-1,-1
modi govt better escape wonder would,0,1
modi govt ready lose election sin removing art also attacking pak,1,-1
modi govt move amend forest law dangerous draconian,-1,-1
modi lost,0,-1
modi spoiled rich powerful rotten,1,1
modi many terrorist killed space,1,-1
modi interest showcasing thru one way communication haha afraid two way never press conference,-1,1
modi kickstarter poll campaign northeast today,0,0
modi live fantasy world wanted that also follow,1,0
modi live streaming near residence panda nagar east delhi quite crowd,1,0
modi like baki detail define like watch movie coming soon theatre near,1,1
modi love always need protecting nation eradication corruption,1,1
modi mission shaft live india join russia china successfully take satellite using antisatellite weapon sat,1,1
modi new fresh form,1,1
modi fight election,0,-1
modi india india modify need job education health peace question whoever govt,1,1
modi say india space power shooting satellite,-1,0
modi say even paris counting dead body opposition asking proof modi born liar wrong ask many dead called attack modi know still people democracy people people people,-1,-1
modi shut also promise promise karla hai,0,1
modi west bengal situation modi say west bengal government encouraged unconstitutional way working even medium surrendered truth eventually come,0,1
modi time definition strong one made gun weak one simply fired strong difference man work silently showman,1,-1
modi utterly failed give job youngster,-1,-1
modi want get political mileage scientist achieved iso belong one political party near contribution cannot forgotten,1,1
modi already opposition told stop writing love letter begging front america forget world pressure india capability create pressure world pulwama har bar modi marker,1,0
modi welcome jammu early waiting,1,1
modi respect honour want draw kind attention may rural service sure total responsibility make beneficiary list depends gram sabha rural area think west bengal face dictatorship tm leader,1,1
modi wont,0,0
modi keep staminaesteemdaring move forward rigid step prosperity nation blessed victory mahatma title given villager museum school timezone stop victory,0,0
mode scheme funded fictitious black money fictitious swiss bank going turn white source mode fund real degree bjp patriotism implementation,1,0
modi cash plan better farm loan waiver shorter relief say raghuram raja reprint via,1,1
power modi sandokan,1,0
worried abt country dan country pakentire nation turned gujarat live mar dis tm modi get even seat dan last election,1,0
morning pic showing modi pic desperate,-1,-1
must watch friend trailer real life story narendra modi april,1,1
mso modi managed polarized kanaddigas rest south man stop,0,0
narendra modi biopic slammed propaganda opposition ahead indian election,-1,0
narendra modi pro active prime minister always among people fully worked welfare people country last year people fair idea work,1,1
narendra modi respond pakistan like mit shah high voltage,0,1
narendra modi usually quick condemn terror attack via,1,-1
nation need strong leader like modi,1,1
near want every kid educated india want every kid doctor soldier radio want become engineer modi beta for bol mein bhi chowkidar,0,0
defender modi february,0,0
never mistake voting modi paid enough mistake,0,1
nice collection epithet gangajamni tehzeebi aristocrat india pak used modi gashti bach,1,1
night real chowkidars reporter spends whole night real find feel mode campaign,1,0
nileshbhai would dare ask modi govt done tax money btw kotaku asia chal raja those anne kam bhi dylan,0,0
nobody bigger fraud modi fraud lord ram,0,-1
nobody done one fourth modi done tamilnadu check fact,0,0
not modi time nation namo,0,0
north angry seems wave building modi,-1,-1
communal request voice silence play unique role womenmuslim woman voice modi govt punished noone take step muslim,1,0
even opposition party politician win modi banana,1,1
getting singapore,0,0
happy bangalore south candidate selection achievement taking wrong step karnataka leader like modi karnataka voting modi sure,-1,1
modi proud indian,1,1
nothing anti modi propaganda usual far truth,-1,1
thief coming together survival modi also aim get maximum seat saying may possible thief vanished politics,0,-1
watch something cute forget done,1,0
situation changed fag end even pitted modi combined opposition modi sail easily,1,0
oh god sir good see young face bjp ala bjp modi everyone world revolves around either supporting defending nicely sir there need expose kanhaiya open book plz share view,1,1
one blamed modi everyone know contribution iso big zero point blame illiterate man fake degree,-1,-1
one tweet show total failure mode grandiose scheme poor lady still cooking wood stove house ramshackle lady two daughtersphysically challenged lack medical help could,-1,-1
modi yogi great event zero error,1,1
congested modi,0,0
