even news modi man work government delivered good reason,1,1
bjp peak popularity grow resentment time go india least around statue around magnitude patel one state also become election promise crypto currency fate become much clear climate denial become even widespread india growing report global warming one indian surely die hope turn wrong personal front gain weight kill make sure lot day day activity made habit chain mba test preparation peak optimistic scoring percentile,1,1
like bjp think early judge current government perhaps low expectation anyway show lot selfie lot decision let see decision result action,1,0
due may need activity interim keep people interested queen wrath better coming oven better last week new stuff week,1,1
jay debate modi manmohan,0,0
met lot nice pakistani like met lot nice bit american aussie bangladesh etc never slug satisfaction making preach self post probably judge people independent heritage,1,1
modi interview people india seek government poor bahumat say modi explaining via app,0,-1
modi meet tim cook exerts influence return india next year apple conference everyone excited see cook announce come stage everyone cheer big unveiling apple seek,1,1
money safe malta neural modi already taken money escapedthen given rafael offer ani albania still saying money safe funny modi sir pls dot tel pls,1,1
nase wall as context modi speaking petrol diesel price jv ianuyy,0,0
actual achievement speak rally maybe endure hair trained decision milk political gain attack opposition critic govt cheap rhetoric,1,0
pakistani voted pretty fast find close came nuclear war quite disturbing find account pulled backindia pak threat hit back quite credible even though want prime minister actually listed nuclear war nuclear friction war,1,-1
predictable lot narendra modi story,1,0
well easy brainstorm ask sir put entire financial story,1,1
wonder many politician son armed force usa went afghanistan first hand saw pain family loved one left war fucking politician trying life soldier sane voice needed government side caller head need prevail war serf one hope stop soon country shown capability good people died need two family ruined forever cant believe politician jumping chest,1,-1
cant canvassing political party even bjp nonpolitical cultural party india even eligible modi fend,1,-1
people waiting youtube modi,0,0
give per month pull crore people poverty per month year made rafael deal one jet question answer gner pale strength,0,0
election modify strategy election well made opposition lose confused unable think straight onl making mistake election become one sided modi even sweep get seat,1,-1
kilometre land border gujarat share pakistan kilometre sanctioned fencing little kilometre fenced rest area yet covered border secure modi jim,1,1
abhinandan asks modi,0,0
aki bar pair modi sarkaari love honorable prime minister modi can call uncle,1,1
absolutely medium modi,1,0
accused disclosing defence secret,0,0
main bhi chowkidar tea cup railway get notice poll body ndtv shameless modi crazy cheap publicity stunt want photo slogan every day get photo printed indian currency,1,-1
modi departs gambit para gonna make sure country get dose daily entertainment worry,1,0
russia america china india became fourth powerful nation space narendra modi,1,1
uploading social medium bad food supplied bef japan sacked declares contest prime minister modi varanasi,-1,-1
agreed swine hence totally immoral many lie life become swine next birth thick swine modi achieved visit visible oil price support conflict eye cup see,1,0
agreedthis modi,0,0
chowkidars modi meet rally today many chorus gather one place police poor fellow,1,-1
col modi created wave kind engagement excitement course della people watch tiktok,1,1
united hindu vote modi,0,1
indian proud outstanding statesman modi phe directhonest core heart decisive totally committed india people outstanding interview interaction medium,1,1
best sir say modi scheme people sir,1,1
thing modi already started,0,0
also someone india try fight summary pretty specifically diaspora desk like figure american engagement pakistan mode test missile problemresponsibility happy learn gonna fight,1,1
also firm till get lakh interest year keep voting modi marker wont leave justlikethat,-1,1
also wondering report modi assassination true seems like ploy gain sympathy vote honest indeed true indian democracy danger quote wire,1,1
also satellite made chain bengal make best satellite puja enjoy might doi,1,1
also modi,0,0
alternative bjp modi time demand,0,0
although pti supporter voter right criticize wrong,-1,-1
compare compassion security officer painted stage show modi excited mother money marry daughter succeeding time demonetization architect,1,1
glad joshi said like refused save modi shah embarrassment,1,1
hope moving right direction front able guidance present govt able lead modi,1,1
modi contesting varanasi tough seat,-1,0
modi lack due lack,1,-1
modi party cheering better send modi chart happily live,1,1
first man must modi,1,0
would possible modi come back,0,0
modi doi,0,0
announcement given modi tweet make feel want nya flop,0,0
anytime narendra modi address nation important message,1,0
lacking common sense acting govt reveal face top scientist enemy state put life danger bec doesnt want credit modi giving ahead didnt,1,-1
modi may live long serve country best,1,1
listening burying face like ostrich keep ranting like rapid modi nil contribution towards bengaluru,0,1
array wah school teacher professor,0,0
sat amid modi bag key policy query via thanks,1,1
assure international community capability wont used anyone purely india defence initiative security modi,1,1
aur taro beef ban beef ban bjp beef ban beef ban paid regi aur pure desk har jayegi,0,-1
war lucha,0,-1
book modi leader,0,0
beauty without brain modi chokidar choose cheer individual brain either resigned sacked modi chokidar,0,1
went decade backwards time rest world moving forward vote modi may travel back king age,0,0
modi know situation ground time worst,-1,-1
vision le tried keep india lowest level happy hear sentenceindia country poor obvious line kata khulwaya wai use repay dal santa his santa bahkawe ja please apni aka laga modi bjp vital,1,1
beef bryan sleep asaduddin waist slam narendra modi pulwama attack,0,-1
there modi come pak cant anything,0,0
belly party organization going good work boost many student voluntarily waiting listen speech modi,1,1
hai stop watching modi paid meet indiatoday watch international medium biased know happened,0,-1
chart cheered lakh every indian lie modi crib every month poor wah that logic,-1,0
bjp narendra modi government must think,1,0
bjp narendra modi must listen want justice,1,1
bjp chutiya spotted vote modi ukhaadna hai ukhaad,0,0
bjp get le doubtful modi remain leader temperamentally unsuitable opposition cant back gujarat highprofile sure mode future look like bjp fall,-1,1
bjp leadership focus awareness among people chennai,1,0
bjp modi rule record high degree holder applying mental job canteen boy waiter cleaning washing job,1,0
bjp one man party run whim fancy one man modi henchman mit shah remote controlled r chief moran bharat blind chart think beyond modi indian think india,-1,0
basal language modi behalf zardari shameful,0,-1
bloody barbarian modi fate idiot year enough enough,-1,-1
bombay high court hear plea release biopic narendra modi march,1,0
boot kicker mission modi propaganda,0,0
boy boy vega getting aggressive recently next beef war,0,-1
burnt frost test much clear leo satellite india much better chinese test presumably target would decayed orbital mechanic probably slow mode electoral mechanic,1,1
afraid feel current situation far better earlier feel safe modi govern terrorist would rethink attackthats power indian gov,1,0
assadudin waist link boot modi deserve shown,0,0
dont disrespectful towards bright mind india,-1,-1
modi never screwed career girlfriend,0,1
modi unable manage one wife,-1,0
modi wasnt temple head modi come r background suspect yogi even real power added two deputy look like yogi face like mm decision taken deputy,1,1
called educated indian would even cast vote want believe modi losingfor hatred modi strong,1,0
campaign narendra modi live onwards,1,0
wil support modi,0,1
someone explain remonetise hell print new currency,1,-1
answer statement given chinese mediator mission rejected manmohan singh twice tenure prime minister modi said yes still party shameless giving credit remote prime minister,-1,1
cannot wait play honestly day rarely excited game last hitman provided something would call definitive hitman experience little better body ready another also hope sell better first one although sure possible rdr breaking record,1,1
capable leader due portfolio changed jai modi india need modi,1,1
celebrate tomorrow april modi day,0,1
halo mana tune narendra modi powerful india ever nazi tum choir bone kai niche nazi home,1,1
chowkidars service rich people modi,1,1
cite modi remark affirm recovery bank due,0,0
claiming modi made businessman flee country loan defaulting tune lakh croresjust answer simple question gave loan last year govt gave loan default tum,0,0
clear modi find dump besides one two circus act like yesterday nothing offer,1,1
come guy local leader freedom expression represent bjp,0,1
concluding remark ata hai,0,0
confirmed successful test would make india fourth country one united state russia china election near modi played maximum effect,1,1
congratulation indian except pakistani passport holder modi,0,1
congratulation hai perfect example democracy party crooked party son daughter meta get seat win surely surely make proud modi,1,1
congratulation indian scientist deserve respect support recognition youre receiving modi govt,0,1
congratulation modi team india,0,1
congratulation namo modi,0,1
contest poll modi varanasi say sacked bef japan,0,0
corruption glue bind opposition modi northeast hindustan time,0,0
court india bot cannot reply query send hotmail subject anti anti block bot query please provide link submission would able help without link,-1,-1
cpi come i bar modi berojgar poll mantra,0,0
dad think modi going change india better mom initially hope bjp sceptical see indian political party full corrupt leader,1,1
dear that akshay kumar bet modi cannot even write scientist without help crediting himthis iso achievement fyi started near yes modi also built showchalaya operational may give credit,0,1
dear listen modify remembering coup story remember modi never forgets forgives,0,0
dear fellow indian modi think worrying abhinandans return wrong thing,-1,-1
definitive forthcoming interview modi taking tough question head making case emphatically clearly competition nationally take let bring vote nda,-1,0
demonitization gst successful modibjp asking vote historic decision,0,1
anyone notice much weight gained probably loss sense quadratically proportional weight gain,1,1
modi fired success credit shut army failure responsible sure anti bhutan dad asked proof,1,0
dismissed indian soldier tej bahadur contest election narendra modi,0,0
dot worry win modi get term,-1,0
modi face spine question neighbour exactly,1,0
dont narrow sighted know modi later previous mount ea allowed give green signal,-1,0
dont think soo make fun modi,1,1
dont understand comic like many others modi best guess stand solidarity fellow comic,1,1
dont worry election cannot single issue modi strong support rural area yes ppl dumb think,1,1
gut question modi coward that asking friend,0,0
bihar election modi shah campaigned rally bjp loose bihar cracker pakistan end result seatsheading towards another similar defeat good luck,1,0
election news live pakistan counting dead iaf strike opposition want proof say modi,1,-1
end debate near modi,0,0
every indian know powerful candid india need leader power modi,1,1
every voter became narendra modi,0,0
everyone opinion say shove pass definately name religion gotta personal opinion think modi something evil many also think criticize,1,-1
everything waste time arguing brainwashed minority defiant dismissive muscular hindutva way minority gravitate decency learn try sell,-1,-1
everything modi intelligent compassionate patriot vision country non misogynistic secular course next,-1,1
evidence something clearly implicated modi duty present nation police personal feeling noise,-1,1
figurative speaking modi figure though,0,0
first time voter vote narendra modi want see modi prime minister modi sir great leader hard working individual honest person thank much sir,1,1
first safeguard mother sister si law modi shah bjp r else even god save evil dirty hand modi shah bjp r rapist that,-1,-1
name sake least raid modi team also,-1,0
free modi shirt,1,1
free modi shirt follow,1,1
today onwards modi start addressing mega rally india appeal everyone support best world full strength,1,1
futureall dream lineal want live peacefully harmony building futurebuilding peaceful nationbuilding cap nation please vote modi with powell come with landslide victory,1,1
game changer modi era finished,-1,0
generally type news come ordo press release modi time address nation,1,0
give formula modi promised lakh promising joomla hai,1,1
goal kick youth modi drive,0,0
good jokemodi,1,1
gua blatantly biased modi backed scientist ordo iso deny joy announcing historic event praise scientist armed force bur want give credit leader,1,1
vote modi get lack free rethink voting strategy,1,0
haha dont justify self ordinary person celebritypeople mark atulji modi,-1,1
haha support modi bjp india love god reading stop defending without taking consideration support isnt emotional decision publicly backed bjp modi fact see,1,1
hahahahaha one choir modi listen old uncle saying,1,0
anyone seen politics trump raped year old yeah right think guy closing,1,-1
narendra modi really got spine,1,0
build good nation important bring three narendra modi,1,1
fool actor indian movie check school math per month become per year hater bjp modi much stainless,0,-1
freedom seventy year government cong always large number society allows glam modi victory hand victory hand,1,1
sense get chronic mindset minister responsible indian space research modi shouldnt announce achievement child pass imp exam dont tell everyone sit exam,1,1
reason vote modi gem portal product category registered seller govt buyer news reservation ongoing project completed adding,0,0
hey dear friend know leader know story watch official trailer modi,0,1
hey guy thanks little exchange two question nice know view american really put planning visit india transgender people using final hullabaloo state mean people care peer really get think religious component also security issue whole issue best possible solution forgive sound stupid,1,1
first election address poll schedule announced modi referred success mission shaft saying chowkidar government courage conduct surgical strike land air well space,1,1
modi fault asshole bank manager fault want shaft staff chutiyapa modi people aur modi band chute main aur range feel sorry mom missile anger,-1,-1
huge thanks bunch scientist sitting somewhere india great thing extremely proud must praise govt theyre one whose provided facility take process red heart,1,1
husband umpteen corruption charge cbi investigation face public without iota shame remorse clouded possession property dli week corruption challenge mind,0,1
iam surprised cbn bet wrong thing shift strategy poll management absolutely great one team good work one team dirty work anti modi anti backfire big time good article spiral,1,1
ideally vote best candidate constituency let decide parliamentary democracy work vote best candidate constituency vote bjp even candidate best list think good people bjp even though nothing contempt option select modi situation select second best,1,1
ignore told would leave india modi would win election till india posting caustic tweet,1,0
india achieving great height visionary leadership pradhansevak ordo chief said political become space superpower modi shown,1,1
india becoming world biggest fascist country modi government,1,-1
india election modi say india space power bbc news,0,0
india capability demonstrate technology sadly political upa give permission ahead project yeh modi dar alpha hai,-1,-1
india load stuff read old book called india age ramayana title might slightly different author used age character proof people used live year old india great stuff,1,1
india need modi government,0,0
india shoot satellite test modi hail arrival space power five life,-1,0
india successfully test antisatellite weapon sat becomes elite space power india becomes fourth country russia china carried feat say prime minister modi,1,0
india survive unless modi elected imagine dmy taking control emerging dayanidhi yet paid snl,0,0
indian rupee using poised appreciate further take probability continuation modi hai government high,1,1
india growth risk modi reelected cisco ceo john chamber,0,0
individual modi hater cant agree supportive even fight modi work towards common agenda hating modi going run country elected power cancerous mole even thrown opposition,1,-1
intact lost election asked vote reform modi know well mere economic performance cant help win election need something energie polarized voter,1,-1
intact wanted modi impose emergency jail corrupt opposition party via demonetization,-1,0
institution like faced worst challenge narendra modi year,-1,-1
intended keep narrative national security implies modi appears battery facing electorate governance record lynching acceptance indicator needn worry aam admin like mean,0,1
inverted indian flag shown trailer narendra modi movie censor board must take note,0,-1
isnt election commission work also hrithik madhavan follow instruction campaign would mean endorsing modi bjp,-1,0
i bat logic hai support area modi,0,1
hate modi much whatever eats get vanished moment enters mouth,1,-1
great achievement country indeed people talking larger picture show lower uneducated stratum modi behind,1,1
bc render modi dinamo,0,0
modi,0,0
goon desperate modi come back power,-1,-1
jaihind sir air force veteran away handed aged yr richard follower modi want perform duty election process noid constituency reside sec need service found,-1,0
jaisheeram jailed mission modi bjp,0,-1
like modi next level radical,0,1
kannada stand modi still win power upright young men,1,1
kindly appreciate strong bond opposition alliance modi think india likely gain idiotic group politician digest need strong bonded india sustain growth standing globe,1,1
language difference opinion entitled cut abhinandan hero defend country everytike get chance far modi concerned never credit bring back hour ignorant modi effort,1,1
last month attended big marriage rural visited numerous village meeting relative extended family modi bluff called outcome pulwamabalakot get transferred roi bjp max seat rural ind surprise many bandit,1,0
leader previous govt indulge corruption kept personal interest national interest modi,-1,1
learn buy hold sell professional trainer mrsahil modi offer exclusive training stock market trading,1,0
least modi converted hindu back wrong secular grandfather muslim mother christian hybrid secular come hindu,-1,-1
let join hand vandematram dam varanasi bulanala trader weeping economy bleeding martyr repeating defeat modi,0,0
let keep modi open job vacancy good job keep fighting,1,0
liberal modi diverting attention real issue also liberal,1,0
live mode important message nation,1,0
live heart modi,1,0
lok sabha election live update modi issue strong response terrorism say mit shah bihar,1,-1
lol indian sushi shot ndtv indian medium would used pull modi govt possible please explain second pilot disp said arrested said one custody hospital pilot,1,0
lol take action gave clean chit even modi ran full fledged program sat launch,1,1
look like despite power five year narendra modi really nothing worthwhile show achievement saying terrorist pakistan want lose opposition win showing desperation nothing else sad,1,-1
look like party anti modi clan town,0,1
letter trusted cooling voter fake promise dynasty millionaire wake voter stand honest dedicated modi,1,1
loved called mahagathbandhan joke coming together stop modi bro nailed,1,1
many heart congratulation space scientist decisive leader modi compatriot becoming world power space military proud country,1,1
massive crowd modi meeting meet,0,0
matter fact modi time bother matter fact chaiwalas son prostitute,0,0
may somebody get pile also party may tell bc modi got pile,-1,1
mean others tainted except modi self made certificate,0,0
middle class bear notebandi lower class poor people stand line die demonization support modi cause though utter failure warned confirmed rbi cant middle class bear brother sisterour people,1,-1
mini modi another modi making stainless ppl youth main victim dis modigovts economic policy talk like,1,0
mixed view video first one say modi chooses people alphabetically good second one sure avoided painting hardworking real chowkidars political one brush imo,1,1
modi eps mla set conform,0,0
modi one,0,0
modi also reached retirement age decade ago,0,0
modi two factor bangalore south seat bjp candidate bangalore tell theorist associate editor interview,0,0
modi arrives arunachals halo address mega rally shortly,0,0
modi enemy india,0,-1
modi best india support modi government,1,1
modi confident seat,1,1
modi contested seat remember,0,0
modi count party,0,1
modi didnt credit brother mentioned india successful mission,1,1
modi engaged celebs boost visibility study window news,0,1
modi failed invest education young people failed invest future change coming,-1,-1
modi sure,1,1
modi game election campaign kill people election extent,1,-1
modi govt corrupt people name came people saying intolerance fact tolerate society jail year safe hand people came to power,1,1
modi govt get credit mission shaft political battle space war tech,0,-1
modi govt move amend forest law dangerous draconian,-1,-1
modi gt ever,0,0
modi destroyed mai baa culture made common people dependent political mai baa small basic need whole god like aura politician used feel poor people hence nya scheme bring back culture,-1,-1
modi everything otherwise well press nota,0,0
modi much better thing take care policy always better called,1,1
modi written bad loan worth lakh crore partnerslike ambaniadani business deposit share offshore account return favour done,1,1
modi spent much publicity selfbranding advertisement opposing poor india,1,-1
modi interact chowkidars part main bhi chowkidar campaign time india,1,0
modi interact chowkidars part main bhi chowkidar campaign time india,1,0
modi interview people india seek government poor bahumat say modi explaining,0,-1
modi keeping eye,0,0
modi loses election guy entertainment next year khan mile ina content,-1,0
modi matter tamilnadu say tholvi bay pls consider hindu,0,0
modi need new title butcher gujarat,1,0
modi never said prove said,0,0
modi mm needed lesson,0,0
modi opposition leader competing popularity pakistan,0,1
modi asset job,0,1
modi scientist demanding testing shooting satellite space government upa postponed decision also make india century strong security decision taken long ago kept getting delayed,1,0
modi promise new launch election campaign,1,1
modi referring,0,0
modi replaced planning commission retrograde step propaganda wing,1,0
modi seems scared,0,-1
modi set new narrative one master precision communicator,1,0
modi shah going sending rubber stamp home min,0,0
modi sir please want next year,0,1
modi sir want vote waiting day due work delhi dont want miss important vote please please suggest way vote city carry document proof identity,1,1
modi sold dream selling shirt learnt selling people dream removing poverty let see play time come,0,0
modi still remain peru tag hang around neck lifetime,0,0
modi countryrepresentive country right announce country,0,0
modi steal credit armed force brings lime light anti terrorist operation done continue done modi award medal instead brave soldier,1,1
modi trying best,1,1
modi using space political mile remain public shame,0,-1
modi want remade history want indian people remain modi like near hand abbr history ending jailed migrant others country,0,1
modi want claim credit everything good happening refuse take blame wrong ref killed due intelligence failure blame modi become anti india pakistan,1,-1
modi wasting money feed poor people,-1,-1
modi win comfortably might force spend extra day varanasi somehow doubt pg risk musique important part appeal let see,1,1
modi worst one film life guilty modi guilty r hindutava saffron terror blah blah,-1,-1
modi early return,0,0
mode petrol trending,0,0
modi year report carbonyl sound fury signifying nothing,1,-1
time toh modi marker anti hee hai abc keyboard android convenient easy simple flawless free google amazon pleasure use,1,1
powerful dialogue modify first election rally,1,1
movement enhanced support msg great modi,1,1
jaipur represent ama want edit everyone visiting jaipur eat tari doha,0,0
narendra modi get clean chit addressing country mission shaft stand decision election commission,1,1
narendra modi india entered name elite space power antisatellite weapon sat successfully targeted live satellite low earth orbit,1,0
narendra modi jai,1,0
narendra modi speech live update india become space superpower say via,1,0
narendra modi thug life moment edition part watch indian via,0,0
narendra modi kickstarter election campaign tomorrow bjp national general secretary,1,0
nda govt committed assam accord grant scheduled tribe status six community modi,0,1
need strong government need stable government need efficient government need honest government need growth oriented governmentthereforelets voteagain shri modi,1,1
