another good example pewdiepie series stupid battle perpetuated racism anything else thank finally someone said know people talking issue,1,-1
bjp lost vote share lost seat,0,-1
campaigning always keep modi ahead china know trick like master,0,1
cup thought scheme upa time oh never economy destroyed didnt money even buy one rafael thanks making economy strong even think hilarious world idea cheer vote modi,1,1
like rebuttal look constituent think voting record pretty erratic unreliable good job documenting long trail criticism bullshit seem pretty legit,1,1
mean bjp could work would really nice new low bjp,1,0
mean something like lot indian name lot indian name lot indian name lot indian name lot indian name lot indian name lot indian name lot indian name lot indian name lot indian name lot indian name lot indian name lot indian name lot,-1,1
modi religious figure fuck bjp worker,-1,-1
never receiving end alt right whatsapp forward post corrects really stupid assumption used think forwarded message would laughable illogical face value sinister masquerade well constructed carefully worded logical argument unless question fundamental assumption motive behind renaming would easy buy also kudos response,-1,0
observed sharp attack well twitter handle run office,-1,0
really happy see comment well explained editor sans jerk huge huge difference aaptards modi supporter,1,1
think many reason think main one radical left becoming mainstream politician moderate centre left followed example people backed people crazy anti free speech gun law extreme intolerance others disagree also reading comment calling people right wing racist oppressive uneducated prime example childish discourse intolerance people like associated comment decency ff disagree someone mean thing,1,-1
called milling cow dry face end tenure losing opportunity make money manner possible real businessman bos,1,0
torus sixthformius need pesticide,0,0
bjp going god,0,0
case corruption registered drsaraswat website called something would pleased know even mode favorite assault company involved listen must nut,1,0
poll narendra modi must become prime minister say rajasthan governor alan singh via thanks,1,1
dont think modi shining traitor sum vote bjp,-1,0
abbey laude people business owner force kar swine machine rake,0,0
actually loan given like entire banking system looted npa finished modi took,0,1
adarniya modi bjp jyadatar voter baker gam rate main requesting plz arrange vote right job site,0,0
air india goal withdraws boarding pass photo modi ndtv news,0,0
airforce drama submarine showed,0,0
getting reelected prime minister india first step taken modi remove sham entry article constitution india declare qualification state union territory,1,0
agree tenure modiganga rejuvenation work started working,0,1
haha recognise well last time gujarat speak sam language working believe positively overconfidance arrogant person modi decided swift vote,1,1
airport operational say modi minister next lie aspxqref,0,0
credit given modi bjp government making opposition feel hindu important make run around temple,1,1
futile modi back,0,-1
left mode oratory skill help bjp win time blame game worked back enough talk year please talk last year,1,1
criticism modi reminds wife anyone help understand,0,0
following true historic day india could done several year earlier scientist modi made announcement mode address country clearly aimed boosting election prospect,1,1
wikis keep spreading bjp helped nav escape,0,0
fine use foreign policy investment sushi sarah recently revealed astounding fact record billion worth di come india past year two hundred fifty billion dollar,1,1
always believed modi knew proof brilliant usual,1,1
anand mahindra pitch scorpion mode official car,0,0
enemy modi govt indian democracy killed indian security force,-1,-1
modi govt unable prosecute airtel maxisinternal sabotage workhypocrisy,-1,-1
remark hypocrite gave mode speech he illiterate doesnt culture,-1,0
promise another jump people india modi attack minute attack sec,-1,-1
another common trait among modi chart keep blaming previous govt failure,-1,-1
another modi jailed exposed worst idiotic economic decision taken history independent india sold people based lie false propaganda,-1,-1
ansh versa resigned party joined interesting thing submitted resignation chowkidar bjp headquarter adding modi fake chowkidar let give equal respect real chowkidar,1,0
anti modi make special every right anti modi please note even duryodhana grand son bhishma pitamah mean dharmaralshak remember claiming real dharma parish,1,1
portal bjp run goa,0,0
anyway modi worshiped showing much interest interesting,1,1
anyways modi best firsemodi,1,1
reporter real friend find place hide face modi going join another modi soon,1,1
arent analyse dispassionately come considered decision upa introduced aadhaar used great effect modi,1,1
arent ready yet ready modi press kill button,1,-1
arithmetic calculation didnt matter election matter election narendra modi,0,0
are ordo announced acquiring capability anti satellite missile today modi make announcement national prime election season take credit surgical strike wah modify wah,0,0
sat happens modi ordo raid karnataka happens dept modi,0,0
sat test brings vote narendra modi help get reelected well truly justified,1,1
sat test like become common place space environment fragile risk weapon test hopefully took every percussion minimize debris,-1,0
sat tested around government give ahead testing hence testing cease testing given ahead prime minister narendra modi ordo started working,0,0
assam rally modi steer clear citizenship bill nrc assam lok sabha election news time india,1,1
aurangzebafter converting original vishwanath temple gyanvapi mosque settled soldier around mosque occupying smaller temple around built house top last modi removed illegal muslim encroaches,1,0
away hustle hustle trailer tom scene punjab eye hitting pink colour theme colour another feeling pride city match roll,-1,1
basically modi ji idea destroying satellite dont respond,-1,-1
internet gotten cheap misinformation spreading like wildfire take decade adjust new normal modi clean bharat politics fan people recently come online seasoned right digging bjp grave though history worst,1,-1
criticising bjp modi mapdata must get confidant minister investigated corruption charge cbi,0,-1
modi shortage job,0,0
behaves like insane person sign seriousness fear losing election,-1,-1
believe modi govt,0,0
believe unemployment collective failure upa nda couldnt help manufacturing sector get going also think least part historic data garbage cant year high wish team make point interview press conference,-1,-1
believe modi fraudsaraing please tell truth,0,1
hai ready kill head every isi terrorist give chance saudi arabia sleeping modi shut make big army kill isi happily lead kill every isi terrorist,1,-1
bjp logic grab throat feeling safe feel fucking safe,1,1
bjp campaigning urging vote celebrating upcoming win,1,1
bollywood deference modi never obvious following list reminder time bollywood along regional film campaigned indian prime minister,1,0
bring back vijay mall nav modi medal chouksi whats benefit travel around world loser,0,1
bro like modi,0,1
bspsprld support varanasi fight modi strong voice poor downtrodden,1,0
btw british empire country scheme used different way america scheme implies something underhanded tricky mean approach usually regard something financial,-1,0
btw support terror blind pre consumed mind open eye first dont drug talk show one tweet mine supported lynching attack said modi r that stop tweet dot belong,1,-1
btw shouldnt ordo making announcement via press release modi getting desperate hog limelight,-1,-1
medium others every thing modi,0,0
political upa govt gave firm ahead iso sarawak madhavan air former chief iso reiterated today first even former mo pm pridhvi raj chapman told upa govt give ahead modi gave fast,1,0
worry modi bjp hindu united,0,0
besides dalla hindu one vote modi india,0,0
wont compliment modi,-1,-1
shouldnt raise thought family manga remember modi international platform vasudhaiva kutumbakam world one family,1,0
call modi take failure sunshields say shot live satellite end paying damage sure got single guy around,1,-1
also brand ambassador beta bach beta padma,0,0
choose vote modi,0,0
lead counter polarization urban middle classbut think anyways voting modi fewer number though concentrated,1,0
understand frustration modi space coda bahn,0,-1
chapter woody think negotiating wont milk cow money going lakh modi jee gonna give lakh era soon winning give another possible bonus,1,1
cheer modi come another masterstroke demonetisation drag blind supporter might actually turn people suffer even,0,-1
chordeep eats like pig speaks garbage mouth mission find negativity modi modi later chordeep,0,0
chowkidar modi say extra male sign,1,0
chowkipolice station darprotector also leader thats narendra modithe spot country want chowkidar,0,0
citizen support india dynastyfree corruptionfree terrorfree safe citizen people nation support modi work tirelessly improving life ballet also pledge chowkidaars support inte change,1,1
citizen support new india fighting corruption dirt terrorism poverty pledge support chowkidar india modi building new india strong secure prosperous via namo app,1,0
comedy circus mean modi government,-1,1
comment kar demo bjp jayega,0,0
confirmedmeanreally shamefulhave seen live telecast great mode speech regarding missile hit satellite made world record satellite launched single flight first county send satellite mar first attempt,1,1
congratulation indian narendra modi,0,1
congratulation scientist ordo beloved ordo capability enabled political key modi never cease surprise growing india day sphere proud moment every indian,1,1
contentious topic like modi helping helper kitchen left,0,1
could someone tell fund ad taxpayer money private money bunch taxpayer,0,0
country minority modi sarkaar,0,0
col modi say delivers,0,0
col partition modi unified india spread hatred hanged see,0,-1
crocodile tear camera move crowd instructed stand sloganeer last time modi wave got lok sabha easy time,-1,1
data enemy supporting modi fearful opposition coming better policy,-1,0
dear hater remember bridge biggest proof modi much better song vajpayee started upa nothing modi restarted completed please makeup,1,1
dear leftist anti modi minded movie pm life alluding people offering humble request try politically centrist mentioned profile,-1,0
dear mr vara opened saving account talking near india rajeev manmohan raga none historical step done time great narendra hai modi dont cheat innocent people,1,1
defense deal atm previous cong govt modi,-1,0
desperately need modi courageous airing support bjp,-1,1
modi shoot vodafone satellite nothing else explains horrible network,-1,0
kill make stronger one way seat contesting varanasi wherever modi contesting simple enough push narrative change get,-1,-1
seem unhappy instead telling truththis anti modi crusade initiated corruption led people one agenda mean modi mean shameshame,-1,-1
dont believe modi personally space collect proof see success sab jump hai,1,1
dont think modi accept defeat peacefully create ripple indian democracy using immoral method gain power way keep power let give bjp,0,0
dont think employed modi,0,0
dont think modi said word bjp anywhere,0,0
distract topic discussion like modi chart discus comment upon issue,0,0
know modify announced department space come directly prime minister india know modify modi those ata ata hai,1,0
ordo iso achievement modi like,0,1
drrajan said could done around panagariya rate economist nothing modi sarkarhe watching economy destroyed hahahahahah,0,-1
east west modi best contrary,1,1
eci slam ministry railway civil aviation asks picture modi removed railway ticket boarding pass ministry submit reply within day,0,-1
effective action security terrorism modi failed even protect army camp assault,1,-1
every country praise modi except pakistan china,1,1
every indian know deceit modi government,-1,-1
every opposing party trying best turn table bringing rubbish gather even know fir make sense half nation caught modi hype looking forward government everyone need change,1,1
exactly dash modi govt best youth india stupid people,1,0
excellent work done indian scientist leader modi,1,1
finally something post modi,1,0
first choice correct choice narendra modi,1,0
first logic nation first ideal stand logic modi best nation rest tempting power country clean corruption free due digital transaction poor empowered anti national institutionsslogans eliminated,1,1
first thing modi you,1,0
first time karnataka history chief minister protesting public never happened past modi forced,-1,-1
former chief ordo sarawak explains significance clearance pm level sat programme modi showed willingness missing upa upa era ordo chief reveals govt didnt give resource permission complete mission shaft credit,-1,1
fresh firing missile knock one india satellite indian modi said thursday india space power bloomberg report,1,0
catching wood modi descended watching near legacy space power double exclamation mark congratulation scientist india also would like thank former near glorious contribution india iso,1,1
modi told every citizen,0,0
fuck paid cash hand ten buck need someone spot money tomorrow,-1,0
funny india option rogue modi population billion proud indian threshold pride,1,1
and superman remember vote modi,0,0
gata dani ani albania signed le deal accompanied narendra modi foreign trip beneficiary modi sglobetrottingadaniambani,-1,1
gdp growth delivered job growth went wrong modi math gdp growth delivered job growth went wrong modi math,-1,1
get flat flashback upto narendra modi movie ticket get promo code,-1,0
get popcorn ready faith modi,1,1
going space personally verify mode claim india testing,0,0
good inspirationcompaign bind lucky modi,1,1
good vision presented next narendraodi,1,1
good challenging please also ask question lately modi also,1,1
great wall china manage home wall india jan devote crane there desk dushmano chan election multiple choice option single cgreatorrect option bjp modi,1,1
guy real life story narendra modi watch official trailer modi erosion,1,0
supporting statistic mostly stacked joomla today right ram raja speaking modi tomorrow say modi terrible tejaswi learned terrible english mean going terrible job,-1,-1
haha slave whose leader went pakistan beg bring modi help,1,1
haha like chart chowkidars without sense irony providing glimpse modi second term,1,1
haha medium helping modi free,1,1
haha seek active transcript mode speech analyse urgency via,1,1
hahahaha got hate modi bc didnt gave lac,-1,-1
given nice gift r engraving bjp leader shah made corrupt assigning suchwise job compelled indulge knowingly due liability modi nation,1,1
courage surgical strike land sky space modi india live,1,1
heard said obama trump also indian modi anyone gave right encroach,1,0
shame calling slab gov failure law order situation keep blabbering modi modi time tweeted,-1,-1
early strangely performance indian people modi honest prime minister india growth india success india need narendra modi hope next narendra modi,1,1
hello provide detail land humanchal people know much anger modi,-1,-1
hello madam modi govt papua govt give duck kicked india,0,0
reason vote modi crore household lit rural electricity coverage household home remain chhatisgarh,1,0
his gate modi,0,0
honorable achievement modi govt strong political doubt achievement achieved dis technology govt friend didnt take strong political test,1,1
hope bjp doesnt use election poster limitless drama opposition target special address nation ndtv,1,1
hope studied science would known going moon mar easier going bottom deepest sea calm control hate modi,-1,1
modi role farmer actually never really happened,-1,0
dare say namo modi modi,0,0
democracy effected due modi mama,-1,0
many mistake burn mano modi hai,1,-1
much bribe medium getting promote modi political agenda said chip note locate even earth liar,1,-1
much india losing,1,-1
much modi going lie lie reached sky,1,0
idiot ministry space headed modi bomb leader,-1,-1
imagine kr winning ipl modi kicked power kya hall yoga chaukidaro,1,1
independent investigation done next government death japan pulwama attack may well added mode mass murder kitty,0,-1
india going country hard hit climate change precious resource put allocated dumb thing like building statue edit wording,-1,1
india shot live lowearth satellite space antisatellite missile narendra modi say making india country acquire capability russia china,-1,0
india successfully destroyed satellite india nation reach position india registered space power narendra modi,1,0
india map one side modi side tomato sold tagline love india love modi came know visiting kurnool march part election campaigning,1,1
india say narendramodi interacted people across nation today check highlight programme,0,1
india shoot loworbit satellite becomes space power say narendra modi,-1,-1
india modi anti india according tejasvi sure candidate bangalore,0,0
indian modi plan national broadcast wednesday,0,0
indian people elect modi govt big economic crisis generate indian economy india become poorest country universe,1,-1
india disappearing deficit whats putting modi driver seat,0,-1
interesting see anti modi comment thread account created one two day back look like energy working reddit apart twitter,1,1
international medium exposed naked lie indian modi medium poll,0,0
better opposing modi base lie,-1,1
mean issue left mahathugbandhan election one agenda stopped modi joke opposition one big thing missing corruption center government free disease,1,1
perception opposition create confusion modi supporter know good,1,1
ticketing taking modi hatred another level,-1,-1
jawaharlal near already made two hindustan modi,0,0
jayaho modi god blessing always youagain prime ministernamo yamaha jai sri ram,0,1
jayaho modi waiting response sir,0,0
jhootha how toh modi asia how,1,0
join modi along lakh people throughout country movement via map,0,0
foto solar flee now aber omar jane good,0,1
journ friend came back reporting one sentence response logo like toh modi hoon iaaf main love country,1,1
july wrote modi establishing system corruption electoral bond requirement identify donor political party,0,1
jump tha bhaimodi jumlabazi fakuisum misleading help country jai hind,0,0
name modi make mad losing mind year much impact happen gang yr modi win lot leave land,-1,0
keyboard warrior searching reason narendra modi declared sat mission success today perhaps still aware iso come directly pm india folk,1,1
chili aurangazeb shivaji era peaked independence hindu uniting chose leader choice religious polarization minority voting modi communal party like url admin aid polarization,0,1
know openly modi expected,1,0
know saying statement clear modi govt never wanted wing commander abhinandan come back,1,1
know pain modi would shouting producing scheme got stamped,0,-1
such bhi taro modi hara hai serious word least completely failure directly dont able give support candidate shame,1,-1
kya space pair chalk karla dia tune mud mud khujli khujli sale don don asia chat hai mud aur khujli raise ice cream chat race,0,0
let see side picture rapid crash miss could also pressure tactic modi marker buy rafael contract price,-1,-1
listen india modi file missing stole,-1,0
live democracy vote ever want dictate term anybody specially youth well aware educated tell antiindia supporting modi gave authorityyou yet,1,1
live modi address public meeting halo pradesh,1,0
living support modi,0,1
lok sabha election live update modi kickstarter poll campaigning northeast arunachal pradesh high voltage planning commission,1,0
lok sabha election modi election rally start meet yogi adityanath join,0,0
lok sabha poll time right narendra modi maker bet big biopic high voltage,1,0
love bjp party bold political render modi,1,1
mama last time voter dpi voting candidate make modi youve failed youre never seen constituency would understand cabinet minister,1,-1
madam maghatbandan people wont allow one good debate dont actual point ask wont allow people answer let anything modi marker,1,-1
main bhi chowkidar programme modi say allow anyone misuse public money,1,0
mam rule bowler warn batsman least guilty umpire batsman cautious also happen,-1,0
man country working hard yes credit uneducated never worked modi people sabha sal gay manga aan people get mic get credit thing heard exists min lol,1,1
man read really india pretty cool country definitely getting better think next year first world probably one prosperous nation id people say terrible thing probably guy lot proud beautiful culture amazing food wonderful religion ever read block hater man,1,1
march pin cancha tweet bootlicking modi march given ticket,0,0
matching lot modi,0,0
may modi power chamchas tower suicide such din aur bio twitter began,0,-1
may modi wish lose election,0,0
military space warfare next level important milestone like nuclear test understand importance atleast make attempt hate india pursuit hating modi,1,-1
mission shaft modi claim government taken step set chowkidar space via thanks,1,1
mm india gdp growth rate exceed bjp gain ground west bengal lose kerala alma retain exchange rate touch kind using real estate construction business,1,1
modi address nation isnt mcc odisha kerala govt announcement must allowed cannot use national security excuse,0,0
modi adorn multi attire cry want win fall play,1,1
modi shut mouth,0,0
modi also protecting r terrorist ppl,0,-1
modi also wont problem saying twitter tell problem finish quickly got better thing,1,1
modi r parva obsessed pakistan hate pakistan dream india like pakistan albeit hindu one,-1,0
modi ani rubbish,0,0
modi announces village electrification million indian home still dark,-1,0
modi quietly hoping temple statue yamaha distract attention maladministration corruption want come back power see iaaf nat shi visa slogan bjp get laughed fear chaos promise actually deliver,1,0
modi busy launching anti satellite missile army busy launching anti terrorist action seems india going right direction,1,-1
modi fight varanasi gujarat problem fighting kerala,0,-1
modi manage anything modi hai pumpkin hai night sane person blind that refuse beyond modi nothing gst personal ask stupid question like many type labour tell many stitch per underwear technical factual,-1,-1
modi coin new acronym sarah hit grand alliance akhilesh give spin news,1,1
modi communal,1,0
modi delivered speech period,0,0
modi denies marathi right fly india top story,1,0
modi destroying constitution problem main bhi chowkidar acc failed cup train haram kolkata baffled shop owner say tmc threatening stunning party flag,-1,-1
modi good job,1,1
modi effect difference actual dramabewkoof dramebaaz,0,0
modi fails control china threat year china war india still lack crucial strategic culture opinion,-1,-1
modi fulfilling kejriwal promise good governance whereas kejriwal joining hand corrupt politician taught initially become definition corruption,1,1
modi get travel lot job would kill job like,0,-1
modi global warming exist climate change changing,0,0
modi govt met disinvestment target one public sector company bought another reprint via,0,0
modi govt passed law anonymous bond donation,0,0
modi hai pumpkin hai,0,0
modi hai pumpkin hai mode interaction people across india watch live via namo app,1,0
modi shame,0,-1
modi gut come kerala surely fall,1,1
modi internet download kia tha dawn news,0,-1
modi jee please cut fraud india legit worker face brunt,-1,-1
modi jee iron man india want dream future india cast vote modi bjp,0,1
modi informed country sat test bigger achievement nuclear test achievement nation bjp alone,0,0
modi secured pm chair,0,1
modi made king doesnt care indian institution,0,-1
modi hope india,0,1
modi promised drop delivered modi promised farm waiver delivered modi promised universal healthcare delivered modi promised lakh tax exemption delivered modi promised toilet delivered modi promised electricity delivered,-1,1
modi proud achievement bihar mah bjpruled state max number la serious criminal charge according analysis association democratic reform adr national election watch newport revealed sitting la mp,1,0
modi say govt shown courage surgical strike spheresland sky space,0,1
modi say india space power shooting satellite sent fortification sixth bard,-1,0
modi sending satellite shooting,-1,0
modi shame like hitler,0,0
modi sir heart every indian none erase picture lessen love precious gift,1,1
modi super human hence capable breaking everything,1,1
modi team mahagathbandhan team playing tha team running ticket mission run,0,0
modi universal honest person,1,1
modi trying hard snatch credit scientist year old project election bastard,-1,-1
modi wave,0,0
modi wave time tsunami,0,0
modi eci establishment page mode mission change constitution turn india secular hindu country,0,0
modi give another chance pak beat shit,-1,-1
modify such hint bunker tara chagrin atm tara,1,-1
mode broadcast poll panel likely decide today alleged violation model code conduct,-1,-1
mode gun working,0,-1
mode hindu india india become hell muslim,0,-1
monetization phulwama want modi,1,0
village electrified govt interesting village eastern india village remote corner north east difficult even reach area modi govt made possible,1,0
narendra modi surprise speed scale skill risk,0,0
narendra modi addressing public rally meet year ago sought blessing gave lot love said return blessing love interest also said give account work,1,1
narendra modi really man fear wall,1,-1
narendra modi answer question context recent terror attack,0,-1
need data common man time modi govt year report card mega analysis drug rather such via,-1,0
never expected much low support anti national element modi,1,0
