always hear modi come gujarat politics le unknown politician know,-1,0
bjp loses pakistani celebrate wonder,-1,1
heard bias army north indian like south indian tamil people like kannada people amazed country still one nation said cia saint either neither r,0,1
hope dark politics mixing lead physical fight case know good friendship broken apart foreseeable future keep open mind weigh policy merit great expectation cancellation money something still cannot fathom day someone come lower stratum understand india work much cash shake head take stockholm syndrome wear completely trying convert idea debate stopped talking far gone childhood kicker hard program come side neutral side consider policy old faith haiti mein baht shaft main different stroke different folk,1,1
indicates almost representative support gay right cross couple decade shameful take long,1,0
inspiring better trust destiny moving independence day touching braveheart,1,1
malayalam guessing mayor mentioned article seem source know pair know pair ritual culture spoken two air friend thought making shit painting hinduism one broad brush probably dipped virgin blood article talk one talk hindu take criticism etc etc probably article full shit lol fucking thread people shift vague article seem clarify anything,-1,-1
sabha chapman dunno whether fringe bjp fact woman said loud thought sash maharaj type double horror real guy,1,-1
minute meeting suggest round submitted information two query september detail whether gram sabha consent taken sure dani group already rehabilitation program mind encroach area also actively investing alternative source energy,1,1
song van say story rule slipper ramayana tamil nadu modi two slipper rule song van also attack modi cavern issue take little get chart triggered,-1,-1
think time taking news bjp high command put mla bus,1,0
weird anyone else use picture narendra modi,-1,0
say evidence important forming conclusion extraordinary claim need extraordinary evidence established true serious blow whole ballot chest jumping even strike may achieved objective hence think tread carefully,1,1
pls send pray kentucky,0,1
crore someone going much black money,-1,0
tak india bang door party jay first hare like taiyaar,-1,1
far best prime minister india today wish narendra modi elected actor reply vote kar campaign namo app tongue language language,1,1
modi,0,0
old girl raped murdered secunderabad labour bihar tweeted ito culprit hindu carry modi agenda spreading hate keep thing let unite moon happy get rid govt,-1,-1
are frustrated achievement belongs modi sun delle,-1,-1
according nasa graphic satellite revolving spaceamong indian satellite traveling decision taken high command credit go modi,1,1
actually modi destroyed terror satellite pakistan,0,-1
actually modi never said would give lakh said enough money smashed brought back could put citizen figure lakh highly exaggerated figure though,-1,0
advance otherwise going die soonhiz leg gravewhat else modi,0,-1
giving whole life bjp respect chowkidaar tadipaar gave shri advance shri joshi modi chowkidaar photo ops bending taking blessing people dont know wedding side disrespect people,1,1
modi twitter appeal voting shin request return,0,0
winning like mm said money doesnt hire tree magic wand blame modi,1,1
want modi,0,0
air india boarding pas modi photo kick row airline withdraws indian express via,0,0
india star war weapon watch modi live via,1,-1
goodness modi,0,1
best follow modi,1,1
always knew doesnt like modi,0,0
amazing angle story modi shah blood group maya akhilesh male sign,1,1
anarchy take place sane moderate keep quiet let evil play music many muslim celebrity hollywood bollywood objected problem deciding trump modi israel netanyahu bush mall obamas,-1,-1
also albania want modi stay power helping modi election campaign,1,1
modi bring fame india,0,1
modi manage issue,0,0
due modi,-1,0
govt denied permission ordo modi made possible namo,0,-1
winner modi,0,1
another feather hat modi achievementwhole country sir going win election,1,1
answer made place faith modi first place,1,1
modi sir,0,0
are chu chowkidar india already bankrupt modi year,0,-1
article start stating agree still supported different rbi told govt read article,0,1
ash hai plz share name information new law established modi govt big loan defaulted,1,1
atleast andhra settler vote trskcr bjpmodi receiving legally entitled one crore rupeeskrishnagodavari water vote trskcr respect maru boom injusticelegall right denied alma bhoomiap,1,1
atleast been been protecting upa medium mandate hypocrite sycophant praying bjp loss ala wont happen modi despite effort evidently explained gadkariji,-1,0
awesome newsgroup indianproud modi,1,1
backwards,0,0
baht logo trigger kar dia tune,0,0
barbaric christian world unite take action also religion strangely india christian muslim together vote modi yechury open mouth minion,-1,0
basically right ram raja noted end think rope dubai medium trying use prop beat modi saka might wrong might right dont care want show around medal,-1,-1
basically easy five star shut shared five star shut shared five star shut shared five star shut shared five star shut shared five star shut shared five star shut shared five star shut shared five star shut shared five star shut shared five star shut shared five star shut shared,-1,1
book nothing modi habit taking credit everything,0,1
earlier busy looting fund spared bare minimum need military modi generated fund golden opportunity loot hook brook,1,1
modi already got credit executing pulwama attack,0,0
becauseindira delivered many act helped india indian feel proud world hand narendra modi continuously destroying shading india indian well every aspect,1,1
modi start campaigning medium put bjp winning seat around modify started campaigning tearing apart opposition campaign adding bjp seat,1,1
verified whether modi said thing doing lakh everyone account,0,0
besides political survival business interest biggest defeating bjp primarily escape probe scam link mafia never good hull party even honest modi couldnt change,1,-1
bet irony modi gaining whole plug event,1,1
that everything done modi anti that every thing done cong gov,0,-1
big big salute scientist ordo iso last least courage great prime minister narendra modi,1,1
bjp candidate prestigious bangalore south constituency tejasvi sure record saying modi india modi antiindia,0,1
bjp goon led village sarpanch destroy crop farmer mode rally initiate action brazeness,-1,-1
bjp nen raise curia banana bjp want win next election keep guy jail like ashram baku,1,1
bjp get seat uttar pradesh bjp get seat across india nationwide angst modi hidden editor delhi,-1,0
bomb blast ref convoy look like modi novel work aur kind lease bichaoge election title like,0,1
bro supporting country ofc modi really well support hme unse alpha nhi mil ska abi future pta nhi,1,1
bro totally frustrated every morning wake night see tweet really give king pleasure would love see modi next year,1,1
buck stop modi,0,0
anyway modi,1,0
modi stop investigation corrupted people party,0,0
campaign live modi interact people place via videoconferencing,1,0
another country influence outcome democratic election esp successful democracy russian probably recently fear pakistan also done well see pulwama thing falling place people started talking issue bjp barefoot seemed change happen bjp shown place pulwama ballot thing changed abruptly seems modi probably win another term forget absolute ineptness infighting opposition helped great deal bjp call conspiracy theorist want cant help wonder pakistan pulloff greatest con job democratic world post cold war,1,1
tag user asking consent tagging,0,0
vote modi outside india nri voter reply,0,0
cause people looted india sucked poor blood made asset eating ship tax money came sweat thats reason high couldnt year done modi,1,-1
ch iron her never tried address city problemswish city city modi hope would consider plea city potential first smart city need right leader,1,1
check trailer real life story narendra modi,1,0
chutiyapa bhi koi had hot hey yea pair colonel aise ban game col chutiyagiri,1,-1
coherent set policy aimed decreasing gender disadvantage workplace absent policy pipeline black holistic planning likely relegate initiative modi govt woman collection poorly executed programme,1,-1
come know upa walk talk say easy credit mean look nav modi mall big mountain pnas left behind dont mean raga okay,1,1
come video iso ordo biggest achievement decade wrong modi also head department space issuing statement regarding massive achievement world especially crucial time pak china ranging,-1,-1
cong taking away job livelihood unlike modi govt double grammy failing create job causing job loss crore,0,-1
contrast modi launching youtube streaming without suffering first nation earth achieve wah modify wah,1,1
congratulation modi team mode supporter ready handle opposition party opposition india achievement victory hand,1,1
congratulation modi team proved modi hai pumpkin hai,0,1
congratulation younger brother age never expected kind glory responsibility ever attained abv stay focused helping elder brother sri narendra modi,1,1
crore indian got poverty modi happened yr agohence need surgical strike poverty,0,-1
summit modi shipped probably bought sell though,0,0
damn people making modi larger party larger country leader bjp wont mind though,0,0
dangerous political posting space hail purposefully created space debris,-1,0
dear american friend please accept condolence share value treasure freedom stand difficult day unfortunately towards exploiting value chris order perpetuate horrific attack innocent people hope west strength mind take determined action aim hurt people mock civilization time preserving cultivating value honor,-1,1
defeat congbio tmc aap egoisticldrsjoinus get vote forgot defeating modi raiserescs total target relief taxpayersend modi taxterrorism gstregd msmesstartubifor familiesfill govtjobs,0,-1
demo world even pakistani saying modi,0,0
democracy danger modi power lizard digest fact,0,-1
depends modi campaigning,0,0
didnt bihar defeat nda assembly election two year ago compared educated folk swallowed modi ji jump without questioning,1,1
disappointing true attack stunt modi,-1,-1
disaster called modi,0,-1
anybody except modi india hater believe corrupt party world share gumption talk corruption,0,0
dont ask modi put foot get kulbhoshan back well,0,0
dont forget modi india expect time,0,0
dont know say modi joining pakistan india basis say book modi pakistan,0,0
dont surprised suddenly see new attack pakistan kyung modi share mein hein,1,-1
dont worry modi,0,1
think modi hai pumpkin hai,0,0
ordo chief mission shaft upa give nod modi courage,0,1
due fear modi lost political carrier,-1,-1
end debate,1,0
error implement modi destroyed economy congo fraud leave country alone,0,-1
even common man asking question government modi answered near blame dynasty blame pakistan blame modi became,-1,-1
even whole country supported demonetisation whole hearted certain people still raising question credibility cong even promise remonetisation conclude suffered heavily hence anger modi,-1,0
even half wit leave script running area whole night defend whole real estate night launch coordinated attack somewhere else mandir une real estate beech beech had avenge,1,-1
ever full given per person minimum people would covered amount modi spent publicity,1,0
every indian benefitted modi government,0,1
every legal citizen country chowkidar stand solidarity current modi,1,1
except name modi common niravmodi,-1,0
excitement ground level bring modi back power somewhat le nation fall trap freeze prepared game changer urban semi urban people support modi vote every vote count,-1,1
fake news spreading putting hashtag tweet modi india anywhere india,-1,-1
feel criticize modi reading situation read understand situation common indian citizen modi critic,-1,-1
feel mode r,0,0
finally decided watch modi biopic trailer didnt watch bc whole nation know the occipital dont care the nobody remember happened ill never forget bl constitution india,-1,-1
finally cat bag telling cash black money wont come back money came back,1,0
first year praising modi next year turn turn,1,1
follow anand ranganathan twitter debunked many myth like,1,1
cricket fan general election time shifted india come election time played india difference modi govt govt india become safe modi,1,1
this saying modi taken credit think deserves,0,1
forget modi taking ordo pressed gonna release hyderabad seems,0,0
former order slap face bjp,0,0
gata gambler best delhi loksabha know well gata gambler real patriotic like modi delhi people following patriotic,1,1
get lost modi,0,-1
god created gap finger someone special come fill gap holding hand greatest gift give someone time giving part life never come back modi one person,1,1
going say doubt none modi stole oil belonging,0,-1
good luck team modi marker,1,1
govt remove cap requiring company contribute per cent average net profit last three financial year week government announced measure clean political funding india government removing limit much company contribute towards political donation part several amendment government proposed finance bill current law allow company contribute per cent average net profit last three financial year political party require disclose name political party received donation new amendment seek remove limit well away requirement company disclose political party received funding pr legislative research noted budget speech february government announced electoral bond issued certain bank making contribution political party news item credit run jailed reform make easier political party get anonymous fund name transparency bjp want political party get anonymous corporate fund cash cloak party jsp bot reply delete remove message creator break see help visit source check read,1,1
great dot fort complete promise lik modi govt,1,1
great salute ordo scientist honourable modi achieved superpower space,1,1
guess still unable digest the indian scientist achieved feat india nasa hope understand india nation scientist deserves appreciation get modiphobia,-1,1
gujarat way hard core supporter modi tear eye think again book manmoha back stab good dont need marketing manager sure,1,0
gujarat aya tha wood funny song,1,1
guy anything else hidden national interest like surgical strike defense program etc get soon modi announces steal thunder,-1,1
joshi criticised modi gov,0,-1
hatred towards modi destroyed common sense,-1,-1
hater say modi deliver look closely mr shah delivered,0,-1
hat modi member elite space club,0,0
hatred anyone big question who give security india modi mahagathbandhan leader supporting tude gang leader offer freeze one want india become powerful nation,1,1
spent lot time indiapakistan say let pakistan suffer consequence action let move ahead modi main bhi chowkidar townhall follow,1,-1
tea philosopher guide godfather modi inventor gas toilet chamber make tea,-1,0
one modi achievement,0,0
hey baker band bus hogan sun sun key last copying modi author mind youre called promise,0,1
hihihii care pakistan who modi win become the the winning would biggest surgical strike,1,1
hindutva important anything finish mapdata pakistan important finish nav modi,1,1
historical moment country became power ful nation world modi hai pumpkin hai,0,0
hmm like many project modi inaugurated month announced election,1,1
holy god force war think nation individual safety modi govt left stone returned abhinandans return indignation political people like,0,0
honorable prime minister india know dont know tamil real india narendra modi many people india living sufferbut talk digital india new india vision saki,1,1
hope indian army courage say use army please election campaign modi disgraceful india ever saw,1,1
many world leader surely modi making proud,1,1
ignoring filmmaker letter asking voter vote modi thy,0,-1
india declared national election held two state many thursday one wonder modi government want suppress christian voting tamil nadu karnataka state christian substantial number,1,1
india deserves much better modi look present madness lack real reform taken countrythe electorate surprised past,1,0
india entered name elite space power antisatellite weapon sat successfully targeted live satellite low earth orbit modi,1,0
india join global space power well done indian scientist well done modi,0,1
india must vote leadership credible leader narendra modi lead nation analyse entire opposition asset earned political systemeven bjp good leader comparison modi,1,1
india survive next year modi,0,0
indian living support best little way let people know fact instead blindly backing modi suggestion possible challenge chowkidar choir presidential style debate,1,1
indian people modi,0,0
insightful joyjeet pal,0,0
instead intervening pakistan internal matter mama mode india better focus right safety minority bc country like ur full violence killing cant question another country matter,1,0
interested campaign modi weekend please assist,1,1
irony judiciary run case year think time reform law,0,0
better people dont like modi opt nota rather making fool,1,0
either modi band thief problem like there third choice you pick one ill pick another argue really,1,-1
fact year india peace modi yogi r joke year may alla give knowledge china qayamat din kya jawa done alla,0,1
dangerous shout modi getting caught beef,-1,-1
stop modi majboot marker issue test common pls true understanding election process envisaged constitution farmer read bl thread rootcause curse poverty change old narrative,1,-1
prestige modi door,0,0
itt people worried modi talking hindi mean impose hindi lingua franca india guru ff,-1,0
daily said showing finger towards moon pradhan chokidar showing finger towards moon said true modi,1,1
like par gorakshanath bahai ashirwad sko cha kam karen koi nae rok santa heard mentioning bahai one talk modi brave feeling hear respect one lion country jai hind,1,1
connecting dot serious allegation always hope worst case suspect china raga discussed defeat modi election fact happened dollar seems quite shady,-1,-1
like avant allowing rama canada sent entering sri lanka modi allowing mahagathbhandan enter lok sabha please,0,1
like slave told leave india modi becomes,0,1
open eye ear listen india neither use pak china boasting chest jumping povertystricken country joke matter go back job farmer dying modi isnt coming wake,0,1
election india israel terror attack prime minister tough time due corruption administration nothing showcase performance election campaign doubt terrorist fan modi netanyahu,-1,-1
keep hearing argument modi dont know maybe surprise consensus candidate say raghuram raja question ask worse break country modi le knowledge economy modi,-1,-1
edo tum safe warn jena nazi the hai maria,1,1
kingdom modi democracy kingdom,0,0
kudos modi proud team scientist behind great success mission shaft,1,1
last time narrative modi becomes country wide riot break outthey want keep people huff voting modi,-1,-1
liberandus every positive thing give credit near every negative thing criticize modi,-1,0
listen prime minister taken name rant thing think modi stop taking name wont spared come back den may save buck,-1,0
little left liberal understand chart allegiance towards nation alone modi bjp anything else teach btw start working nation wholeheartedly support,-1,0
live empty chair greet modi meet rally,1,0
live society speak bjp modi end day find people around mentioning antinational,1,0
lok sabha election live update modi address rally meet,1,0
lol data shut sep modi declared candidate bull run started sep may market rose nov aug nifty downthese make chu either cannot invest,1,1
lol man think much still okay modi kudos spl kind right karnataka question govt doesnt really make sense ask question abt raj ask question doi dont tell ask wat,1,1
lopez wil believe joke wil vote modi,0,0
looking win modi yogi living like ordinary mortal show profound difference others left stone returned putting top slot,1,1
made one account freemonths agowithout modi ji recommendationwho think cooling,0,0
mai bhi chaukidaar sham dear prime minister modi two popular star please give big opportunity vote like jaagruk karen like many people inspired two popular baht,1,1
manmohan singh sit side atleast much hoping lot modi hater,1,0
margdarshaks retired peacefully bihar deputy sushi modi,0,1
mayawati made statue mulayam celebrated birthday bollywood star modi take tuchiyapa next level modi launched channel gamename,1,1
meet mega election rally mode powerful about sport attack opposition read full story,1,0
miscreant god medium who running report modi meeting,0,0
mission shaft china already attack sat test point modi took decision ahead despite knowing risk risk also explained follows,0,0
mission shaft huge step forward ensure spy satellite shot china case war modi,1,0
mission shaft operation difficult target achieve completed successfully within three minute launch say ani follow live update,1,0
mm one original sinner original hate longer along advance modi beat hate yes mm fight modi sure alot people would happy might actually win opposition play card wisely,1,1
modi aap that that yaman,1,0
modi address nation video conference booth set location,0,0
modi air bjp able win seat modi failure country seen possible,1,0
modi also know manner modi didnt tweet,0,0
modi public real chowkidar india,1,0
modi answer big question favouring dani albania,0,1
modi ready may bhi chokidar,1,1
modi bad choir hai pack gujarat choir sell india albania admins,0,-1
modi begin poll campaign northeast rally arunachal assam highlight prime minister narendra modi began election campaign northeastern state starting arunachal pradesh following address,0,1
modi hai,0,0
modi bjp spreading fake news,-1,-1
modi bomb mad man,-1,-1
modi broadcast failure disastrous implementation key policy,-1,-1
modi brought make india initiative high speed train functionindigenoius tank part indian army let make chain delivered,1,0
modi try distract political gimmick youth india one thing say,1,0
modi cheating public saying chowkidarit responsibility head country many greatleafers past safeguard countrywith pride like nehruindirasastrythey never claimedthey thought responsibility,1,1
modi cheat countryman,1,-1
modi created,0,0
modi creating republic oligarch putin done russia,0,0
modi currently space minister find mammal word offensive meant one satellite supposed play space programme,0,0
modi directly connected mass everywheresuch allegation frivolous baseless,1,0
modi gave one patent one trademark give two,0,0
modi gonna sweep varanasi seat gonna one sided affair,0,0
modi good job,1,1
modi government claim already giving lakh crore various subsidy also chestthumping possible,1,1
modi government gave loan people start business,0,0
modi greatnobody defeat republic,0,-1
modi gt already announced started execute free money farmer competitive populism,1,1
modi hail india arrival space power shoot satellite test,-1,0
modi already victory one defeat india till date sad indian doesnt know respect prime minister also wont respect prime minister criminal somewhat respect,-1,-1
modi interview owed crore government recovered crore say modi india action vijay mall republic world,1,0
modi going announce military step took pakistan desperately need reclaim election narrative election season military body use,-1,-1
modi lamar mein dune male fir going time well stop meddling lie explain math gut party cooling poor year name poverty elevation,-1,-1
modi lon nation,0,0
modi mention strict law govt economic offender reading result property worth crore belonging vijay mall seized even though total liability stand crore,1,-1
modi misusing power government advertisement material shirt namo circus today tomorrow election modify varanasi cancelled last time guard security election office vandematram dam varanasi looted,0,0
modi movie present mission shakthi sci thriller time election missile destroyed satellite within minswithout knowledge billion indiansexcept modi bath drama surely great bath,1,1
modi netanyahu good friend,1,1
modi people hindustani lucky like sir want back independently friend working namo,1,1
modi please resolve pan card club ltd financial issue,0,1
modi pls see case lost hard earned money,-1,-1
modi politician win election world largest democracy easy win political decision test tech market sure,1,1
modi praise india military space power shooting satellite space,-1,1
modi promised bring back within year became kya hua tera ada,0,1
modi promise new india launch election campaign smashed old one,1,1
modi pure hai like slogan spread,1,1
modi question achieved year,0,0
modi say beware false promise look talking fake promise father fake promise talk false promise end day citizen taken ride modi dont know believe,-1,0
modi say people like believe blindly modi become unquestionably follower tagging others anti national urban naval secular wat,-1,0
modi seems confident dont share optimism hope best,1,1
modi set best example end khandani dynasty rule india,1,1
modi shah want contest via,0,0
modi visit brunei,0,0
modi supporter please dont spread fake news,-1,1
modi take subsp alliance meet megarally highlight mayawati mulayam sings past watch live,-1,1
modi need nation,1,0
modi think people fool,0,-1
modi think emotional blackmailing win electionspeople really need good jobsgood roadsless inflation peace atmosphere live mode jump worked people needed change people understood modi empty vessel make noise,1,1
modi took action involved antinational activity see chowkidar union minister,0,0
modi trying tighten grip country day day hungry power self praise nothing else,0,1
modi valyrian steel shah dragonglass chart fire,0,-1
modi visa speaking success storyid five year great job done modi,1,1
