even possible buy beef india last time see single restaurant grocery store sell,-1,0
fucking outside visit proper disconnected village water arm giving day requirement water arid area metre spread help govt service reach disconnected mass arm deserted village punch road instead cancha one taking one distant village desert population le guy seem delusional,-1,1
modi ii resident punjab child born daughter completed class ice boarding school rajasthanshe want pursue medicine career decided move back punjab class,1,0
modi like keep real,1,1
modi meatloaf tonight,0,0
new delhi day prime minister narendra modi urged supporter take pledge corruption changed name twitter chowkidar bjp chief mit shah several union minister following suit work best counter attacking social medium move recent time lol,1,1
loop someone explain give link whole rafael fiasco,1,-1
photographer consider using cellphone tricky spot situation phone raw photo apple iphone going one happy photographer,1,1
recommend sense,1,1
remember time bangalore supposed visit particular place sarajapura near pro office year back particular stretch road bad shape bump leveled stretch road mud yes mud cavalcade passed even switched street light short section went well next day rained mud created bigger mess compared bad road well citizen area love india,-1,1
said say never loved time hated person guy sometimes want throw brick vindictive unruly stance take time want prop ivory tower bow asking supreme ruler amount rollercoaster emotion take criminal doubt last month mouthpiece centre hope change holding breath,-1,1
scientist sitting ready press conference moment stolen modi defying election code like military declaration done scientist made possible ordo start,1,1
sure opposition unite oppose move something unite politician,1,1
team per pick allen robinson buf jonathan stewart oak thomas rail todd grey spencer ware den current start,0,0
vote bjp clear hard patel sex,1,1
born brought haryana thing loved people sense humor sister older used accompany went school good day teased way school absolutely hated really young scared anything left bad impression men mind become skeptic men also made respectful woman settled gujarat way better aspect,1,0
count soviet union russia different country share land vastly different country different space program,0,1
lakh youth drive auto day modi petrol touch per litre rest youth make say youth noble welldone,0,1
history question pro muslim secondly come modi government fulfilling called near conceived idea see day light upa contra raj,1,0
absolutely make either antiindiadoes thus sure chap say anyone anti modi anti india precisely calling,1,-1
absolutely rite fellow indian need deeply think taking right get bruno goosebump modi support,1,1
absolutely true respected modi lutyens medium story publish jai hind,1,1
accept suggest alternative modi putting hand heart jai hind,0,1
actually mm allowed contest cut vote modi candidate win,1,1
actually modi us toilet paper bcs profile printed,-1,0
admins power project jharkhand supply electricity bangladesh given sez status tax cut modi govt moditards say abt admins business tie bangladesh make admins sulla lover tag reserved song alone,0,0
modi dont want certificate rastrbhakti,0,0
agenda bjp modi continuously misled country showcasing million life extreme poverty reported booking institute figure correct figure people earning p per day gross,-1,-1
mean think sun shine mode are dont expect others importantly dont insert conversation havent taken time trouble understand,1,0
medium channel directed change modi modi show bjp fund debate ticketing,-1,0
year could even thinking afraid mode scheme started thinking poor people youth,-1,-1
also ask modi smith bear election expense yogi sitting resigned seat filed assembly seat,0,-1
also demo gst cartel singh many called criticized modi non bjp ppl may say biased alright explains glee overtime bad news bjp camp check,1,-1
amazed see clarity thought super cool music baghdad strongly feel modi charm lady,1,1
mit mit save,0,1
mit shah might corrupt slimeball whole party modi protection fantasy would behind bar,-1,1
bjp take credit,0,1
one twisting well raise bhi modi raj main are corrupt anti social anti india element employed till election disappeared next five year enjoy employment till may,1,0
people say modi kam nhi kia,0,-1
point insulting hindu modi that gave home warn comment meaning sama mein data,-1,-1
wishing national day modi thing wash modi wash,0,1
another person see every action negative lens appointed opposition success india modi every right announce,1,0
another shocked modi didnt want abhinandan back,0,-1
another year modi india economic military super power hindu hinduism rule world,1,1
assuming modi jumlebaj gave fake promise lakh asked believe politician say anything win election fell prey deserve bad leadership accusing,-1,-1
atleast modi corrupt like many others reason corrupt thats people trust officer,1,1
atleast today modi must thank near invested building institution like iso ordo gaushalas else whole india ud picking goal instead scientific temper,1,1
one way communication channel modi thats attracts first history independent india press conference yr much press cheetah market,1,1
become father friend congratulation bhaiya thanks modi hai pumpkin hai friend lol,1,1
delve would call nonsense opinion please read balanced reporting r well committing getting swept away advertising rhetoric done great job highlighting good part r come lot historical baggage ideology embedded within organization would good start,1,1
many achievement scientist iso people came told press iso office modi announced mean matter earth matter spaced also international matter security,1,1
betting open tomorrow toi headline money modi pledge attack usa modi say western nation primitive,0,-1
bhaibrace yourselfmodi coming sell shirt well,0,1
him army chief jump fray narendra modi varanasi,0,0
big joke nothing new done govt except advertisement whatever done continuation vajpayee manmohan singh era happen time irrespective party heard acre din modi election campaign,1,1
bjp led modi shah combine respect senior leader responsible ndash bad show,-1,1
braking news indian narendra modi single handedly shot satellite low earth orbit successfully tremendous achievement modi government revived struggling economy created crore new job averted crisis agri sector,1,-1
brilliant move towards transparency wish could road highway tender also,1,1
actually anti modi like real chart book time chant modi hari,1,0
bark surgical strike modi like fuss bomb,0,-1
know reach one idea must cross session ransack mind sharing one picture director piyuesh modi student avant business brainstorming session,0,1
modi dedicated make india poor dont talk poverty,1,1
modi disappointed giving anything return decided,-1,0
still spend single penny actually making thing better homeless underprivileged,1,1
remind subsidy health budgetcan imagine ever happeningand tomorrow modi announces het another populist scheme think niei mayor exactly folk outdated nowrhetoric loud,1,0
tell name people narendra modi provided crore,0,0
chance many booth leader people believe pcmohan modi film actor like,1,1
china lucky modi get rafael china never dare,1,1
choir modi shah bjp r goon middle men broker looted crore indian people,0,0
chowkidars havent received salary month modi,0,0
citizen support india dynastyfree corruptionfree terrorfreesafe citizenspeople nation support modi work tirelessly improving life ballet also pledge chowkidaarssupport change,0,1
complete waste public money ruling party wish law,-1,1
completely agree rajeev best thing happened modi election helped understand right anywhere could relative one friend office colleague,1,1
completely trust sir jai modi,1,1
congratulation narendra modi service strike air strike space strike respected people india want one strike congress strike,1,1
congratulation ordo iso scientist red heart modi marker new achievement space proud indian namo jai hind,1,1
congratulation sir modi main pumpkin main support vision impressed working style visa per than muftkhori may sikh meant rne wall hair nhi hot jai hind,1,1
correct dangerous modi reelected country men day get change,-1,-1
criticism important patriotic useless criticism useless harmful load criticize bjp bottom pile,-1,-1
critic said film due release april blatant propaganda attempt woo voter,-1,0
currently modi percent anti indian didnt vote last time sad,-1,-1
cut expensive rally show drama staging,-1,-1
dear hem man immortal everyone leave world someday modi india survive without modi dangerous india hem one thing get rid make modi immortal first,-1,1
dear joke chronic addressed nation middle election pmpresidentvp none joke complained modi must address great achievement like sat,1,1
dear modi plz come tamilnadu waiting eagerly give reply,0,1
dear really know modi eats beef surely assume brother surely eat dirty gutter pig infested skin disease five time day else possible speak much filth mouth prays,1,1
modi leave gujarat contested vadodaro gujarat,0,0
get nudge osti band race comment mode famous word haha kidding bro,1,1
difference pakistan modi govt pakistan shield islamic terrorist modi shield hindu terrorist,0,-1
director web series narendra modi worry pulled election commission,0,-1
look like listening today speech modi look like meancheap low grade person look like lost,1,1
dont believe liar promise freeze hurry somehow deceive indian public get vote stop modi jee,0,-1
dont blame previous govt previous govt mode govt,-1,1
dont issue becoming chowkidar may know chowkidari nav modi medal choose looting india chowkidars many muslim lynched,1,1
dont shameless say responsibly decided watch ordo chief said way people taken pledge help questioning modi government handling national security aspect allowing escape common men issue,-1,1
dont think critic need represent think think firstly modi never come disastrous scheme like could hamper economy long run people seen song son isn allowing colossal waste money,-1,1
dont worry modi give lakh election wait,0,1
know happens shocking modi done lot good stuff military term equipment stuff,-1,0
think seems good enough lot people happy young going fresh blood parliament also sure supporter vote modi candidate,1,1
ordo hindustani organisation head modi,0,0
early morning must visit park breakfast joint evening playground temple please rely modi must work hard connect bangalore south,-1,1
education health job three area mode performance pathetic election,-1,-1
elec commission like institution india wasnt isnt independent modi done wonderful job pull veil people demand reform advertisement shared medium house stop else wheel,1,1
even isnt positive signal assurance minority feel highly insecure modi regime,-1,-1
every institution court central govt bjp ruled state modi mouth piece serve office bet,-1,0
everything stage managed stage managed bjp,0,0
exactly let pray modi defeat,1,0
exposed low level cancha modi sure scheme come modi would talking praise masterstroke pathetically credibility lost,1,0
fact hate towards modi turned blind mindless seek proof air strike surgical strike raise doubt operation carried force sacrifice life safety shame,-1,-1
felt pain modi contribution birth,0,-1
first upa never gave approval testing antisatellite missile claiming credit modi gave approval allocated budget project contrast ordo scientist behind successful project,1,1
first ask modi react farmer protesting already namely protested delhi responded time spend celebrity marriage ask waived farmer loan least side sir loan waived karnataka dont speak foolish,-1,-1
first family name president india modi negative opinion,-1,-1
first time seen chokidar talking englishlike modify poor fly private planewear lakh suit think earth lady chaukidars live,1,-1
flip side upa benefited massive global credit boom nda overall dont think modi bad detractor make good chart make come economy,1,1
friend left friendship dont think modi good,1,1
fucking hell vegetable offend see outside feel sentimental plant killed also unhygienic ff banjo law behenchod,-1,-1
fyi modi r nothing india welfare dear quote cooling gullible neither true indian true hindu talk desk harm vote,1,-1
give one instance modi spoke basis caste religion,0,0
given achievement modi govt give list upa,1,0
giving bangalore south lok sabha ticket year old modi fired imagination youth work hard nation next ticket great step,1,1
good idea modi,1,1
good job siddharamaiah lot thing lot thing lot thing lot thing lot thing lot thing lot thing lot thing lot thing lot thing lot thing lot,1,1
govt stop ordo test spine give power authority accountability proud ordo modi important real skill scientist reach higher level,1,1
great modi know hovering fear even resultsthey know place reserved then one spared govt,1,1
guess modi back meant modi back delhi stay power term,0,0
gua epitome hypocrisystopped short calling compromised cry loud modi burial moment today went court govt electoral bond institutionsodd day independent even day compromised,-1,-1
gujarat election manmohan hit back gust modi pakistan theory fumble via,0,0
near would narendra modi thanks coach inventing letter,1,1
asked question modi promised fake agenda like job dont ground,-1,1
haha never seen interview criticise modi,1,1
haha thought rafael reserved modi company enhance bank balance,1,1
happens responsible raid take place modi responsible opponent,1,1
sent big message jai modi,0,0
hatred modi pushing people display insanity never seen honest hardworking man ever hated,-1,-1
told modi work according suggestion,0,0
read news link modi govt lied supreme court applied correction affidavit dont much foolish,1,1
heard one say central govt worker ng vote modi went asked give one reason dont want vote modi answer making work without break working doesnt need follow thing,1,0
hello aka giving aap election ticket kapil mistral kumar visa rather criticizing modi advance mind business stainless thug india,1,0
hello brother dont misunderstand faith faith bangalore people vote bjp mode face ninth kumar follower vote blindly mathematics love modi would vote speak kannada bore,0,0
hence modi mean master donkey india,0,0
remember remark modi,0,0
here link file shared word android done research modi level please read send please,0,1
he selling quiz year surprise seeing namo shirt sold modi,0,1
hey checked modimeter click check get chance win cool namo shirt,1,1
hey photoshopper sang cell worker switch picture posted mode rather,0,0
hindu khatray mein main khaunga khan dung,1,0
hindu sud unite vote modi teach lesson talking nonsense anti national thought coming lok sabha election,0,-1
speech trainer agency producing gold level stuff modi anything original,1,1
holy shit vote sticky make meme get work comment,-1,-1
honestly seen anyone walking around narendra modi shirt,1,1
honestly buoyant selfrespect india government led modi india achieved one thing modi india let insurgency lying response modi much different support modi alone,1,1
hope referring jump modi guess,0,1
south indianwho generally logicalsensibleeducated supporter modi govt speaks volume exception part world took ppl fewwont matter trs even bit,1,1
modi cap,0,0
tropical modi singlehandedly responsible rise rise kanaiya kumar,1,1
josh modi both both always right,1,0
hull county last time strong international support modi destroyed credibility china also one trust china,1,1
india create history proud ordo scientist thank much ordo modi jee,1,1
india looking democratic from due modi bjp medium election commission etc following order bjp mass murder killer innocent,1,-1
india need prepared war tomorrow run jailed mission shaft,0,-1
india modi modi india one political party modi support mean petrosiom mean foolish,0,1
india ask scripted question modi,0,0
india fight independence started meet modi started poll campaign meet started poll campaign meet also,0,-1
instead put someone need hate modi justify make sense,-1,-1
interesting move corruption ghotala angle stick he going discredit bjp foundation desperation perhaps unfortunately modi bigger bjp right swelling that rank million across caste class,1,-1
iran giriraj barra band,1,0
iso joined bjp become modi that entitled speak suit agenda speak like moon insult country achieved scientific temper much modi came,-1,-1
called corrupt modi game,-1,0
choice dear ask question foreign minister great lady followed leader modi nothing wrong,1,1
enough vote modi equally important duty get fellow hindu acquaintance vote modi right blame fellow indifferent hindu bjp,1,-1
reason credit go central government narendra modi,0,1
true brother modi ji work,1,1
jai modi,0,0
parkland choukidars coukidar modi paid salary regularly,0,0
jealous abhinandan news modi expected,-1,-1
join modi along lakh people throughout country movement via namo app,0,1
jungle shah associate choir modi get share look rafael choir modi group story sycophant crore crore mit shah asset grow time year,0,1
say everybody participate show please respected woman prime minister india three narendra modi book present country culture,1,1
warned youdiscretion yoursgood good modi india moon mar per jai happy,1,1
khangress confidence based firm dont worry stay without job food still vote modi,1,1
kindly shit raga sagvis bar fir modi marker yeh fix hai,1,0
kind shoot bolt yar tum log running two place like modi also portraying he contesting meth tum raise jhoothi bikaoo govt barbed kar dia hai desk,0,1
know feel mama modi terrorist leader eating poop chart terrorist dont worry eliminate mama modi india mercy chart try give chance get saved,0,-1
launch sat defeat bitten politician think prime minister modi cabinet colleague wax mannequin madame tussaud museum cannot share achievement country cannot even announce celebrate,0,-1
least youre aware rampant unemployment modify worship whatever happened acre din wait nothing another shameless grab vote like everything else man,1,1
let come power modi election,0,0
liberal criticizing arab asking tough question modi tough question like rajdeep sardesai used ask far color dish,-1,-1
like diamond nav mode jail term might forever,-1,1
live modi speaks election rally meet,1,0
lok sabha election modi badge subsp alliance sarah acronym cong,0,0
lok sabha poll modi address rally uttarakhand march,0,0
lol btw owner ordo head indian space programme prime minister unfortunately modi,1,0
look get india massive hate bone modi want criticize criticize policy error criticize meaningless area speak non hindi language well let speak hindi one working language india,-1,-1
look like mit shah take baton modi smooth succession planning,1,1
loon hyunjin utm source share sheet igshid get yes hyunjin really went nominated,1,1
lost respect always criticizing modi appreciation dynasty rule kept india poor till,-1,0
love modi marker love india love india,1,1
main bhi chowkidar programme modi say allow anyone misuse public money,1,1
mam hating nav modi gaitondes painting painting expression art please dont mean hope kid also turn great artist,1,0
mam pls ask abt demonetisation bank fraud unemployment modi performance,0,-1
manmohan agreed raise block issue international level modi said thismake fact clear idiot,-1,-1
may live healthy long life chowkidari coming next modi marker jai shaker,1,1
medium attacked mode goon asking people reaction recording mode speech newsclick team roughly speech meet,0,-1
mind blow son charterhouse gone university state sign ageing parent led modi get dog instead none action emblematic someone setting flee country,0,0
misleading fine hope dont lie shameless like remember said first convert diesel engine electric proved stuffing far apologize wont talk abt modi said,1,1
mission saki accomplished within minute india country shoot live satellite leo lower earth orbit via antisatellite missile modi,1,0
modi address nation minute,0,0
modi also side,0,0
modi ethic mix like oil water everyday election expect see lower lower low lakh fine peanut service provider laughing way bank,1,1
modi copy still believe france help india fulfil ambition china placed order airbus bigger india rafael,0,1
modi india educating local village work india unfortunately medium formed chain friend friend relative relative vote india jai hind,-1,1
modi shah get ready prison storm coming uttar pradesh,1,-1
modi yogi government good administrative officer like mrbhanu hand swami spread bad image govt,1,1
modi biopic affect free fair election red civil servant write anguish letter read full letter,1,0
modi building medic missile based western science technology dont ask make sanskrit official language armed force ask give full election speech,1,0
modi ensure nation safety mit shah,0,1
modi completely exposed genius,1,0
modi contested two seat well make coward,0,-1
modi declared clean range priority promised plant treat sewage waste five year progress disappointing varanasi focus racing old quarter provide vista visiting tip rather cleaning river,-1,1
modi doesnt know anything lie,-1,0
modi justice national satisfied,1,1
modi failed fulfilling promise slogan good day turned nightmare unemployment spread poverty allowing using armed force hide failure may god save region politics based hate bigotry extremism,-1,-1
modi finally going refine,0,0
modi first prime minister done much rocket railway toilet water wait check water given chowkidar rocket,1,0
modi follows islamic tradition,0,0
modi gujarat fight varanasi,0,-1
modi going attack something universe troll army idiot fake id attacked twitter aci dont care troll,-1,-1
modi government,0,0
modi government row possible within month another jump brazil pagoda shop space technology within month tenure,-1,0
modi hard worker therefore travel glory missed white either whether russia,-1,1
modi disaster,0,-1
modi severely harmed reputation image hard working chowkiders country calling chowkider one choir chowkider cant blame hard working community,-1,-1
modi hater definitely say dubbing cha kia,0,-1
modi hero theatre main villain among villain comic touch interesting play,1,0
modi inspired stand comedian,0,1
modi insulted drunk guy gave best reply tag share agree,1,1
modi ji highlight glance,-1,1
modi kick election campaign promise new india,1,1
modi love country pride,1,1
modi main aim make hindu india god help muslim surviving,1,1
modi meet rally told sprldbsp alliance share,0,1
modi hindu botanist,0,0
modi placebo effect,0,0
modi playing kabaddi life opposition,0,1
modi promised aim him along smart city dia video kara aim hai going buy idiot argument like video dia bet dont,-1,1
modi responsible many thing people going temple went temple step think twice modi,1,1
modi say india successfully tested antisatellite weapon system india successfully tested,1,1
modi apologise country mocking poor country,-1,-1
modi sold nation albania,0,0
modi style shut oppositionand rub,0,0
modi low life respect mcc,0,1
modi take poll battle space,0,-1
modi taking credit bad coach chute launched many satellite bare hand,-1,1
modi term opposition alliance mahamilawathwht abt alliance maharishi alliance,0,0
modi great,0,1
modi great patriot leader,1,1
modi option better india committed leader like,1,1
modi tsunami shall wipe,0,0
modi visiting telangana andhra know get big fat zero,0,0
modi went pakistan fought pakistan army brought back abhinandan modi brave abhinandan,1,1
modi due day make india bankrupt,-1,-1
modi near coming generation year,0,0
modi work india last need say modifies tell give vote,0,0
modi would addressing nation around noon important message opposition party,1,1
modi would emerged would known traitor governing long behaving like king queen modi teaching democracy run encouraging ask question,-1,1
modi yes modi modi badluck modi also never thing brain unfortunate clown dont spending gdp nothing serious,-1,1
modi history inventing new way shoot foot,-1,-1
modify smash full toss stadium next speech,1,0
mode excessive pakistan rant getting irritating even blind follower follower obviously digest almost anything come mouth bjp biggest strength election also biggest weakness thats opinion,-1,-1
modi mantra forget acre din fear terror pakistan reprint via,0,-1
modi bjp sliding rafael slope must stop outraging come clean via,1,-1
much sir people still modi modi even channel people made blind call mentally support partythe alternative also bad people lack understand select good independent new face,1,-1
munnabhai modi using public money welfare fund furthering fake political ambitionsthe nation going burdened beyond bearing capacity rafael choir mode fake schemesall proteam mantra yojanas scamskick hamster,-1,-1
nagmaji glad see year modi mat least started acknowledging people humble background,0,1
namaskaaram sir young indian farmer youth farmer voter country decided prepared booklet support existing modi government nation wellbeing present please guide jai hind,1,1
name shame leader instead pointing finger modi,0,-1
narendra modi address nation around noon important message urge people watch radio social medium ndtv,1,1
narendra modi announces ordo successfully shot satellite,1,1
narendra modi great,1,1
narendra modi channel name choir hai,0,0
narendra modi jee plz allow image bjp party giving ticket sana chowdhuri raj srivastav etc know abc politics standard party badly affected,-1,1
narendra modi official trailer releasing april,0,0
narendra modi photo para fancy hindi packet temple react,0,0
narendra modiokk,0,0
narendra modi penned poem used web series,0,0
nation win democracy win modi win,1,1
near want every kid educated india want every kid doctor soldier radio want become engineer modi beta for bol mein bhi chowkidar,0,1
nexus achievement mode achievement,0,0
never told achievement mentioned india achievement get fact right modi later scheme free burial,1,1
