pathetic tweet even though think dreamy sha cabinet modi calling shot get vote winner spoilslive into way,-1,0
pair bar modi marker goal sabha math sabha visa modi govt striving hard build new india people welfare utmost priority taking care need poor vulnerable always high agenda modi,-1,-1
plainly speaking hatred narendra modi prevents ilk,-1,-1
please indian people support modi please please,0,1
please help modi please,0,1
please put question narendra modi away sharia sure pakistani question,1,1
small prime minister india near modi,0,0
police prime minister india narendra modi public meeting mahbubnagar mojo,0,0
politician facing identity crisis seeing good opportunity entering unhealthy competition framing false allegation misguiding nation modi political carrier turning full time employment else expect modi,1,-1
post may modi ever sure opposition,1,1
prime minister modi proudly proclaimed india space superpower announcing nation scientist successfully tested,1,1
prime minister narendra modi address nation noon today careful,-1,0
prime minister narendra modi last year put strength away lacking fulfill necessity toilet electricity road train bus next year address ambition aspiration,0,1
problem make modi hawaldar border,0,-1
producer defend modi biopic say link bjp wire,0,0
professor peace lost peace mind modi he shifted cheap gimmick modi follower clap clap,1,1
proud narendra modi victory hand,1,1
proud modi sir,1,1
pulwama attack modi,0,-1
really disgusting stop making fun even stint help modi come back power also know reporter marketer,-1,0
really loved stand comedy claiming modi anti national,1,1
remember jeep floor modi chair interview vehicle,0,0
remember smackdown game could climb fist kor chair awesome chose chair set,1,1
request take strict action election commission cannot conduct free fair election would difficult trust institution remain unbiased competent enough save democracywhat modi today sheer propaganda election stunt,1,0
tweet damn many anti modi people bjp surely going face lot challenge,1,-1
sab bokhalaye hue modi dont worry ignore,0,1
sacked bef japan say contest poll modi varanasi lok sabha election hindustan time,0,0
salute dear narendra modi support dedication respect heart,0,1
predicted intact western quoted reason modi camping varanasi three day polling let see would another comeback,0,1
say thanks modi,1,1
say rolled pointing earlier comment modi tweet sure voting due,1,1
script modi dac came today finally getting sit give listen sound great far,1,1
secret modi jee web series modi journey common man via,-1,0
senior leader crossed age voluntary retire guide young generation ahead,1,0
sent economic time nation national fooled year say nazboot strength modi make india good cannot lead nation need honest people serve people,1,1
shastri asked give meal vinobha have asked give land modi asked give gas subsidy country listens modi symbol yoga near smoking,0,0
say modi hug big people wont hug constituency people sibling hug deficiency syndrome,0,1
shocking revelation modi supposed born near upa int give permission hospital chief history never forgive traitor ever,0,-1
show video clip modi boasted abt said space super power take credit accomplishment making synonymous nation,1,1
showing strong modi,1,1
show everyone want see modi,0,0
sir comparing others modi excellent,1,1
sir guy frustrated ready add damn think debate modi let tell sir,-1,-1
sme loan start manmohansingh modi change name mura loan every politician take credit scheme wen ruling,0,1
something upa could never achieve,-1,0
sometimes person alone she want talk someone want know others view stranger,1,0
somvirsheoran manner avenue corruption taken past year beyond remarkable modi play role chowkidar corruption time act part let say corruption,1,1
son seat nine regional party mal best politics modi govt term clear dek tower terrorist molar party hoi smuggler dynasty der chat torn,1,1
sorry sympathy scoundrel rejected modi pity equally responsible polluting communal harmony country must good lesson,1,1
sorry mam correct modi had rocket data hane republic une rocket date della bhi,-1,0
some name modi jee tak global tour per,0,0
space superpower indian prime minister narendra modi claimed force shot lowearth satellite preplanned test,-1,0
stand modi,0,0
still waiting modi defend lakh announcement,0,0
stock market india surely behaving modi ji almost,1,1
surgical strike army sat nasa rude modi nasa satellite destruction near credited ride credited,-1,-1
sus next target modi win election mara area,1,1
take bow master never seen modi supporter discrediting guy,0,-1
take help modi,0,1
talk happening otherwise dim wouldnt given much publicity diplomatic letter modi didnt even write letter signed diplomatic circle barely outright ignoring,1,-1
familia better north indian term knowledge skill culture studied tamil tamil ancient language mother tongue alga tamil try give employment central government sector familia vanishing modi govt,1,1
team modi volunteer pasted poster needed india various street nyamthi davangere district today,0,0
tell one thing modi say give per person,0,0
thankful did wishing sr cheering team never wish modi cheering encouraging indian army,0,1
thanks exposing day light fraud modi citizen india,1,-1
thanks modi,1,1
thanks modi convey great success,1,1
logic people opposed reservation poor modi antipoor,-1,-1
vicious lying opponent modi intensify viciousness answer vote modi,-1,-1
thats called modi spin line spindle teaming achievement,0,0
modi thanks pointing btw jha continue moon stay way suit,-1,1
bjp government data data consulted give reservation announced modi would head heel,0,0
elder built house kicked home someone could elder anyone else indian tradition hindu culture doesnt say disrespect elder discussion among public country modi insulted sushmaak,0,-1
first really indian anti semitic something maybe appease pakistan muslim population avoided israel someone please fill,1,0
great leader modi,1,1
indian military successfully conducted antisatellite weapon system test satellite lowearth orbit according indian prime minister narendra modi,1,1
modi modi modi,0,0
modi government reached goal world guru five yearlit proven,0,0
word chowkidar used better narendra modi term recall value cell trend corner namo promote free,1,1
one war affected nation,0,-1
result study indicate even called prestigious constituency represented highprofile political leader fail infant child issue basic minimum nutritional requirement,-1,-1
sub gap closing,0,0
thing treat everyone equal hate anyone cant even back stabbed hand sang better half hate simple question hate modi anybody commits hate modi,-1,-1
trailer actually look better movie hopefully web series give indepth insight struggle reflects path common man modi leader modi wish biopic created inspiration instead political campaign agenda,1,1
cheek hai modi going mamatas nemesis focus corrupt mapdata,-1,0
job seeker job creator due modi govt mura startup india scheme,-1,0
modi choose two seat poll people large reject opinion,1,-1
woman safe lawlessness state modi resign immediately according,-1,0
alternative modi,0,0
contender modi true voice republic,1,1
blunder whole speech let dream shatter bangladesh could prosper something effect pakistan naar main dum kia hua hai watching whole speech imagined worried mha official working furiously preparing clarification speaking rather like modi unprepared tempore way speaking however often unable speak inherently talk speaking living room good ups allowed like talk informally need careful speaking high level,1,0
there case modi surely going win,1,1
there question allowed anyone beat illiterate modi,0,0
start nursing modi country electing modi,0,0
think papa so atleast brain strike deal modi guy national joke,0,0
real he modi fan he targeted,1,1
happened modi know stole credit election read news right arrow curving india attains capability target destroy space satellite orbit,-1,-1
hilarious according newspaper modi bastard giving thread pakistan btw name newspaper,1,0
kind achievement deserves chest jumping let cheer rejoice instead concluding timing political negativity kudos india shoot satellite joining space super league modi,1,1
military secret revealed modi always using nation defence power cheap dirty political benefit,-1,0
mode acre din,0,0
modi india,0,0
much confidence truly aap let fight modi bansraschallenge accepted,1,1
bump election discus city issue need like modi fight corruption provide able administration,1,0
good celebrated india blew satellite low earth orbit militarization space huge concern,1,1
quite serious former iso chief get death threat supporting sat sure security agency alert voter alert make sure every enemy narendra modi india sent home election,1,0
selective carrier unhappy actor responded appeal modi imagine hatred,-1,-1
greatest slap iso scientist modi nothing done last year congratulation iso proving worth success also giving fitting message feu,1,1
impact modi marketing strategy,0,0
last election modi pakkodi jai cbn victory hand,0,1
man said global warming exist people get old feel colder source hindi yadfhgajph,1,0
thread petty always personpresidentpm founder everything equally important people far take initiative forward much effort made,1,0
started modi,1,0
bane narendra modi broad based growth issue,1,1
couldnt open bank account poor year talking sending money bank account modi demolishing song meet,-1,-1
thought modi,0,0
till month back kept defending modi despite knowing mess today claim respondent find another liar like modi vote one care,-1,1
toby madman representing crown prosecution behalf indian authority final submission london westminster magistrate court nav modi isnt cooperating indian agenciestheres risk hell fly there risk hell influence wit,1,-1
today area interview modi shortage burial market,0,-1
today modi meeting,0,0
true mode willingness see thing otherwise concrete family member always busy looting country already saved permanent role joker theatre play across country,1,1
true modi blame everything near isnt reverse also possible,1,0
true people look forward mode address nation yoga make address people simply switch set,1,1
truemodis policy like painting resting iron sympathetic real condition people low happiness index high unemployment rate care people say modi modi,1,1
truly wtf must tried question government anything relation army navy airforce abhinandan also back guy started barking soon got news thanks modi govt pakistan give day modi power,-1,1
typical that logic india matter regarding modi personal choice depending upon impression created last year,-1,1
unfortunate couldnt find space mention ordo word appreciation actual one appreciateddilution institution autonomous body core policy always overhyped chest jumping modi projecting designed,-1,0
unlike modi,-1,0
various role drama queen modi fighting election minister tagging away sheriff governor demonetization minister launching gst minister defending rafael launching missile,0,-1
good sir vot modi,1,1
interesting snippet muslim tongawallah more say vote bjp though seen work want give another chance also see narendra modi,1,1
via modi kick election campaign promise new india,1,1
vote party leadershipwho take fast firm action none narendra damodardas modi bjp party,-1,1
waited year modi delivered modi failure,-1,-1
economist bjp kya kia modi policy see naa india economic dollar dean blade piano sarah haryana know naa economic directly proportional employment given crore student graduate,1,-1
expecting modi give chance others become india bigannouncement,0,1
highly complex one conducted extremely high speed remarkable precision show remarkable dexterity india outstanding scientist success space programme shri narendra modi,1,1
modi supporter vote tejaswini brilliant prospect ground worker deserves ticket tejaswi sure still far away inducted isnt worthy candidate let see happens,1,1
mode inferiority complex,-1,-1
talking hype created modi announcing something big end boring monologue space program,-1,0
wasted money rail intact arab better rail bark loudly pakistan army pee pant modi govt send rna border india save thousand crore,1,1
watched war child year today movie catch imagination modi shah like arab well feature,0,0
watchman modi shirt seller,0,0
welcome director appeal people india vote modi bjp,1,1
well done ordo team honorable prime minister modi thank making proud,1,1
well know people like never true citizen india ordo say strike satellite doubt order hate modi airforce say hit target pakistan accurately doubt order hate modi slowly slowly wouldnt surprised start,-1,-1
goby time added modi took credit tsk,0,1
narendra mode announcement mean india,-1,0
entrepreneur college student entrepreneur help college student giving opportunity normally always struggle get poor modi secondyear student integrated human,1,1
kind example modi want show cannot expect type fake wrong statement,-1,1
modi also spent advertisement get power serve nation one gave credit cheering modi grow dude,-1,1
alleged achievement modi marker,-1,0
mean word fact said antibody thing said fact multigenerational army background trying tell patriotism essential value upbringing,-1,1
think case nda shy seat railway ticket boarding pas air india modi pic airline say looking,-1,-1
whats wrong statement every anti modi tweet like pakistani,-1,-1
come recreating acronym aint one like modi absolutely got hill,1,-1
surpanakha wished modi died swine flu become ndtv,0,-1
watch feel guilty see chaukidar choir modi,-1,-1
south india region taking always believe modi new india jai hind,1,0
agree title article content lot amateur political pundit tired none wannabe psychologist actually look data making tall claim,-1,0
modi hailedfor air strike asks rajnath via,0,0
song hate army hate modi shunt answer mocking army action pak terror first uri ballot,-1,-1
modi give cricket show answer question ethic integrity people falling short manor kumar r saysdefinitely say man word dignity pay promptlyguru,0,1
modi chowkidards enough let debate,-1,0
also add even ardent modi fan agree lot expectation met,1,1
one every two week modi ji win,1,1
mode last lie,0,0
nav modi vijay mall share jail cell extradited judge asks prosecutor,-1,1
surprise see couple filing divorce due either supporting something else except modi,1,1
vote modi problem solve,0,-1
due respect atari modi thanked,-1,1
pat done nothing remains,0,0
witness modi led loot india nimo,0,0
wonder buying rafael aircraft flyaway condition make india cancelling fighter contract actually make plane india modi turn everything head mesmerise gullible demagoguery,0,-1
wonderful shri narendra modi ji governanceindia highly responsible fellow nation worldstands international community count justice humankind shri narendra modi jiindiawill serve along great nation world,1,1
would fitting someone supporting modi would made point issue unnecessarily coloured political overtone issue much larger civilization nature,-1,1
yeah modi give free money farmer hail good getting burial moment,1,1
yes plz ban caricature modi,0,0
yes say stand modi modify centre support modi state support bjpdats sit,0,1
yes space leadership current shri narendra modi,-1,1
buddha twitter vote kar narendra modi appeal everyone tweetstorm,0,0
already know answer modi hai toh pumpkin hai such bhi,0,0
right saying vote dont misunderstood vote divided society name politics country country need government double prime minister narendra modi,1,1
shame nation and that modi belong lunda gang abv god save country like hell,0,-1
wasting time explaining thing idea basic science know hate modi,-1,-1
cannot blame bjp many modify chart educated blame cong cong book education policy created million educated illiterate,1,1
cant claim perpetual elected expected enforce law proved coward run people complaining see wretched rival vote modi gifted cleanchits nautanki,1,-1
need ppl unbound corruption india impossible need start micromanaging every little thing still garbage pile side road someone taking shortcut government job,-1,0
notice bypass leader liar modi trained accomplished liar leading example,1,-1
think making genuine mistake worst brook whose hate modi made antiindia,-1,-1
one view asked nose nav modi medal choir managed fraud rbi governor,0,0
ball condemn china treatment uigjurs dont talk modi making pak shit brick build house free,1,-1
favourite china fucking muslim may still blame modi,0,-1
opinion god father democracy family treat first family modi strengthening democracy put sideline first family,1,1
modi leader thankful modi anything else,0,1
telegraph talking even pakistan daily would kinder choice word propaganda tool hitler did consider part india hence hatred modi ba banana hai,-1,-1
assam gave prime minister people even remember modi vibe manmohan singh gopher rally,0,0
bahujanahit훮ya bahujanasukh훮ya lok훮kamp훮ya good many happiness many compassion world gautama buddha,1,1
