arrested man made modi remark private facebook chat misleading headline gist man got arrested making remark modi headline give impression man got arrested reason also made comment modi,-1,-1
five year kid writing exam write page long answer near lady man indian kultur time pack bag,-1,0
hope mother sister wife daughter use mobile phone motherfucker gonna rape every moving thing using mobile phone,0,-1
hope mounted rider sort magical bow super effective legendary water type screwed,1,1
india point point today trajectory show upward trend never seen anyone dispute sub point exactly,1,1
know maybe got audience amazed mere well supplied professional ring hollow worked happy managed get instead old still crappy lens matter body even situation technically putting enough sharpness final resolution look good take little editing quick snapshot better setup instance took quick picture day messing around one without set extension tube even aesthetic seeing closer,1,1
sure thread date indian politics bjp always radical hindu political party,-1,1
one thank make modi even ppl use data write publish artecals entire medium house dedicated talking shit ppl,-1,1
intrepid duo home well deserved rest aureus dream set year future read foresight thor show door ready rumble happen yet see cutscene beat game grow,-1,1
posted thread yesterday many taker guess interested negative criticism anxious find fault oath praise,1,-1
pretty sure remains temple jama masjid,1,1
recently got ebola notification batch group eng guy died taka real,1,-1
remember hope right well looking new platform feel pain starting whole legume politically enjoy hug october kid place citizen right connection contest,1,1
hindu sit gave clean chit modi even may via,1,1
thought largest solar power plant commissioned modi used solar power initiative paris climate initiative said alternative current govt going reverse issue pointed,0,0
april modi marker shoot marker first last fool day main,1,-1
jab modi such hua toh google near kam dense shame guy respect,0,0
wont blame student govt india year modi shut nu sell land highest bidder dont blame others failure,-1,1
riot communal violence modi feb due andhra riot gujarat watch killed ppl went refugee camp modi never apologised also used maya koda diversion suk banned visa,1,-1
account also blockedbut modi doesnt handle,0,0
admitting fact pakistan expert lying cheating towards use islamic jihad terrorist fight war deceived world long modi keep punishing terrorist,-1,-1
afp meeting infantry like modi meeting bjp party vineyard come first always overtime,1,1
dani mining scam time read dani modi airport scam,0,-1
modi removed name voter list aap allegedly call people pretending radio channel,-1,0
railway ticket boarding pas air india modi pic airline say looking high voltage high voltage,0,0
bjpjai modi,0,0
aggressive modi batter love modi heart suit heart suit,0,1
agility ladder cradle work foot stick eye time fundamental back boy modi lax,0,0
agree fail youre observation right earlier people wearing modi jacket feel closer modify overtime modi taken place heart jacket required,1,-1
aint capability political willie capability airstrikes didnt willmodi,0,0
air india withdraws boarding pass ad vibrant gujarat pic modi news,1,1
idiot parenting mode travel reminds accountant ud pas travel bill sale team climbing jealous misconception salesman living,-1,-1
usual suspect come together defeat patriot modi must preserve group photo usual suspect future generation reference,-1,-1
although shouldnt sake modi really think would better bjp mp lost much arrogance sympathy voter manor toward would first name list,1,0
amazing bird eye view rally maharashtra modi mit shah still zoom see crowd,1,1
american browsing top hour namo,1,1
base data argument one thing hate modi,-1,-1
expires next month modi come worm wont last another year seeing lying desperation defending defensible survival fight,0,-1
guess modi horse,0,0
modi didnt change anything term kyung secular marker hai,0,0
see guy used time last year criticise modi issue lack job even talking world renowned economist dont single framework create job agenda want give freeze,-1,-1
true one that modi supporter true hindu,1,1
exactly india shining work youth get workplace vote modi come,1,0
final assault bjp modi,0,-1
say modi dictator every institution threat,0,-1
vara isnt jail gov yr put as jail still chose ignore modi already knew vara issue target damage,-1,-1
rule look much written modi made lot noise show thank,1,1
think survive good life anywhere india one try much better scheme trash political overtone modi,1,1
job cancha modi,0,0
announces nya scheme modi get address whole nation,1,0
body able prove modi made promise giving lakh side give gift,1,1
appeal crore deshwaasi join church tomorrow please support mean modi,0,1
fake person fake party looted india year together responsible giving birth fugitive person like nav modi mall others youth india full trust better stop nonsense,1,1
bollywood actor medium influencers bjp bollywood actor promoting modi thought,1,1
need modi,0,0
are hai narendra modi isle bhi doubt hai kya opposition party were supporter barking modi addressed thats reason announced pic,0,1
sat missile crucial national security narendra modi,0,1
assured bhupesh babel stop put outsourcing step taken better employment opportunity recently around farmer said would contest narendra modi varanasi demand,1,1
atleast near gave scripted speech science mode best take science far face surgery game pushpin vian,1,1
attorney general misled court save modi case,1,1
ballot mission shaft happened modi deserves credit,0,1
basically inefficient ppl blaming modi,0,-1
become perfect chaukidar like choir modi need thing like selling tea committing theft house abandoning wife making mother stand queue speaking lie etc etc,1,1
muslim hate modi may even hate hindu understand earth hate india celebrity india muslim country would imagine hence please dont support tude tude gang,-1,-1
belgian birth indian choice indian accident like marker modi teach economics delhi school economics besides score university india around world sultan said,-1,0
best bet need challenge modi constituency loses real clash amongst party veteran case bjp manages make government least thing avert lapse democracy,1,1
best luck vote party desire thats beauty democracy modi best country present scenario,1,1
that bhaktonce modi spread humour thesis ordo work want tell dot know election desperate trap voter,0,0
bhasadbaji sama ga public anti govt fail every sector like education health employment fir chawkidari yacht modi,-1,-1
biased inexorably stupid clearly antibody narrative shame,-1,-1
big blow modi hater,0,-1
big failure modi govt job front,-1,-1
bjp win election,-1,1
blocked whoever support modi human,0,0
bloody joke modi landing bloody joke today,-1,-1
btw technical waive farm loan way better usd loan borrowed albania dani perfectly better idea takenirav modi borrowed took money country retiring right kinda debt fine good idea,1,1
assure modi place sure,1,1
indian medium may working article modi got done poll notification opposition say politicised,0,0
issue modi produced poverty,1,-1
official changed tenureinfact every institution ppl changed support modi,0,1
apply modi fit fine physically mentally,1,1
see tweet praise modi below dont indulge muslim appeasement,0,1
calling modi mullaha true ideology done modi owe anything true postal ever true may hero read true history fed cert book want bashing leadership like sulla modi garb neutral,1,1
somebody fetch data much money deposited withdrawn bank one hour time across country sudden upward trend visiblewill interesting read,1,1
debate mode fake promise giving lakh every citizen indiamrarnabgrab mrmodis leg demolish entire democracy countryshame mrarnab,-1,0
cannot allow explosive pakistan pulwama distance modi say people india,0,0
cant say modi neither become baa data,0,0
cbn dangerous currently cr modifies let defeat snake cheese,-1,-1
choose brave brave india,1,1
choosing picking best worst clip two person support purpose first think modi leader mass murderer regardless position hold moment,1,-1
congratulation scientist carrying successfullyindia moving fast towards becoming world leader mode leadership way become super economic power also super science power,1,1
congratulation great orator dynamic young leader shri tejasvi sure hope win bigger margin matthome,1,1
congratulation modi finally achieved something he completed total scam get full list corrupt practice,-1,0
congratulation modi whole country,1,1
could tweet also referring theresa saying yes modi would different world,0,1
criticize nation dance desk were kite tude hongephoto modi hatersspend year nu studying useless subject hero made urban naval ticket allowed party found nowhere world map except india one left seat,-1,1
curious narendra modi biopic want know make mit shah look like mud cake head,-1,1
deal modi threat evidently sorry see losing perspective matter manner,-1,-1
dear dp song wikis medium dallas battled even pareshan bhutan also ois grand announcement national radio eve election modi chose announce ordo iron decade old work anti satellite weapon new surgical strike,1,0
dear india okay admit sat testing mode achievement mode please back fundamental problem discus job security lapse false growth lynching,1,1
dear prasad sir win record marginthis time modi ji bjp election cr take personally clear mahathugbandhan central enough modi ji insult insult family jai hind,1,1
dear sir dont cut clutter housesgas connection road waterwaysureasecuritypak relationsface chinaetc visa current govtand upa per choice grill modi skill awaits response eagerly,0,1
de modi,0,0
help foresight declare national anthem time truly acknowledge space scientist ordo destroying spy satellite making india country achieve capability thanks modi announcing elia national anthem time,0,1
jump voluntarily someone holding,-1,0
modi say single word taking credit whole medium address statement india leader bjp everyone rejoining moment opposition party politics,1,1
girl ask rescuing putting back could getting paid service consisting guess matter agenda make someone look bad,-1,-1
eat beef bryan sleep asaduddin waist slam narendra modi pulwama attack,0,-1
disagree modi destroyed men guarded willingly surrendered modi merely exploited loophole people failed build institution could resisted attempt failed,-1,-1
dog barking mean bark front fuck shit milk una begin mikka bhi modi harsh jake dek pakistani medium indian bhagawan,-1,-1
dont pay attention comment illiterate follower rssmodi,0,0
dont worry dont need discus modi going,0,1
ordo created modi young lad,1,1
duimukhi modi work albania indian,0,0
election commission issue notice maker narendra mode biopic via,0,0
empty chair nonexistent enthusiasm crowd rally today clear indication election heading might hung assembly bjp well seat,1,1
end debate forever col victory hand,0,1
everyone look jpl navigation engineer saying jpl designed trajectory mar mission iso guy,0,0
exactly sir wish modi govt learned lot india shining liar hold gut top political score awake people damage done well,1,-1
fear next year well spinning around cool stratosphere thanks modi hot summer space belongs,1,1
feel safe modi,1,1
feel proud nation modi,1,1
feeling proud watching exclusive report mare desk meta modi asia sir salute,1,1
first time seen leader unhappy disturb modi common people thats vote reserved modi,-1,-1
former iso chief called upa govt disaster received death threat jem supporting modi,1,-1
twitter modi dream started showing result bihar cleanse bjp,0,1
made kai modi govt well keep mouth close modi govt became roundermodi,0,1
good idea aspirant opposition debate one modi,1,1
good job keep bootlicking bjp,1,1
good job modi,1,1
good thing ppl thanking modi,1,1
governmental authority anything law order matter come individual state case,0,0
guy singlehandedly made modi minister chart add chowkidar name,0,0
haat going talk deleting tweet true follower modi retreating truth brave,1,1
modi gut announce subsuming prevalent subsidy marginal situation would arisen lost plot trying make india economy mistake made,0,-1
haha account modi ji,1,1
hahaahthey dont visita modi promised thier rehabkya hoyawo jump that reason dont want back simple none want live cage curfew internet shutdown,1,-1
hahahaha next interview modi,1,0
hail moment success mode give apt response,1,1
happy announcement came powerful india dream modi happening delivered,1,1
looted farmer also collusion friend one case reliance earned crore crore premium,0,1
done year back modi took help gujarat,0,1
pledged support modi,0,1
hazaribag lok sabah watchman public servant shri modi government victory hand victory hand,0,1
heard modi show aap adult sunday,0,0
heard saraswats statement yes nda government also credited unfortunately nda government modi government modi credited statement enough modi dragged controversy model code conduct violation,-1,1
heyheyohey narendra modi,0,0
hmm like modi jee fought two place data kya rta,0,0
hmm main question rag line modi albania crore die come,1,-1
homeopathy nothing loot fool poor ppl many modi chart involved scam call fake,1,-1
hope modi scrap article right,1,1
dare become modi that havent telangana youth beaten pulp,0,1
dare modi converted catholic christian sibling ram that bad modi,-1,-1
many seat modi contest becoming,1,0
modi planned shopping fifteen lac every citizen,0,0
immature really want eliminate corruption support modi contest modi varanasi say sacked bef soldier ndtv,1,1
india great leadership modi india pale asia nhi tha india century mam living,1,1
india enters elite space club scientist shoot loworbit satellite away space say prime minister modi via,-1,-1
india shot live satellite space say narendra modi india new missile technology spreading around globe necessity make world peace hope live satellite,1,1
india prime ministerlets work make india trillion dollar economy modi,0,0
india shot satellite modi say joining select group nation million indian lack access indoor toilet,-1,-1
india space super power narendra modi speech live update india become space superpower say via,1,1
india biggest democracy size true democracy modi giving next family,-1,1
indian foreign policy modi era,-1,0
indian mindset fascination govt job causing faux scenario elite economist must remember modi govt disoriented conservative economy market based economy augment growth trajectory well plethora job lazy bone,-1,1
indian news match jaipur next rajyavardhan singh rather five year modi govt,0,0
indian prime minister narendra modi addressed nation tell citizen country successfully tested satellitedestroying missile,1,1
indian rest till modi removed done much damage keep waiting cache din,1,-1
india rupee went asia worst best currency turnaround fuelled improved chance narendra modi winning second term amid recent tension india pakistan,1,1
instead nursing modi try something positive country,1,1
instead modi scientist would tell nation success name scientist behind think bigger honor address giving today work medium section,-1,1
insult bjp modi insult country,0,-1
iso band seems efficient modi,1,1
given amazon modi country,0,0
modi era like modi come time,0,1
modi april india building block sat weapon place sarawak ordo chief india building block antisatellite capability india today news april,0,-1
blocking right melanie dont vote modi ill post pic recipe arrange food tasting home made wine,-1,0
price paid indianehru thought became noble leader must common sense impact future today modi trying correct checking parameter resolve past decisionthey want stop cross mark button monkey lost nehruvian,-1,1
time show doesnt believe modi hai pumpkin hai great job,1,1
ive done ballot nation japan done first salute modi main bhi chowkidar townhall,1,0
jab log had barbara hong chase koi kya kar santa ppl seen wat bjp country every aspectjust div chance delivered choice choose simone elseppl understand simple thingmodimodi,0,1
jammu root harvest premature wheat crop vacate land modi rally,0,0
join tomorrow march state head office sector tanager live interact onwards ema hand karen rijiju taper gao narendra modi mit shah tame phasing,-1,1
joker showing drama chart saying moon shining cup modi hai,0,0
one family berozgar modi regime lakh job created month formal sector,1,1
suggestion offence word chowkidaar warden narendra modi better optionagain offence hard working chowkidaars around globe,1,-1
keeping busy mean le terror infiltration india masterstroke modi har har mode,-1,-1
kind att indian dont know name castereligion relative indian brosisters going helpsave strengthen life thru vote modi yes modify,1,1
know cong main objective election win restrict bjp modi cong end seat time well,-1,1
know better pointing conclusion parliamentary committee chaired damning modi govt,1,0
labor law modi labor law,0,0
lack common sense sagarika known spec venom india becoming nation dis world achieve declare make world knwindias prowess space har cheek modi carat,1,-1
lad whining fact chasing nowadaystmcs abhishek banerjee busy squash wife allegation possessing illegal gold airjourney bangkok kolkata modi uncle custom help cutoff,-1,-1
launch scheduled date way back think modi worried violating model code onlyhis biopic releasing phase objected genuflection part job description modi appoints anyone,0,-1
lead across new frontier turn india techmilitary power space proud moment ordo security establishment every indian nation take rightful place high table world affairsthis good governance modi,1,1
let explain modi fought seat knowing well win fighting varanasi strategic seat fighting another seat acceptance,1,1
let support modi ji party,0,1
let debate modi say say open another channel,0,0
like modi want send important message election commission name many legal candidate cut district ball please enquiry,1,1
like wise longer list say year modi rule modi built yesterday,1,1
list reason must dread hung parliament point influence meddling busybody particularly noteworthy loss influence select set problem modi,-1,-1
limb test nation election show whether people brush aside rhetoric modi favour genuine problem exercising mandate,1,0
live modi crowd size indication verdict forthcoming election,1,0
live update lok sabha election narendra modi interact people main bhi chowkidar campaign,1,0
live update lok sabha election narendra modi interact people main bhi chowkidar campaign high voltage shaw high voltage,1,0
lok sabha election narendra modi wave bjp bastion gujarat say opinion poll pre election survey,0,0
lowest nice know see dear shri narendra modi come back power coming poll whatever little bit without hesitation save nation corruption scam,1,-1
lol sure hope voter exercise even brain vote modi also throw r bjp leader country,1,1
looking trawler sycophancy modi doubt intellectual rest agree,1,1
look like canadian also happy work modi jee congratulation advance becoming,1,1
look like modi selected someone image represent bangalore question know guy represents bangaloreans want represented,1,1
look like country care see heroism star modi tried create saying something big announcement coming,0,1
movable dear youth friend running campaign please between trend help make success reach mass failure modi govt,1,1
madam thought modi bjp never thought hell dot care abt national security,0,1
maharashtra cable rate rupee month modi marker rupee check cable pack,0,0
man jean free bharat singh different modi got dumbass working among adivasis surely serving upper caste rejecting god religion caste also serving upper caste always fascist proving idiot,-1,-1
mater stroke ragahope make promise like modi lakh,0,1
mean else supposed find pot end rainbow problem supporter want everything bjp wall call masterstroke even modi post hashtag twitter body language matter bro,-1,0
mission demonizing india modi tall country fall thats,-1,0
mm modi choice missile testname risk bathroom mm went bathroom modi took risk need cry modi claim success mm asked failure act like asking cricketer she hit six crazy,-1,-1
modi address startup founder silicon valley time india,0,0
modi adorn colour north east via namo app,0,1
modi,0,0
modi appeal people come large number vote government corruption free,1,1
modi begin campaign rally address halo arunachal pradesh follow,0,0
modi begin poll campaign northeast rally arunachal assam highlight ndtv news,0,1
modi biopic intra publicity ichi desperation establish cult beyond word,0,-1
modi came power farmer vote modi waived lac crore loan copy modi nothing farmer vote,0,0
modi give speech rally interview favorite reporter ask asked ask,1,1
modi come country turn poor gst much praise go high still want govt shame doesnt care people problem said perfect really solve rr alp student problem really,1,1
modi contested constituency,0,0
modi deserves,0,0
modi,0,0
modi dredge parade taiwan male chowkidar bna the,0,0
modi forgot address people raid,0,0
modi fulfill primary need people living poverty line well delivered maximum promise middle class people,1,1
modi gave indian cache din made prostitute lose cache din,0,-1
modi give important message nation minute,1,1
modi govt saved billion money looted cong rule cong want use money personal gain shame,0,1
modi govt use people mu footballplz little concern towards mu,-1,0
modi great actor surjewala flop actor,1,1
modi completely ignored young people,1,-1
modi edge rival digital outreach struck chord ravi shankar prasad,0,0
modi hate bigger national interest,-1,0
modi hater say nexus rule ordo started lie credibility give shape think unleashing people innovative thinking making possible achieve desired,1,1
modi hater turned india hater true away along happy see hater troubled nervous hater china pakistan,1,-1
modi wide vision every field yogpurush proud worthy man,1,1
modi supporter walking talking comedy show,0,1
modi intentionally delaying called intellectual fumble gather maximum attention entire country message rapidly reaching mass min enough might take min,1,1
modi interview attacked personally pulwama got answer people modi speaks opposition conspiracy charge pulwama terror attack,0,-1
modi invention cooking gas,0,0
modi main reason bjp defeat,1,-1
modi much better monmohan,1,1
modi murdabad,0,0
modi never promise lakh,0,-1
modi contesting,0,0
modi kid sitting physic math olympia exam knowledge technical technocrat figure explain far mocking religious belief concerned remember nobel prize winner believed man born virgin mother,1,1
modi seat quick decision understand thing better interest nation,1,1
modi demolished youngster future,0,0
modi play pakistan card attack opposition say pakistan still busy counting body india air strike opposition asking evidence detail india biz hour,1,-1
modi promised every citizen receive lac account dont want yearly wait seeplease vote also citizen india,0,1
modi say fake promise country list modi first,-1,-1
modi talk missile technology body talk anything people arrested jailed,0,-1
modi sir respected much govt condemned raghuram raja defended see happened pussy cat want comeback india hope swamp sir pass like,1,1
modi thing bastard anti indian,0,-1
modi specific community,0,0
modi stand transparency promptness patriotism decision maker daring new india make india rank india space india former uplift baking reform upgrade armed force force first india first world forum corrupt jail never ending reform,-1,1
modi still shock mara thagbandhan,0,-1
modi taking credit order misguided voter favour,0,1
modi minister space announced technology tested theoretical test lastly needed put ban lock,0,-1
modi prime ministerial candidate side worker party race post prime minister union minister india anchorexecutive editor,0,1
modi thinking yar much angrezi yada ati nazi mai hindi bologna firstpost brilliant plan modify colonize colonial mindset bla bla bla,1,1
modi think narendra actually neither nar india,0,0
modi time,0,0
modi took political decision test mm give credit due,-1,1
modi tweet spree post time halfanhour economic time,1,0
modi want make chowkidar every bodywhy dont want free unemployment youth first pick common public going happen telling chowkidar chowkidar,1,0
modi want total submission guy smith iran way right mix ignorance young fanatic zeal submit cause india risk becoming oceania orwellian modi get reelected already hate session,-1,-1
modi sleeping intelligence report pulwama murderer japan,0,-1
modi definitely come,0,1
modi rally,0,0
modi winning,1,1
modified bollywood scene idiot via,-1,-1
modify proven loudspeaker announce big project get free publicity propaganda nothing happened last yearsother thing moditake credit others donethis modi story last yr,1,1
mode definition strength speak volume intellectual capability adviser around,1,1
mode pro poor multi purpose program made declare sop like economically better one eat happening manga,1,1
modi campaign get big boost swiss bank show india winning black money battle,1,1
reason vote modi lakh higher amount wont let modi easily till pay share,1,0
intellectual signed petition last time vote modi bring,1,1
morning night modi modi moon lost sens know happen modi return power,-1,-1
suitable modi,1,0
modi dont know public service know public money using enjoyable journey around world joyful life modi achievement nothing know people create employment public etc,-1,1
narendra modi confused confidence successful win election take care loose point manga help nav modi robbery bank pnb,-1,1
narendra modi declares india space power destroying live satellite low earth orbit,-1,-1
narendra modi government already giving lakh crore poor every year big question remains whether terminate existing scheme,0,0
narendra modi india fourth nation world space superpower,0,0
narendra modi sarbananda sonowal,0,0
