squirrel like datum man fair hum sala ine cute bhi main cow cute nsw warning,1,1
bad taste yes really surprising court asked shut get similar ruling desi dark theta town share name make modi special snowflake know theta must using name standing citizen deceive potential customer,1,1
believe someone could super fucking dumb yesterday said hit appease indian upcoming election multiple foreign medium reported modi exactly supposedly,1,1
even look decent thinking worse proud beyond,1,0
hindu eat beef love cattle see nothing wrong true cow protection however clear new generation gaurakshaks little actual animal protection simply thug looking cause communal violence strongly condemn act well government camping,1,1
honest admit thought pakistan would first pull trigger guess underestimated hindutva weird should bjp,1,1
asking good one need answer first little finger even brook modi direction jai hind,1,1
got whatsapp forward asking stockpile enough supply one month until get rampant fearmongering,0,0
know site usually spring around election time funded rival political interest cannot say feel sympathy guy essentially run hate site political purpose,-1,-1
like everyone fat shading rename eating beef watch every rand quota liblunds sucking dick ended world hunger,0,-1
shared hand indian,0,1
think others eat lot nda share upa seems fine though,1,1
toi like mouth piece bjp publish cartoon paper,0,1
update still found debris black box evidence pilot remain standstill,-1,0
vote tilted towards good moderate margin first year tenure travelling around world building brand india globally course travel domestic policy took hit indian society look divided certain issue ever think biggest achievement absolute zero case corruption cabinet union government level modi cabinet minister need buckle area definitely need improvement pretty much best right single national level political party leader see alternative prime minister india right period,1,1
never promised mistake thought hard earned money taken modi,-1,0
china made sat test cong laid upa power till nothing modi made le understand power cant ignore fact,-1,1
bjp candidate bengaluru south say bjp party recognises potential karyakartas,0,1
pic slogan air india train ticket cup sold train cup biopic released such toh sharma taro stand toh koi nhi,0,0
may ordo already announced capability modi trying take credit election time,0,1
absolutely right tight slap face propaganda anti modi,1,-1
absolutely true modi show,1,1
according celebrity joining politics hypocrisy bjp copying modi good nothing,1,1
according source initial investigation show violation code conduct force lok sabha election address modi neither mentioned party appealed voter vote favor,0,-1
actually illiterate people like cannot understand simple language modi claimed india country posse tech hard get,-1,1
advance want modi listen drop name,1,-1
nearly thousand year subjugation muslim invader british india hope modi deliver rightful place upon time india modi hope country future,1,1
watching debate intriguing almost tried seen biased modi guess fake comment former ordo chief seems baffled praised modi,-1,0
one attack ref soldier opposition questioning govt total system failure band banana chalice govt bull habit para modi sank karoyo debate news channel jawa silent issue declared ur pump,1,-1
admin chief asaduddin waist mock narendra modi proposed hyderabad rally,0,-1
air india delhi samurai flight found using boarding pass narendra modi photo,0,0
modi chart please reply tweet,0,1
attacking mode governance last year,0,-1
thing fine grace difficult still remember expression swearing ceremony modi looked petty,-1,0
work going people good sum right left problem long live modi,1,0
also modi supporter canvassing bjp vote bjp victory hand,0,1
always cry bjp much scared head hit wall nothing going happen like muslim india ruled muslim muslim could even remove head till hindu ruling safe whether modi else,1,-1
need modi,0,0
firmly believe modi become,1,0
modi ji future progressive visionary idea giving excellent result,1,1
questionquestion tweet people unemployed election many ppl chose modi,1,0
modi hater,0,-1
modi hold account nothing,0,0
still fell modi didnt delivered god save,0,-1
supported support apprentice worked alongside architect modi,0,1
answer message send stop shouting modi modi,0,-1
anti modi presence around,0,-1
anyone politician near vision modi kia etc need put next fucking rocket towards space tum caution sir outrage karma ata hai,-1,-1
anything bjp modi odd dont bring level,-1,-1
anything possiblemodi hai pumpkin hai,0,0
april environment ministry released draft cr notification critic say draft open india coast industry threatening environment surprise point youve reading thread,0,-1
expecting sabha road show karimnagar loksabha constituency win easily great committed leader pair bar modi marker,1,1
argue puppy modi,0,-1
ask modi r fond also oval want way afghan leave another papa jem altar mahamood take help garb nation,0,1
awesome describes got brain support modi stainless obviously know,1,1
awesome interview arab thanks,1,1
back modi raised fist,0,0
modi government would act npa company also draconian demonetization planned,1,0
chose modi constituency anti indian naroda voted modi true patriotic rest traitor timeline pakistan,1,0
begin leave modi harmed youth india much,1,-1
best luck gambit election hope would achieve success keep modi hand stronger winning seat,1,1
best modi gee,1,1
bjp narendra modi must think judiciary system,1,0
bjp see issue release mode biopic listen panelist discussed watch show,0,0
bjp sample people ground still believe modi individually,0,0
bjp modi tried level best use national security issue also political gain,1,1
explanation near made mistake long story everybody know independence faced condition getting better prior modi era modi came stone melting started happening blame,1,-1
breaking news video india shot live satellite space say modi,-1,0
bring massive reform coal remove coal ministry completely open sector one corrupt sector people earn corruption crore every year modi cannot complaint minuscule investment apex last year,0,1
past week see aggressively promoting hatred towards modithe first lie start even voted modi look country news much scam intoleranceindia peaceful country anymore,1,-1
earning stopped modi gun modi go biz continue,0,-1
india country soap paper possible modi made possible,0,0
time modi dont want chowkidar chaiwalawe need leader lead country,0,0
calling china name even india didnt blocking unse resolution modi ji diplomacy work,1,1
tamil people confirm vijay actually christian name seem practice similarly viral full name kennedy john victor seem christian practice give damn religion follow seems odd choice name actual religion different,1,-1
understand ud easy divide india thing wrong need monotype character divide country scientist engineer achieve breakthrough,-1,0
cent per cent correct doubthonest tax player never blame modi,0,1
certainly moulding great leaderand may long way point also far better choice present modi,1,1
challenge modi become talk take oath dickhead,0,-1
change spec mama come together defeat modiwho polarized election agenda trying bring agenda paid confuse voter show frustration simply hitting head wall,0,-1
chokidar trying cheer already supportive people favor modi,1,1
clearly priority far better dan bjp,1,1
congratulation scientist hardworking nation safe proud feel thank much scientist sir narendra modi,1,1
congratulation sir great achievement proud bar pair modi sarkaar,1,1
country india doppleganger modi,0,0
county mean say important event postpone due election remember modi still india still country whose national security prime importance,-1,1
cow facade gautankwad unemployed brainwashed hindu hired raider killer villager,0,-1
critic made popular people barely knew keep following live blog detail,1,0
damn modi attention seeking chap,0,-1
wood pak according islamist jihadist modiindia responsible everything,1,1
day far modi election arena,-1,0
dear modi please cum visit,0,1
debris may spread aggressively conducting anti satellite warwick india never detractor pakistan china got clear message modi hai toh pumpkin hai didnt,1,-1
desk doi found maria change done modi govt,0,0
desperation announce jump scheme like nya unfortunately achievement modi govt played section medium,-1,0
doi smastastic strategy game sucked boundary per dot single towards end keep strike,-1,-1
modi come scorpion,0,0
see bullied booted wait watch modi going booted guy run,0,-1
didnt got lakh instead cache din promise told diverting people time tell promised delivered modi mouth shut,0,1
didnt money give second person speak modi,0,0
dont expect anything modi dot expect love letter pakistan,1,1
dont think last poll violation modi many come hand glove,1,0
dont worry modi come back people get worried became cash property,0,0
dont worry thankful near today got narendra modi best ever,1,1
appreciate kind language young girlahe nice modi still,1,1
dude one person make country great solve problem modi raga stop making person start thinking country high time stop meddling shit electing rubble trouser represent,1,-1
dynasty family always targeted poor people neglect poor people vote difference chowkidar modi rajamaharaja family,-1,-1
especially karnataka modi follower taken hindi pride pride outgrowth superhero translation kannada nothing submitting egg blind see advantage,-1,1
everything said done jeetega toh modi,0,0
exactly modi supporterbut keep blaming near wrongsthen must courage even credit thing like iso ordo,0,1
extremist modi banned enter united state america due terrorist activity profile,-1,-1
fake begs part fest old anti bjp medium friend anti bjp venom explode soon like bomb modi ud return next term,-1,-1
false promise bounced back mode head,-1,1
fan middle class modi fan wanted many time,1,1
father massive npa touted next dont believe modi make barakha drink little le control man,-1,0
finally medium site picked news born reddit india,0,0
flipped modi betrayed country ruining army namemodi surely anti india double agent hired destroy india,1,-1
many watchman modi campaign political gimmick unlikely improve life life,0,1
reason narendra modi decided blow satellite sky give press conference actually explain done,0,0
first time forever aap said something make sense ga rakshak poly bag first concern,1,0
asks modi credited,0,1
forget pakistan sir even fix know killed pakistan shot plane showed proof form abhinandan release id terrorist strike killed talk proof,-1,-1
free fund lady frequent flying lifestyle got bolted modi lost mental balance,1,1
church mosque wood premi say dont vote tell creating country called pseudo singular scoundrel modi marker strong secure india,1,1
full antibody propaganda modeehh see doctor trust need one,1,1
insight gift auctioned proceeds collected,0,1
give proof modi said give lack everyone prove ill pay lack live pune honest people know full corrupted party shameless high people lack intellectual vision nation shame,1,-1
good deleted modi name otherwise people started doubt work market even behaved today,1,0
great son india speak modi,1,1
guy studied school jamshedpur though much much senior feel proud,1,1
haawhat jokecontrol joker bound lose left brain may modi take oath,0,-1
hahahaha modi going good help past month,1,1
name kiss bhi sarah there there gang dare jarurat nazi hai care country taking place universe thankful primeminister modi sir,0,1
happy birthday sired bless modi,1,1
successfully changed indian mind ayodhaya dispute berozgari ballot attack really pakistan plan india hide lie nav mode arrest london polling time gain vote,1,-1
conspiracy theory sort modi introduced demonetisation gst former killed growth manage inflation letter that one theory may even buy,-1,-1
hate modi communal india united communal force create myth think bli low rated politician get life,-1,-1
army space power modi read yesterday news paper namo,0,0
acted illegal migrant narendra modi moran assam,-1,-1
come begusarai defeat traitor say giriraj singh ndtv httpwww shameless fellow telling everyone pakistan speaks negative eccentric modi kanhaiya defeat send pakistan enjoy retirement,1,-1
friend big quota interacted month last month sensible guy big modi supporter asked changed said us quota lot day,0,1
got lakh promise modi,0,1
heard story modi love thai massage want hear,1,1
made stringent law confiscated property economic offender ascended india property worth crore belonging vijay mall seized even though total liability stand crore modi,1,-1
between cause goaparty modi back,0,0
seen fixed bogus interview modi swami seen between like,1,1
seen modi ji rallieswhy quote well,0,1
heat rajasthan governor alan singh reflect modi remark join video,1,1
hell yes case didnt know government iron budget grew crore government political ahead test scientist deserve credit obviously modi,0,0
hello modi supporter dont hypocrisy like care everything anyway mother teach,0,-1
degeneration modiworshipper chant modi modi modi,0,0
here vote modi lok sabha election vote,1,0
hopefully hell abolish note bought modi govt make easier store black money,-1,0
arrived northeast modi vishnu gupta,0,0
demeaning observation according observation modi would taking breath get vote,0,0
powerful narendra modi political history india able modi extended dynasty state one another question one answer powerful world largest democracy,1,1
know decision taken modi,0,0
hypocrisy modify cohabitates escape bank fraudsters vijay mall nav modi medal choose others fled looting lakh bank opposes respite poor,-1,-1
ideal modi,1,1
immediate escalation see one mistake modithats want,0,-1
india becomes nation enter elite space power club antisatellite weapon announces modi via,0,-1
india becomes fourth nation sat missilemodi hit hater like boxscore power,0,0
india gear bring back nav modi,0,0
india killed six defence personnel achievement modi marker destroy one satellite destroy chopper anne game ghuske maarenge,1,-1
india modi wrong youre antinational point modi,-1,-1
india prime minister narendra modi speaks success mission shaft declaring india space power,1,1
india sorting right modi want next term,1,0
india successfully shoot satellite space modi time india via thanks,1,1
india successfully tested new antisatellite missile wednesday move prime minister narendra modi said catapult country space superleague analyst said risked drawing international opprobrium,1,1
india successfully test antisatellite missile system low earth orbit satellite prime minister narendra modi,1,1
india sat country modi time india via,0,0
india main opposition party criticized bollywood biopic prime minister narendra modi labeling propaganda suggesting break country election law,1,-1
india present prime minister narendra modi chief minister gujarat state advance could called pioneer antichristian movement distributed,0,0
injustice meter poor form demonitization antipoor policy modi led bjp government erased power boy,1,-1
instead vote political party vote best candidate represent constituency parliament last list modi yoga,1,1
invitation fan sir know busy schedule request blessing har har modi gear gear modi raised fist pair modi,1,1
india church youtube channel modi series pls subscribe,0,0
much fun see pidismodihatersdynastic bootlicker getting pass burned weekly basis burn year really fun many many contrast special mention willingness,1,1
world threaten day india enemy threaten day least basic knowledge haa respect common person india modi congratulation technology,-1,0
timing objected modi done nothing except thankful shut importantly vital top secret capability would helped surprise enemy war leaving time recover needlessly exposed,1,-1
itt everybody fat shading modi,0,0
jaikumarrana thats call strategy accept defeat without fighting bihar last election seat loksabha fighting modi hai pumpkin already accepting defeat,0,1
way song making noise mode appearance missile launch biopic even act buffoon reported violation never life practice come election hindunessbhakti go wa upto,0,-1
alan multiple corporation election modi government declared haryana become smart city year announcement time current member parliament mla mayor corporate show hole done smart city,1,1
kannada allahabad difficult bjp point obc consolidation big hope modi election happen largely irrespective candidate modi ballot,-1,0
kapil final respectfully saying modi,1,1
cr good telangana state fully agree hype impossible task moreover needed energy level like modi worry seat time actually want seat bjp,1,1
know bjp great work income see bjp modi want modi win bjp perfect modi india fine without bjp,1,1
son political said mission mar successful hua tab bhi modi announce kia tha tbo election bhi nhi thy,0,0
land air space government shown settle narendra modi,0,0
layman diary right pleased satisfied red modi marker back,1,1
le modi sir,-1,0
life one one support without expectation long live thank prime minister modi done support tamilnadu jaimodisarkar,1,1
like modi today listening,0,1
lol see video see shi mein tumhaara dimaag ghetto hai youre agreeing fact modi india india modi right,1,1
lolyou guy come innovative way nonsense act last year continue like may you still scanning dictionary come new word target modi,1,1
lot people becoming anti modi become anti india right stay india get india pakistan,1,-1
madam story half see whole take modi topic understand talking,1,0
made boo boo chowkidar prime minister narendra modi,0,0
mall property attached action nav modi govt took action default cong allowed continue loot,1,0
mam first time voter first vote beloved chowkidar modi first,1,1
man seek super facebook kill modi foolproof plan arrested jaipur,0,-1
matter explain wont get easiest word dont get across even hold placard victim wont satisfied end goal join bjp say wash modi wash forgiven sometime back germany heir hitler,1,-1
may cong jds got common beam raid done otherwise need rally tat lighting fast provoking party worker giving credit modi get credit right,1,1
may deserve following trusting service company narendra modi,0,1
mean till modi government come problem stay indicate moment modi government came fled india know chowkidaar let stay easily india,1,0
mean dead abhinandan would served modi better daily achieving new low,1,-1
mein bhi chowkidaar aab modi saabji i bar api marker aur ani missile parish hong chalice nuclear powered submarine make india protect indian ocean rogue nation like china pakistan nuclear reactor meet energy requirement,1,1
model code conduct joke wont anything modi consistent violation party movie releasing april another violation code conduct,1,-1
modi accomplished year,1,1
modi accuses cr copying centre welfare scheme,0,-1
modi address nation thing important opposition already getting pant jai hind,1,1
modi betterment future,0,0
modi shushma sure none business question happening pakistan earth,0,1
modi announced,0,0
modi answered every question politely powerful interview,1,1
modi attacking vote bank last mla election lost deposit,0,-1
modi biological son modi shah,0,0
modi cancer society promise proof everywhere,0,-1
modi creating work irony friend youth india,0,1
modi dared launch ambitious scheme citizen important raise reach unlike regime raise used reach ur commission drive economy,1,1
modi desperate time show,-1,-1
modi finding impractical real world willed,1,0
modi previous government anything,-1,0
modi whatever party r,0,1
modi dont know form got type enthusiasm really surprise day day working style roll model indian hat sir modi hay pumpkin hay jai hind,1,1
modi dwarf banana gay sha sarah meaning share surprising hindi urdu meaning key bhavarth atlas bhi nazi ata ski tuna shrarab karen page hein joke surprising reporter also studying meaning,1,1
modi enough destroy india indian like blame pakistan care one care india,-1,1
modi exist japan going expose modi cruelty towards armed force government done scam rafael food japan best japan,1,-1
modi feel blessed fortunate committed dedicated like strong asset country countryman make sure lead country future always make khangreess must hindustan,1,1
modi flop actor flop moviewhat stand for term india flop country modi hero made country flop eye one else,0,-1
modi going loose many seat,1,-1
modi government know divert attention grad headline,0,0
modi govt giving much per year poor family well established various scheme,1,0
modi govt reduced price anti cancer medicine one really good step,1,-1
modi govt missed chance useless talk,-1,-1
modi perception stop mf liquor ordinance share kasabare part speech top head behaving like local third grade leader immature horrible,-1,0
modi grip intoxication power,0,0
modi achieve self goal terribly exposed vulnerability indian air force world pakistan,-1,-1
modi live nhi area recording speech lmaz,1,0
modi made crore people self reliant mura romana,0,0
modi must milling threat like mayawatis yadav,0,-1
modi photo nikaldo modify doesnt cheap thinking like warn batsman first wasnt even far crease spirit game killed yesterday book shin indian doesnt make right,1,-1
modi picked straight election public frenzy another rally like opposition knocked,1,1
modi playing politics antisatellite missile capability mayawati,0,1
modi prime minister country saying ruling sense responsibility,0,0
modi promised safe country delivered modi promised gas cylinder delivered modi promised strong economy delivered modi promised transparency delivered ram mandir remainingalthough promised expected,1,1
modi pure election chain raga,0,0
modi raj rojgaar drowned arabia second termed flipped last year,-1,-1
modi real god,1,1
modi regime nod mining hectare forest chhattisgarh,0,0
modi relies pakistan win election,1,1
modi marker set example shin followed footstepsawaiting theater cheat drama,-1,-1
modi say pakistan die death india move ahead,1,-1
modi spent cr market course follower think india cannot afford give poor month,0,1
modi terrioust prime minister india watch video guy,0,0
modi new lyricist avatar may using lyric poem modi already written,1,0
modi one pea damn india,0,-1
modi try divert people failure governance indian people ready hope modi,-1,1
modi today gujarat visit march,0,0
modi unveils bjp poll plank via,0,0
modi born cutter vajpayee looking star oscar wide,0,0
modi right continuing advise anybody price,1,0
modi wear chowkidar cap serve people wear skull cap kill,0,-1
modi emerge strong position mark movie founder emerging market asset manager movie capital partner say result favour impact indian stock favourably,1,1
modi another yr whatever said done,0,0
modi win peace pakistan india even le likely,1,1
modi yhi yoga bjp data,0,0
mode address nation today let see,0,0
mode demonetisation biggest heist indian history,0,0
mode extremist hindu campaign continues many million kill,1,-1
mode hand hovering clearly proof terribly scared bjp looking,-1,0
mode selective silence play gallery fanatic follower led situation naive think isnt deliberate silence act perpetrated hate crime,-1,-1
mode showed gut bring back abhinandan,0,0
mode year explained le minute honest via,1,1
modi televised message smart move right time aimed electoral dividend full credit scientist,1,1
offending disgusting individual modi,-1,-1
nagaland confident modeled nda government storming back power,1,1
air got baptized joining bjp,0,0
namastay chowkidar many chowkidars together chowkidar modi,1,0
narendra modi next year plan indian thanks,1,1
haven woman empowerment way forward modi nah think space marvel hold think idea guy,0,1
near laughing modi power education companionship build man man known friend,0,1
new delhi election commission wednesday questioned centre railway ticket boarding pass carrying photograph prime minister narendra modi withdrawn read,1,0
nav modi company sends legal notice stop auction painting economic time,1,0
none pertains modifies period modi scanner taken care confiscation property case extradition process put place ensure fugitive return heart alleging true patriot country,1,1
none safe left alleged liberal brigade voice support even appreciation anything done modi attack like pack hyena disgusting scumbags lot,-1,0
none may modi,0,0
note giving proof modi left institution untouched good way,-1,1
expert feel saved benefitted modi government last year question last year look many middle class people would come poverty line,1,1
surprised allegation likely swamp isnt far truth obamas trojan horse economic policy work way controlling emerging economy china would none neither modi,1,0
modi ride,0,0
part community antiindia category broadened modi antiindia hail democracy,0,0
interesting see whether deshbhakt winning modi that winning correct time show patriotism respect soldier,1,1
say fake done modi,-1,-1
offense best defence mission shaft modi proved real chowkidar nation today citizen motherland india standing together proud chowkidars,1,1
oh modi,0,0
converted modi something terribly wrong,-1,-1
one thing surely using prime minister position using leader bjp party modi family member never become billionaire never loot deshkonation,0,1
channel taking purchased indian election valley time modi spoke pakistan must sad state politics taking growth creating job opportunity,0,1
modi modi red heart red heart,0,0
apps dont brain brain fill modi haunting blackmoney,0,-1
work unlike india national dog modi doi lying forgot recent international humiliation stop acting like bill gate dog check begging graph plz also internal condition india,1,-1
paranoid pseudo intellectual cannot digest courage common man happened julius cesar napoleon bluebook conspiracy backstabbed one messiah poisoned another different era dagger modi see face guise,-1,-1
party person next working modi hope stand,1,1
