agree said tho may said jokingly debut hero bit old ssr quite mature face doo beta hope story requires bit old requires someone else yet cant think else could done need young hero perhaps sid could done value desperate time desperate measure even ayushman perhaps ssr,-1,1
believe people even considering reason guy willing wag mouth guy made video apparently promised compile heroic deed report higher ups hindu sama get handsome rewarded hard imagine one would eager reveal one criminal action complete stranger believe naive thread,1,1
case spiritual corruption message love bond harmony peaceful coexistence lost power feeding security moral migration hurt everyone,1,1
country first wah thought nazi actually taught something,1,0
hard time choosing favorite submission scorpion crosslock black widow,1,1
heard direct line narendra modi accessed average guru true,1,1
look forward tomorrow quota praise hero,0,1
look eyebrow facepalm turn camera pair salary detay into shooter kao ina image hot aap coal tar eyebrow line taro,0,0
lot love india many colleague work strong trump supporter biggest issue modi however current attempt ban cash see play though,1,1
mode blunder davis say indian voted india population,-1,0
seems like problem megathreadbot updating,0,0
start whatsapp forward linking modi jumlendra modi see opportunity,0,1
surprised people surprised fraud bjp,1,-1
indian express left leaning singular jeep man getting beyond sucked atleast kick guy party want semblance responsible ruling party,-1,1
saturday wearing something ugly,-1,-1
well let modi,-1,1
reason modi must elected back power bunch crooked unknown deserve absolutely nothing le,1,0
gift memorabilia received modi auctioned crore added nama range fund crore seoul peace award also nammami range,0,1
lok sabha poll modi likely address eight rally maharashtra,0,0
modipassed yoga day day india creating job give opportunity young mind,1,1
aaj push baht home tumpeople like rather corrupt people like power modi actually something time,-1,1
aam admin party file complaint modi violating model code conduct using name defence personnel interview political gain,-1,1
away year want appreciate india find sample century modi,0,1
abe home big fan home chutiya modi dont know anything question explosive come,0,1
abe futile got sanctioned modi govt previous congo govt int enough gut carry feat making india proud,1,0
absolutely modi leadership defense research working successful venture remain paper tested ready deployment,1,1
according well educated friend giving per month farmer giving per math undefined poor hat modi hatred,0,1
acre din aae aae modi create fascism maroon area,-1,1
across country even bjp strongest state people dissatisfied modi modi came wave going back tsunami,0,0
actually fact mahagadbandan get power with win whereas modi career admin dont interest making money working country,0,1
again fake news round confirming personal detail nav modi made statement court,-1,-1
russia china said addressing nation success called mission shaft modi called test india capability shoot low orbit satellite asserted india action directed country,1,0
alka agar kejriwal tujhse batamizzi kai aur apshabad kate believe deserve least stupid post modi,-1,1
know agenda want become choice dislodge modi trying course wish fulfilled,0,1
modi delivered said firing air target destination amino result,0,-1
best sir modi,1,1
already crystal clear bjp modi come powerdobara,1,1
alright huge abhinandan released tomorrow,1,1
also congratulation modi,1,1
also story quest involve np grand company slightly different text depending grand company,1,1
also village see anger people towards modi,-1,-1
mit shah said modi destroy nation bro india today delete article please check,-1,-1
among typhoon mode regime fully revolution destroying may june behind general election,-1,-1
indian failed prove even single allegation modi visited pak interest said still living past koi boat hai present ana koi rada nai sarbijit spy shakira innocent citizen,1,1
modi enabled,0,0
prime minister narendra modi jai hind,-1,0
remember used say modi wife named jashodaben one trusted time modi agreed,0,1
unlike use military vote bank weapon program initiated manmohan singh good luck recovering delusion memory loss need better research team,1,1
modi hero movie doesnt know people real life,1,1
whole world behaves gujarat religious riot happened yeah modi get clean cheat supreme court,1,1
year old shown gate seems khamish bjp hav policy give ticket old generation thing happen modi mit shah well policy matter share intact thrown royalty,1,1
angel tax parenting permission trade gst difficulty many problem entrepreneur parish government modi big corporate getting benefit name government purchase,1,-1
another laptop owner recently changed conclave format accommodate modi shameful,0,-1
anti modi people searching proof sat missile system,0,-1
common idiot know modi job,-1,-1
appeal mode nemesis double supreme court stature call cbi aged parrot rename misadventure conspiracy assassinate aps transferring intelligence chief yr security chief christian bark cp,0,1
apr taken leave morning ant vote back afternoon pair sumptuous lunch home happiness bright future india modi,1,1
april india building block sat weapon place opportunity modi done nothing stole credit work done scientist previous government,-1,-1
super power space thanks modi,1,1
saying modi nut,0,0
muslim really scared thing government done scare community talking purely term legislation,1,-1
ask question modi,0,0
ask simple question competent modi name one person opposition party claiming modi done nothing united election fighting alone bsp,1,1
baby modi,0,0
bachelor hui would taken wicket,0,0
ballot attack chowkidar choir nazi dark bhi hai,0,-1
battle half india win denied nav modi election tricky sticky wicket,1,-1
became cause modi plz get straight,1,1
laskhar faith know china finish within year india threat keep attacking hindusthan keep sitting quite thats happened uphill till modi came,0,-1
better read first given big statement mode demonitisation,1,1
hai main game modi first opposition ridiculed armed forcesand scientistsjealousy hatred kya kya karate hai,0,-1
that modi made,-1,0
right fanatic deceive even mode laugh bisangi,1,1
bjp fighting optic,0,-1
bjp india bjp modi best bjp modi bjp upa india,1,1
bjp get seat uttar pradesh bjp get seat across india nationwide angst modi hidden editor delhi,-1,0
bro dont talk tolerance modi bhaktsthey exactly opposite,1,-1
btw congratulation successor keep tagging modi,0,1
btw problem mode announcement timing politicization bjp opposition backlash effect,0,-1
buddy politician make lot promise modi fixed one number well raga sick one number saw confused rafael cost well dont need confused leader,-1,-1
bulawayo south raj modi similar fielding candidate mica,0,0
follower instead supporting raid leader cleanblind follower cry modi social medium,1,0
iaf said casualty would better matured cr cbn criticised modi politicising army using abhinandan photo retreating pas claim wrong way sending message,1,-1
modi politicising pulwama attackskhud promotion merge hai humane kia humane kinase baki log poochege,0,-1
modi indian hitler using hinduism symbol hatred uncanny resemblance,0,-1
modi scientist iso iso official could announce specially election melodrama time announcement justified problem remembering contribution pioneer laid foundation,1,0
one voted modi crore job promised think problem people vote someone give job reduces inflation intolerance corruption,0,0
ask take opinion never said positive thing modi govt far,1,-1
cabinet committee security meet chaired modi underway address nation also note tweet come mode personal handle pm,0,1
get statewide data dont misunderstand modi upa,0,1
candidate work hard ground win seat party modi expect modi win seat corporation parliament,1,1
cbi nav modi case breaking agency team reached court hearing modi start shortly,0,0
cheat bury difference single agendakick modi achieved unlikely look forward another election,-1,-1
clean chit modi,1,1
communalanti indiahindumodi toxic creature tweet testimony typical muslim radical,-1,0
cong initiated play politics end scientist success sat fool cong start barking modi achieves nation confused didnt politics modi praised scientist proudly shared success nation,1,1
contrast ordo best modi namo,1,1
congratulation always proud scientist engineer able decisive leadership modi together achieve greater height keep indian flag flying high jai hind,1,1
congratulation chowkidar modi chowkidar agg raja,0,1
congratulation chief mission shaft upa give nod modi courage india news indian express via,0,1
congratulation modi entire team becoming fourth super power space possible one party govt power hungry mahagathbandhan politician,1,1
congratulation modi jai hind jai chart proud indian,1,1
credit others one modi deserves credit,0,1
credit scientist near modi,0,1
damn brutal modi made christian girl made,-1,-1
day chandigarh newdelhi welcome support hon ble prime minister narendra modi,1,1
dear dur hee familymakerplease dont natural collecting monthly bone soon god know modi chart bomb also wing commander rejoined base,-1,0
dear lady discount news get immediately para fancy hindi come slew hindi product printed mode face rapper hindi packet also line read pair modi marker modi,1,1
dear shri modi siryour unrelenting passion strengthening democracy country totally completely supported honour privilege ardent duty assist endeavor thank personally reminding,1,1
dear note many country carry modi nano chip even traceable america,1,1
decide want government teach pak lesson modi via,0,0
definitely le though want modi next term also,-1,1
despite gst setback start trader stand firm modi via,-1,0
dhanywad modi,0,0
done amazing talent cricket everything calm collected see much similarity modi dont get excited wait right time confidence integrity,1,1
drug great analysis appreciated one parameter added lie modi card reported,1,1
ask question modi promised lakh unlike modi fulfill promise,0,1
ever ask question like prime time lac crore public money waived modi corporate,0,1
difference upa modi government,0,0
direct transfer made feasible modi government party sat,1,1
dont care modi directly involved happened watch he masquerading chowkidar today ironic,1,-1
dont fix blaming game modi jee man substance dont blame mismanagement,-1,1
dont obsessed modi heart poor oppressed modi represents upper class good people passionate,-1,0
dont take tension question answer prepared team modi handed one parrot repeat parrot,-1,1
dont worry akhilesh maya combine leg modi chair modi expects bring support mp,0,1
dont worry cheerboys cheerseniors also modi brigade get basket,0,1
sarcastic job cook created modi,1,0
ordo chief mission shaft upa didnt give nod modi courage via,0,1
dude there difference alleging communal riot local fearsome gone mad allege modi responsible local fight course good severely punished,-1,-1
dynasty politics threat democracy modi interview,0,-1
earlier mm tenure people looking carrier scientific sector etc tenure modi govt people happy feeling proud named chaiwala chowkidaar pakorevaala etc,1,1
east west modi best best primeminister ever seen,1,1
election commission examining mode address antimissile test,0,0
every day modi exposing number opposition party leader hell bent discrediting young friend joined ordo left myth disgust way worked allowed use internet phd astrophysics modi worked,1,-1
excellent article mean history repeat modi advance shah modi karma,1,1
explains reform undertaken modi govt curb corruption,0,0
exponent freedom speech expression releasing biopic modi election visual propaganda material clear violation model code conduct propaganda film release delayed till may,-1,0
fake news pais nhi newspaper cutting dia modi delle badge madarchod,-1,-1
family proud modi,1,1
felt happy watching video hope make sure video kept social application well people may get inspire narendra modi work common man support thank,1,1
finally found person hate radar support party anti privacy many way waste many donating left last option oh wait donating hate modi best hope ch read left operates,1,0
fir modi song,0,0
first vote dinamo,1,0
follow support modi,0,1
modi rate rafaelethe date ram mandirthe certificate degree secret matter boast loudly disclosed,-1,0
past five year asking modi government first decision special investigation team black money ndtv,1,1
free gift paper glass mode name tomorrow glass let see private citizen,1,1
friend garb chowkidar ani albania make mini alibi data modi sent bank account one point five million dollar everyone bank account,0,1
whoever insult modi humble origin make comment like first family gonna send thank tweet thank check free cost publicity,1,1
south india know south especially tamil nadu dont usually trust northwest especially gujarat unfortunate bad habit however come modi like mass historia people even deep rural area love passion,-1,0
giving tough competition modi,-1,1
glamorous outside completely hollow inside namo government sir inside country situation absolutely explosive blinded ego inferiority radar narendra modi think prefer ignore significant symptom taking indian governance brink,1,0
going prepoll promise one crore job per year modi around lakh job created every month updated pfo payroll data released january year show monthly average lakh earlier figure declared lakh new,-1,1
good morning year proud nation give mea narendra modi india able bar modi marker,1,1
good point modi contest,1,1
great achievement celebrate congratulation great scientist modi took bold decision safeguard country,1,1
great appreciation modi,1,1
hahahaha agreed still vote modi,1,1
happy modi,1,1
har har modi song,0,0
done great mode leadership overwhelming legacy issue tax gdp showing improvement india moving forward right path revenue improve visible transformation felt,1,1
forgotten party got abt vote src mode coming together gave necessary impetus storm power otherwise neck neck battle anne per kulhadi maria tha begin centre state don modi swath beetle kata,1,-1
given cleanchit modi address mission shaft,0,0
hatred modi led accept guy want break india,1,-1
largely failed sabha swath sabha visa bogie modi govt want divert public attention national security hence action election eve didnt soon may getting historic mandate poll,-1,0
heard seems mahatma modi find answer year,0,0
help understand credit modi sat given logic applies,0,1
fact check modi govt come power huge decline poverty india span yr almost half population extreme poverty fear come source booking,1,-1
he clearing fake news narendra modi glad,0,0
hey depressed fight together said beginning long road forward,-1,-1
hey santa steve job didnt voted modi show oratory skill,0,0
hey today make narendra modi tweet mentioned udia governmentwith one word,0,0
high moral ethic practitioner thats team modi,1,0
hold modi saying need send plane bomb pakistan,0,-1
big role advertising play watch,0,1
many mode guard frontier,1,0
mature indian citizen view work growth modi last year mahathugbhandhan caste appeasement cabinet minister performance honesty corruption truth lie define society decade,1,1
india acquired nuclear capability vajpayee govt india acquired antisatellite missile launching capability modi govt yet moon keep barking near khandhaan scamgress teach willfully blind idiot,-1,-1
india cinema news biopic india narendra modi played vive omberok roll india theater first week april,1,1
india antisatellite capability ordo via modi may game changer truly name changer,1,1
india registered space power modi addressing nation,1,0
india shot satellite orbit nation space power modi via,-1,0
india shot satellite orbit nation space power modi,-1,0
india need enemy reflect modi pakistan one cannot even imagine man accused killing people end,0,-1
india say successfully testifies antisatellite weapon indian family watch prime minister narendra modi addressing nation television,1,1
india shot satellite modi say joining select group nation confirmed successful test would make india fourth country one united state russia china election near modi played maximum effect,1,1
india ranked country environment protection index rank dropped massively recent year guess modi war environment ecology,-1,-1
indian army want heart modi lose election modi coward hide behind army,-1,-1
indian election duemodi expecting difficult electoral battlethere conflict india pakistan similarly israel netanyahu sure electoral victorynow go bombing palestine,-1,-1
intact one boot linking modi mit shah gut question misdeed chowkidars spine answer people ignore rat,0,0
inspiration sure top national interest pride remains intact,1,1
intellectual scholar educationist place modiraj one right question good plan execute never question modified version democracy,1,1
crime anti modi dear make antinational one question would prefer modi candidate,0,-1
one world level thing guy one agenda criticize modi bjp atleast respect good work,1,1
bc narendramodi bc modi govt india top,1,1
latin jha asking sarawak date approval given modi conduct test another way asking proof shame people lobby,0,0
jay bjp vijay bjp har har modi,0,0
joy three modi,1,1
earn hundred crore modi team pushed lakh commuter road lakh daily ridership fall delhi would full state modi would dared punishing deletes big election delhi vote,1,-1
executing modi policy javdekar dig book department scholar already suggested change javdekar allow following mode policy could gone modi,0,1
read name sham ligand spared usual anti modi bile dat spent read yet know wa develop,-1,-1
keep mind accuse modi btw nehruji given credit,0,1
kindly watch modi interview republic,1,1
know like whole nation angry fraudulent nav modi equally raging anger please sack person trying derail probe effort take nimo justice,-1,-1
kappa patel graduate nyu stern school business message hindi fellow indian point mode honest intention work betterment nation prime minister stood,1,1
such bhi defeat modi dont want freeze tude tude gang member namo back,0,-1
last modi gave interview bjp owned news channel,0,0
left supported bjp trying vote singh upa nuclear deal also capable india suffering modi,0,1
legitimate question given hijab modi marker opposition detail,1,0
let share let see much indian believe fake news,-1,-1
let know proof one loan waivednot modi that nya stupid,-1,-1
let modi remain space say sitar yechury,0,0
let poor also share waiver,-1,-1
like always upa thickened whereas modibjp showed,0,1
like ppldont feeling poorspoors let diego say drunkard smokersthats problemwith haram modi think albania dani doesnt think poor modi dog albania,0,1
liked youtube narendra modi pub modi make everyone laugh parish church,1,1
lok sabha election live update india love chowkidar king modi time via,1,1
lok sabha election live update narendra modi launch bjp campaign,1,0
lol modi lover tell toi hate modi hindu all tell toi hate islam truth bitter ball accept check news website,1,0
lol modi send satellite shaft save modi pumpkin hai,1,1
lol say guy represents brook,1,1
lol lutyens elite belong middle class family state education life dad small business owner belief strongly modi learnt seen world enough call bullshit call elitist,1,0
looking surprise,0,1
mama forwarded message contact group whatsapp trying bit helping cause hon narendra modi,0,1
mama pls stop listening liberal puppet lying teeth venting anger dustbinned modi,-1,-1
mama supported tejasvi sure publicly giving statement medium specifying crowd tejasvi sure need hour bjp win modi support,1,1
madame jee bihar assure bhisaab thoroughly washed away coming modi tsunami,0,1
make awareness racist dividing modi government please preach young mind vote anyone choir chowkidar,1,-1
make big announcement twitterati say metro pair narendra modi mission,0,0
many congratulation scientist many many thanks modi achievement,1,1
many modi critic saying real issue joblessness agrarian crisis manufacturing segment etc discussed opinion real issue provide strong honest leadership sabha swath sabha visa,1,0
might thought going another vijay mall nav modi tried also give peach day back square one,0,0
minute number one interview biggest election narendra modi speaks arab stay tuned,0,0
mismanagement height obvious proof economy modi claim tax choir entirely possible revenue fallen short target due economic slowdown,-1,-1
mission shakthi mission modi protection nation,0,0
mission shaft credit go dynasty didnt complete thats modi able india forever remember great sacrifice dynasty,1,1
modal modi sudhrenge,0,0
model code conduct violation clean chit modi sat address nation an live,1,0
modi aaj israel iran aba kia tha manure dei territory israel rainbow want pok part country sir love pls,1,0
modi afraid minority vote didnt modi contest minority dominated constituency,-1,0
modi always,0,0
modi version awaited heart wish upcoming mission nation bravo,0,1
modi already fooled people nation people aware,1,-1
modi also visited,0,0
modi asks people want government strengthens india one weakens country,0,1
modi atleast understands stuff,0,0
modi deed vanished image much run camping like main bhi choke dear,1,0
modi came power promising give crore job per year destroyed crore job come power may destroy another crore job india forced say kick pm save job,1,-1
modi come back ensure song indian politics ever parasite free india,1,1
modi deserves another write,1,0
modi deserves nobel prize heard done work ordo lab fool degree choir vision r demolished nation ideology killed mahatma demolished bari transformed india mob lynching nation crushed economy,-1,-1
modi nothing,0,0
modi didnt buy narrative made sure true fact reach people like reached without leakage true pradhan seat,1,1
modi didnt need shah ask speech best one bjp,1,1
modi space complaining full magyar band,0,-1
modi elder give respect oh forgot hindu sanskriti cant expected,-1,1
modi exposed video,0,0
modi fighting muslim dominated area keep dreaming,0,-1
modi next yr,1,0
modi vision,0,1
modi give fund mega govt first check tier,1,0
modi giving right direction country,1,1
modi going address nation important announcement please watch,1,1
modi got confused leadership dictatorship,-1,-1
modi govt gaining power without check balance raghuram raja next govt would come matter india destroyed economic man like come india would break leg,1,1
modi gujarat dennis miller,0,0
modi said would address nation modify such hint bunker tara phage atm tara curry towards bunker atm asked tweeted,0,0
modi courage give ahead via,0,1
modi burned wikis much year look aged year god know happen till,1,1
modi deceived whole nation,1,-1
modi ignored constituency varanasi say,1,-1
modi hate south indian,0,-1
modi crore bullet havent fund farmer backbone indian economy,0,0
modi heart,0,0
modi ji called monologue also based input public student santa public meeting also like dialogue interaction video audio mail twitter inst google plus nris,1,1
modi spoken equal justice person think done equal justice least state level,-1,1
modi law modi india modi court ruined every institution country,0,-1
modi mention strict law govt economic offender reading result property worth crore belonging vijay mall seized even though total liability stand crore say via,1,-1
modi mistake democratic india,0,-1
modi need doctor seriously,-1,0
modi obsessed name one pakistan second name modi modi creates big hype pakistan use punching bag show stronger irony pakistan present form weak politically economically,1,0
modi one ruin future modi near future join rank unemployed allege correct,1,-1
modi pig ambaniknown,0,0
modi please give full drop know best world,1,1
modi rightly said abi gauche share main feel hole plugged,1,1
modi say govt showed courage surgical strike land air space,0,1
modi say india space power shooting satellite,-1,0
modi say india shot satellite join space super league,1,1
modi come thats,0,0
modi sir best prime minister world,1,1
modi many people got struck today people india happy proud,1,1
modi used metaphor made reference never promised thing support anyone want video evidence public never see dont understand metaphor,0,-1
modi using teleprompter speech hindi would interesting know whether teleprompter made india china,1,1
modi elected when upa centre even appears seat gujarat top fight oppositionwho win time azcentral government policy reflects varying state govtspolicieshow gujarat face problem time say,1,0
modi sit natural role opposition leader,1,1
modi start like comment surprised,-1,1
modi win ill seriously part way issue resolved soon,-1,1
modi wont,0,0
modi would suit better fleeing victim,1,1
medial credit go hardworking scientist piddihaha planned way back hail near exdrdoit possible due political modi nda govt upa didnt help piddistop politicising everything modi,-1,0
mode father,0,0
mode signal market,0,0
modi extremist action win general election,1,1
modi government transparent his required upa government shady need lot hijab giving,-1,1
mrguha like song digest fact happened modi commoner happen go town tomtoming would hailed hero forget airforce ordo capable earlier also,1,1
much downtrodden asking wheeler vote modi poor slogan support,-1,0
must praise modi thuggery made murderer bjp president able make look like completely normal polarising india,1,0
narendra modi bjp post hold single press conference tenure evidently murder democracy want,1,-1
narendra modi address election rally gopher sentinel assam,0,0
narendra modi make open mouth opp allegation,0,0
narendra modi government taken lot initiative directly impact common,-1,0
narendra modi jindabad,0,0
narendra modi movie detailed trailer review reaction video explains informs trailer film first frame,1,0
narendra modi next,0,0
