new top story time india narendra modi project military might testing antisatellite missile,1,1
new video alert talk modi hai watch share like yeh shirt mei aakhri video hai god promise,1,1
nic indian people modi tract mission susfull,0,0
nice move modi election,1,1
nice video liked shalt narendra modi,1,1
nav modi reveals london court threatened song escape india paid commission wonder fulfill final rushed nav arrest make sure zero loss song,1,-1
nav modi threatened kill witness destroy evidence london court told report court drama modi alleged mafiastyle behaviour chief magistrate unusual decision keep behind bar,-1,-1
nav modi threatened kill witness destroy evidence london court told via,-1,-1
nav mode art auctioned million sale challenged court today,0,0
nav mode seized painting auctioned crore,0,0
nobody opposes question sam made fool trying snipe modi ending skiing india know intellectual also foolish purpose compromised,0,0
northeast vai been please vote modi,0,1
indian seeing horror past year co scuba modi raising awareness minimal way friend india local german administratorsplan engage local politician raise awareness r terror angle,-1,-1
interested jacket time doesnt mean modi going win come back full swing power,1,1
really sure come across much balanced lot ndtv like gupta rajdeep dont even try hide nomination hate honest,1,1
single bypass chowkidars talk achievement focus blaming politics,1,-1
sure bank confusing crore good idea fold say know business suffered enough hand fling mall nav modi throwing good money bad job give salary golden handshake,1,1
notaveer tasmacvaasi want modi declare individual opinion woman reservation party,1,1
nothing shocked modi hai toh pumpkin hai,-1,1
filmmaker urge people vote modi guess result,0,0
modi bullet deewala hogan,-1,0
dont misuse dado work politicsvote gaining reasonsall effortscredits ordo scientistsofficialsall staffsworkersactually medium briefing made ordo official modi,0,1
throwing abhinandan bus abhinandan must past use date modi plane important pilot,1,1
whole bollywood going join hand start defeat modi campaign,1,1
old game modi like play every election turned farmer son cry tiger tiger hope know end story,-1,1
one chance modi announce success exist get vote,1,1
one strongest unbearable achievement vote modify bar pair modi sarkaar,1,1
one nation one mission bjp,1,0
achievement ordo team modi fact modi decreased budget ordo,-1,0
one gamechanger lok sabha poll narendra modi run jailed,1,-1
opposition disheartened india growth alleges modi arunachal,0,0
opposition party think support pakistan corner india ruled modi,0,1
orwellsch modi sat sat missile give new strength india space programme assure international community capability used anyone purely india defence initiative security arm race space,1,1
leader chokidaar ani modi jay modi,-1,0
others especially anti modi lobby guy shout spoiler debate,1,-1
honourable prime minister shrinarendra modi address nation shortly big announcement likely watch channel choice immediately think going step immediate,-1,1
pak salt branded naval india sold billion still compromised ruling elitethe child modi,0,0
pakistan definitely want modi lose giving helping hand,1,1
pakistani want modi lose know right,1,-1
party name appeal vote may give clean chit modi mission shaft speech row,1,1
pathological later modi opposed ever modi say modi say breathing important living may see better result,1,1
people sensitive day back gay joke racist joke fun people took joke director looking job meeting homophobic joke smh joke take one,1,1
people famous person endorsing modi asking vote modi youre cancelled famous person let troll,1,-1
people love modi,1,1
played role staunch cong opposition voice probe ppl opposed gt logic came way dangerous modi delivered promised,1,1
plea filed release mode biopic activist question timing release,0,0
please stop movie release narendra modi wrong election show dignity,-1,0
please vote modi,0,1
power earth stop modi,0,-1
ppl response seeing modi speech,0,0
pradhan mantra mura romana crore people got mura loan past year modi marker promoting enterprise small business across country,-1,1
president said nya scheme remonetise prime minister demonetised asserted party antipoverty programme thrown total disarray,0,1
professor researcher nu hu launch academic namo campaign support modi via namo app,0,1
profitable weapon company nato politician power payroll let relation india pakistan continue faster nato israel want modi win,1,1
proud india narendra modi,1,1
proud moment nation congratulation team ordo became possible vision present govt leadership modi jee time rejoice complaint,1,1
proud modi,1,1
pulwama happened modi didnt took responsibility launched antisatellite weapon modi bhaiyo aur been della mere kamal,-1,-1
punjab punjabi still able understand supposed standing together let stop nonsense get track together make great india,1,0
question modi asked republic interview quit,0,0
really beginning wonder opposition would want stay modi biopic gladly sit back watch disaster unfold,1,-1
really doubt grown sophisticated family india graduated abroad least manner expected call respected choir national social medium modi,1,1
recent study based reveals adult believe job opportunity gotten worse modi,-1,0
religious guy country bjp modi giving bad name good religion hinduism extreme hindu provoked modibjp eat meat kill people kind religion allowed come,1,-1
remonetize plan clearly show upto request follow india one day decide country next five year modi raga choose wisely wrong one year destroy country bit bitplease dont,1,-1
request sent correct person modi modi,0,0
respect woman leader samajwadi party bjp party respect woman trust mode leadership jay rada tell reprint,0,1
responding rti university refused share detail record however university support claim made modi legally india bound hold degree would suggest file petition high court seeking detail,1,1
roll going laugh long chart bjp back institution broken buddha bless india,1,1
roll asking permission internet sent already ghotofied message one ama posing ask social medium viral team leader permission happy initiative thing steal idea give credit fine pokal machine wall taste roll,1,1
sabha swath sabha visa long muslim christian gay beef eater gay christian beef eater like holy trifecta bjp r instant lynching,1,1
sacked bef japan say contest poll modi varanasi via,0,0
sacked bef japan tej bahadur yadav contest narendra modi zeearnabtimesnow others please call japan antinational,0,1
shi kara modi bjp hate divisiveness cant camouflaged,-1,-1
sana tum itn hitman rakhti anne desk like asia bolosuch shameless lady areexpected tha tumsehow much really know albania modithey call performance,1,0
say choir modi killer shah,0,-1
seems modi policy towards anti terrorism worked,0,-1
sends notice maker narendra modi allegedly violating model code conduct,-1,-1
shivraj chuan eve election said politician promise moon nowadays people believe lost loan waiver implemented farmer care let forward nya lesson modi must show dream moon win,1,1
sham singh clarified ideally said government change every five year keep taking voter granted new government modi done added political competition good country,1,1
sir anti modi anti logo head doesnt matter making serious follower wrong path cant understand,-1,-1
sir telegraph always antibody right gujarat day nothing new become aggressive cause new payout option,1,0
sir road state high way class apart irrespective government helm within latin modi mm raga take credit kudos administration,1,1
sir first time election happening work done previous govt previous govt conduct test make deterrent available country didnt desire win election thats alleging modi,1,-1
sir journal fool deliberately misleading people india agenda well scripted methodology weaken helping modi sure nothing else wearing musk name independent journal,1,-1
sir neglect indian issue obsession pakistani issue antipakistan antimuslim stance simply prof mode hate campaign working election believe hate violence solution muslim pakistan,-1,-1
sirmost industrial worker sir wrong information probably worker get please visit time next year modi government,-1,-1
slap modi medium laptop hat,0,0
social medium lagoon modi evolution chowkidar salesman,1,0
thing done behind scene without publicity main grape modi everything medium attention done many called surgical strike past modi insecure enough publicist,-1,-1
source believe modi next speech opposition worried terrorist pakistan silence attack thinking soldier country revenge pulwama,1,-1
spread like wind word wide melted even modi say word unfortunate cant speak way kudos,-1,-1
sridhar chityala,0,0
start meditation help maintain calm unperturbed look noise like modi,1,1
style credit soldier shaft credit ordo raid blame modi opportunity opposition,0,1
still modi say cache din,0,0
sum matter cb fan followed are also support cb troll ina guest dey act like modi chart poll always offend hate,0,0
surgical strike carried upa regime without publicity cr tell modi,0,0
surjewala master lie wait watch grand master nearest jail nearest day month prosecution going please stop nonsense promise poor leave namo har har modi gear gear modi,1,-1
swift global messaging software used transaction financial entity massive fraud perpetrated nav modi case misuse messaging software,0,-1
take carejai hind come back modi come back,0,0
take narendra mode biopic film example movie like fantasy movie,1,1
team leave assist authority extradition case,0,0
thanks acknowledging sat strategic bold move difference modi bold understands strategy modi winning election effort cross no,1,1
thanks giving scientist show capability world amazed progress india direction support pair bar modi marker,1,1
thanks sir telling india many reporter disturbed see taking action surprised see considered non political true india lover day also playing politics modi,1,1
thats mode effect expr effect woman finger exam mute button,0,0
thats omg airportshout modi country thats man need passport life lie,0,0
thats modi waived loan lakh crore,-1,0
biggest terrorist modi butcher gujarat india,0,-1
biggest worry lack credible opposition country worsen mode victory margin bigger strong opposition ensures healthy democracy hope unbiased medium thats really long shot,1,0
biopic trailer paused bit modi shown heartbroken personally saving life isle page define hitman nazi hui say,0,-1
food delivery war going pretty awesome got bubble tea free even delivery looking dinner top head grabfood use delivery price may vary time right might actually able get meal last till sep honestbee free delivery till notice anyone else got loan,1,1
girl seriously asked row baba row baba much data hai mai confused hoon raise aap bhi confused hai let explain modi given entire rafael money get point dont electricity,-1,-1
individual connect modi people unbelievable,-1,1
least champ till election bring paywall alone marketing modi champion free market reform ought known better,1,1
new face racism modi bjp reborn,1,-1
old broke wasted year life wish pray long life suffer see modify take oath death main narendra damodardas modi ishwar sheath meta,1,-1
power modi,0,0
rate info shared per second damn high,1,0
real defeat modi govt fighting election issue national security journey cache din pakistan pure worthy vote guy,1,0
way take responsibility loan given mall nav modi visionary leadership manmohan singh,0,1
strategy seems evolving dont take modi head thereby face save case massive loss bleed bjp pan india cut across seat post poll tie battleground shifted every individual seat intensity,1,-1
temptation quit maximum near achieve himanshu modi,1,0
word chowkidar perceived pen class person word repeated modi prime minister country long live country,1,0
competition man modi far far ahead race like constitutional post even responsible country law order could even talk people wrong lol dont think past,1,1
need sub dean herald post collected,0,0
coming aki bar bhi modi marker,1,0
dont know difference sat theatre set say modi comedy character raga even good man actor theatrical via namo app,1,1
modi shah ruined country five year pitted one caste another one community versus another modi led corrupt government last year said,0,-1
think monkey think stop linking mode boot,1,-1
correct want share cup anyone bjp would lip load as,0,1
called modi half,1,0
come cabinet scholar like modi smith hem time retrospect,0,1
embarrassing get whatever modi touch turn ash mode touch,0,-1
gift enjoy,1,1
guy meeting continuously till modi made speech single tweet congratulation scientist col guy care election announcement molehill,-1,1
happening every day indian medium whenever modi address nation,0,0
mean modi address every alla country retain power,0,0
mindset people peace loving religion whoever modi supporter belongs r,1,1
due great prime ministernarendra modi,1,1
reminds charlie wilson war bombed afghanistan armed rebel tune billion end fighting let build school million nah fuck done money money moving bring radical scholar,-1,-1
survey conducted among modi chart guess,0,0
indication bjp going thanks god bjp radical like modi shah,1,1
real face modi r,1,0
guy told kid could make badminton court meth col aambani took modi intends launch largest min guarantee program planet funding plan may he opening foreign account ppl,-1,1
unfair court duty judging whether crime committed cleared say he guilty divine eye saw everything modi dddddd,-1,-1
chart going together ipl match shout modi modi,0,0
thx lata did blessing boost modi dedicates make india global super power,1,1
today going long day damn modi miss much todo,1,-1
today joined chowkidar support bjp dynamic deserving leader shri narendra modi become next prime minister opportunity lost india suffer suffer,1,-1
true modi done bad either especially juxtaposed predecessor would say done better job,1,1
true modi treason india election fight national anti national people,1,-1
unbelievable wikis modi bjp hindunative indian hating scoundrel india india launched first satellite aryabhatta april,1,-1
modi job loss around lakh government institution,0,-1
unshamdely guru,0,0
upa disgrace far science tech initiative country concerned modi took bold decision say madhavan air former head iso cong always interested looting nation building self pride,1,1
ya layer fool need man look sad wa ladder humiliation resorted kim woman queen she,0,-1
vijay malaga still percent star united brewery money enough recover money abt nav modi,1,1
villain modi movie,0,-1
wait day jab bjp bamboo pamela bcc pichhwade mein pair debate main,-1,0
modi brought single window clearance indian filmmaker long standing demand thats mainstream film industry want modi remain power,1,0
wasnt planning constituency vote think modi win unanimously nut definitely home april vote,1,1
watch government formed came know economic condition country state bank two alternative say modi watch interview,1,0
welcome modi ii,1,1
welcome modi merit,1,1
wen crore vote modi put crore poverty think may prove point aunt,0,-1
modi promised deposit failed,-1,-1
else cod expected modi raj,-1,0
modi chart know science chart know cow dung urine modi even bold enough attend press conference answer general question regarding nation,1,1
mode contribution said road lead rome credit every thing go modi whether surgical air strike valiant force risking life achievement scientist credit taken modi henchman,-1,1
spineless appear air everyday via namo app wow shameless give clean chit modi sat speech,1,1
three la exactly sabotage win whisper campaign asking voter vote whisper campaign done core chart forget modi vote tejasvi,1,0
agenda modi something new special others clear please,1,1
whatever might messageopposition day win extra votesmodi announced purpose,1,1
whatever modi hatred might force vomit indian people may understood meaning ordo sat missile success know sure modi successfully fired missile finish modi hater,1,-1
whats skill metric fail narendra modi,-1,-1
spoken modi female sign,0,0
care little knowledge nobody care opinion modi come back whole family well community vote bjp,1,1
silent told open mouth instruction air digi raja youjust dont give ammunition modi untimely unwarranted remark giving modi call name,0,1
arent saying anything modi sprite degree beyond jurisdictioncould fairy tale made,0,0
didnt people say intolerance modi,0,0
every channel show live every rally modi mandatory intimidation becomes boring repetitive speech force switch channel edit show highlight punish viewer diatribe,-1,-1
modi responsible crap indian medium,-1,0
modi trying create series across medium desperate afraid someone find judged data,-1,0
pull obama isnt mode personal achievement cry attention week ahead election much remaining limelight news didnt need urgent call nation address,0,-1
shouldnt modi get credit ballot strike asks rajnath business standard,0,-1
antibody lobby battery whenever positive news india achievement,1,1
share jail cell extradited judge asks prosecutor,-1,1
would like hindu friday smart modi appeal regarding international community silent,0,1
aaa one thing true anybody follower one leader thats modi modi,1,1
yep modi never reveal many know detail satellite tracking,1,1
yes hell pay time messing mode plan kanji that good example,1,0
yes modi come true give direction world sir proud today arjun,1,1
yes modi declaring result announcing massive defeat united opposition koi sha,0,1
yes modi defeated,0,0
yes unquestionably correct modi modi fan offering clean india strong india safe india healthy india digital india better education make india ndash gram welcome gift,1,1
along chid jail true nation want know nav modi business associate,1,1
cursed need find fault everything modi,0,-1
great sir wish beste people begusarai feel proud privileged electing privileged member modi government,1,1
greatest mockery indian politics done single correct thing entire life come mock insult every thing done well country power hate modi doomed ever,1,-1
vote ever want one stopping say vote modi going vote modi stand one force vote person party simple happy democracy,1,1
feel happy eagle india become country world hit low earth orbit satellite space whoever feel happy desperate hear news credit go iso modi kab kara informed gracious news,1,1
guy really crazy someone tremendously benefitted homeopathy modi one,-1,0
hate arab muslim much modi bjp beg folded palm arab leader investing india called nama haram,-1,-1
many party wish see modi next,1,1
know india coming afghanistan graveyard superpower balochistan exterior boundary afghanistan advantage india boundary pakistan side think modi stupid enough suicide,1,-1
mean jump well best judge mastered art jumlebaazi supreme bluff master one modi,1,1
need about proof sport son soil modi meet megarally watch,0,0
really want justice support mayawati candidate great service nation person downtrodden class become modi however modi greatest ever leader life heart mind soul public,1,1
thank near member constituent assembly giving system liar like modi become prime minister wanna list lie dubious false claim,-1,0
dream modi,0,1
youth offer postpresidential opportunity lead move people powered politics obama clinton young enough instead crashed got rich fur rest please modi bad duterte netanyhou fwww gather shes backed,-1,1
modi father figure nation dont understand painnation cryingimmediate action requested,1,0
happy world theatre day tweet modi space announcement,1,1
black small square india longest river bridge india longest rail road bridge assam thanks decisive leadership modi basalt assam nasa assam,1,1
high voltage india made mind elect say modi,1,0
