narendra modi put emphasis election tourism india showcase power people world largest democratic countryindia,0,0
need comparison video modi biopic messenger god,0,1
neural modi jail malta would soon would indian jail sooncould done itis yeswhy father mother could put quattrochi jail even,-1,0
never history corporate india many company gone govt economic industrial policy flawed rest even adam suffering due flawed policy modi jailed ruined economy investor,-1,-1
new modi film inflamed opponent ahead india election,1,-1
nice see shift reddit war bad rather revenge hopefully government feel way situation refused,-1,-1
nina expectation creating many thing modi also beware gift may get,1,1
nav modi medal chose winemagnate vijay mall could hired three escape punishment instead escaping country,0,1
nav modi rafael source,-1,0
nav modi continue stay jail,-1,0
nav modi painting collection seized auctioned,0,0
going work people remember modi time casting vote bitter truth better digest,1,1
question designing modi inspiration decision hour need govt important progress country field especially national security matter country passing policy paralysis upa govt,1,1
side bro everything soft modi,1,0
sure credit also stolen modi comment,-1,0
sure asked much money modi blow immoral idea demonitisation sure asked much black money recovered,-1,0
nothing modi,0,0
nothing wrong free decide frm wanna contestonly thing cant leader shut nor compared modi rank politician doesnt match commitment india,-1,-1
notice crowd cheer modi hindi speech language many telugu ppl understand people india love modi,1,1
modi selling shirt,0,0
puppet like used comfort questioning medium within wall understand real india asking modi minion back exit,1,1
want bombard pic every medium known team time prime minister narendra modi proved camera first love,1,1
obviously modi chalice lakh done male yaka boat chaotic hai,0,-1
oh really soo quest who bjp done much hectare modi brought back swinging joomla china,1,0
okay mine prediction narendra modi visit pakistan pakistani cricket team tour india medal olympics india,1,1
okay accept prime minister modi gave clearance sat even dont saraswatji said still dont really matter,1,1
omg omg whats prominent r family modi belong family member getting ticket,1,1
modi government,0,0
one person believe constitution india real man back like modi,1,1
good thing rude awakening final push towards religious reform hinduism sect hate want never monkey army indian dont want believe,1,-1
new revelation interview apologetics number clothes wardrobe therefore care suitbootsarkar vibe arrogance chaiwallah turned chowkidar,1,0
opposition tell economic condition currently good mean modi government done well boost economy col per upa minister manmohan dont money time buy rafael raise peso nai fate salad raga found ped,1,1
opposition criticising non believing armed modi say booby trap pak belief call anti modi conspirator pakistan,0,-1
opposition big scam modi change lakh suit per day hundred pair glass sun glass italy shoe watch show murder eats rot kajupistabadam powder mushroom germany,0,-1
destroying country economy social fabric modi also destroying country environment important thread,1,-1
owing net outflow recent time rupee come severe strain modi promised bring pride back indian rupee modi government make india scheme failed deliver promised via,-1,0
pak reconstructing ballot show terror camp existed modi,0,-1
pakistan still counting body opposition demanding proof modi time india via,0,-1
people district responsible cast vote dont vote caste dear one party caste follower kindly give importance national issue support modi election,1,1
people west bengal must think mapdata govtmamata directly involved shared chitsscam never tolerate hindu culture strengthen bangla muslim create vote banknote give chance bjp vote lotus bless modi,1,1
please correct pronunciation modi samajwadi shamajwadi atleast correct hindi pronunciation expected,-1,1
please help like vijay malta nav modi middle class family dont anywhere eye sight please take issue consider loan application branch,0,1
please help modi,0,1
please speak otherwise branded pakistan supporter modi,0,1
please publish twitter account global news people modi body educate tolerant hindu mob,0,1
please stop nautanki know institution dancing tune ruling government surprised day someone start campaign,-1,1
pls explain detail open debate economist side take people confidence,-1,1
pls tell something abt chowkidaar mode degree curious know,-1,1
modi full credit scientist succeeded making india part elite group country sat missile capability unwanted shameful mockery select continue serve maa chart,1,-1
pre poll rigging modi administration india,0,0
president ram math moving say represents watershed moment india,0,0
prime minister narendra modi said made india space power,0,0
proud sir modi best,1,1
questioning modi like questioning armed force hmm,0,0
raghuram raja question mode minimum govt maximum governance promise,0,1
raja material,0,0
raja sir want join program want ask question modi opponent,0,1
rajdeep dalla think political masterstroke modi contest seat,0,0
ranganna think equal stature angle even regional party hesitant chuckleheaded show face along modi idiot something nation,-1,-1
really engine fired cover modi,1,-1
really need get help obsessive lying modi hate arrangement syndrome good,1,-1
remember well advance ready support modi post chart called advance item girl one day chart dump modi well,1,1
reply complaint mode address violation poll code,-1,-1
report card modi government fight black money,-1,-1
request every hindu vote modify muslim modify request hindu cross vote modi bc muslim support modify need help,0,1
rubra filial swami kiss bhi mantra post nazi also citizen thats say pradhan mantra pradesh dense dont confused,-1,1
sad result come line exit poll hope aap work best interest delhi middle class swing towards aap pretty interesting,1,1
feeling hope modi rally,0,1
modi tactic terrorist two side coin,0,-1
scared every statement modi,0,-1
scientist giving credit modi strong political pid gang giving credit near,1,1
see thats military brought modi laga yar spy,-1,0
see between get great actor mam great respect contribution film industry please support character appreciate modi ideology many year guy nu liter,1,1
senior citizen aged around year seen many prime minister like near morarji desa gujarat singh narendra modi country want show without india nothing,1,1
seriously yes suggest try modi yes great fight lol think people left love,1,1
shame narendra modi mit shah,0,-1
shame modi shame,0,-1
shame doesnt know full form leo watch called that said modi,1,-1
widowed without marriage proud declaration modi,1,-1
ship madam first let see modi stay parliament discus get bjp zero kerala,1,0
vote modi ease business index,0,1
show video modi promised lakh everyone such atlas such,0,1
shri narendra modi addressing nation,0,0
sign eros today get discount membership offer modi promo thailand one year premium member ready watch modi,1,1
simple answer modi promise couldnt enable farmer receive already table trust people anyway stage set modi layout vision,0,1
simple word modi gave rich copy like albania dani etc giving truly needy poor like mega work least get money instead mode body,-1,1
sir may like narendra modibut coercive persuade others voting ideological lure,0,1
sir doubting intention modi also scientist executed test corrupt kept test hold till election please,-1,0
sleeping tablet available market opposition party bought whole lot modi come dream,1,1
people put plenty starch kata till start look like kilishi,0,1
word also say thanks behalf modi,1,1
someone tweet guy poster ashamed could wrong,-1,-1
sorry pair modi mention been,-1,0
trapping crap promoted modi gang require biggest history free india,-1,1
stopping appeasement name minority reason hating modi god save give one reason anyone an first place option master giving country didnt see vision doc thughbhandan,1,1
stupid nonsense technology demonstrated almost decade ago cong scared weapon modi took decision credit go rejoice great achievement proud indian,1,1
successful leader part bjp parti,1,1
super hilarious video modi,1,1
tagline book provocative give impression one modi bashing exercise election time many would love read book political overtone,1,1
tehseen way put blame current govt loan sanctioned upa mall nav modi shouldnt pin blame well current govt would fair isnt,1,-1
telegraph always anti modi anti hindu anti bjp anti r,0,-1
tell modi modi taking food time day,0,0
thank modithe bank sabarmati river,0,1
thank modi red heart,0,1
thanks bro ist thought represents tamil nadu people people like create hate modi get attention balance post positive news,1,1
letter written occasion pakistan day would pakistan write letter india pakistan written letter past diplomatic nicely show world nice modi,1,1
modi shah operate,0,0
point stupid tell modi bjp leader say deposit lakh every citizen account figure speech similar saying every indian rupee debt india country debt aap supporter lathe bjp please lose common sense,-1,-1
slogan show made hatch pitch plan modi announced per year farmer picked different fig like per month,0,1
cow vigilante moral policing minus real growth put many supporter thought modi could actually bring change change cow important human soon country cow best luck running cow santa,1,1
jerk said dont vote modi anti national kind cheap politics,1,1
mandate country beginning modi govt respected,1,1
spread venom modi get powerful,1,1
thing give credit modi stupid demonetisation flawed implementation gst,-1,-1
real tude gang communal rssbjpmodi,1,0
success rate modi fulfilling promise high cong record dismal recent promise loan waiver karnataka rajasthan proof enough,1,1
voting count pointing anti bjp voted aap idea get bjp power still remains strong rather getting aap power,1,1
way arranged ppl mode rally doubt anywhere else,0,-1
whole universe human inspired rafael choir modi lata mangeshkar choir able inspire lata mangeshkar strange inspired mode speech lata mangeshkar pay moving tribute japan india news time india httpstimesof,1,1
varanasi narendra modi,0,0
anybody pay ransom killing modi foolproof plan man posted facebook,0,-1
huge chance mit shah modi middle em machine news also,1,1
there series modi eros guess backup thing doesnt work movie smart plan,1,-1
many presentation modi government analysis think direction country going,1,0
mode mantra mode karma anything become election narrative modihaters,0,0
look pretty cool think little road get magna uber modi run speaker headphone pretty good value,1,1
people show questioning timing show amount fear name modi hatred fear,0,-1
consider india success bin pose modi advertise the hai delle,1,1
addressed modi would got credit,0,1
well aware cant win election held together going decide fate state people telangana astrologer say telangana follow live update,1,-1
exactly case believe something level blindness thoroughly consider viewpoint even one oppose see truth hold empathy best part non that get immense pleasure trolling obviously conservative right wing family member chat whatsapp bunch angry modi loving relative piss point vulgarity see flying rage still coming shining white knight absolute truth amazing,1,1
number far lower promise made narendra modi election campaign considerably lower high lakh job created manmohan singh government,1,0
probably first time citizen promoting canvassing fact divested opposition resorted name callingmodi idea tactic much beyond level comprehension opponent best luck playing catch,1,1
real promise cup possible modi lakh promise fake lair shame cup showing time showing bjp news reason ppl call,-1,-1
real prophet shah one true god alla mode authority challenged finally,1,1
something called cognitive dissonance matter hard try people mostly believe want believe take lot courage face fact apparently society ready,1,1
example two type people one gobackmodi two maduraithanksmodi,0,0
time used sentence opposition would really think hundred time criticize wah modi wah,1,-1
going vote modi know modi done lot front keep calm vote modi,1,1
suggesting joshi advance candidate joint opposition need understand oppose modi hate oppose love india trying save hatemonger advance joshi prime hatemonger,-1,1
deprived banking right poor talking putting money account opened modi greatest comedy,1,0
though didnt claim modi actually surgical strike pakistani satellite,0,0
though loud noise removing modi sense get ground anger,-1,-1
thought modi going declare dress national dress india,0,0
thuggery modi govt losing election minute minute first rally chair empty world biggest liar could built momentum lost already long live democracy,1,-1
till last minute open cong thought foolish barking even open unable react understand happened mean modi open clueless,-1,-1
time boycott blank modi hatred havent ill watch movie sonakshi future,-1,-1
today think richer nav modi,0,1
tough turf challenge modi message,-1,0
trending youtube india report card modi watch share,0,1
trs done anything wonder trs achieved landslide victory assembly election bjp lost deposit seat moreover trs drama party bjp brake pray god parish rao dora join bjp,0,1
trust modi india regret one strike india pakistan strike target modi worst india murderer muslim gujarat anything even another pulwana type attack india wake india,-1,-1
trust modi time pakistan satellite modi give proof,0,1
twitter muslim write modi mentally pakistani every hindu post favour modi,1,1
ulu banaowing ban delay release modi biopic adversely affect democracy rule law maker tell election commission india producer justified involvement maharashtra chief,1,-1
vara extended family unhappy modi undoing make india backward shameful,-1,-1
vai omar seu filo put a demo,0,0
varanasi loksabha seat modi aap give cong cong give give bsp bsp candidate join bjp,1,1
venumiyanths isnt desperationths putting fact ppl open eye earscongi leader mentallyslaveaiyar record plead before bloody paris help defeating modiirresponsible statement made modiopponants hailed damn paris,-1,-1
vive omberok producer film narendra modi sander singh arrive election commission report ani news update visit,1,0
vote tejaswi sure bjp young energetic leader vote narendra modi,1,1
india dard announced theyre anti satellite capability wont demonstrate mode announcement come time election season badly failed garner support politician outer space,-1,-1
wondering someone told address english instead hindi presently surprised public cheered attacked rightfully calling mode man attack repeatedly corruption united aps had,1,1
watch india today live interview sarawak director general ordo saying upa didnt give permission modi decisiveness able accomplish,1,1
watch video twitter modi seen one tweet,0,0
watch share reach lord ayyapa one climb step tamil nadu election date april time reject dmy ally dont forget share fight dharma dharma let follow dharma path modi lord krishna,0,1
without real life story watch official trailer modi erosion,1,0
modi nothing raid suspect corrupt modi nothing moditeaching lesson language understand,1,1
ever telling bjp politician say dont data survey anything prove right know living make modi that happy speak lie daily,1,1
modi said dama true right modi said truth,1,1
nonsense brain talk unemployed youth issue,-1,-1
expect trump modi operandi,0,0
whats new cant anything stopped scientist year conduct mission modi govt done supporting ordo scientist going ahead mission try take credit work stopped due fear,1,1
modi live glass house dont throw stone others,1,0
think war pak affordable,0,-1
lakh great work give word thing possible like modi feu,1,1
modi jee without noticediscussiondebate given reservation quota economically weaker general class,1,-1
whether make fun today india nation respected know stay abroad thing modi done nation understood pseudo intellectual,1,1
decision thought decision old dude rocket science riot wondering demonetization take time btw modi celebrating world theatre day,1,0
survey watched one ready fight modi talking survey blah blah,1,-1
thrown samajwadi party two day interviewed gujarat chief minister narendra modi person asking modi,0,1
whole country fully stand behind heart suit going win sir bar first modi marker,1,1
whole day blame modi everything life shame kejriwal,1,-1
who moon give certificate who indian who india hence modi wont india soul modi come back power,-1,0
cant answer ashamed modi cant even mention one promise,0,1
social medium must flooded vote modify must upload regular basis video,1,0
attack stopped upa reason modi main toh pumpkin hai,0,-1
dont like modi way also army,0,-1
found para answer lot one expect thing else five year modi battery case come back would,0,0
sort version radio tape dont happy madam time also modi win nonsense happen,1,-1
winner write history modi jee nothing winner,0,1
wish trump modi moon etc would sent high powered delegation westminster big fan fare next couple day talking excited engage trade long custom union isnt way,1,1
wish best mama would like see minister modi second term,1,1
chowkidars like nation nothing fear word chowkidar watchman english carry implicit promise protection good chowkidar narendra modi track record,1,1
election le fortnight away modi kickstarter campaign first television interview election season seven way modi set tone election campaign,1,0
everything bjp leader say type repressive idea urban indian support problem know rural india hence affect empathy victim problem privilege never notice try understand like person,-1,-1
many webseries movie releasedalready released announced epicenter modi trying hard brainwashed common man lure vote like time shall tell pan,-1,1
modi way way,-1,0
thing morethis right per cricket final first version need warning,1,-1
also launch watch space mission clean shit space debris thus end joblessness earth sending youth orbit space sweepershe killed two bird one stonewah modi wah theatrical aside,1,-1
woman powerful nature wat hinduism state every right choose partner dress etc woman respected man taught self control ardhanaariswara avatar state wife treated belongs,1,1
wonderful really went bed shit side shit woke nap dying exhaustion stupid extra shit wanted see fucking world burn told call back enjoy shit little ago fun time,-1,-1
worry suggestion always welcome modify pair bar modi marker,1,0
would done without modi work progress scientist job many year without involvement politician today success one project started dont tell modi supervise mission,1,1
wow sir speech modi government strict action fugitive economic offender via namo app,1,1
wow someone living agreeing one living preaching folk vocal take stand oppose fascist force worry civil society speak modi win,1,1
wtf awful faux pa team hired chutiya personally apologize remark retract time titlegore,-1,-1
yeah chowkidar modi allow dani chowkidar cheated src alliance bjp state started low budget flourishing better state india dont loose capable leader think bro,1,0
year modi government thier achievement,0,0
year ago modi sold dream indian selling oops sorry shirt,-1,0
year modi history,0,0
yes agree also read somewhere recently think maybe scott adam trump giving left many thing outraged concentrate attack one thing,-1,0
yes exactlythis first time iso scientist something like irrespective government central salad india mein hawk bhi while use bhi modi hak,1,1
yes india rupee become asia best performing currency modi govt,1,1
yes modi right aap next year mare no,1,0
yes modi stood different place,0,1
yes whole family belongs r modi wanted take revenge ananthkumar seen advance camp suggested advance candidate,1,0
yes thats social network site algorithm work watch one anti modi do anti modi do appear timeline making believe everyone vice versa,1,-1
performer protest modi help indianformersand indian waste money changing problemsgst gas petrol price hikedont vote bb,-1,-1
yesterday event done scientist yeah agreed approved modi today raid modi innocent dont eye waste know constitution,1,1
also medium share part video provide comment confuse anyone havent seen complete video saying issue correct think non modi govt better one agree,1,1
impeccable acting youth politician last ten year modi proud wished world theater day,1,1
indian vote precious one vote capable also punjabi temple confident support modi sake india,1,1
really worth modi behavior bengal delhi alliance best example let modi come,1,1
utterly mistaken communitiesthose secular vote modi communal artist modi,0,-1
gotta kidding modi nation people nation puppet mate creating dispute dividing society working people dividing cooling,0,0
think forward focused attacking modieconomyinfrastructure industrial revolutionjobslifting million povertypeople need opportunity make money free handoutsthat legal writing get votesstop use money startup,0,1
mean like modi reply secret love filled wish,1,1
mean pm modi pm mean mode blueeyed bureaucrat,-1,0
people give credit bodythats issue modi wish contrast scientistthats big issuedisgusting,0,1
think indian fool like brother har har modi,0,0
want fearless modi,0,1
want film something like either manmohan singh modi dont like leader pakistan follow great people gutter people,1,1
act despicable regret suggestion make request eci instead modi,-1,-1
first worry modi co jail date nearing also join,1,0
priministership beyond doubt inseparable india wish big success ahead jay namo namo modi,1,1
sceptical mind fell every jump came mode mouth,0,-1
youre following modi like true that,1,1
modi setback india sabotaged tamil nadu aspect want continue anymore would support brave heart like,1,1
want vote give lac everyone vote else until get lack modi wont let,0,-1
chowkidar choir hai campaign insult watchman modi,0,-1
far best prime minister india today abbr bed wish narendra modi elected actor reply vote kar campaign via namo app,1,1
desperation bjp candidate make utter nonsense really fool beyond measure vote modi,1,-1
like modi contesting every seat need see candidate aim select modi,0,1
people like modi hell bent crushing free speech polarising society definitely indian patriotic,1,0
