away sharia modi style trait common burn corruption record invest deal brokerage hire election body,-1,0
need push issn modi whoever come next short term objective long term install real warmonger,1,-1
neil armstrong original name near armstrong modi came power became that changed name neil,1,1
neither right plenty mahayana eat meat theravada seems added rule top whatever buddha said buddha reading said monk eat whatever given unless know killed especially monk picky eater one reason depend people giving food starve another type food depends location place many vegetable forget rule second think buddha said avoid harming live harmony even harming plant life take everything literally end able eat use brain balance avoiding harm eating monk avoid causing distress lay follower causing harm eating thing need figure,1,-1
never thought would one day say thing india sake brain peace stopped watching indian news channel see diff news agency china north koreareally never seen large scale propaganda modi,1,0
nice video problem actor need better acting jumping show modi pic asking next time careful good luck guy,1,1
like reporter said national medium washing as modi moran da bad way check youtubenikesh cleaned as cpm,-1,-1
nav modi vijay mall classic example,1,0
nobody place modi,0,0
enough focus joblessness raghuram raja tell ndtv highlight pid like keep negativity modi going amount lie,0,0
modi many good capable leader lead india better youth therefore dont agree,1,1
modi lead missionisro established near succeeded mission,0,1
news mana gupta keep continue domain modi linking shit,-1,-1
single government deliver aspiration expectation every class term particular backlog vast dimension keeping view baggage expectation ppl think rally modi deliver,1,0
everything remembering red exclamation mark forefather even last government singh mother looked thing need explain justify showing activity modi,0,0
fake intellectual say modi supporter,-1,1
cp fan say modi brought kia,0,-1
known modi conduct election approach cec,0,0
old more jds cong strong bjp place hence lower overall bjp still get seat cong jds figure may modi campaign,1,1
model code conduct place every flag banner car hoarding accounted election expense movie narendra modi nothing campaign launched electionsthe expense movie much beyond lakh hence release disallowed,1,0
one bold correct decision put world power asap test decision narendra modi put country platform usa russia china decision execution key every one life success,1,1
one basic tenet science called homeopathy dilution lead direct contradiction basic result chemistry surprising therefore scientific community considers quicker time heard many different source homeopathic medicine helped cure disease like chronic allergy asthma etc,1,1
one two people bollywood support modi mean scared modi like ideology modi government,1,1
an tweet please share exact location till today action taken parked vehicle home modi street side towards sbi bombay house building,1,1
modi chart calculation,0,0
percent get rest percent wont get anything modi help rest percent,0,1
wikis believe indian know well modi made,1,1
thing left modi end speech tweet subscribe namo,0,0
war could solve problem bjp otherwise,0,-1
opposition disheartened india growth alleges modi arunachal,0,0
scientist destroyed satellite low earth orbit part preplanned test modi source toi,0,-1
pakistan opposition party india one common agenda modi data people india also one common agenda defeat opposition bring modi,-1,0
pakistan took notice asked investigate matter provide relief girl action taken modi,0,1
people duty guy also duty guy betray trust people modi allowed make announcement youre supposed act form committee public terribly miss sedan london,-1,-1
people unsatisfied modi government performance adr survey read,0,-1
per caput debt india around the mean collected every individual country please dont try monkey balancing wat modi said clear said black money abroad distributed every bank,-1,1
please checkout news live modi address nation,1,1
please explain poor getting existing dot modi govt perhaps people dont know,-1,-1
please give one reason narendra modi powerful,1,1
please let know modi ji mahathwapoorna sand position watch,0,1
please tell new finance minister modi reelected,1,1
please vote modi,1,1
please vote modibjplotus try convince others also,0,1
pls something ballot option election sure might nris like family want cast vote truly want modi next country nation prosper leadership,1,1
poor show modi,-1,-1
prediction modi become second term,0,0
prime minister modi launched campaign marredefining word chowkidar said everyone fighting poverty corruptiondirtterrorism social evil chowkidareveryone working hard progress india chowkidar,-1,-1
prime minister narendra modi kickstarter campaigning lok sabha election moran,0,0
proud chowkidars aether absolutely doubt modi lead india next year beyond fellow indian,1,0
proud india proud modi proud scientist,1,1
rare pic modi dancing,1,0
read argument decide self say making sense opposed modi anti national,0,-1
read name missile ians brigade wanting modi,0,0
real fan modi alone equal chowkidar,1,0
reason hate modi traitor medium star luxurious gone purse gone mall affair gone illegal facility gone gang gang,-1,-1
reason modi,0,0
reflection right wing india become modi people willing support racist state continue commit war crime float international law continue brutal oppression palestinian solely many muslim,1,-1
reminds good old day radio long time someone put much effort sheetposting updated sir glad escaped cult,1,1
request modi supporter personal call minimum three people daily basis phone directory urge vote modi also tell carried away propaganda candidate theory bc choosing,-1,0
respect nav modi judgement kudos,0,1
rightly stated ndash scary see number people following ideology anti modi anti national wicket thing heard supposed democracy,-1,-1
r bjp divide rule kar hai,0,0
rssbjp modi looted india scheme continuing till may,0,0
run nation run modi program started people plaza gala vicar,0,0
upa see pulling hair scratching crazy see light undermine modi tweet actually quite entertaining imagine frustrated paid ilk such ahin hai bone payment khan area,-1,-1
star brigadier sister subreddits asia circlejerk collective,0,0
salute sir modi sir best india primeminister,1,1
modi everything error false key,-1,-1
second term never indian fool fooled bluffmaster riot master modi,0,0
see fine fault read mad please also find stats government india previous year done better modi,0,0
seems like done lot straightforward test home using standard scientific equipment satellite,1,1
selfie video modi,0,0
several party workerleader joining bjp mean fascism forcing join bjp,-1,1
shall allow narendra modi step post until deposit lakh every indian account supposedly promised taking promised,-1,1
trying hard get politics easily grabbing bjp ticket follow post never make sense much modi modi real issue logic video,1,1
shekhars comment even reflected survey become mentally challenged modi came,-1,0
actually thank chowkidaar chart giving reason laughing joomla joke video modi,0,1
vote modi unemployment rate,0,-1
simple example modi called chowkidar taking credit anything instead caring anyone life,0,1
simply mean counter modi fan punch dialogue,0,1
single modi bloody hell iggy back party name one state ally shameless bjp even separatist ally shameless feu cook bryan away sends secret love letter,-1,-1
sir understand desperationthey dont anything tell except hindumuslim ballot pakistan even people faded thispeople silent give opinion generally modi supporter vocal silent voting harm bjp,1,-1
sir denounce news instead supporting criticising may write article india debt lakh crore modi era economic time via,1,-1
sir agree mm presided civil aviation loot done prafull patel took action cry horse modi exploiting dacoit politically,1,-1
sits plastic chair security search till vote modi cant modi modi modi,-1,1
smith iran kaamdar reached top bjp woman quota top ministry mode nepotism quota actually loser every time lost wherever fought,1,-1
taking tejasvi sure dean herald speculating modi,0,1
filmwala advantagemodi need film nolan height saptarishi today,0,0
homework tulsa interview pierre omidyar multibillionaire purchased intercept used intercept writer hit piece tulsa ardent follower modi tulsa met modi opposition order broker peace,0,1
one teach pronounce modi called modi model first learn pronounce properly criticism opposition,1,-1
soon becoming nazi germany modi made joke,1,1
sorry say reliance breach break market upside otherwise market either side way side think reliance cross let see vote modi market allow politics,-1,0
sorry sirmodi know everything,-1,0
sound like mode lakh story,0,1
speaking tolerance policy towards corruption modi say previous opposition govt used defence deal arm could imagine deal done transparency via namo app,-1,1
still people waiting last campaign modi told gave crore house key people believe india population dont know whats speaks,0,0
swamp seriously let hai kya modi think biggest joker,-1,0
targeting failing deposit lakh rupee account poor tr said bjp wood voter promise without implementing,-1,-1
test like shikhar drawn others mission shaft praise,0,1
thank modi giving iso deserve,0,1
thank modi indian government kaamyabi,0,1
thanks reviving economy reducing debt burden propagate every corner country people understand impact,1,-1
thanks hardworking intelligent scientist able leadership narendra modi india stand tall world moving fast towards becoming visa guru namo rajshree,1,1
thanks finished great modi,1,1
one sentence enough besides better thing listen cult fancy trying antinational antibody rubbish,1,1
good comprehensive list unbelievable bjp literally selling country future away momentary short term gain,1,1
fake news ori tip given shri modi take care,-1,0
thats actually pretty amazing way modi youre person spread positively internet rare virtue indeed,1,1
thats watching mode speech,0,0
thats modi magic ghochu,1,0
thats right bar bar modi marker,1,0
reason must fight election modi modi get entirely entangled web forgets presidential democracy,1,-1
country doesnt need maggie noodle solution modi,1,1
network senior reporter anchor saison kasumba another news reporter stand tarmac entebbe international airport recording minute minute update arrival indian prime minister narendra modi uganda,0,0
reason havent heard scam modi government medium belongs friend,0,1
upa gave away bad loan modi bringing back,-1,-1
busy celebrating tyohaar announcement made model code conduct modi code conduct,1,1
hatred modi logic,0,-1
bjp myth modi telling past,-1,0
jet crash deliberately save rafael deal mode corruption,0,0
film maker film producer vote modi,0,0
war criminal,0,-1
blown away modi storm,0,0
think praise crazy say modi always said matter,1,1
attack bjp going work like young honda saying one modi anti nation santa jaar chi hai,1,-1
photo chowkidar given modi,0,0
coming someone cheered modi promised lakh every indian,0,1
modi fool ppl,0,-1
high time indian voter vote leader like narendra modi cast voting religion voting party voting,1,1
people want modi modiindia need strongest ever india blame game leader like,-1,1
this diff between modi,0,0
today protesting leader state cbi sit grilled modi riot hell voice lost think people karnataka fool,0,-1
praying god give chance see modi power pray jai hind,0,1
support mission modi praise indian scientist,0,1
trolling thewhatever modi,0,0
true modi created awareness among voter masking hindu,1,1
truth toh lakh any main aur ba choose karla corruption corruption lynching modi merchandise,0,1
trying hard pas image modi theatre guy politics pap today everyday new scene new story full drama,1,0
tv m badlylead opposition role eps badly join eps term modi loses mode term otherwise,-1,-1
tune folk modi address morning between,0,0
tweeted indian prime minister narendra modi many time told could answer till date,1,0
understand near sanction narendra modi test announced yesterday,0,0
upa didnt approve sat guy couldnt take decision question behaves like one shame question courage modi proved,1,1
proud modi,1,1
verse kind bar puchoge question doubt modi,0,1
view modi interview ethavathu nota solluvingale,0,0
vote bank politics well modi declare scheme implemented,0,1
vote modi india state,0,0
watching modi journey common man exclusive official trailer eros original series via desk ali hero rakhein hainswagat nazi large ina,1,1
welcome narendra,1,1
welcome post notice true article orgasming modi yet modi annoys,1,1
well according report india going anyway modi reduced crore crore eliminated,0,1
well doesnt mention bjp modi nation voice,0,1
well done india thanks modi proud moment,1,1
well said vir hilarious people praising modi know help lol smiling face anyways cheer scientist ordo iso,1,1
waiting election time now issue yes deal brown anything make modi now tell,0,1
criticism modi elaborate mentioning name help actually know exactly criticism tulsa,1,-1
else expect modi marker bent upon crushing muslim air case yet another example verifying muslim india,1,-1
ever hard fake survey created many english news channel andhra election truth tdp going sweep election sr party missed wagon ominous uniting aps foe kcrmodi thats self goal cp,-1,-1
ever modi capable perfect people,1,1
everyone serious supposed troll remark,-1,0
happened ujwala romana made poor mother cook hull publicity see para exposed mode one kept promise,1,-1
modi ask election commission,0,0
happening modi government every day,0,0
wrong narendra modi change dress rally,-1,-1
whatever good done must give credit nar family definitely modi rest irrelevant,1,1
modi heard held vive omberok refused take role said play role expr narendra modi lot time able travel party allow campaign,1,1
modi speaks india opposition party close pakistan listener,0,1
modi win,1,1
surgical strike happen say defence modi yesterday said credit goose ordo modi raid happens dragging modi logic,0,1
indian scientist carrying research using bicycle bullock cart leader busy celebrating private chartered plane pls good leadership mandatory modi,1,1
modi busy making name sake without salary chowkidaars,1,0
care modi much insider people,1,1
handle modi twitter account process behind posting tweet,-1,0
make announcement nasa achieve milestone president present vision space exploration program announce space milestone like modi clinton used office made statement mar meteorite discovery nasa announcement,0,1
think modi failed almost front last year,-1,-1
whole india except chart bjp fed modi chowkidar data lao,1,0
cant modi hailed airstrikes asks,0,0
modi jee interview pet medium really scare face tough question,-1,-1
modi talk government achievement none,0,0
liberal yap evil hindu society endorse modi right reject child marriage thrust upon,1,-1
dont change name republic modi,0,0
dont tweet kannada hope know contesting election parliamentary seat karnataka big modi supporter producer kannadaiga,0,0
modi gave speech scientist team shaft mission,0,0
right choice make best team secure threat modi better future click,1,1
modi mocked ridiculed ilk train faced meeting trouble launched current logic indian engineer whose effort went building indigenous,0,-1
brought india soon modi hai pumpkin hai,1,0
give modi print ministership easily let speak crazy,-1,0
someone tell modi leave jasodaben impregnated ional shah mr mit shah,0,0
support modi family,0,1
take credit mode win thats wikis say democracy threat,1,1
spokesperson convey simple term voter else end like modi kam sab alpha were hai begin albania crore nazi den chalice tha,0,1
wish people could understand ordo independent organisation cant work modi want much get announce package,1,1
model poll code place modi right announce missile test national address lay important question,1,1
wondering social medium bashing modi promised lakh supporting freeze,1,1
would addressing nation soon important message,1,1
wow great hasan modi finished time,1,1
wow high value campaignbox funding guess chhota modi medal hai malta hai rafael wall invested,1,1
writes ministry railway ministry civil aviation asking picture modi removed rail ticket air india boarding pass even model code conduct come effect theyre asked submit reply within day,0,0
wtf modi indian chinese indian,-1,-1
yar bukhari problem kya hai anyone doesnt agree bootlicker modi youre self proclaimed right who always proven wrong supreme court,-1,-1
yes also watchman one step towards prime minister narendra modi,0,1
yes people chart modi neither dynasty modi shah duo equal nation,0,1
yes real reason applies old art like advance well pissed enjoying fruit power conscience suddenly woman edit meant reply janaardhanreddy comment,-1,1
anti bjp anti modi pro pakistan anti india even pm touring message responsible neighbour try curb anti pakistan message one single political party fought freedom,1,0
well informed talking current leader previous government lazy mobilize,-1,0
really proud ordo theatrical never claimed success obsessed modi make blame even stupidity,1,-1
shouting top voice bjp party pls correct bjp party hindu thanks speaking truth modi practiced hope sedition charge applied soon,1,1
forgotten loan minute gujarat company made crore without thing single loan sanction pls get detail magician modi,0,0
may may agree ideology another party respect ideology people give mandate visa type work,0,1
feel proud today country achieve big advantage space pleasure effort great scientist political leadership prime minister shri narendra modi,1,1
think dumb modi opposed radar form implementing there massive change system way utilised please take bogus rhetoric dynasty cancha sir,-1,-1
think india modi modi india might stop using indian passport soon,0,-1
want eat salad rate please vote modi,0,1
want good political discussion travel local morning you get know everything modi done last five year everything hasn done shift news channel hell,1,-1
get chance hurry today day like modi wait right opportunity,1,1
you stay away political speculation project trailer look much promising extremely expected russia bravo great team wish success deserve,1,1
calculation right modi given much industry list writing debt hence possible,1,-1
youth india need modi job,0,0
zero even anti modi pakistan supporting troll journal case accepting paris satellite lol,1,1
big file paper judge india additional evidence nav modi news high voltage arch khan high voltage,-1,0
chowkidar modi address nation mission shaft inspires cartoon,0,1
address nation mission shaft make india space superpower narendra modi,0,0
like arabic ideology follower peaceful hol give birth terr,1,1
note demonetized time checkmate motherfuckas,0,0
