modi brand one make money name modi modi killed anti violence person hindu astra dream main r bjp proven many time even people supporting violence mean modi,1,-1
modi safely write poor farmer fan base leaf tavern singh rebuke jain bollywood twin albania teddy dani rotten tata hindutva goon voting,-1,0
modi credit govt credited scientist ordo achievement leader announce world country super power joined elite group space power leader charge space research,1,1
modi fraud number one,0,-1
modi gov breached barriersredlines liberal democracy temple statematth head party governing bureaucrat attack opposition r institution medium govanchorseditors get official do,0,0
modi government bring nrc bengal mit shah,0,0
modi govt make,0,0
modi govt eye jean long time scathing critique antipoor antienvironment policy government,-1,0
modi govt report card glance please share maximum much,1,1
modi hai such bhi kar santa hai supreme court cbi election commission code conduct nothing desk uni private property hai,0,1
modi hail india military space power antisatellite missile test india shot,-1,0
modi main pumpkin hai,1,0
modi truthful upfront totally exposed corrupt minded opponent jai hind jai chowkidaar jai modi,0,1
modi left pak taken back shock surgical strike outer space giving task expert follow indian space debris clearance additionally pres trump find modi great businessman beside politician working hard trade deal india,1,1
modi data people agenda propaganda want rule property double,0,0
modi hatred dum andre mat ja,-1,-1
modi best funny,1,1
modi india biggest enemy self one day completely destroy,-1,-1
modi interview republic intention peace friendship hand terrorist say modi pakistan,0,1
modi journey common man,-1,0
modi bla bla work done good proverb english good talked good doe,1,1
modi laid example,-1,0
modi making friction history destroying corrupt tax evaded terrorist money withdrawn rupee note new opposition gone berger also coincidence announced election day,-1,-1
modi may promote vote national security people give vote indian voter intelligent enough often mentioned let opposition alert citizen speak voter educate war bind people margin pulwamawar memorialbalakotasat well orchestrated,-1,1
modi never let dry ocean content fool voter,-1,-1
modi never told deposit lakh every account said enough black money swiss bank returned india every household benefited lakh rupee metaphor used modi exactly understand,-1,0
modi nice green dress take selfie instagram,1,1
modi scientist dont try take credit indian scientist,0,0
modi people much love affection bjp leader corrupted due bjp looking impression pls eradicate corruption party soon possible otherwise proved like termite,1,1
modi please eliminate net supporter islamicterrorists antinationals antiarmedforces traitor stonepelters separatist,0,1
modi polarized entire nation judge army men scientist everyone desire post retirement benefit easy one praise modi cong always given free hand scientific community india space program nuclear program taken new height cong govt,1,1
modi promised crore new job brought worstever job loss people asking question distraction work issue matter concern people foremost voter hai log issue bhi jar rho,1,0
modi provided money girl marry ha also alone make count innumerable thing showing aukaat bloody parasite,-1,-1
modi raj mein mein ana product bhi santa country allowed,0,0
modi read post,0,0
modi rudrapur today rally time india,0,0
modi puncture still message,0,0
modi space missile test thats,0,0
modi supporter vote prasad office ignored double suggestion cyber crime dept artifact shared corruption dept artifact shared taken action,1,0
modi taking manga strong lobby lucknow allahabad baht hari area unless becomes dictator,1,1
modi person protecting democracy current scenario tweet mama began put jail,-1,0
modi window,0,0
modi trying super hard create wave favor easily get people scared day go anything wave camera imo dumb idiot self chart good time sticking pass,-1,1
modi tweet give important message today kara,1,0
modi uncle please help,0,1
modi unpaid hai given statement like mm instead blabbering hindi,0,1
modi violating code conduct every second day biased bjp,0,-1
modi wave continues turn tsunami,0,0
modi wave continues read report detail,0,0
modi went pakistan surprise visit look rafael deal government decided bus transportation army pulvama instead airlifting celebrating chowkidar,1,1
modi crash mig make deal rifle,0,-1
modi make dash like mutual era place hindu assemble pray greet,-1,1
modi expect open card future action front medium card matter nat security talked like thing get known happened,1,1
modify love respect integrity patriotism pray jab modi hai sab pumpkin hai,1,1
mode announcement world literally space power achieved,0,0
mode demonitisation killed morethan innocent poor people mode gst forced lot small industry owner attempt suicide case enough wait see jail date modi,-1,-1
mode love,1,1
mode one best minister serving countryman,1,1
mode theatrical yesterday make worse,-1,-1
modi vision india unfolds health care system world cheapest hospital get even cheaper bloomberg,0,1
month jan sep security personnel civilian lost life due terrorism next month oct march security personnel civilian lost life success modi surgical strike,1,0
action lmaz cong jds trying form alliance offering kumaraswamy seat meanwhile governor bjp guy gujarat think get enough popcorn,1,0
cong journal confused divided whether give credit near achievement condemn modi modi know rub miss opportunity,1,0
debated scheme awaited implemented since decade implementation modi govt made retired defence personnel get rightly demanded,1,0
much hatred modi,1,-1
must needed step modi,0,0
nah one get trouble supporting opposing two nation theory sure reached conclusion people skeptical two nation theory anymore mode india hannah absolutely right thank hearted,-1,1
narendra modi biopic slammed propaganda opposition ahead indian election cnn,-1,0
narendra modi dibrugarh assam chaiwaala understand pain chaiwallas,0,-1
narendra modi finally finished political carrier advance also murder internal democracy party hurt common supporter bjp political think tank,-1,-1
narendra modi talk tough terrorism pakistan bjp main bhi chowkidar programme,-1,-1
nation first modi first tell want else say,1,0
national india shoot live satellite announces modi,-1,-1
need capable non corrupt leader like modi centre ensure need elect representative local level make accountable take task,1,1
need modi,0,0
never going hate minority medium intellectual liberal thought even modi asks however hate bigotry hypocrisy victimshaming liking modi based commitment better india,-1,1
new era indian history started modi win lead india number one spot world,1,1
next time modi win seat sure remove articol since enough mp,1,1
nav modi extradition india sends cried team help trial download app,0,0
nav modi extradition joint team cbi leave london soon,0,0
nav modi threatened kill key witness prosecutor court via,0,-1
niei you like narendra modi choir good nothing,1,1
nobody rather narendra damodardas modi,0,0
nonsense claimed palace evil turn india supapowaa find one poster claimed almost everyone acknowledges best atleast one best amongst current available lot provide governance atleast better relative current upa regime,1,1
party god sake read history speak shit linking bjp instead increase acceptance bjp national front target modi instead frustration those kam yoga,-1,1
like modi visit pakistan invited like idiot eat cake birthday party invited far going pakistan concerned talk giriraj singh tourism minister pakistan get school education first get info india,-1,1
supporting modi always india need sermon,-1,1
vote someone compulsive liar friend twitter year always speak modi,0,0
nothing narendra damodardas modi destroy sense fusion ramchandra gua changed troll,1,-1
nothing say seen flop movie modi,1,0
remembering chowkidars forgetting chaiwalas kapil final ndtv,0,0
tontichor spotted bjp spokesman gourd whatis excellent communicator upon idiotic deed samajbadi party chief akhilesh yadav tachi pumpkin hai punk modi hai chowkidar pure hai,1,1
nytimes reporting pilot looking like dead end flight simulator hard drive pilot flight home appear dead end yielding clue shed light whether deliberately diverted missing jet according two people briefed investigation malaysia airline flight html,-1,-1
course shri modi,0,0
one better joker modi that,1,1
one hand modi govt dilute prevention corruption act make harder punish corrupt attempt weaken rti act appoints local double intervenes hand campaign main bhi chowkidarmy view,-1,0
one know escape velocity better modi make promise escape way talking others study check,1,1
one fight productivity justice looking mental balance bc hatred modi,-1,-1
modi,0,0
modi government,0,0
opposition release film modi whether really amount violation code conduct one individual producer investing resource making film opposition scary,1,-1
beloved modi sir sending pakistani pakistan,1,1
paid kar naa stopping dont yogi modi,0,0
pakistan rafael bjp election campaign speaks bad,-1,-1
pakistan reconstructing site ballot airstrike deny existence terror camp modi,0,-1
per ministry home affair people killed others injured communal incident country bjp ruled uttar pradesh alone reported communal incident highest country,-1,-1
please concentrate governance sir dont know run govt please take lesson modi work tirelessly taking leaf,0,1
please delete post otherwise fall level modi,0,0
please let know missed information add text part organization working towards protecting privacy ongoing case regarding right privacy government response,1,0
please research near gone established made life easy dont need believe anything hear check fact book dislike modi dont act stupid even,-1,1
modi addressing massive rally meet watch,0,0
pm election modi address rally rudrapur uttarakhand,0,0
pop narendra modiindia becomes nation shoot low orbit satellitemission shaft succeeded,-1,0
pnb fraud fugitive diamantaire nav modi art collection go hammer,0,-1
poor indian already getting lakh various scheme modi govt bank account proposing lakh would poor indian vote get benefit reduced,1,-1
pray brother get well soon still people like rangasawmy blaming modi giving best india,1,1
prime minister modi target spbsprld alliance sarah acronym,0,0
prop page lure voter freeze vote bjp spent lakh week political ad via,-1,0
promise delete twitter modi shapathgrahanke band,0,0
protector thief their using opposition name call modi thief silencing modi call thief,0,-1
proudly saying support modi bc people brain guy keep calling anti national whatever want great south indian extra ordinary brilliant people female sign,1,1
public asking modi lakh crore naukri smart city ram mandir time public alert abi began bhi nai meta paying,1,1
public rally meet police official involved security arrangementsestimates around lakh people gathered hear modi,0,1
question modi iso ordo hal good scientist engineer gave rafael deal reliance company,1,1
quite big list operation cobrapost nothing coming modi rescue though time,0,-1
rafael choir modi incapable organising surgical strike fake always capable surreal strike people show mara cheat modi surgical strike kicking,-1,-1
rajasthan governor said last monday narendra mode return important india,1,0
rajdeep think bjp agenda election country economy anti pakistan modi forgetting got bloody nose pakistan,-1,-1
read clearly behaving like blind clear crop family mean crop people dufferness peak modi era trust le blindly mathematics silly people modi,-1,1
really see point people going pay watch one definitely voting undecided voter going movie yes modi,1,1
re sir gambit para merit best wish always ape bjp swath victory hand best namo bar sir modi sarkaar jai hind sir,1,1
respected chawkithar mragarwal seen debate stated present achievement general issue gst became transaction topic nav modi super excellent,1,1
respected modi sir common man belongs middle class family received may class scheme benefit even month applied bank said way track application please help,-1,1
respected sir sar madam kindly sar good sar adam sar thanks adam good gaunament narendra modi sar bjp government india telangana state sar sar adam nat interested sar jai birth mathaki,1,1
sacked bef constable contest lok sabha poll narendra modi surgeon news,0,0
shi kara home modi fan people like destroy country home chutiya modi said national security muddy every country every person know national security responsibility every political party,-1,1
said pipe modi declared prime ministerial candidate like really pipe,1,1
gambit exposing modi,0,0
economist created mall nav modi refused fund rafael,0,0
seems like hate modi fine,-1,0
shouldnt modi pela interview,0,0
shri sandra modi kindly arrange stop free sari free clearance loan vowed free gift fund come fro indian people arrange law stop thing indiana people want free request gas subsid left person,1,1
sir believe thing said modi kindly ask proof,1,1
sir like salute three modi vol ordo chief staff tested successfully shake man mission indian pride great job performed ordo eng supporting vol,1,1
sir looking washing modi beard,0,0
sir want join program want ask question modi opponent,0,1
sir respond like rowdy intimidating manner looking respect every single interview,-1,1
slip tongue dont mock human pls listen complete statement say lack year pls dont provoke tag modi multiple time slip tongue,1,0
someone please deeply,0,0
sometimes feel modi unrequited dream becoming bollywood star closest get bollywood,1,0
son prostitute pakistan newspaper insult prime minister modi mother india news,0,-1
sorry mama dis election vote modi open dis vote end worship hc entered post wrong timejai hind,-1,0
stop pakistan propaganda come national security modi dont see election,-1,0
stop meeting like otherwise stupid mode supporter start trend,-1,0
stronger happy mode leadership,1,1
suche ron short gayamodi murky gear laga left least coming generation cultured,-1,0
suddenly turkey responsible woe world strong economy awe based democracy military power israel wife convicted corruption case top official caught corruption testing system modi rafael,1,1
sure modi encouraging people sport showing result,1,1
sure remember vote modi,1,0
swamp saw interview modi expecting question issue ram mandir next finance minister,-1,0
talk something potential pakistan che che modi parasite modi,-1,0
tea shirt that wah wah modi,0,0
terrorist outside within country remember get fitting reply plot nation modi akhnoor rally,0,-1
thanks team modi jee scientist achievement,0,1
thanks chronic leadership modify,1,1
case guy wouldnt even bothered cover modi entire nation know,0,0
modi best mit successful party president congratulation surely win serve nation congratulation shine tejasvi sure,1,1
need reject divisive communal politics modithis show world india voter tolerate fulfilled promise pay lakhdid create two crore job wasted day foreign travel election meeting,-1,0
thats bjp future growing new fresh minion take fanatic guy vile vile modi seems like bach,1,-1
thats exactly thought never vote modi,1,0
bad news opposition mode first rally,-1,-1
big scare despite stellar performance modi government people bihar might vote caste people might totally disconnected rest india,1,-1
canal anti modi caucus us ostrich method hiding fact truth surface regardless manoeuvre,0,0
dim nothing left show world world power want talk modi modi giving chance dim kept begging talk throughout post balakote scenario avail,1,1
govt run rhetoric mm thug modi came changed ham apni large,0,0
govt stance army said along mea stance called liberal like believe government army thanks present govt take strong decision unlike upa need modi,1,1
left long trying create narrative sort discreet setting calling modi hai did hai syndrome anyone buying argument sure,-1,0
modi marker bjp leader used year campaign mr dose lead boredom,0,0
appeal voting modi people stand modi,1,0
name modi hatred become traitor,0,-1
thing stopping modi taking challenge twitter character limit,0,0
problem world moving forward every sense exponential rate every day without progress cost lot day project future using historical figure present,1,-1
thing happen minority india please donttvote modi,-1,0
student leader turned mainstream politician understands label associated name even stand contest left candidate begusarai election modi people,0,0
three code modi cracked give india huge foreign policy upstart read,1,0
many first well people think vote man unleashed modi india pray people,1,1
part mode propagandaand chowkidar think influenced mode vision,0,0
put magalyaan pic note awesome,1,1
say modi never said give,0,0
win joke talk aimed shit lose god help modi,1,1
think high time r rope gadkaraiji face saving seat look distant dream modi bjp still,1,0
think modi promised,0,1
fascism without case fir investigation committee judicial process bringing personal failure anti modi agenda,1,-1
great feat became possible scientist india strengthened power prime minister modi credit go india,1,1
indicates manga become cleaner modi delivered,0,0
modi extremist india minority face everyday atrocity world silent,-1,0
moon dead bent destroying good work modi unfortunately modi hater hating work religion,-1,-1
political stunt done modi election,0,0
probably best description modi,1,1
prof modi losing badly uttar pradesh frustrated clear,-1,-1
pure propaganda election advancement space program could announced scientist iso worked modi announcing look like gather good,1,1
reflects current situation unhappy modi power whats point anyways,-1,-1
seems sequel one mode picture checked net original republican party,1,1
proof near visiting bharat singh jail actually dont enough time otherwise teach history whatsapp history history evidence really exist reached r mode historical knowledge example,-1,0
thought would neutral guess everything modipro anti,0,0
thx alot leaving called composer start using dignified language pretty obvious butcher like modi popular legitimate choice india moreover hilarious find country nsa using terrorism neighbor cry,1,1
time defence budget time bigger country growth rate percent indian air marshall saying jab rifle age pakistan human nazi kar pai door barney mouqam modi eye india eye latin hum rifle baa band race hein thunder,1,1
intellectual stuff used whatsapp consumption need build story like pakistan fear plane operated sky due satellite destroyed also push radio silent modi masterstroke,1,0
tracking space debris mode surgical strike space sat hindu via,0,0
trait modi obsessive compulsive pakistan lover,0,1
traveling busonly modi,0,0
trust watchman keep money safe modi delhi event high voltage sham due,1,1
shirt pen badge mask embellished narendra modi catchy message sale wherever prime minister go namo rate follow,0,0
meeting threat perceive ques dont want vote modi trs cannot form govt centre,0,-1
twisting underlying statement suit objective talent yet master suggest till try col see obvious hatred towards modi without real content,1,-1
uncle modi obviously disappointed know stopped freeze luetiens secular didnt gave importance ppl obviously ppl like disappointed drutharaashtra such cancha raise dikhega use anne lady cancha laga hai,-1,-1
uncle never questioned modi farm also man crush spend crore publicity thats hard earn income anyway meat business safe dont worry,1,1
modi bank losing lakh per minute wash modi wash masterstroke,0,-1
unemployment rate fourdecade high per govt nsson survey modi ji,1,-1
unemployment rate high become govt avoid data render modi,1,-1
vajpayee made india stronger nuclear power narendra modi make stronger space,0,1
boring always subject modi tell acre din come,-1,0
proud able give vote revolutionaryman like modi,1,1
rarely person considered loser written politics humiliating loss bounce back recognized prime challenger shown significant revival spirit modi considered govern eternity challenged yr,1,0
true sure happy perspective india increased multiple fold international community modi became india differ provocative,1,1
well analysis modi hater also rightly challenged hater prove wrong anything modify spoke rally,-1,-1
video modi claim become space superpower india tested antisatellite weapon,0,0
vote modi jai,0,0
vote leader provide better facility secure future country opinion modi best option leader india election vote good governance national responsibility,1,1
waiting wonderful movementjai modi,1,1
want fair clean govt without modi friend govt,1,1
indeed well thought plan modi put tweet morning made almost everyone wait next surgical strike announcement well done,0,1
perfectly well timed article omits wake terror attack pakistan proxy killed indian soldier february heightened military tension mode leadership saw successful trial sat britain try one,1,-1
watch speech modi fool,0,-1
watch narendra modi addressing nation,0,0
well quite frankly shit like make ashamed corrupt politician scam,-1,-1
lakh modi remembering poor,-1,-1
mission shaft prime narendra modi march announced india established world largest space super power prime minister stated feat historic till,1,1
piece human increment parasitic peso boy founder fucking tax money go hope god exists someone kill motherfucker,-1,-1
say changing statement people still believe ingredient replace modi god know,0,0
announced iso modi made surgical strike iso btw thought modi declare war pakistan,-1,-1
asked using modicare panama say never heard matter narendra modi illiterate,0,0
come lens employ algorithm ski bike many need represents number currently,1,0
modi speaks none capability stand,1,0
modi talk destruction pak world man talk response declared terrorist double standard world,0,-1
ram raja come india honesty transparency hardworking committed towards nation r modi govt jai modi jai hind jai shri ram,0,1
someone attack country stand take revert back interest always heard politician backing promise modi fulfilling every promise last year stand,0,1
see amount work modi government done understand nation behind,-1,0
whenever get idea shaking meditation find doubting whether figure try harm may learn something,0,-1
modi presstituteswhat saying raga new india scheme poor,-1,-1
credit belongs detractor like keep attempt deny well earned credit matter public modi rather wasting time lending ear discredited detractor modi,0,0
figure show source show airport built modi able show,-1,0
modi govt,0,0
stopped upa govt manmohan singh allow ordo testreally upa missed golden chance credit sorry credit ordo modi namo,-1,1
who else expect modi that,0,0
modi surname love flying,0,1
bjp modi campaigning economic policy like sole agenda bashing pakistan real issue affect sang medium trying,1,1
build man demigod cunning trusted anything sent packing modi election,0,1
every move poor always opposed govt sagvis kidding modi waived loan worth rich opportunity nothing poor already know modi govt eaten money,-1,1
fearful modi racing issue national security modi gov achievement protected life indian preventing terror attack indian soil,0,-1
modi giving speech,0,1
much negativity kannada medium tejasavi sure karnataka bjp leader shameless rallying behind propaganda almost seat disposal win hand canvas part karnataka ensure modi victory,1,1
opposition sucking release ntr modi lalbahadur shastri movie unless something hide aware merit protagonist movie portray,1,0
post getting downvoted shared absurd also selling shirt say namo,-1,1
waste time giving proof shift people dont important work the criticizing modi work people even trust army accept achievement achieved modi rule,1,1
surprised channel get expert satellite second modi finish speech,-1,0
winning modi make permanent affair,1,1
wish happy world theatre day modi baby,1,1
wish modi,0,1
due respect could might well said modi bjp best,1,1
wondering indian news channel havent change name yet beloved modi bjp supporter done,1,1
world number one prime minister shri narendra modi,0,0
wouldnt surprised election commission also add chowkidar name start praising modi modified india every government agency become spineless unfortunate,-1,0
writing modi strong leader substitute providing fact figure anyone educated person vote begin hum are are kya aur bold bold kya,1,1
wrote modi took oath read,0,0
yeah also credit modi rating petty t super deluxe c winning first two match ashwins managing,1,1
yeah guess time modi naam sko big hot yoga thats got stats,0,0
yeah went better madrassa taught fight terrorist sympathizer like friend modi,1,1
yes important thing vote first vote modi,1,1
yes may modi come,0,1
yes modi people india decided meta eesti vote bar chowkidar,0,1
yes sirabsolutely correct sirapart everyday killing soldier also terrorist modi sirtheres country called pakistan creation chart sir jem claiming death drama sir,-1,-1
yet modi blamed gujarat riot,0,-1
confused showing modi antiindia bjp hp etc,-1,0
staying place transfer voter card modi home phone utility registered rani eci everyone country know stay voter card,0,0
wrong want modi win done nothing india last year wont anything next well want well plus embarrassed whole india globally want modi also take sharia family,1,-1
refer video reason vote modi also fact check clearly mention allegiance,1,1
find thread mode tweet lol,1,1
guy need understand modi politician patriot indian lift finger would crippled party every politician corrupt,-1,1
accepted contribution near first time congratulation second point space technology concept near able put forward subsequent government even today satellite sanctioned mm need modi fulfil near dream,1,1
prooflike modi property dani,0,0
shared modi famous didnt,1,1
know thipirathan parti haram param close kaaviri never still ppl didnt get water modi solve,0,0
