neither want daysneither want city renamed want earn living honestly see unemployed crore indiansmujhey roger chalice bhi berozgar due failed policy modi,-1,0
never seen advance laugh even smiling like modi,1,1
never think life decision never asked vote modi decision,1,0
news shot modi mission shaft speech without logoreports print pm residence reportedly studio team readiness leader,0,0
nice try moment lower class hindu continue vote chowkidar narendra modi,1,0
nav modiowned classic gaitonde raja ravi karma abbr padamsee hammer,0,0
note modi,0,0
bjp person attained r an iso chief current ordo chief praise modi work bjp that common change inset entire nation stand modi open eye read article practice theatrical,-1,1
supporter modi raja time gun surely overtightened despite inflation undershooting expectation talk gdp slowdown unit patel equal culprit da refreshing change focus growth,1,1
filmmaker told mean modi get seat contrast thanks sagarika help modi win,1,1
waiting vijay malaga nav modi prefix chowkidar before name twitter,0,0
cub dear future also lion god give greater height modi hai tho pumpkin hai,1,1
jump communal issue iso ordo tested modimodi baa nei haiisro,0,0
often spoken friend bengal said time loose seat significantly modi party get least aka kya yoga did,-1,1
ohohoho thank near keeping iso idle till modi came power,0,1
omg new country world dont even know modi pakistan tod dia kya,1,0
modi marker big congratulation jay para joining bjp great vision nation jai hind,1,1
one mit shah narendra modi within gadkari win highest margin,1,1
one thing indian voter understand scheme modi pro poor innovative scheme anybody else fraud think made happy good day people gone back foot,1,1
modi,1,0
modi nothing,1,0
people dont support modi asking lakh never promised,0,-1
shri narendra modi time forever good work continues took command hand status india global level changed positively,1,1
oscar best actor go modi,1,1
great modi,1,1
parallel blabbering mode unambiguous statement lakh spun lakh lie year wont even discus,1,0
people india must understand game played congress confuse hindu voter hindu must unite else artwork modi vein come may hindu need trust man,1,1
people india want chowkidar modi choir cong ally,0,0
people called economy class cattle class autorickshaw rendered noble modi,0,1
people firmly stand modi inspire call pseudo secularism pseudo intellectual,-1,1
pessimistic modi winning though,1,0
please reminded feu failing modi that dumb blind,-1,-1
please support modi india,0,1
plz dont tell modi die heart attack,0,0
plz dont think modi nation indian live standard able think going,-1,0
pmnarendramodicanmakeabigannouncementinawhile,0,0
poem penned used modi journey common man web series based life,-1,0
point guessing name give hey hold horse asked youre antibody col genuinely need answer stop playing victim making assumption,1,-1
politics well balanced strategic optic modi played card well today good demo capability also came handy right timeitna toh santa hai,1,1
powerful people using powerful position influence powerful demographic sigh,1,1
prateek boot lickerthey dont follow soul follow money demo masterstroke even whatever modi masterstroke,0,0
pray god long live modi sir inspiration young generation daily life fail solve even small problem seeing really feel proud tackle driest politics played country truly great jai hind,1,1
prime minister narendra modi spoke scientist involved successful conduct mission shaft via video conference,1,1
probably modi motto india first modi raised profile country also,1,0
problem guru know somebody elect small trade habit remain merchandise trading business lucky educated near independence envisioned india industry education research modi come back guess end,1,0
propose common candidate modi varanasi,-1,0
proud prime minister render modi jai hind,1,1
prof modi govt everybody equal father playing family politics karnataka supporter got sitharam haryana movie ticket,1,1
per comeback modi,0,0
raul give wrong information nationally rule cong loan given vijay mariah nav modimanmohan made recommendation vijay mariah modi job collecting loan,-1,-1
rajdeep wanted bash modi bjp ala turned upa kicker,-1,0
rajdeep tweet always neutral tone scared speak truthbhakti brigade violent currently need say modi powerful leader india forefather importance like near,1,0
ram modi bjp bjp modi india bjp india team best bjp ram,1,1
ran away within minute debate modi run away karan taper show like leader like fancy,0,1
cb hope give much awaited trophy year disappointing final strength batting weakness relying abd best dk vora abd sarfraz corey sunday wake sir kuwait neg depending condition mesh chapel one balanced team ipl finally best batsman playing together like messi ron playoff cb c,1,1
really great even support central government lot andhra pradesh winning odds exist operated politician modi dont like telugu state dont like south india,1,1
reason reject bjp reason allison pvt ltd decorated diamond award modi govt large exporter,0,1
received ani chowdhary academic modi,0,0
recent study based pewresearch reveals adult believe job opportunity gotten worse modi believe price gotten worse opinion corruption worsened last year,-1,-1
remember modi government decided give permission india space mission man let see taking credit,0,1
response indian pak scoring sri modi,0,0
rest assured modi take credit everything institute achieve,0,1
r good part like hp barring dal bad yeah hp barring dal banned harassing minority,-1,-1
salute parish,0,0
salute shima strong girl true modi that,1,1
sardesai big idiot jealous person happy modi thing good,-1,0
say people like rajamaharaja also like corporate looting money active connivance prime minister pretend gatekeeper poor actually gatekeeper cronycorrupt rich,-1,1
scientist achievement credit go modi,0,1
secure child future vote modi,1,1
see corrupt govt gave loan fraud modi recover money,-1,-1
seems worried modi getting mileage understanding technology defeating attitude someone say india long way people saying india directly surpass china thin air step step hot main,1,-1
shame great feat test could gone either way failed hit country sat risk leader country modi took ala logical oppose heck,1,-1
sharing photo team modi volunteer watching live screening ji today,1,1
doesnt explain closeness modi responsible killing innocent riot progressive associated positively known genocide dictator,1,0
state happened modi landed iit entered cancer institute thru boundary wall specifically broken avoid hero people tamilnadu dmy alone,-1,-1
would dont stan modi house,0,0
mode party type dumb statement come party,-1,0
try like modi mind base every one work,-1,1
show mode video asked gujarat massacre nervous asked glass water,1,0
significant achievement india celebrate success,1,1
siliguri rally modi april held soda ground railway ground channel reporting also refer news local telegraph newspaper yes permission denied first soda authority,1,0
sir always inspired amazing life common man respected person resembles life every single person thank much contributing creative beautiful project congratulation,1,1
sir congratulation big day sir waiting become visa guru sab jane modi pumpkin,0,1
sir please raise issue delay gov job like railway ssc modi said earlier process completed month railway alp exam going year done please raise ask request,0,1
sir face country working primeminister india people may call modi commission instead,0,0
dare many choose see end journey yr journey undertaken choice,1,0
people narrow mind stereotype image chowkidar say modi,-1,0
somebody make scoop doo meme post please,0,1
someone buff night,0,0
someone post edited video sadcringe along medium broadcast,0,0
sorry mem use word gujarat use shah modi also bjp gujarat proud,1,1
successful credit go scientist neither modi near stop using every successfailure political agenda,1,1
pity country need better people opposition modi need better opposition really shine,1,1
supreme court reject floor test secret ballot,-1,0
sure modi engineering civil,1,0
surgical strike army air strike air force scientist credit modi whatsoever cbi raid corrupt modi dont cry clerk minister,0,1
spain think hold everyone high standard modi everyone like even within bjp rotten worm wed rather tackle entire party letter limit,-1,0
talking strict law crack heavily corrupt modi say made law fugitive wherever world hide money confiscated law taking course extradition fugitive via namo app,-1,0
telangana big leader warrant meeting modi,0,0
terrorist modi secular india,0,-1
thanks modi government brave move,1,1
thanks gambit ii,1,1
poster awesome love know source well,1,1
sense and war modi,0,-1
main reason visceral hate towards modi govt,-1,-1
case adjudicated govt upa modi find anything wrong process removing ban end matter,-1,-1
contest decisive government decisive past modi said addressing rally meet,-1,1
day people recognises nothing free world way vote surely gonna change promised lakh promising,1,1
difference approach say modi cong,0,0
guardian mode space weapon announcement struggle liftoff top trending story refuse take much,1,-1
strike modi vote get challenge victory hand,1,1
promise made show news modi said lakh fake promise medium hour showing,-1,0
right answer question anyone bjp r definitely modi considering bad last year anyone think strong leader person dumb fuck guy doesnt even ball give press conference people want,-1,-1
moon modi promised,0,1
top superstar mode win,1,1
upa lacked gut prevented modi wait till election could done long back he desperate sat away modi nya,-1,0
way see seems accessing data already pre loaded meaning altering console system calendar trick destiny thinking may explained sentence turned may house wolf unlocked game result analyzing implies date may enabled first date access,-1,0
whole country proud achievement scientist modi taking credit,1,1
wire chestthumping speech test narendra modi shown nervous via,0,0
must made heavy payment much gave modi shah nothing move party without money ask teddy atleast read file,0,0
achievement modi usually achievement announced iso seems publicity lover,-1,1
separate sub line hailcorporate post like probably hair something like,0,1
politician shut fuck long citizen pay capital gain tax involving shit concern like someone coming house tell trade valuable card profiling yet maybe banking family telling politico puppet spread ffd know,-1,0
going touch easily yesterday asked yadav said vote modihaa boat hai caste baht bad factor hai begin modi factor going cast politics,1,0
modi later understand leave,0,0
better elect bjp state cup gonna pair bar modi marker,1,1
voted modi,0,0
think priority said far target modi come relentless mocking got bjp easily see wounded human venugopal may asked focus,1,0
think thekedaar baht par kami hot thi encountered similar case uncle retired fear looking became property make hate modi,-1,-1
think modi follow shin footprint follow rule spirit,0,0
think big decision coming prime minister modi,0,0
chance people karnataka grab ensure unholyalliance bite dust last assembly election wafer thin margin weak candidatethis time sadananda good modi saying bring,-1,1
singapore airport varnasi kai railway station inaugurated tomorrow modi modi hai pumpkin hai,0,0
one chance india loose people voting betraying india next generation lead filthy living standard seen,-1,-1
best could make original html reduced bot prime minister discussed india position vision help fight climate change american talk show host david letterman documentary series year living dangerously world help technology help resource first person switch clean energy completely modi said special behind scene video show first episode letterman also meet key government official besides travelling village million people live without power understand india continue use fossil fuel like coal supply energy able lead way renewable energy extended summary comment monitored constructive feedback welcome top keywords letterman help energy first,1,1
person cheered modi pompous song dance lied lakh hailing visionary century,0,1
would achieve nothing except maybe bring one personal satisfaction one extremely skeptical influence online revolution tear man tongue proving liar telling world fear might say trio canister clash king,-1,-1
big economist outdated context narendra mode new india framework clue yet moreover score settle modi therefore want bebakoof like head,-1,1
thought modi became thing become better complaining month response made official complaint till nothing month vodafone blackmailing sir lot fix,-1,0
thought would blame modi done,0,-1
threatening stop everything present govt running modi said election lutyens medium would prosecuted like single one debating,1,-1
time come clean framed quickly book nav modi next month he jail blitzkrieg borrowing raja gupta playbook back business,1,1
tomorrow big hashtag starting modi promised crore job india today stand time low job rate year,0,0
tomorrow slip bathroom modi held accountable right,1,0
totally agree time proved modi thinksplans rich friend whereas thinksplans indian,1,1
true sense youre modi youre antiindia,1,1
two car run honest patrakar huge failure modi govt india becomes space power honest patrakar modi govt,1,1
two day ago said pulwama suicide bomber attacked force modi take responsibility said sleeping eating beef bryan social medium pm follower saying,1,-1
two mistake market lead indicator event upa period begin pre election result shock event end sep modi candidature announced adjust return inflation compute real return nominal return,1,-1
modi regime law applies help poor downtrodden lynch riot kill rape educating already know,-1,-1
unlike china india paid heed minimize debris could potentially catastrophic operational space asset target satellite inserted pretty low altitude orbit done modi hate learn space system,-1,-1
upa disgrace far science tech initiative country concerned modi took bold decision say madhavan air head iso cong shocked pride iso,1,0
varanasi know little even thought earlier modi might lose last day story exactly opposite impossible defeat time rest agree disagree,-1,-1
true sir thats modi sir alliance created scam corruption,1,0
vijesti bath forbes india renew mode tenure second round reform via,-1,0
vijay mall appeal move forward nav modi set court hearing set timescale judge pronounce decision whether mall granted appeal decision likely within next week,-1,0
vote modi save nation,0,1
vote modi eliminate,0,0
vote modi,0,0
want modi lollipop,0,0
expecting good sense prevail upon modi finally take hold get output luck bear till may end shaken take sort farewell bhaashan,1,1
antibody always,0,0
ready upa time modi waiting year till election suggest better use bit logic concludingand something called peaceful use space raised hell china test,1,1
mit shah playing jersey shin preacher must modi during inspired demonetisation move historic act ipl disgraced entire nation sportsmanship,0,0
extra heat experienced modi wave,1,0
warranty always two year new thought year,1,0
watch social medium pork sympathizer crawling woodwork modi troll lay prostate get rolled every jimmy get ruled single chrislamocommie fucktard hide,-1,-1
watching time long gone bro uncle watch reduced lot found indian medium modi god medium often get headache irritated studio debate male sign male sign kudos arab,-1,1
well know individual kid involved find school kid shame school internet medium volunteering student clean drive around neighborhood armchair editor best particular case,1,1
well modi come back wont leave till leave corruption,0,1
well th want modi,0,1
well mess modi cancel public rally also,-1,-1
aap party president vision except removing modi alternate give one name,0,1
credit want done thing military get credit modi shah quite useless,-1,1
reasoningbuwill false see mood people want chowkidars theater like modi shaw,-1,1
slow anti modi anti national,-1,-1
stop announcing similar scheme vaguely burden middle class modi shifted contest caste religion economic son,-1,-1
something proposed govt seems unanimous approval radio internet might improve,0,1
whats credit modi,0,1
chennai floating friend north west east india worked many good thing tamilnadu state modi celebrating jallikattu without trouble dont play divide rule politics proud indian,1,1
japan life risk cannot stay uninvolved modi,0,0
modi bjp r mit shah swacchthen india swachch raise yoga,0,0
mahamilawati used rule india many blast country modi,1,0
established leader bjp source,0,0
selling pagoda dont try learn english least wont remain illiterate like fraud modi,-1,-1
vote scamfull upa unlimited scandal filled given rule india give another term let see anything good happens reelection modi,1,0
afraid modi wave,-1,0
even surprised ever seen master beloved working entire country also bjp worker also salesman narendra modi shirt cap,1,1
modi coming best shooting stalking guy around,1,1
modi episode direct benefit transfer corruption via,1,1
modi showing without india value,0,0
total number economist country many accept political power courage st turned face economy country would like say international economist praise modi strategy,1,1
shouldnt modi get credit ballot strike asks rajnath,0,-1
fuck modi started campaigning,-1,-1
copying modi schemesdrained new idea take class modi,1,0
create sunrise problem andhra pradesh issue modi lot good thing dont blame,1,1
definately lose meth might scrape wayanad neither able cry em em claim moral victory secretly hell praying loses boththat way get blame modi em day head bangkok,-1,-1
modi talk another surgical strike pakistan ear wait pm address nation amid model code conduct,0,0
vote mode governance because providing employment thousand aspiring preparing last year,0,0
wish happy modi day april fool day,1,1
like per minute modi tweet surprise message go viral,0,1
modi building new india working honestly along lakh chowkidars,1,1
total confidence modi answered question asked arab answered factsthis confidence needed,0,1
support modi keyword,0,1
work like tractor office le work noise may work like modi le work noise,1,1
would like see modi say hit campaign trail tomorrow hope something balkotsurgical strike etc,1,1
yeah right get ticket fanfare modi era,0,0
yeah said kanji gotta vote modi get isnt decision choose wisely,1,0
yeah way ppl blame modi everything yeah one grp blame modi one near good see equilibrium maintained,1,1
yeah like freeze modi modi give free gas etc limit sagvis double standard homelessness,1,1
yes right sir talking love sir big salute loving modi jai hind jai japan,1,1
yes electionthe teamcomitte launching like control current modi without knowledge modi nothing donald panned done election news released also election gain,0,1
yes modi mean india,0,1
yesbcz honest narendra modi hope indian people flowering,1,1
helping modi uncle good luck,1,1
real laughing stock basis brave abhinandan released pakistan geneva convention modi shall dek kar those andhbhakt year,1,1
right due nehruji thought process else modi thought process would dumped marriage would done bjp la thank near thought,1,0
call supporting assad modi progressive good regime change endorsing mass oppression people violent autocratic clearly,1,1
feel narendra good poor people,1,0
also left modi sink,-1,0
know bjp know run government best policy please make narendra modi marker,1,1
know change politics fighting elect moditrust preacher except vanarasi turning point trust retake chance,1,1
mrraghuram raja doesnt doubt international statistic mean mean even poor people earnings mean poor people job shri narendra modi ji governance job market growing shri narendra modi,-1,-1
really tweet modi tell police men asked tweet digilocker also tag local police commissioner also local newspaper edit guy pls between,1,0
right without dat modi title vale hai,1,0
saying came together name secularism secularism clearly dangerous nation vote name massed altar better nation voter vote modi,-1,1
listen modi speech understand integrity,0,1
still answer modi able bring black money back promised get back money equivalent lakh per person saying deposit asking int come back,-1,1
worded experience well read yet think would really vibe particularly lead time memory another sense love subject even try implement similar model software,1,1
family power yr destroyed india modi yr restored strength country,0,1
completely ignores context timing sequence modi started outreach look scroll tweet rts giving blunder convenient miss,1,0
ಗಮನ see many people questioning modi announce indirectly saying claiming credit untrue never even used bjp kindly fyi minister responsible none victory hand,1,1
quite visible much influence company film industry safe parking black money hawaii channel surprise disturbed forced oppose modi govt,1,0
know one minister narendra modi government said growing job well one possibility growing say mrraghuram raja,0,1
new india prosperous strong ancient time glorious heritage modi,1,1
