almost modi moment,0,0
antibody still say anne moth miya mitt also seems like using propaganda win election,1,1
boy he man wish value best luck wish see next term modi jee minister,1,1
fan chowkidar modi explain near portrait stamp near portrait coin near portrait currency note disgusting started dirty marketing thats brainwashed sheep,-1,-1
marital status hurting woman already pain yr sensitive,1,-1
political person supporter party frankly speaking substitute modi prime minister happy,0,1
sure voter confused party agenda one strong leader confusion modi might done thing right still matured dependable bunch selfish ambitious candidate,1,1
people either vote nota trip election day working modi,0,0
waiting pakistan china ask proof condemn act use stance language critique achievement people oppose,0,-1
predicted confidence level grew modi coming back,0,1
oh come economist work country world hungry politics like modi shah,0,1
who tweet seat shahmodi criterion seat allocation much hate minority much one divide india name religion caste way nice selection contrast victory hand,1,0
asshole always asshole people lynched death actually anti modi become anti india people like,0,-1
one reason vote modi also cb fan,1,0
one oldest printing forest shall sacrificed vulgar profit dani mode parting gift friend dani,-1,1
marathi think mode performance bad say good,1,0
modi best,1,1
thermal power capacity added historic low modi visa parish,0,0
people using oakland choir etc modi creep dont understand manner full word,1,0
opposing mega nya antipeople antinational crore crore beneficiary scheme bjp modi finally succeeded generating,1,1
opposition leader mapdata banerjee lash indian modi,0,0
scientist doubt pride nation worked defence year political leader big let modi fake claim speech deplorable deserve seat narrow minded remark achievement year,-1,-1
pakistan terrorist dont want modi india proven wrong young man back school get fee paid parent cannot fathom extra mile,-1,-1
pakistan fix ballot strike modi india news time india,0,0
pakistan want chowkidar defeated modi via,1,-1
panel cracked actually spoke bjp follower said,-1,0
party name appeal vote give clean chit mode mission shaft via,1,1
people nothing happen modi coming next yr,0,0
people keep coming soon see hike price sure demonization stupid step modi government plenty data benefited rich,1,1
people become financially bankrupt hate modi made people mentally bankrupt,-1,-1
per ideology feel also mein bhi chowkidar plz answer thing modi chowkidar country pulwama attack happened,-1,-1
please check foot bridge stretch hoarding modighadkari still hanging poll conduct violation,0,0
please cover modi positive,1,1
please send corrective link spreading false news must hate modi bad,-1,-1
please tune news channel immediately modi address nation important message,1,1
plenty present future lawyer one could possible classmate mine,0,0
lez modi one one seems distant relative,-1,0
pls read said spit the said hat ordo scientist wished theatre day modi claiming done drdothis program started kya kane hai kya i bakwaas sunday,0,0
plz write article modi sudden announce bid vote escape away,0,0
pnzz dont die modi win,1,0
pointadvani thought far business hate every tom dick harry becomes champion business reason tough climb difficult business hate easyfall precipitousdexterous hate player like modi yogi luck everywhere,-1,-1
proud country modi,1,1
proud modi,1,1
proud scientist modi,1,1
public aware,1,0
raja mandal foreign policy need consensus,-1,0
battled modi interview behaving like cat hot tin roof,1,0
really medium paid air rant zero credibility stop wasting time money run far away whatever money looted far below vote modi power expect take stern action,1,-1
really feel proud step modi,1,1
retreating commitment towards strengthening security nation modi said japan life risk cannot stay uninvolved told armed force make plan enough enough given complete freedom,1,1
reminded modi running away param taper,0,0
rendering help everyone yielded great popularity modi sir,1,1
reporter india much much tougher ask question like secret energy without telling narendra modi answer,-1,1
respected modi sir great milestone done ordo nda government proud moment usual hind,1,1
respected shri ji interaction people across india,0,1
revelation blind hatred man eclipse normal intellect educated person political decision taken long back attained fruition today modi functioning would announced find fault every thing,-1,-1
sad see bat deep blind folded modi silver tongue theyre unable distinguish good bad,-1,-1
said last year reverse evolution instruction turned invertebrate vertebrate creep crawl front master bjp modi reversed evolution year,0,0
go secular teamall modi supporter think extremewhich casehope get enlightenment,0,0
say surely going prime minister country want appeal people gujarat give seat gujarat narendra modi make prime minister raised fist,1,1
seems noble wait story forgot chowkidar modi,0,1
self goal toni choir modi controlling,0,0
senior bjp leader call party leadership gujarat thug asks elected pradhan mantra preacher mantra singh said forgive narendra modi could worked chowkidar strap eye read,0,1
shame modi comment,0,-1
shame modi natural god murdabad,0,0
shame standard medium india modi government lakh laanatt,0,-1
shear sad see change colour like chameleon day back seen video praising modi achievement commenting sat announcement huge achievement announced,-1,1
shenshah modi,0,0
ship sent credit successful sat missile launch admits modi hai pumpkin hai financialxpress,1,1
favor aap delhi inc weak somehow managing misuse modi shah threat improve alliance seat hope voter adjust alliance,-1,0
done playing catch game modi bound come second,-1,0
included indian express hindu wire etc oops modi referred pakistani mean news burger included,0,0
vote modi rate interest higher education loan dropped,1,1
shri modi didnt fight seat wasnt held bjp man,0,0
since del stopped buying khan take seemed proxy lvjihahd since distortion history tb become nation respondent respondent mass stockholm syndrome ripped collective psyche dhimmitude dna,0,0
sir information upa govtwhich blocked mission shaft time political leader credited political upa lackswhen modi gave ahead scientist upa crediting mm delaying mission year,0,0
sir narendra modi know create suspense even better bollywood movie director,1,1
real anger modi among citizen western speak family lost loved one pulwama attack also unimpressed bjp politicking ballot must watch,-1,-1
thing fishy going bangalore south bjp candidate mit shaw modi intervene urgently,0,0
sometime back heard film actor shark mentioning people made thier career criticizing way prakash raj kanaiah finding thier career criticizing modi,0,-1
somvirsheoran today every indian saying modi standing firm serving nation alone everyone fighting corruption dirt social evil chowkidar everyone working hard progress india chowkida,-1,-1
soo say reason anti modi prove thug meta patriotic come hate modi ppl muslim community blind hate,-1,-1
soon new elected pascal racist extremist murderer behind bar modi selected worst,-1,-1
source orwellisright,1,0
sri madhavans service attitude clear addressing sri modi srimodijisir remember function daughter school principal welcoming school director padmasreedr sri raja sir,1,1
star war indian news studio modi space suit,0,-1
still interview modi killed relevance ndtv,-1,-1
stop bowing modi,0,0
stop spreading bullshit business man loan waived modi give concrete proof scamgressi folk proof everything,1,-1
stunning twist mission shaft upa blocked sat missile test say former chief,1,0
shameless people pakistansthey talk much modi ball talk china,1,-1
sure win next minister modi cabinet,1,1
sure people leader behind execution medical college multispecialty hospital kanakapura,-1,0
swami type economist job hand defend grandiose scheme modi forming run anything opposition suggests,-1,1
take money save jet airway vijay mall tell bank slam modi govt,0,0
take grim view mode photo rail ticket air india boarding pas zee news,-1,-1
run good say modi like intelligent people around,1,1
tat case action modi responsible,1,0
teaching student best government vote pure govt vote modi government violation mcc become congress self interest,1,1
technically could argue sober evil would represent power also crocodile whereas also represents fertile land also guy could shapeshift crocodile bass,-1,-1
test dhaka asaduddin waist double beef attack modi,-1,-1
thank pmprachar mantra modi part scientific team restless working,0,0
thanks alot great team great modi jai hind,1,1
thanks hope nail refrain talk campaigning hope write similar post tejasvi bjp south karnataka candidate tag modi yeddyurappa tweet,1,1
thanks karnataka select youngest karyakarta proved party term bangalore south pair bar modi marker,1,1
mean modi transform chowkidar chaiwala span yr question lakh promise,0,0
paid medium modi stopped nonsense,0,-1
thats like modi cabinet wont forgive terrorist,0,1
exactly point supporting chronic scheme raga plan elevating downtrodden job improving farmer condition another green revolution even modi govt failed issue clue solving,-1,1
power modi need support pride namo,0,1
article saying lot right thing doubt run medium take moment also wonder run wapo whether person visible company recently took hit due regulation india see critical article thing going well company month ago apron string everywhere different guy holding,1,-1
fringe left dangerous fringe right yet vote modi come election hypocrite arent,-1,-1
nation dammed name removing modi ppl trying bleed death like group wolf name secularism soul nation mama mentioned secularism hindu century several pledged,-1,-1
people already decided vote modi continue decided vote modi continue still havent decided continue hence influence general election,1,0
place modi planned get lack every citizen,0,0
result modi government poor move chatter today judge also come pressure make wrong decision,-1,-1
slip mouth common issue better concern sha modi govt transfer officer duty handle case,1,1
thing brunei say five year modi missile,0,0
victory modi govt ahead victory hand,0,1
capability show capability tragedy modi seeking vote upa displaying achievement upa,0,-1
case modi,1,0
there fucking namo actual fucking channel dedicated modi atlas had chutiyapa hai,-1,1
there web series also coming modi someone need look,0,0
fact quote indian saying bad india modi policy also fact tou chowkidar hai apo kya gaz gear mai kya chal raja hai apo tou baş hifazat earn hai country,-1,-1
helpless cant see mode working always talk modi nothing nation enemy like kanahya support,0,0
take money vote modi ideally,1,1
think vegetarian maybe always tell lie like demonization surgical strike lakh recently made statement regarding drdoisro given idea ani missile used sat destroyed satellite,1,0
criminal modi drawing park tax paid poor wafadari towards peoplebut modi,-1,-1
dalla rajdeep stupid saw scientist giving credit modi tried blame saying the taking side bjp anyone criticised upa moon rajdeeps as burning quickly,-1,-1
gateway drug world pain empty wallet think maybe grab speaker maybe amp headphone know couple thousand deep downloading flag god done,-1,-1
huge even modi started yet,1,0
ker definitely make statement usual nursing modi well,-1,1
kind fake news like gutter gas modi,1,1
modi power,0,0
mode style working control everything busy election,1,0
new model code conduct save modi,1,1
question similar chowkidaar narendra modi make nav modi rich,1,1
taylor much mindless the modi like banner hath mein astra modi banner hath ina,1,0
difference confident leader call upon action say vote kar requesting citizen exercise right hand opposition saying haven vote are modi hataavo thats difference,1,1
type violence muslim happens north india r power modi basically r member r hindu group type atrocity associate bjp power south india never allowed,1,-1
fantastic analysis modi govt performance last yrsthose seen video vote bjpmodi,1,1
jacket useful direct attack intelligence let terrorist attack like pulwama bullet proof jacket useful sir modi era rafael transfer original deal change without techtrans albania justify,1,0
couldnt open bank account poor year talking sending money bank account modi demolishing song meet,-1,-1
till underground naval modi got left option,0,0
told armed force make plan enough enough given complete freedom modi,1,1
true cannot blame modibjp using thing provide look congo regional government refuse implement central government jonas designed help poor,-1,0
truth today patna use two time ola really people well aware policy step taken modi led govt sharing video conversation one,1,1
tulsa fake progressive anti muslim anti gay pro pedagogue modi relentlessly worked hindu terrorist,-1,-1
tum hush modi announced farmer,0,0
tune modi ji message nation shortly,0,0
typical modi fan boy,-1,0
umm translation abhinandan incident happened every party talking proud shot instead kept asking abhinandan would come back narendra modi,1,1
modi even bird enter illegally global wildlife news download wildtrails android io,-1,0
understand indication willingness push greater woman representation fielding larger number woman candidate bad tmc done btw mode bjp better happy pathetic show,1,1
une like class hai modi fan modi later don irreversible hai,0,1
upa govt sleeping strike stopped airforce hitting pakistan modi pakistan gear mein good mara,0,0
upa billion achievement modi government make india,-1,0
usa noodle modi nowadays speaks master voice,0,0
view decoding narendra mode chowkidar economic time,1,0
vote modi modi modi take pledge make another mainly poor person vote modi bust lie,-1,-1
raise bhi bjp advertisingnot even mention bjp modi angle bear make sense,0,0
wait soon going new calendar modi yr ago prehistoric era modi,1,0
waiting see indian voter shooting modi satellite may,-1,0
want chowkidar would elected one insult indian electorate stop bull shit think sane idiot left bjp thx modi,-1,-1
want modi,0,0
modi modi alone took decision purchase rafael france nobody whether iaf defence minister parrikar clue still modi govt lied giving writing govt followed due process,-1,0
like safe sorry cop pov free injured kidnapped worst killed naval whole opposition would claimed modi killedkidnapped,-1,-1
speak rudrapur last month terrorist struck pulwama feb reach bad weather returning via,-1,-1
told modi known outside gujarat prove point contested varanasi cultural significance gave seat decision history prediction lose meth prove picking wayanad,1,0
wasnt modi tea seller became timeline mentioned existed,0,0
watch full interview prime minister narendra mode first lok sabha election interview speaks arab swami,1,0
watch sense nifty next year estimate sense touch nifty touch book modi factor confidence governance ease business,0,1
way crediting modi demolishing near whose immense contribution making nation family run corporation make permanent guardian angel nation good go credit bad god forbid mode bore brunt,1,0
week ago bihar new narendra modi destroyed half pakistan heard lot people surrounding village,-1,-1
well hold people responsible part see obvious conniving agenda govt maybe deserve get embrace whatever bullshit decree impose mean fucking protest right raise question,-1,-1
went tag celebrity ask respective fan vote coming election,0,1
mode promise lakh,0,0
taj medal know bury swami call swami anti medal,0,1
india biggest asset narendra damodardas modi,0,1
think reason shouting special achievement modi government,1,1
grab share buck cheaper would opt,0,0
people named modi high level crime,1,-1
couldnt year modi making possible within year,0,0
bjp promise thing fake narrative modihaters,-1,0
modi say lakh scheme,0,0
modi said repeat lie umpteentimes anywhere everywhere make look like truth label strategy,0,1
say india weaker china comparing public data available military hardwareresources skill available bothwhen saying todaymodi beat pakistani dont see decrease power part pakistanthey still armed warhead,1,-1
supposed candidate contest dynamic shift dramatically last heard south percentage point lead modi candidate,-1,1
survey done modi already rally time scenario always change soon jump full flow,1,0
whole corrupt leader come together defeat modi clearly show men great business country individual want modi back,1,1
rajasingh but dakshin stand namoism,0,0
learnt hit modi govt knowledge politics economics feel hitting give box office like success,1,1
sad bjp lost deserve,-1,-1
whole india proud prime minister modi,1,1
worrying modi adult enough fuck entire lung anna community lung nadu logic ask change name,-1,-1
didnt iso chief announcement nation right surname wasnt modi leader party wasnt bjp got,1,0
modi always talk opposition party every public meeting forgot power ever talk demonitization gst according historic decision,0,1
modi chose announce ordo look international coverage ram desa ram desa ram desa,0,0
modi episode honouring deserved one via,0,1
modi episode honouring deserved one youtube,0,1
modi given indian tell jump,0,0
pakistan cry name modi every day nation support india airstrike electrification thousand village independence indian economy became largest economy world year,-1,0
sir worried talk did inspired issue courage speak loud hatemodi remove bjp item,1,1
shout silent lac pnas irony friend modi written,0,1
answer becomes modi raga quite confident election result suppose,1,1
dangerous country modi doesnt return power alone courage right countryfellow indian think seriously vote dont believe fake opp leader lie,-1,1
give premier show ticket modi movie,0,0
hear modimodmodi,0,0
modi contest south indian state,0,0
speak support modi terrorist mass murderer thought,0,-1
wire article mombatti seller struggling job modi draconian move provide electricity home special youtube episode drug tutti electrification helped albania dani group,1,0
wish best india rna modi is door,1,1
kind reply obvious arent would defended modi much better honestly supporting arent,1,1
wonder every attack indian army ruling party brass give credit modi someone asks justification evidence questioning indian army capability logic,0,0
worker divided modi impact,0,0
wow modi hearing start scathing word judge emma arbuthnot defence barrister clare montgomery state paperwork index,-1,1
wrong assessment show took strong stand give highhandedness modi regime difficult choice continue position despite compelling reason quitting good people chose resign end democracy,1,-1
yea learnt ppl eat modi shit right as breakfast like,1,0
yeah saw modi patriotic modi antiindia type stuff good,1,1
yeah thats thinkingoops many tweet enough time reply bad honestly waiting someone use message endorse someone else haha kind wish modi would message he fucking vicious love,1,1
year modi government performance,0,0
yes scared please please request moon please dont vote modi scared dont pleasearey please,-1,1
yes someone counter levelssometimes modi cant take name directly run,1,1
yes people vote rest vote modi,0,1
tude tude gang lierssoldiers got almost respect benefit modi regime govt,-1,1
son already looted poorest crore family get straight answer son visiting office give show respect honorable modi,1,1
right sir modi,1,0
better kindly say thanks say social medium atleast people reading tweet spit atleast crowd unlike speech ground modi isnt anything foul mouth corrupted mind digging pit,1,1
praising,0,1
cant handle fact modi league tyrant history like hitler trying defend defensible really show need open eye stop following blind cliff praising pleasing cleansing india,-1,1
dont even million follower think compete modi hahahahahahahaha,0,0
even write share modi photo,0,0
fool opposing modi antiindia modi country first read civic book talk politics,1,-1
reason upset remember ninth elected time support bjp member make sure tejasvi sure win election modi let fight nation,1,1
think modi india sold soul anyone become india keep growing,0,0
think cry mistakenhalf mint money pony scheme half zombie whose point achievement modi data dia mar bhi javelin koi boat nazi,-1,-1
surely think wish modi netanyahu come back power dream remain dream,1,1
party job hold press conference accuse modi nothing else,0,0
backbone heart good ear mode regime,1,1
definition terrorist clear one kill innocent agenda,1,-1
new hypothesis modi parkinson,1,0
suit bjp say ran away vijay mall target government hindustan time high voltage kerala wayanad,0,0
movie real story watch official trailer modi erosion,1,0
called lie bjp r gang cook start brown losing say gospel truth see arab man differentiate as mouth called medium czar india hey ram save modi jai,1,1
khaunga khan dung remember slogan turned another jump commanderinthief aka modi scam scam happened mode watch,0,-1
want tell world new capability acquired used anyone purely india security modi said address,1,1
