almost modi moment,0,0
apple globally famous based company manufacturer iphone relevance incident,1,0
childhood modi mit shah,0,0
debut ghost plane theory plane make turn new coords input never heard one automatically speeding,1,0
feel nice find cyber attack ransomware non state actor attacking state machinery problematic criminal regardless whether victim perpetrator,1,-1
lost container another ethnic group still college student matter though,0,0
love find shocking lot thing ignored newspaper seriously except lot rubble rousing,-1,0
sorry surprised bjp opposed debate sec someone claiming bjp supporter clueless bjp also think bjp want make mosque yes mosque ram janambhoomi,-1,1
final solution make sharma youtube link la feature youtu,0,0
something bjp gov would ever doesnt ring image least,-1,0
thought bjp coming power solve water electricity problem change intact water le emi still despite rbi dropping interest rate inflation literally burning hole pocket see news thief sorry mean corporate getting fucking tax break going holiday seychelles wearing expensive suit wtf like gov animated project called eliminate middle class one thing beef ban caused people eat beef,-1,-1
tvotebjpfor anyway swamp much regard taken seriously,-1,0
planning picking magna modi week glad,1,1
modi always wear saffron serious question vote please give rational response,-1,0
farmer telangana also contesting modi varanasi stated back modi hears demand,-1,0
english respect modi intro handle parent oppressor sent school collage become engineer didnt wanted today hate making life easy hijab oppression guy since year,-1,1
april modi marker shoot marker first last fool day main,1,-1
bjp got crop vote may crop upper class hindu use nota,0,0
manga like theme nirbhaya happened every citizen india white collared job modi made unemployed average indian wake asshole like sorry tutti,-1,1
way people responding well modi,0,0
scrapped thats modi pic long rally finished stop spreading communal hatred,-1,-1
aah saw recent tweet complaining man instead finding solution people complain complain complain big population care plenty useless chap like conversation complaining people like found last modi win,1,1
cache din possible terrorist ruling roost wipe terrorism acre din avenge modi mantra,0,-1
according bjp sang modi face doesnt leave impression thug conan face first instant still raise issue really doesnt look even acting skill baht likhvate year,1,0
accusation political let declared guilty people feel shame praising convicted crook modi,-1,-1
actor madhavan offer support modi urge voter cast vote election get rolled liberal,1,1
edit rao result bjp seat nda seat filmmaker urge people vote modi guess result,0,0
agenda modi new india building infrastructure improving defence improving economy agenda citation team stopping modi personal agenda become political agenda,1,1
ani missletejasbhramos made near india modi painting renaming tum push yahoo,-1,0
agree last line would like add suitable word everyone opposed modi liberal logical loyal india,1,1
indian politicised pulwama ballot,0,0
insignificant unknown individual join together create sham movement min fame using name people used corruption slavery prejudice life bound scared modi,-1,-1
proud modi taking india ahead super power,1,1
cheat waiting government change come back prime minister narendra modi,0,-1
kicked post election modi driven,0,0
mentioned already done modi come power check economist predicted milk honey slowly silently withdrew predicted nobel prize,-1,1
already tested ordo another blunder modi,0,0
also questioned mode message nation,0,0
always modi marker,0,0
modi rejuvenated demonetisation,0,0
thousand karsevaks gathering ayodhya fuck bjp,-1,-1
think modi representative hindu sorry der difference normal hindu curia hindusbhajpaisanghi,-1,0
announces crore minimum scheme poor family india poll promise time bigger support scheme one announced modi govt pradhan mantra romana,-1,0
another scam could nya scam anyway expected cong came powernarega big scam came modi govtwho opened poor bank account andstarted transferring area payment accountsnyay scheme earn crore cover notebandi loss,-1,-1
guess modi say,0,0
say termed arrogance bjp barra chart modi without claim confidence wah dharma wah,-1,-1
thing modi,0,0
anything gone wrong mission guy would first blame modi forgetting scientist successful hurting even acknowledge one showed execute,1,-1
space superpower nowfuck jobsvote modi,0,0
are bhailogzara iso dinosaur humane are mein daldho modi credited,0,1
array year ine india voter bhi nazi hai share cast vote best modi wave kia kya hai vote share increase yoga,1,1
ashley tell writes mode foreign policy win,1,1
shin appears indirectly canvassing bjp shut addressed modi anyway shin must appreciated exposing power modi even caretaker remember ec conduct people surveillance symbol issue,1,0
ask modi show evidence investigate chowkidar,0,0
atleast good happening world,1,1
www really irritated modi work hard wont spared dont worry,1,-1
boat hai party fear existing candidate cant defeat modi bewaoof laga hair gay toh bhi okay meta tha profit,1,1
back switching watching credit away modi,0,1
bakchodi never revive thanks twitter itself bench poor din rahman khangress bad modi hindu emperor chart meta hai,-1,-1
careful dear voter people misleading modi came power country financial burden much improved vote raga country suffer financial crisis,1,-1
become fan mentor politics retreating commitment towards strengthening security nation modi said japan life risk cannot stay uninvolved told armed force make plan enough via namo app,0,1
best leader modi world,1,1
hai sir cant give help busy gathering vote modi,1,0
bjp release list candidate gujarat lok sabha election one candidate byelection tall assembly constituency ani report,0,0
bjp supporter say job opportunity india gotten worse last year pew research center survey,-1,0
bjp modi failed engine engine give growth destroy everything,-1,-1
boy insensitive comment make,0,0
brother ascetic working relentlessly beloved motherland comparing near modi true sense common man amassed money neither family member see wealth near family managed billion source,1,1
btw time modi wife,0,0
btw left liberal think quite different ideology modi antiindia guy gem class sarcastically,0,0
modi said ballot he afraid going bedroom flush people want chowkidar stand gate someone else work,1,0
sri modify end corruption make india great,1,1
clear seen chief acting like agent modi sure time anchor blind stupid note,-1,0
explain sir dont play cancha modi,0,0
please guide south indian hate modi,-1,-1
chowkidar lane app chowkidar ante modi lane mai agar such karla hai chowkidar become central employee taro ape,0,0
citizen support india dynastyfree corruptionfree terrorfree safe citizen people nation support modi work tirelessly improving life let also pledge chowkidaars support,1,1
clear modi also targeted ndtv pro pakistan satellite channel night vast jain trying best little massive achievement pity see face,1,1
confused whether scientist deserve credit near see two kind post scientist need credit politician modi get credit,1,1
contrast indian people request indian voter plz vote support bjp iam sure country safe mode bjp hand,1,1
contrast big shoe fill best great responsibility keep faith need drive home point election nation need modi helm god speed modi,1,1
congratulation team member great job indian proud modi sir really great thanks,1,1
congratulation scientist narendra modi,0,1
continuous diary modi govt coupled viewing decision jaundiced eye creating wrong perception abt public even causing harm goodwill former dont stop nuisance put time better use,0,0
crazy money come first party ensures people remain poor proposes idea implemented even overseas,-1,-1
dear friend one day one chance choose best leader like modi year good day live secure safe life,1,1
dear opposition people india trust scientist modi want may start asking proof,0,1
dear sir totally intention uplift poor past record upa performance upto mark wish see one term modi delivers ppl mandate doesnt ppl elect party fulfill promised,1,1
dear sure path cake walk dont worry remember neither vajpayee advance modi opposition always try crush motivate time always supported positive ppl betray win huge margin,1,1
nearest modi india hope chosen leader blessing god good citizen praying remain long time come sparked,1,1
desperate headline hunting modi team strategy marketing team seem falling apart,-1,-1
despite bjp troll army comment sentiment similar mother across modi follower failed appreciate genuineness protest also tagged protestors naval anti national people want pay back lack sympathy,-1,-1
didnt want bring back abhinandan modi mean,0,0
directly thier account hope know account open modi government upa never thing reform banking sector help economically weakest section country,1,0
dizziness first get used work like modi hour,1,1
want everyone agree r bjp,1,1
dont know mode air offence took anyone side border seems killed seven,1,-1
dont like modi,0,0
dont mind dont believe modi definitely believe god god take care desire get thing done modi perhaps could painful,-1,1
dont worry india survive well without modi actually better,1,0
ordo iso indian army iaf functioned near got autonomous state modi took,1,0
ordo press release usual procedure modi fooled biased medium anchor,-1,-1
dude authorized testing responsible success failure tech fault vane express didnt guy jump gun blame modi,1,0
due sharpness badalshah vote transfer cong help modi,-1,1
election commission working independently otherwise mode mission shaft violation election code conduct,0,-1
environmental disaster narendra modi blessed first day,1,0
even mediahype cant save modithe worst nonperformer,-1,0
ever known modi take anyone advice anything,0,0
everything good far bjp concerned cow injured,1,0
excellent job modi,1,1
exclusive manor joshi told modi shah want contest lok sabha poll via,0,0
exdrdo chief say ordo mean pm thanks modi,1,1
fact expected modi path breaking scheme cheated country,-1,-1
narendra mode fake politics policy,-1,-1
fan open modithemed cafe tamil nadu thoothukudi news reel business today,0,0
fiscal deficit rise shopping election year modinomics flop modify laptop let bogus blog min retrospect,1,-1
modi everything national security fake fake irritating hope loose,-1,-1
rich modi like chowkidars neededthey want help keep swiss country want chowkidarsur conception wrong,-1,1
wafadar journ anyone praising leadership modi taking side,0,1
former iso engineer explains india mission shaft complete waste,-1,-1
found interviewer little annoying love continued reiterate principle wish could make way banana vote slightly optimistic bjp defeated,-1,1
follower leader modi webseries official trailer here citizen reacting,0,0
year adamant jail modi happened decimated ground time even worse waiting please start cry em respite,-1,-1
getting frustrating government collectively made dumb nation institution bought blatant violation col mean breaking channel,-1,-1
globally also see prime minister head state immediately addressing nation appeal calm communal love peace see call right wing terrorism adorn muslim symbol show solidarity india people die modi stay silent go film shooting,1,1
good morning modi,1,1
governor alan singh said bjp worker want bjp emerge victorious want modi become per indian constitution governor neutral post kalyanji wake act like bjp worker,0,1
great achievement shri narendra modi government feel proud present government,1,1
great atleast than modi opening crore bank account highlight term,1,1
great day battery mission shaft world theatre congratulation space scientist modi,1,1
great leader modi bjp going get,1,1
guru dumped modi shah combine,0,-1
limited credit giving spree modi mm tweet ud hav made sense claim credit success pm charge project near mon oscar call every acquaintance give gratitude,1,1
haha sometimes compare presidential debate kind point party raise absolutely hilarious sorry see credible lead like choosing lesser evil two,1,1
haha modi government modi everything possible including tweet minister people cannot believe minister replying,1,1
happy birthday loved remake narendra modi love see accidental line,1,1
hat burma battle knowing news grandfather edit sure whether know know whether team would purposefully tell telling would right move team stand point personal pov right move per news apparently missing since friday,1,-1
conversation parachute twitter pinned great deal hope say he good reasonable guy may is charm image mode strongman image attracted lot people towards promised,1,1
hello modi youre addressing nation please tell many job created tenure many indian startup flourished startup india scheme managed improve farmer life,1,1
hello would please clarify position position party regarding universal basic income universal healthcare free college education inheritance tax wealth tax step taken case support,1,1
help election time main chowkidar modi like param param aloochop julia,1,1
reason vote modi manga waterway transportation usage shipping giant mark cost transportation reduced road rail,0,0
come ha economistmodi saved moneyreduced inflationprice rise controlledwith money wikis makemoney themselves impose cathen every year breadslice yr ppl enjoyed benefit modigovt wont get deceived,1,1
he producer film modi biopic,1,0
highest rate unemployment last year modi sarkaar,0,-1
doubt economic naturethese doubt remain till modi power,-1,-1
hmm hope able give fight mode election,1,0
hmm found flourished modi govt,0,0
double sir modi ahead support forever,0,1
hope defeated hope bjp routed upcoming election modi must defeated good country,1,1
hope contest modi everything settled,0,1
become stand comedian india add modi everything,0,1
nu student opposing mba course charge marketlinked fee modi wasnt obsessed petty antinational stuff would actual taught guy something free ride getting,-1,1
hybrid get bjp,0,0
human being care surroundings taking nothing away modi focus important matter well miserably failed,-1,0
idle afraid modi misdeed preparing political vendetta mask,-1,0
ignored msg wealthy gamma neighbor friend family said application white ration card approved hardcore tdp fan praised modi sky demonetisation sc issue turned antibody,1,1
incompetent illiterate mode mura loan another crisis making,-1,-1
india attains antisatellite capability become elite space power modi,0,0
india desperately need called dictatorship leadership next year atleast mean look china economic growth dictatorship modi,-1,0
india heading towards becoming superpower till leadership modi,1,0
india modi,0,0
india modi stated national india shot low earth orbit satellite antisatellite missile whole operation called mission shaft completed minute operation clear yet satellite indian test satellite foreign one,-1,0
india shoot low earth orbit satellite antisatellite missile action country modi,-1,-1
india shot missile test satellite created another debris cloud low earth orbit space nation arent trapping earth ocean want polluted space irresponsible gardening,1,-1
india strengthening friendship across globe modi via namo app,0,1
india today apologize result day anti modi gang blame em bakakot air strike count defeat count defeat india dignity security wont let happen modi india pride,-1,-1
india upa noticia modi ready thank god got rid guy hope crook party stay power forever,1,1
india want know modi eat word spare new naamdars dis remain true jump,1,1
india brink face venezuela type crisis rao saved modi saved kind divine power helping india india never fail,1,1
india working behalf pakistan face heat second term influence indian medium public discourse take beating hence pakistan fear modi victory,0,-1
india defence strategy disaster management concern ambig election model code conducted appears august self lacking opposition rant modionly true patriot logic support india super power space stride,1,1
india gandhi russia slavery something vajpayee modi pure indigenous indian work hat,1,-1
instead fun comic video twitter think account increase see fun act modi serious stuff,1,1
good see modi bath asking feasible provide weak economy know broke backbone indian economy demo bad execution gst,-1,-1
modi col bharat kept,0,0
modi achievement,0,0
ive got everything talking modi government,0,0
jammu mein you see two type beggar asking money name god others asking vote name modi demo toh bar nazi kara such karunga yeh kara vote taro kyung modi laaungaa turn blind,-1,0
jungle shah note kumar power power rafael choir modi mara cheat choir modi using greedy fellow cbi dept opponent bihar power finish kumar mit shah positive twist old topic ndtv,1,0
like mm guy also never took single holiday,-1,0
saw clip start ridiculing modi funny punching truth power funniest comedy least move chowkidar trope remaining bit insulting chowkidars premise ridicule modi tone deaf entitled,-1,1
kejriwal admits modi good work may long time ourvoice cover aspect issue people talking,1,1
know back return award gave award people high integrity field member gang let cry foul want,1,1
congress year nazi kar saki sara kam modi seal main raise expect karate give modi little time know nation,1,0
least near didnt spend building statue modi raped benefit ordo,-1,-1
le said gujarat judiciary better modi destroyed essence india institution,1,0
let work full strength modi again election,1,1
like brown skinned beauty photo stopped body amazing jeezuss post wait,1,1
like economy jumped position modi government put indian economy fragile still job created doesnt sound right,1,1
live talkatora direct competition interview different channelsenjoy,1,0
live modi begin address nation tune,1,0
lol look like one person split modi mit shah mitotic,1,1
look gang contender modi potable lot family run party one person show sunday fortune seekerscan one trust even one helm dear mother land,0,1
looking forward,1,0
look like bed lost chance debate kejriwal gonna pas enter assembly,0,0
love pid burn much modi get credit,1,1
lowest job growth year maximum unemployment maximum hunger since independence advance right modi event manager prime minister thankyou destroying prosperous india modify,1,-1
lutyens asked modi replied look see satellite,0,0
mama think modi that deserve,1,0
make hai didnt miss deliberately saw quoted anti stats made angst many senior bjp leader modi lately rajnath advance etc etc chose crucial time elec interesting isnt,1,0
maker narendra modi submit response election commission notice indian wire,0,0
maybe dont good enough candidate mean bjp candidate modi say,1,-1
modi also contested seat also planning flee lost one,-1,0
modi magna fine long tossed around rubber foot stop scratching remove knob actually worried headphone put stiff walled carrying case amazon decent one,1,0
modi shah virtually pulled rug joshi foot hurt joshi told ram lal weekend would make announcement keen contest kingur sitting via,0,0
modi announced india entered name elite space power antisatellite weapon sat successfully targeted live satellite low earth orbit name mission mission shaft russia china india fourth country,1,0
modi capable cheating every one including,1,0
modi cared son would terrorist attack last year check much percentage increased,1,-1
modi stay bjp without advance modi,0,0
modi didnt last minute otherwise ever tejasvi chance prove better given chance,1,1
modi doesnt value word word hollow,-1,0
modi exempted code conduct code conduct opposition,0,0
modi face condom pack effort aid campaign leaf customer unimpressed,0,-1
modi flew without speaking bringing back black money mayawati indiablooms first portal digital news management,1,0
modi,0,0
modi india hitler germany,0,0
modi indian border security,0,1
modi gave lakh crore mura loan poor middle class,-1,-1
modi give employment opportunity supplier enjoyed,0,1
modi give people much write isnt corruption scam compromise nation security vested interest dynasty politics topic hold reader spellbound,1,1
modi government helpless youth,0,-1
modi government work hard empowering state assam,-1,0
modi govt wasted entire year looted country thru bank scamsrafale dani power eddie diary etcetcbut time cong taken state waived farmer loan historical moment final assault eradication poverty great move cong,1,-1
modi govt work hard empowering state assam covering infrastructure manufacturing housing healthcare meme sector led govt assam given crore increased lakh crore modi govt,-1,0
modi gst mentioned unless india digitised financial inclusion gst make sense radar diff thing radar failure address proof wrongly executed,-1,-1
modi confidence integrity even one press confer yes debate cause fraud character modi character left wife stole mother jewel ran away home promised job lack black,-1,1
modi done nothing last year need make ordo achievement workspace shame choir modiproud ordo,0,-1
modi exposed cry,-1,-1
modi ordered new generation zero rafael fighter jet fyi crashing simple process recycling aircraft,-1,1
modi wiped small micro industry india demonitisation indian enterprise small micro industry section,-1,0
modi data path hurdle,0,0
modi supreme never uplift anyone,0,1
modi interview highlight air strike mahagathbandhan math top thing said,1,1
modi ji mum pregnant chaiwala,1,0
modi kia hai such alpha yoga,0,-1
modi know prepare meal kitchen monmohan doesnt know definition poorsbecause monmohan never well poor monmohan zero modi great leader world,1,1
modi launch reelection blitz meet round campaign rally cover bjp reprint report,-1,0
modi launch worker pension scheme gujarat visit,0,0
modi likely announce retirement citing health reason gadkari shivraj singh take obnoxious man,0,-1
modi lot fraud people panic,0,-1
modi making news fun time fee scot female,1,1
modi failed country ever seen,0,-1
modi coming national announce jet airway flight left time delhi airport new york,1,0
modi preparing next gov next modi take one notch higher god hitter germany better get rid modi ever chowkidar pass get,1,1
modi prime example extremist hindu blinded uncontrollable urge spill muslim blood,0,-1
modi promise new india launch election campaign,1,0
modi said important message nation,1,0
modi say satellite destruction show india space power via tell improvised indian todaywho cant afford food,0,-1
modi say terrorist across border praying somehow get rid chowkidar,0,-1
modi sending white flag stop fighting,0,-1
modi set tone election amazing way read know,1,1
modi told today bjp worker strict towards scamsters next year,1,0
modi using different tactic win upcoming election human bahai,1,1
modi voice nation election hanna,0,0
modi want win election propaganda pakistan whole indian uneducated senseless understood,1,1
modi address nation ist almost min word yet,0,0
modi going fight day ago thickened sent moon come die,-1,-1
modi wave like hurricane opposition time crop field crossroad people talking political sensation modi modi modi,0,1
modi went space modi brought suit made milky way chart felt happy way daylight also see star,1,1
modi anything win election he basically r hindututva keep repeating every election tea shop owner member r childhood today modi away close friendsbusiness corruption,1,1
modi never forgiven gujarat massacrefake encounterskilling people eating beefcow meat biggest culprit creating ga rakshak kill,0,-1
modi,0,0
modi tell everyone done thought idea used visit forest brief stay menu menu choir choir rabbi bar satellite marker,0,0
modi vadodara margin lakh second highest election left vadodara bus chose varanasibut raga consistent member meth ran away,1,0
modi wont known fiscal presence,0,0
modi would great seeker,1,1
modi,0,0
modi follow,0,0
modify head space department credit go modi also,0,1
mode rupee reward poor farmer giving akhilesh mayawati many sleeper night,1,1
mode knowledge medical science elephant head transplanted torso kid micro surgery,0,0
mode partner,0,0
mode speech doesnt breach mcc eci dept raid opposition leader house midnight bingo,0,0
mode stamen modi might given qtlstonnes till today stupid hungry power hungry hoarding money love nation love family,1,1
modi shocking remark instead worrying abhinandan opposition party felt proud indian air force,-1,0
month back election date announced problem bjp supporter selected voting modi sure proud win happiest person sure,1,1
moreover way modi insulting negativecampaign soon people stop listening samenstale lecture,-1,-1
much freedom expression liberal modi dictator,1,1
must action bring awareness votersintensive campaign imperative national security stability sovereignty sustainable modi stand pro pakistan pro moist pro desk tude gang tainted leader awareness voter cant cheated,1,1
narendra modi wan justice bjp want justice,-1,1
narendra modi father money spend bloody statue farmer dying,-1,-1
narendra modi producer sand singh turn singer movie,0,0
narendra modi recipe attack indian union muslim league kerala url taken massive space even rival,0,-1
narendra modi take dig meet bsp candidate,0,0
nation need leader worker wisdom bring,-1,1
need vote new technology ev read mind cast vote automatically totally foolproof vote comfort home modi india first consider convenience voter,1,1
veteran liked world guardian space modi reiterated speech successful mission meant peace security fighter anybody india peaceful nation remain per basic ethos world strong,1,1
near allowed dali lama move india ppl bet leader would allowed even modi modi denied higher leader visa even attend event near make blunder give credit allowing titan india,-1,0
news anchor propagating modi,0,0
nice hear already spreading awareness modi,1,1
nice modi picture,1,1
night pls admit biased reporter anchor biased news channeled watching dont hesitate bold let hate modi first step salvation,-1,-1
