modi interview arab eye opener citizen country family misusing system connivance judicial system date date behaving like king since modi believed rule law never interfered example,0,1
modi stock answer jawahar lal near blame,0,-1
moma admit defeat easily get scared sometimes,1,-1
molar riot took place kerala modi chose varanasi one oldest city world nerve center india buddha gave first sermon varanasi sarah city known culture knowledge trade going place known assault conversion priority,-1,-1
achievement election propaganda modi could done thing took oath may march last day authority office know issue like used mislead pole,1,0
created otherwise massive unrest every lakh graduate coming come modi hair splitting analysis earlier nobody knew nsson irony saying job job employed,1,0
motivating time voter first vote modi campaign hit ruwatia coconvener rajasthan bjp professional cell,1,1
modi shown double standard governance process country positive direction,1,1
much bjp brand despre,1,0
muslim handle critical modi bjp anti national jihad hindu pid narrative entire regime bjp,0,-1
narendra modi nda ned north east assam,0,0
narendra modi address nation around noon important message एकच,1,0
narendra modi govt could deliver strong leadership excellent assertive foreign relation deserve accolade delivered cant take pride achieved share directly countryman problem kya hai,1,1
narendra modi govt strip icai csi mi power financial express,0,0
narendra modi interact main bhi chowkidar supporter via video conferencing today hashtag retreated three million time,1,0
narendra modi military aviator soldier wondering unconfirmed shooting pdf important safety return mig pilot cdr,1,1
narendra modi see play dirty politics near base,-1,0
narendra modi sleeve achievement prime minister surely drop temperature help citizen upcoming summer droplet surely help agricultural sector benefit farmer,1,1
national highway construction year km year km vajpayee year km upa upa yr km modi govt km,0,0
need much experience dont explain modi try help sister win nb,1,1
neither thread one topic front page explains illegal unethical someone explain dont give shit secured loan bad loan something unique company edit thread,-1,-1
neutral juno always use criticize every policy modi biased typical attitude dumped year back,1,-1
next waiting modi back,0,0
nav modi made death threat witness court told time india high voltage,0,-1
non modi government come power raja play important role government opposition publicly talking since raja global superstar,1,1
allowing director organization achieved milestone make announcement exactly mode contribution huge achievement,1,0
beef modi ate dhaka slept pulwama attack waist beef bryan remark high voltage,0,-1
fault alone normally christian like anti modi anti bjp afraid bjp might declare india hindu state would mean le power christian always try find one stupid reason,-1,-1
literal chowkidar spirit modi opposition mode chowkidar choir hai campaign ive longest serving chief minister gujarat yes chaiwala past never spoken tenure,-1,1
necessary modify declare result may corrupt ghatbhandans see result bjp modi ji aim new india loser focus result know well failure winner like bjp saying,-1,0
nya master stroke den dis get irritated hyper sarcastic modi something,1,-1
old gold narendra modi unable differentiate pineapple via kai fact shi aka ko fake news chaplain ati hai,-1,-1
modi government air travel made affordable,0,0
one indicator modi disaster india last year,1,-1
one reason vote modi,1,0
one best news heard progress made country always noteworthy mission shaft make india space superpower shot live satellite,1,1
one vote make difference ani kapoor answer mode election clarin call extends support vote kar campaign via namo app,0,1
one vote make difference answer mode election clarin call extends support campaign via namo app,0,1
fake news modi cause truth chowkidar choir main,-1,0
bjp desk bach santa only modi jai hind,0,0
modi lead india glory paul via,0,1
one person named chowkidar modi,0,0
part election work village villagemodi listens voice people always political power,1,0
open party disheartened india growth say rally arunachal via,0,0
opposition doesnt even basic knowledge procedure say hitting criticised india sat success test timing,1,0
oasis razacker never said anything nice mode government whatever say meaningless forgotten like waste sits tea stall mock everything thing missing bird,-1,-1
pak dropped bomb premise thank god lost aim given answer much bol hara dia pakistan contrast hit also lost mig dont answer modi dont,0,-1
pak still counting body seriously modi,-1,0
pakistan back narendra modi india next prime minister time choose wisely vote wisely,1,1
pakistan still counting dead body ballot air strike claim indian modi,-1,-1
pakistan want chowkidar defeated say accusing biased jammu region prime minister narendra modi thursday claimed pakistan wanted lose,1,-1
passed modi interview dress formal skill knowledge fail reason namo merchandise that bos reason unemployment namo merchandise buy march job last dont apply,-1,-1
people india including highest institution like defence judiciary rbi local body student medium banker farmer small scale business group middle class family youth senior citizen even bjp compiler working money fed modi policy,-1,1
petition moved income bench maya pradesh high court challenging release date bollywood movie narendra modi biopic prime minister hearing petition would held april two day movie,1,0
photo vijay soneji,1,0
please answer mm didnt take action action plan brought military political wasnt modi atleast gut fail took risk,-1,-1
please checkout news cr follows astrologer advise election modi,0,0
please dont prevent modi making speech right election voluntarily campaigning mahagathbandhan dont think mcc say anything promoting opponent,1,1
please upload modi photo medio speech social mediabjp getting free publicitymodi that juku hai definitely loss,1,1
please remember people shri narendra modi prime minister one else respect office please,0,1
pls modi want house,0,0
plz modi remove,0,0
politics rule hainpgv never fight modi,0,0
postpone release biopic narendra modi sign petition via,0,0
pray modi doesnt get elected,0,0
prime minister shri narendra modi addressing public rally kurnool today video clip,0,0
problem party opposing looking view point instead point view voter,1,0
producer defend modi biopic say link bjp via,0,0
proud modi proud moment proud,1,1
proud leadership modi pumpkin,1,1
proudly next india modi,0,1
rajdeep never made sense reason got hog limelight book father law amazing relentless imbecile made far,-1,0
rakshak raja get elect bjp state india,1,0
regain modi,0,0
reliance industry manor modi jio ecommerce leadership,0,0
remanded till march nav modi spends hold overcrowded jail,-1,0
respected modi sir one suggestion mind would like people elect candidate instead mp elected people though bjp party suppose didnt get minister post resign jump another party,1,1
rest assured parliamentarian brain lead ppl world largest democracy present secular india access globe,0,1
ring master modi circus maroon shah great combination coming fool billion peopleget ready patriotic speech,1,1
said lang km think pak state cannot afford alert atleast may modi come back sus pant,1,0
manner modi submitted lakh every individual bank account,0,0
sander para say modi father isnt huge achievement shake student,1,0
say part time economist part time lawyer full time irony well modi dignity clown mass murderer,1,0
saying modi sent going,0,0
see frustration coming guy totally lost mind absence power position become nightmare separatist pal lover antinational long live modi,1,0
sends notice maker film narendra modi,0,0
sensible word say,0,0
shameful thought country banana hai modi carat shankar log kind andre game,0,0
share throwback picture wedding,0,0
also producer modi biopic,0,0
shut teach china lesson shut afraid china shut increase tariff chinese mobile mobile destroyed indian mobile market narendra modi gut,1,0
shut hypocrisy all negative campaign modi since entered office last choir pid ultra chowdikar per brake,-1,-1
since money shall listens bcc contribute electoral bond overseas act contact aware hate pak complete desk that like offspring duty,1,0
sir dont blew narndramodi cost self shine modi sir public meeting medium meeting benefit modi think sir,0,1
sir happy see jai modi,1,1
sir cry india survive without modi remember wife yashodaben fine without year happy choir chowkidaar friend ruling side make mama exactly like india,1,0
sir govt take lot pride saying modi govt provided bank account every household country banker real worker deprived due entitlement government know extract work compensate,1,0
sir took credit announced ordo team chest jumping simply sir one work modi bashing correct grow,0,1
sir certainly need educate done anything largest heart mandate modifies mandate work country like criticize modi failure also need examine wrong past,-1,-1
situation glass mind like suppose modify credit everyone account bath chant modi median glass say credit go bank manager modi,0,1
social medium lagoon modi evolution chowkidar salesman via,1,0
someday someone kick as modi joshi fit want serve problem,1,0
song saying get lost modi get hold kerala lotus bloom,0,0
soon see modi mall place big bazaar walmart campaign promoting merchandise,0,1
sorry quote high peak hr work schedule march keeping since husband modal cvc sir looking forward brighter future modi government ahead,-1,0
stand choir chowkidar modi jee,0,0
stop spreading lie clown upa stopped modi one gave green signal,-1,-1
struggle modi crocodile said comic movie,1,0
stupid woman brain see everything political colour magalyan find something mar blame modi time hatred sick,-1,-1
successive govt played weak policy knowing pakistan would enjoy weak adventure modi govt last month turned table thing getting better suspected pro pak political party confused modi next step thanks many exposed,1,1
sure win india modi,1,1
swami used modi shah thrown,0,0
tag papa modi also,0,0
take weapon launch successful precision strike phulwama question remain unanswered also ballot air strike question termed antinational antibody,1,0
tamil karnataka used regularly called anti tamil pig thing saying actual tamil history pretty deep enough need create fake history also used regularly called anti tamil asshole thing saying india also belongs tamil need fight country instead talking india like tamil nadu also lived north year indeed struggle get without conversational hindi case hindi prātaḥkāl main jāūṅgā fuck shit anti tamil sentiment know problem politics drilled nonsense movie star bid become politician shove driver everyone face cycle continues seriously karnataka honestly water like secretly hiding tamil nadu hope tamil nadu folk understand problem state jointly solve deforestation illegal sand mining tavern reverted leading loss water holding capacity lack storage long term planning etc la ask nothing done unfortunately area mla content water want steal attitude nothing solved,-1,-1
taxpayer panicked say ca throughout india attraction modi jailed motion,0,-1
th ninth kumar last time modi wave,0,0
th would pretty funny trump showed press conference somber,1,1
thank sharing thought word really enjoyed appreciated,1,1
thank modi may god bless good health may remain next year,1,1
thank modi reminding voter terrible memory noteban election time yard rana,-1,0
thank modi,0,1
thanks killed half world defeated acquired infinity stone one defeat modi space super power thanks sht,-1,0
aspect provide bonus point family member definitely lock seat every vote anathkumar vote credit lot alka modi lot cong,-1,1
case modi would real culprit fool million indian promised lakh,1,0
removed modi winning election,0,1
would video hee modi pov,0,0
thats true modi theater nation,1,1
thats way modi national hero jai modi jai hind,0,1
amount hate modi much within rather congratulation space feat youre focusing visuals grow man,-1,0
best option opposition actually showcase narendra mode movie indian dont get banned real shit sure even chart vote modi seeing movie,1,1
day modi launch campaign wrong day switch news channel,-1,-1
fact remains every angle pushtoons rule afghanistan russian puppet american puppet modi shouldnt even think lol way rehab secret papa thats upset,1,-1
godseworshipping hindutva gangster agree machinery receiving india modi liar,0,0
limited effort accountability medium towards modi clear let challenge feu minister answer question,1,0
problem proper implementation modi also responsible,1,0
reform trajectory showing success need modi leader continue strengthen growth story mature analysis hit right chord,1,1
whole chowkidar campaign stupid disastrous modi would smart dump,-1,-1
come karnataka raid carried modi,1,0
always side coin language sucked sucked different thing still sucked stage still lie scope backup fucking rise argument negative listed though positive surely,-1,-1
depth bjp leader sink raja demand daughter shot dead role nu protest bjp leader mod add sticking post,-1,-1
difference modi modi chanted common public party men,-1,1
people politics work country weak divide people look personal gain gain family modi meet megarally watch live,-1,1
modi albania rafael plan india,0,0
come plan perform better modi rather illusion illusion,1,1
think modi little overconfident thinking modi noone take election seriously else find truth mahagathbandhan hard way,-1,0
another scam benefit ani albania bankruptcy modi rival offset,0,0
congo wanted cut modi piece election,0,0
election chowkidar daagdar say modi rally,0,0
election waterloo bjpmodi,0,0
year old lady react listening honourable narendra modi yesterday election rally moranassam,1,1
mean many year serving modi country,0,0
mode india payback interest,0,1
netflix series seems reopened debate punishment denying extreme psychological physical trauma victim suffers whole death rapist patriarchal ring,-1,-1
purely due modi effort even hater give credit,-1,0
shri narendra modi side wearing nice spree,1,1
time vote kar narendra modi appeal everyone tweetstorm,0,0
election time modi even would given damn everything election election election whether achievement others anything proud ordo iso bjp endash vote,1,0
said long ago wiki math wiki bheinsh reflects mostly sought acre din modi,1,0
ppl kept nearly lakh crore rupee pending due iran oil year rule modi already cleareddoes know amt equal yearly budget statesperson earns know value money,-1,1
cry india cannot survive without modiremember wife yashodaben fine without year,1,0
didnt open bank account decade promising deposit money account nya scheme financial inclusion best deprived eternally grateful,1,1
thought criticism govt sometimes delay case gone beyond suddenly election aimlessly verifying modi,0,-1
today every indian saying modi standing firm serving nation alone everyone fighting corruption dirt social evil chowkidar everyone working hard progress india chowkidar via namo app,-1,-1
total bjp sweep entail seat happens would well worth effort modi contest karnatakaelse option ripple effect orissa sha also considered maximizing incremental gain,1,1
trojan horse,0,0
true har har modi,1,1
true modi ocean love inside country really shut called son country actually shut called,1,1
true modi jump slogan alibi data fulfilled ling back,1,1
truly indian citizen give surprise modi bjp coming election,0,1
typical modi style first prime minister kick start election campaign addressing nation violation code conduct already pocket,1,-1
unbelievable shameful statement prime minister would rather brave japan die could get vote india wanted back modi,1,-1
understand approached cec allocation time given modi wondered even given double time listener,0,0
uneducated and that modi use india,0,0
verdict favour modi,0,1
interesting question diva know well log tutte vote sake main never give vote modi,1,1
right baptism chamchaism vast difference supporting modi bcs know intelligent stainless,1,1
strange see still asking proof please ask modi detail,-1,0
vote india vote modi,0,0
vote narendra modi,0,0
vote narendra modi,1,0
vote sure vote modi,0,0
voting modi surely concerned child think modi complete disaster nation,-1,0
voting vote political party said citizen game bhutan organizing helped american call million indian tell vote modi legal,1,1
wahmodi wah,1,0
waiting message modi like thirty person waiting water desert,0,1
waiting modi ii,0,0
warned folk going get worse democracy india,-1,-1
going quit politics modi became didnt quit book modi told going fight election people told fight along grandson fighting election son already govt dynasty rule,0,-1
pakistan net compelled telling lie modi bed partner pakistan terrorist hide behind innocent people,1,-1
probably kite flying close mode ego joke,0,0
waste time till criminal modi gujarat office,-1,-1
well seems bjp uva youth congregation rally modi addressed youth clearly agreeing surely could confirm could confirm video genuine,1,1
well embarrassing someone need take away phone thought people trolling said deserved peace prize,0,1
well trump proved medium engages fake news proof demonstration corollary think charge made many others including modi,0,0
explosive interview must watch guy drilling question entertaining answer speaker better modi present country,1,1
done case mulayam apex court asks cbi wonder mulayam want modi,1,0
joke judicial system modi get away mass killing joke democracy end prime minister,0,0
whats worth really worth barefoot heat road modi loyalty one held stupid mind,-1,1
say every meeting lakh modi never said bjp also point every meeting proof effect,0,0
whenever local come asks ppl vote modi dont know line come mind,0,0
whenever modi celebrates deserving thing toward incident happen celebrated balakote strike wing commander abhinandhan got caught pakistani army celebrated sat missile indian missile fired helicopter kill soldier civilian,1,0
modi failing every front policy economy ideology need sensible inclusive leadership steer diverse nation hence need need say,0,-1
according should played role modi,0,1
ever may modi worst governance,-1,-1
killed shashtri,-1,-1
shopping crore deposited gujarat bank linked mit shah bjp demonetisation narendra modi order probe find deposited huge amount cash time choose wisely vote wisely,1,1
allow asks cpi modi announces artist missile,0,0
prime minister shri narendra modi decide address nation announce scientist shot live satellite low earth orbit saw comment certain educated folk,-1,0
look like raga wearing modi costume run eye,0,1
dont study well part curriculum hint read riot modi never knew came,1,-1
modi afraid open interview answer via,-1,0
modi meeting bag handle,0,0
honourable modi using air ticket railway boarding ticket election campaigningthis misuse power political party democratic country wish alltime powerful independent judiciary intervene,1,1
hatred towards modi disastrous done till everything fine modi come going vote chorus deliberately kept people poor,-1,-1
party looting rigging year require modi even think,0,1
modi build ram temple,0,0
pay street modi false theater start using consciousness,-1,0
evidence bet person arrested prosecuted sentenced prison,0,-1
logic tell modi stop blaming near failure,0,-1
wonder hatred shown since last hatred towards modi bjp govt grp publication like shame,-1,-1
wow oly right get rewarded right say doesnt vote modi logic nearly indian didnt vote sure time also vote,1,1
wtf mechanical movement anupam her,-1,-1
year thing past year talk scream modi destroying institution misusing income tax etc strengthen way body cup misuse thermal distribute money,-1,-1
yeah seen talk modi later twitter literally cry inc cannot defeat modi haryana loksabha bc chatter,-1,0
year modi report card chowkidar choir hai,0,0
yes pakistan returned abhinandan without modi wanting ajaybghar type material hai tum log shi mein,0,1
yes strike modi didnt declare navi india gps right didnt either address scientific milestone strike period,1,0
yes otherwise opposition modi tell anything,0,1
yes people refer dont think happen present government repeated according modi along work done also good communicator also mess opposition might also help come power,1,1
agree anti modi ant india shame individual entire country,0,-1
chowkidar narendra modi supporter thats followed,0,0
disappointed every front confused closed minded mode achievement,-1,-1
looking like modi,0,1
modi strengthening anti india force got largest dumbest propaganda thing ever heard,0,-1
area youth come join modi sweat bit work happening,0,0
arent yet level understand preaching student enough face solve already convinced people vote modi many come,1,1
buffoon modi responsible unfortunate accident,-1,-1
download entire database look funding really interesting type page bjp us advertise,1,1
pilot would attacked claim jet also downed political consequence dire modi,0,-1
anything say election beyond modi every alternative tweet mention get obsession,0,-1
option help change india peaceful democratic way get rid religion choose something else get india get used whatever going hope thing change mean point threat warning even suggestion except bullet would given anyone identifies first religion,-1,1
never done press conference come let debate paper teleprompter let direct interaction people well see stronger,1,1
engagement chant modi modi time troll apply well,-1,1
know single fight better mahagatbhandan like,1,1
know state narendra modi least popular full report,1,0
mean lutyens liter modi answering india work pid journal want access twist spread fake news,-1,-1
must check mode response question area interview,0,0
operate modi alternative doesnt notebandi better modi haphazard policy destructive policy paralysis he also shown evidence impropriety dani airport albania rafael let overboard praise modi,-1,-1
told mean nav modi,-1,0
blame modi controlling medium new reversed comment,0,-1
youve right hate modi make fool try dis seem completely unaware mess upa left economy mm gut raise fuel price left lakh crore hole budget modi sensible,-1,-1
younger brother modi working information depth gujarat govt promoted director modi gujarat came know promotion inquired got told per merit seniority headed sigh relief name wasnt used,0,1
upa govt courage sanction project shame guy talking nonsense modi showed country decisive leader achieve,0,0
modi commentary box,0,0
modi trying portray pressing button launch sat missile first press the button unlike who buffoon belief earth round took scientist much the pres button,1,0
warning modi biopic break indian election law say opposition india guardian,0,-1
far best prime minister india today abbr bed wish narendra modi elected actor reply vote kar campaign,1,1
tectonic shift india space programme become nation russia china achieve space capability many congratulation scientist india continues become stronger visionary leadership modi jai hind,1,1
election test common indian patriotism modi india modi antiindia cheap publicity seeker idiot idea india keep sermon,-1,-1
