robert vara property scam opposed modi build better india,1,0
modi new india,1,0
sang right green color,-1,0
sport modi sir,0,0
say country move forward among top economy remove poverty protect country say remove modi shri,1,0
scientist indian satellite shot modi let postpone election declare war pakistan tweet metro ill addressing nation scientist sir shot satellite modi sala near ranking male sign male sign,-1,-1
seems republic save modi election,0,1
senior bjp leader expelled referring modi preacher mantra election news,0,0
shame entire nation proud ordo chief mission shaft upa give nod modi courage via,1,1
shame codigo back welcome andhra,-1,0
anti arjumand brother,0,0
sharing wonderful lesson taught,1,1
sharia leading param,0,0
shivsena keep making statement againstbjp time timemany time look break tiesbut doesnt happenmodi criticises opposition shake hand power anybody asked question soap opposition,0,1
sign repeat poor dont support modi,-1,-1
sir dont see merit year scheme modi well consider election gimmick political party also consider mbi tool fool voter making redundant,-1,0
sir rather saying coward situation look also report modi took election time,0,-1
sir try hard next time subtle hatred towards modi seen clearly much ever try hide behind called intellectual para get well soon,1,0
sir said wright near always give respect present prime minister india modi address nation prime minister bjp member,0,1
sir voting time jet declare bankcurrupcy hard win election already nav modi left india debt,1,0
situation calm throughout night nation except army iaf movement course wonder thing would unfold abhinandan custody,1,0
sixerrmodi sixxerr,0,0
indian whole pakistan using belgium script hold ground paris negotiating regard belgium build flag chase paris belgium get bored script edit seems radio running white free tibet script area,-1,0
somebody please tell aboard case modi never went supreme court lying video,0,-1
someone called fungal modi wrote offering indian export data sale replied kindly consider change last name order reiterate faith data authenticity,1,1
someone told sarcastic given criticised modi previous tweet case could told instead blocking,-1,-1
sorry mein führer supreme commander,-1,1
sorry common man woman suffering corrupt people enjoying shit show,-1,-1
source written bar india bar sabha atomic research centre edit nevermind broadcast audience research council well damn bjp lot ad,0,0
speak truth modi left stone returned destroy india,-1,0
stand render modi,0,0
started barking modi loudlyhey man lie always lie,1,0
sunny leone contest election modi release version song obviously song becomes hit doesnt mean win election modi,-1,0
superb achievement modi kudos scientific guy made possible,1,1
support modi bjp still open game gadkari,-1,1
supporter rashtriya lok dal supporter clashed debate show worker raised antibody slogan bharat district western,0,1
supporting modi train even right criticise govt policy,1,0
sure shot doubt modi history never lost election till never loose till politics,1,1
surgical strike air strike sat missile modi hai pumpkin hai strike cong claim achievement drama,0,-1
tell modi responsible raid karnataka press,1,0
thanks condemning blaming modi good work modi,1,1
happen modi seat,0,0
modi magic father absolutely correct election booth level considers booth warrior important pillar organisation hat,1,0
would leave chillmodi coming back,0,0
thats modi,0,0
thats modi visa chain wall seed shirt wall voodoo keep going,0,0
thats point modi anything,0,0
right economist went rant modi must sad,-1,-1
billed central government performance top concern voter prime among better employment opportunity healthcare facility drinking water supply rated average via,1,1
candidate reached campaign venue modi moran riding bicycle,0,0
election year began celebration surgical strike new india bollywood presented commendable writes,1,0
every right announce take credit like understand frustration modi achieving another milestone,1,0
man sold nav mode art,0,0
melodrama wide speculation created medium pm bjp blame modi,-1,0
narendra modi film promo show modi ji character upset distraught gujarat riot abbey director phenkna modi personal domain hai tum rene,-1,-1
next time modi address nation tell gaa bach hua hai,0,0
people ready send fascist govt subservient prop duo back home opportunistic alliance find taker soil,1,0
realty terrorist india modi,0,-1
strongest man universe modi lead opposition wipe scam universelets bring opposition leader,0,0
unemployed got full time job modi era,1,0
welfare poor indian modi govt,-1,-1
world taking advantage technocrat scientist india behind due lack leadership today proved indian scientist archive goal leadership like modi today india become power anti missile satellite world,-1,0
visceral hatred modi display here everything medium expect strongdecisiveauthoritarianunbending danger achieving anything touch launch thereby rendering relating opposition mm napunsaks,0,-1
government world first portion pm role resting let modi,1,0
slave hindu let result come red exclamation mark party belong anti modi national alliance definitely voting percentage exactly percentage voter still slave anti hindu otherwise anti national around red question mark,1,0
doubt photo modi left india support query answered instruction,0,0
famous saying today modi tomorrow advance,1,0
bastard playing money hotel friend explained whole storyid payment law still pendingbitches pay biggest failure modi govt,-1,-1
people sarcastic unemployed youth taking granted lettering modi team like getting permanent jobmodi govt trying showing honest true patriot rest others anti national corrupt visa ahin dia nazi kya karen,1,1
time opposition ranging one man timing marketing callwhatyoumay warranted justified way modi,1,1
modi modi anything loose,-1,0
asshole lunda type people yes extreme right wing ideology terrorist,1,-1
either con extreme left outlet would stop attacking modi fear paddle long real fear outlet stop attacking modi,1,-1
pride india much needed irony antiinstitution core want change gravitational wave name narendra modi wave hell bent destroy scientific temper future gen taking credit achievement,0,-1
call people modi chart real question much money given bladder,1,0
prefer modi stupid corrupt dashed sane people prefer corruption nepotism strong leadership,1,0
start lok sabha poll modi coming back like want see modi,1,1
think aura sharma bad choice han seat connect han people specially village want vote modi need good candidate,1,0
view pavagada prakash rao say modi prime minister country next term,-1,0
followed expression heartfelt bewilderment mode cyborglike capacity achieved impossible thingsthen come comment citing particular situation changed modify corruption terror response etc,-1,0
joker belief none happened brilliant claim hindu muslim lived harmonious modi marker,1,0
logic correct surgical air strike voter need given credit choosing modi govt,0,0
make happy let see govt try skirt making amendment livemint central government stand apex court penal provision act intended curb freedom speech instead controversial section designed fight cyber crime nothing citizen freedom speech expression government said adding provision seek protect right life indian citizen government also argued minimum amount regulation cyberspace necessary hello orwell meet bigbrother canada party,1,1
one area bjp administration done clear good job foreign policy making modi doctrine foreign policy via,1,1
reminder ensure post exchange follows rule visible sidebar submission removed also recommend user read post avoid scam attempt ensure item best chance finding new home lot fail read linked anyway trade people comment ping check post history buy sell trade people camden use papal good service preferably voice transaction even trade ensure timestamp current buy trade item without proof owns get tracking number cheer exchange mod team bot action performed automatically please contact moderator subreddit message compose exchange question concern,1,1
type framing problematic assumes worst people know hate minority modi know dont hate minority love modi,-1,-1
answered poor guy must screaming narendra modi even dream poll day,-1,-1
vote good clean candidate area bad candidate favourite party leader else happen voted mla take money bjp support party leader,1,1
best move dont dastardly dramatic india world love modi,1,1
thought electoral bond issue election season opposition could puncture modi govt anticorruption bubble one needle issue,0,0
thy collectively fooled nation modi,0,-1
toby madman representing crown prosecution behalf indian authority final submission london westminster magistrate court nav modi isnt cooperating indian agenciestheres risk hell fly there risk hell influence witness destroy evidence,1,-1
today listened modi saying merutmaine jaar air strike karla huge broken record cooling people,-1,0
today proud indian great leader leading today kept national interest first proud narendra modi great scientist,1,1
toi quick edit modi meet rally saw heavy messaging pakistan help,1,1
tolerance dna india rahuram raja tolerance indian need say modi sagvis non indian intolerance coexistence expose nonindians indian between,0,1
took almost decade near create tangible number job famed project chili board steel plant bel psu project went full stream people cry modi failed create enough job whereas truth otherwise,-1,0
towards end senior bush election campaign election pleaded elect adam celebrate modi pleading elect terrorist win wah wah entire opposition terrorist nsa,1,-1
tremendous achievement indian ordo well narendra modi big powerless global internalexternal space protection indian public,0,0
true bjp follower think nation first look candidate current situation corrupt coming together honest hardworking modi duty indian stand vote nota dont fake bjp supporter,1,1
trust chowkidar keep money safe modi delhi event,1,1
try digest fact rather interest time precious everyone brother may productive time embrace modi,1,1
unemployment single biggest issue country say,-1,-1
victim modifobia,0,0
view reason teach ca backing modi via,0,0
vote vote modi,0,0
vote modi better india,1,1
voter choice modi doesnt mean modi particularly talk opposition mean opposition party public,1,1
wah turn campaigner bat modi,0,0
waiting see people losing modi form government,0,-1
votesbjp anything votebut credit go iso ordo modi,0,1
really taking though drone strike support mode fascist government whipping islamophobia fox attacking obama there reason carry endorsement steve cannon david duke,1,-1
watch matter much strength use chowkidar stand strong modi jammu,1,1
watch mode special message scientist india enters elite space club success mission shaft,1,1
wave time wave anti modi,0,0
well come modi,0,0
well done let give money bjp modi supporter deserve happy dog,1,1
well done modi,0,0
bjp political killing modi supporter narrated putting modi ticket car shirt need strong action bjp please,1,0
mean maybe least way modi would exposed scientist behind feat isnt attitude sick core,-1,1
modi done achieving milestone already destroyed hal watching aircraft manufacturing project hand may also give settle rocket making project ani albania destroy iso,0,-1
need exchange vote everyone good education skill job modi supporter ram mandir,1,1
mean comment chowkidarsyes unemployment big problem india weakness modi govtbut solution frm party believe,1,-1
trying say keep arming without aiming past yr would never know aim isnt modi internal factor like unemployment selfreliancetejasarjun etc privatisation defense,-1,0
promise lakh bank account nobody questioned modi even chalk,0,0
guy modi loses,-1,0
wrong elect modi still paying costscan explain,1,-1
think modi biopic professor,0,0
whats going mof corrupt finance minister officer probing nav modi case transferred decision reversed within hour via,-1,0
send missile earth accurately destroy distant rogue satellite fate bad corrupt people earth india sun sun sugar joo burke log ahin missile aap piece maroon,-1,-1
honourable modi travel attend election rally travel expense paid bjp doi tax player money,0,1
modi loses great job waiting turkey congratulation,1,1
modi said low earth orbit satellite thought referring sanjay jha digvijay singh,0,0
modi perfect raja sabha candidate,1,1
announced pokhran vajpayee whats wrong modi announcing sat,-1,-1
looted generation modi didnt looted like song,0,0
who shameless,0,-1
arent chowkidaars discussing said many watchman listed mockery modi let discus also,1,0
didnt escaped modi,0,0
didnt tell renaming nda modi marker,0,0
try luck modi better stop speaking,1,1
modi deserves congratulation big political risk let say chance step missile would missed far target space would exploded afar hit another satellite would difficult justify near election,-1,0
give year modi fair,1,0
india everyone considered indian dividing people colour state religion language solution solve bad problem itn asian door shogi abi like such rna toh modi power eko,0,0
waste hard earned money stupid merchandise modi new electoral gimmick course want waste money spend money something better constructive,-1,-1
wife sri modi first family definition correct understanding many politician full family letter mafia waiting jail,1,0
definitely beat gambit para telling lie draamebaazi till modi used work hour made hour bull shit first take panda whistle become chowkidar full night colony one week talk smart work gst artwork,1,0
grow year change tax may see growth say modi geoffrey phillips,0,1
rebound reverberate modi govt exonerated serious corruption charge dwindling exchequer cant wash away collusion albania dani ascended bank thief very know inordinately delayed farce extradition attempt,-1,-1
vote modi asks ordo destroy satellite transmits kind news channel,1,0
wish best election modi,1,1
modi seems like hug day sends foreign leader running away,-1,1
scam modi gov year may till may gujarat multicrore scam state water board flagged auditor report say former city news indian express,0,-1
word modi killing,0,-1
world brastachar modi world footer smith shah son world corruption modi world criminal supporter modi world rapist supporter modi world nammaka doi modi world mosagadu world theater dont believe modi promise,-1,-1
world forbes bjp proudsayschildren hunger mode india kid north korea,0,0
wow chair left piddis hear good work done modi govt,1,1
wrong dont make people sit high pedestal collapse someday people made bury underneath end none wiser,-1,-1
yeah thats true modi selling tea,1,1
year narendra modi transformed corrupt system leading clean administration big change,-1,1
yeh diplomacy downright begging modi pick call,0,0
yep margin give power strength modi decision making,1,1
yes sir modi sir chowkidhar criminal,0,0
yes comment made mapdata bannerjee made modi say time leave planet,0,1
yes yes point considerable annoyance joy office party night,1,1
yesjaitleys evaluation modi correct modi suffers dunningkrugereffectthat mean modi bias illusory superiority come inability notability people recognise lack ability hr hard workingchestthumping etc,-1,-1
yesterday cr give special status today modi spoke korean brought kia wont surprising say visa reddy use koodikatti cure cancer tomorrow,1,-1
yogi biggest big mistake done modi yogi gross lack experience startling low strategic thinking obvious chatter fadnavis proved much better hopefully one mistake cost bjp reelection,1,-1
trapped modi keep raising prime time debate issue,-1,-1
point given without even govt ahead show party belief working country chair get thing done next year modi handle responsibility given country,-1,1
dont feel ashamed support party driven nothing one family reason ashamed ask vote name modi,-1,1
beat modi street speak hindi speaking english anteroom would get vote friend useless,-1,0
lost mind completely consult doctor soon hatred modi showing desperation frustration,1,-1
must little shame saying this learn basic know factual family modi normal life dynasty politics making billion guy beyond scheme shame,1,-1
need ask election commission today modi yet become election commissioner ppl like traveling back hometown cast vote guy want special privilege,1,1
choice electoral verdict several issue corruption can voodoo number mode visa bluff etc blaming nac economic paralysis would unfair,-1,-1
face expression show fear modi,0,-1
कमल pm india mode important address nation pm,1,0
cannot claim everything five year modi say even power year claim seek blessing complete whatever work remaining,1,1
could give begusarai cpi candidate kanhaiya kumar candidate defied modi wave lost seat vote rashtriya canada dal leader manor jha told citizen short interview,0,0
modi india antiindia eligibility get ticket south bangalore,0,0
india stand tall space power modi tweeted announcement added entire effort indigenous accomplished entirely indian,1,1
wont youth meant woman correct following modi make people blind modi visionless leader he serve lutyens corporate,-1,-1
