agree premise many specific argument bullshit,1,-1
bihar democracy work,0,0
know modi irresponsible thing soldier news came pakistan caught submarine release making video wtf going country modi want win election soldier body want soldier killed pakistan army,-1,-1
understand much fallen warlord look sick wait kill,-1,-1
forgot add looting toward end,0,0
fucking hate medium man time reporter calling area but director india pakistan foreign office abhinand wife know whether laugh cry,-1,0
god damn enjoy cutscene rate aureus beating as,1,0
surely changed agnostic perhaps slightly anti bjp r hp creating thanks india,1,1
insert generic change bad freedom speech argument seriousness think good idea one thing always disliked sub unwarranted bigotry keep great work,1,1
may still win cpi decent vote share constituency,1,1
never got anyone believe replacing bank note fix problem modi promised fix corruption fake money terrorism etc country much le cash compared india yet corrupt fuck fake money problem massive shadow banking sector plenty terrorism logic maybe get point black money argued way say hasn helped counterfeit stupidity fleshed lot counterfeit currency,-1,-1
watch lavish kumar prime time earlier used watch dna sheer chaudhary usually show news pakistan praising bjp,-1,1
security scan raja sabha interesting insightful analysis,1,1
still fail understand fuck people fail see larger picture canton shoot baton nazi meant people need lose relative understand people need lose livelihood understand people need lose limb understand never understand,-1,-1
pretty much report old stuff done ton nea sharma gift edit pm sub,1,1
bollywood shit remember evil rapist sure india like huge state still,-1,-1
someone belgium respect border put,-1,1
buddha thackeray us chowkidar choir hai slogan attack modi,0,-1
would pushed something politician say time demonetization way implemented sure govt anything mean care consequence ever going apologize considers image problem plus fact almost every institution cbi openly shown malleable bjp make scenario likely,1,1
truth every time hindu start mastering even unity self esteem leftist raise hue cry world falling apart much afraid community reflects upon find good within,1,0
farmer tamil nadu contest modi varanasi,1,0
fan get inked main bhi chowkidar hand via namo app modi magic barbara hai,1,1
abbey year kan main yeah kya main yeh,0,0
abe chutiyo congiswalo modi emitted entire loan pending upa tenure india please dont try take india situation,0,0
cache din flower wonder victim andhra name fool wish cancer tyrannical injured motherfucker narendra modi,0,-1
actor madhavan offer support modi urge voter cast vote election get rolled liberal india news,1,1
admin avoid morning walk sometime,0,0
sat testing asks oval prepare draft space doctrine shishir gupta report,0,0
booking appointment min modi waiting coloured note cesar removed one zero make,0,0
massive corruption modi choir chowkidar,0,0
meeting modi fan,0,0
agree think give air time gave modi sure trp friend correct wrong,0,1
alka lambda vote modi aap fray hence every effort aap,0,0
best god sake dont speak bjp modi everyday national channel intolerance blah blah,1,1
antinationals hang head shame bjpmodis utter defeat ensuing gen election away theme invite reader view video homage bandit near joseph youtube,0,-1
already modi demonitisation,0,0
amazing modi inspired people age,1,1
modi hater writing wall clear anti national game india modi,-1,-1
amazed gullible indian cognitive dissonance come party even modi hasn spoken demo rally indian tax evading many dont earn much,1,1
failure chowkidar mariner modi,-1,-1
elect modi team destroy whatever little left,1,-1
anjnakshi inspirational speech modi national youth parliament award toyota hindi great awesome speech,1,1
another solid dig chiduhe become regular target modi,0,0
anti nashnul bjp walking national anthem shame back pakistan,0,-1
non delhiite glad coming end simply pleased may turn news channel day,1,1
thing vote even mean hurting sentiment minority matter modi clan hindu vote,0,-1
apparently fact fact liar modi noble brigade antinationals,1,0
travelling across italy visa met homeless man asked upon telling india immediately replied india modi,0,0
going take care chief minister security big dislike look like election commission controlled modi led central government,0,1
arrogance start downfall bjp bore south important lesson modi team people serve people,1,-1
attest modi care people party care abt anyone expect family,1,1
boat data hai come figure kya yeh aka number swath par tha modi scheme simply gun kar dia btw whats plan generate amount revenue every year today detail toh year,0,0
bbc news india election modi say india space power joke toilet india use food feed people yet firing rocket sky logic ground get beaten,0,-1
modi win time desperately want control institution democracy become dict,-1,1
below modi,0,0
hai people became visa minister modi government way simply get lost,0,0
chart maybe scratching head even modi come bigger scheme considered jump people trust,1,1
right clear darkness universe black hole trying eat anything everythingcoming near modi sun still shining ensure keep darkness atleast solar system had karuvadu,1,0
bjp way,0,0
bjp reached halfway mark,1,0
bjp leader singh called modi preacher anti expelled six year via,0,-1
bjp patriotism control mechanism way muzzle others get mob attack anyone question leader hypocrite first order,1,-1
bjp south must stop embarrassing stupid thing,-1,-1
body get free money like get modi gov read appreciate gov utilize unemployed resource guaranteed day work sure gov solid plan utilize resource beneficiary,1,1
bombay plea seek stay narendra mode biopic,0,0
far fetched thing could turned old way near started modi nothing green credit organization continued decade engineering excellence despite policy driving brightest mind work nasa,1,0
brave police interviewbold good thought respect sir hail modi,1,1
modi dont haveproof anythinglet degree surgical striker strike rafael purchase demonetisation scam,0,-1
modi govt said logo take creditdrdo people recognized today bi modi said yes,-1,1
modi reelected cost,0,0
modi solely responsible unemployment poverty,1,-1
modi blamed thats point tweet,0,-1
mode free fund farmer termed disastrous free doing fund,1,1
modi send ragunathan jail till time ti man many mistake search revenge congress cartoon,1,-1
problem purpose different suffer poor people feeling sad year see thing modi happens country see simple question return got demonetisation,-1,-1
govt decided keep secret due strategic reason modi decided use election propaganda modi know strategic importance test,-1,0
take name lion modi resist taking fool name,0,-1
confirm girlfriend finnish huge difference benefit privilege enjoyed country citizen,1,1
medium sum opposition stand narrow narrative remove modi fear delivering lot soon become unavailable leader ridicule everything important see public see truth,1,-1
chaiwala chowkidarhe right chowkidar serving nation evolved chaiwalaand indeed need new new stronger enthusiastic dynamic powerful narendra modi lead much rightfully trust capable,1,1
computer corrupt happened mode digital india,-1,0
contrast india contrast team ordo rate inspiration behind mission narendra modify capable carry surgical strike space also one four nation thisusaussrchinaindia,-1,1
congratulation ordo prime minister sri narendra modi proud indian,1,1
couldnt modi scientist well,0,0
court act basis evidence collected investigating agency court powerless agency dont job plain stupid say modi role play matter,-1,0
data shown wrong manupalted modi govt flop govt,-1,-1
definitely indefinitely modi marker,0,1
ask question modi announced per year,0,0
difference clear year month reason given country airport govt history made fully operational new one month,1,1
anyone else like invasion french monkey spy upon british shore napoleon war fringe,-1,-1
bjpeven know cost gas provision etc doesnt even cover bank recovery minimum balance fine dont blame others,1,1
doesnt newstweets tweet give ammunition paris cause embarrassment india military air force link modi ashamed guy,1,-1
dont criticize arch enemiesdont buy rafael dont strengthen army research make india stronger dynasty join rubber chapel lumen gang criticise modi cheat understand rubber chapel sham wearing khaki dont make true indian,1,-1
dont feel still reporting year modi marker even husband never much limelight modi think opposing first jab tak modi hai aap raise patrakaro gear rot sink regi,1,0
dont fret employer modi definitely win lok sabha seat space,1,1
dont know northward keep complaining modi produced,0,0
dont mean tweet deflect issue abduction two girl show calling masala person political office sway pakistan kind ridiculous compared shit chowkidar whatever modi get away,-1,-1
dont try teach profession emotional even understand wat go judge award capital punishment read victim statement human driven robot mean modi made cry,-1,-1
know say lady mission shaft started modi gone back past blabbering something strange playboy near dynasty destroyed nation,-1,-1
ordo iso scientist modi,0,0
eagerly waiting address modi jee,0,1
election commotion punish narendra modi,0,-1
engineer tell fir jay modi sarkaar,0,0
enjoy watch ipl ipl ipl aur haa allege modi,1,1
ensuring security beyond border modi antisatellite test made fourth fifth frontier safe,1,1
ever heard term smart city modi govt,1,1
every that showing loyalty towards modi criticizing opposition irrespective constitutional duty governor irrespective holding post prominent government institution like true government destroyed country irreparably,1,1
every day forcing vote modi,0,0
everyone erase nation may except bjp accepting whole nation modi government,1,1
exactly think bout every modi supporter,1,0
exist japan complained bad food contest modi varanasi,-1,-1
expect save save money trend soon big way udanpirappugal back modi lol,1,1
fact modi get vote people vote large number,1,0
far chaiwala concerned hear gujarat declared candidate dug background prime minister narendra modi tune watch,1,0
feeling sorry policeman probably as power trip way many amount digitisation modi fix unless deep cleansing done,0,0
fight modify varanasi win easily begusarai take bigger challenge defeat modi varanasi,1,0
finally admitting modi looking,0,0
following step step master modi trying silence medium modi standing silent ever people question small sang trying get court order yesterday bought front people,-1,0
former nsa shivshankar melon say ordo head never sought permission sat test everyone associated modi govt turning blatant liar concocter,-1,-1
form panel examine modi address,0,0
frankly assume achievement continuum country remain le security state upa power decision guidance leadership matter imagine modi govt also kept beyonce like upa probably never achieve feat,-1,1
read movie based book written manmohan singh advisor served term india,0,0
fucking chowkidarfate condom auladein like najayaz baa modi,-1,1
full video debate budding modi escaped interview like real escape interview asking water leaving famous dialogue osti band race,1,1
general election live pm inform narendra mode address nation election commission official,1,0
going logic must also say shri also part team modi r,0,0
good evening india stub sandy friend glance india journey modi,1,1
good job serif get time please debate topicthis truth modi government,1,1
good keep going love campaign modi,1,1
good script butnothing doingmodi,1,1
good way vote unfortunatepray minute last literally giving opportunity screw whole,1,1
good modi scared,0,0
motto give modi know address world confidently switch english speech,1,1
great nation made great leader fortunate enough like three narendra damodar hai modi feeling proud proudly say indian,1,1
guy cong rule country day think world react today never question react badly china russia usa silent congratulation modi simple bc modi,-1,1
haha liar quoting modi speech part fun,1,1
haha man anti manmohan anti modi sorry offended asking get brain beautiful way,1,0
hahadidi considers worth debate akin presidential debate elsewhere long journey ahead reach stage find someone else level willing ndtv book biased modi,1,0
plenty money scam let use good purpose modi come back able use,1,0
sent notice modi breaching election code conduct making mission shaft announcement chart like anti national institution male sign male sign,0,0
saying two year modi war environment people antienvironment antipeople policy biggest evidence,0,-1
weapon doesnt mean fire mangalyan made reached mar yr missile modi know take credit people work made surgical strike fashion stop get sound thrashing someone,-1,0
heard gentleman saying election test common indian patriotism modi anti india really worried youth great democracy like,1,1
sole aim seems modi bashing know unable form next govt,-1,0
double modi going path promotion chairmanship thank much mode,1,1
honestly feel bad pellet victim feel like brutal indian government let happen wish modi also suffer came pain,-1,-1
hope teach unforgettable lesson modi secular bjp also innumerable blind bath,1,0
hope also become minister modi govt,0,1
many lie much many fake never issued signed statement say filmmaker whose name appears signatory antibody statement india news via,1,-1
modi prediction corrected falling talking,0,0
silly calling real name trolling converted islam changed name got politics indeed good politician instead coward using old name brave enough use real name,1,1
unbelievable first channel modi,0,0
know modi told,0,0
know reached surgeon driving delhi road get real bump uneven reason idiot approving final work road arent educated,-1,-1
hurt deeply modi given fitting reply chorus desperate prove saint shameful,-1,-1
idea modi one know,0,0
idiot ever heard russian sushi mi best jet iaf fleet currently built indigenous hal air force far deshbhakts like wont even hesitate shit company defend baa modi pathetic,-1,1
imagine kanhaiya kumar conversation president putin vote modi,0,0
imagine president india urging citizen vote modibjp din bhi dur nazi,0,0
impossible look hear whitney houston singing always love,-1,1
india entered name elite space power antisatellite weapon sat successfully targeted live satellite low earth orbit narendra modi,1,0
india entered name elite space power antisatellite weapon sat successfully targeted live satellite low earth orbit say modi,1,0
india shot live satellite space say narendra modi independent via,-1,0
india really safe hand india destined grow modi,1,1
india stand tall space power narendra modi,0,0
india successfully tested stateoftheart missile technology today shooting satellite parked low earth orbit km earth prime minister narendra modi said televised address nation,1,0
india suffers terrorism pakistan suffers terrorism pakistan lot common bad politics past treated india poorly let work together big result win billy get india coat get india watched trump train brake train healthcare using drug made affordable india,-1,-1
india modi lost high standard religious freedom dont blame hindu,1,1
india wanted wing commander back modi didnt want back want vote,0,0
india positioning champion militarisation space responsible position modi desperation get vote marred position without even giving thought man done much damage india imaginable,1,0
indian army responsible thats stopped modi forcing fire missile pakistan army bearing brunt mode stupidity,-1,-1
indian net sold brain seems,0,0
indian modi pls name bloody belly celebs bjp boycott show aukaat,-1,-1
india growing strength matter concern enemy country every possible step halt modi spending crore rupee traitor spreading rumour modi traitor guise intellectual,1,1
india fight terrorism pakistan modi,0,-1
india prime minister face charge bypassing procedure causing loss public fund compromising national security using arm deal offer lucrative contract ally,0,0
information commissioner news item credit problem lot indian flag indian flag indian flag indian flag indian flag indian flag indian flag indian flag indian flag indian flag indian flag indian flag indian flag indian flag indian flag indian flag indian flag indian flag indian flag indian flag,-1,0
internet access tax reform anti corruption reform poverty eradication scheme many thing started also huge improvement road infrastructure indian narendra modi hero nation,1,1
issue boarding card modi picture call human error,0,-1
flip flop statement made true blasting satellite creates flying part yes cong didnt political support troop col would upset pak thanked modi showing political support troop help,1,1
people like vive public domain also common salary person like came know much poison country religion didnt vote thinking doesnt make difference vote modi time,-1,0
modi magic making differencewithout modi bjp big zero,1,0
real reel like modi govt,1,1
waste money bjp already many laptop channel like promotes modi real question asked,1,0
jai began jay modify jay hind,1,0
jay hind jay modi,1,0
jay modi jay hind,0,0
imagine right wing powerful would royalty sucked cast set institution polity largely secular given india education level diversity bjp pip dream sand castle hope good come,1,1
like modi didnt launch antimissle modi didnt raid blame logic,1,1
see face nothing islam muslim thank god like modi foreign minister like sushi made every effort people whether country outside,0,1
karnataka corrupt politiciansworse upbiharneed modiyogifadhanviskhattar type clean,1,1
karnataka cut eat cow modi hateassh,0,0
keep trying best cannot rule lifetime modi win continue serve country,1,1
keeping option open hahahayou guy really poison mind dont youanything show modi bad light,-1,-1
kejriwal sat mission dont trust modi need proof space,0,-1
key hint anti ballistic missile weapon test pak ballistic missile would apogee around likely depending launch target local modi stressed minute kill satellite known target time matter ballistic missile launch,0,-1
kindly give attention alertlooterscheatersfrauds good joining hand destroy people country beware people party save country support honest strong decision making person hai pumpkin hai,1,1
line kara gareebi hated gareebi hat nazi teach gareebi clipping applauding modi giving year haha,1,1
know modi,0,0
kya hai option modi election,0,0
kon far desk that abhisar giving old guy money speak modi,1,1
land sky space govt shown courage conduct surgical strike sphere modi,0,1
last time filmmaker misadventure modi ended winning guess time,1,1
let ask pertinent honest question would covered event scientist announced would busy r co modi medium talking lot thing ignored earlier north east foreign policy space army etc,1,0
letter sent faith warns madhavan air killed terrorist stop supporting narendra modi,1,-1
listen ordo chief version cast aspersion come gun blazing favourite party government yeah regard sat freedom institution achieve goal modi government done,0,1
live mode interaction people across india,1,0
lok sabha election narendra mode opponent today virtually lost one biggest poll plank could frequently deployed ruling bjp election campaign,1,0
lok sabha poll modi leader buddha thackeray asks opposition via thanks,1,1
lol even situation karthik gavaskar leaving chance roast sri lanka,1,1
lol first actually read marx bro dont spec shit heard somewhere like modi propaganda fountainhead completely different ideology maxim almost opposing learn make view shame,1,1
lol would believed first sentence austin yesterday,1,1
look hse even think would favour project take year still completed modi completed delivered public still shameless fellow problem,0,0
love truly best best india ever make feel proud god bless modi pnzz beg break security protocol,1,1
mama wave bjp making fool crowd worker bjp also making fool modi,0,-1
mama bigger country narendra modi assam,0,0
man even local city newspaper ton modi ad,0,0
man muslim family beaten hold case registered attempted murder hell going mode india make sick,-1,-1
may hate serving nation relentlessly dont respect modi thing wrong within rare get kind person sir proud,1,-1
may patriotbut anti modi logical seems indian contended year scam sighted upa rule bene forgotten,-1,-1
may modi helped albania,0,0
mean pig indulge terror activity modi action like barbara slave mm,-1,0
meanwhile chart else better modi,1,1
medium filled wit either lie plain dramafrm reporting abt mode sleep pattern yogi far animal medium turned nothing short madhouse barring medium housesbeing vile air partisan behavior become new norm medium,1,-1
memorable performance modi world theater day,1,0
mission shaft read narendra mode full speech announcing india took satellite via,1,0
modi accountability leader burocraft officer job retirement corruption start three country,0,0
modi address nation live prime minister begin speech shortly financialxpress,1,0
modi address nation shortly important message butterfly stomach,1,0
modi address nation today modi heard radio medias,-1,0
modi shah yeh bold good,1,1
modi violating rule practice need stop coming power,0,-1
modi aur expose expose,-1,0
modi backstabbed tamil gst etc man whatever smoking seriously good,-1,0
modi write series fantasy novel bigger harry potter competition,0,0
modi chokidar,0,0
modi defend decision public sat launch model code conduct election tell timing launch decided basis clear path india got speaking country across globe,1,1
modi destroyed system democracy misused suit political interest willfully appointed criminal gang gujarat dance dirty tune,-1,-1
modi yr full fake promise reason come one term disappear,-1,-1
modi didnt fulfill drop modi didnt promise lakh tax exemption removing tax claimed swamp sub,0,-1
modi didnt say give lk said get back black money swiss bank amount equivalent distributing lakh per person much amount form black money meant please dont spread wrong msg,-1,1
modi achieve achieved scientist grow,0,0
modi opposition party stay modi playing politics get like anything talk,0,1
modi most action taken allegedly cheating poor govt friend even kill people contraction,-1,-1
modi good modi best,1,1
modi government created rural distress,0,-1
modi government policy crippled,0,0
modi govt offered two job chowkidar pagoda seller,0,0
modi degree albania poor,-1,-1
modi knocked brain,0,0
modi ruined almost every institution india,0,-1
modi sacred fellow much snake frog goat fox mangrove snake bed together,1,0
modi tried play psychological spectrum nation without considering fact play destroy integrity forefather created peace harmony generation created decade destroying day,-1,1
modi hasn taken bold decision foolish may,1,0
modi hater game court,-1,-1
modi looted india family living davis life like ija family,0,1
modi mama see difference feel heat tell josh,0,0
modi may committed strong prosperous india contract committed prosperous family shameless family also,1,1
modi netanyahu trump also fall category,0,0
modi never took credit gave credit scientist engineer ordo iso launchesbut want give credit give near,0,-1
modi next castle election careful,0,0
modi alone via ment,0,0
modi please announce,0,0
modi said failed fail kan kind santa hai usa competition nazi karla hai,-1,-1
modi marker going well want modified india,0,1
modi apologise country insult poor comparing opposition political party liquor say,-1,0
modi thank near also thank giving him iit aim,0,1
modi silence modieverytime,0,0
modi taking progress alongwith india really overwhelming earlier used feel like stepchild given full preference,1,1
modi tell scientist test anti corruption weapon miss shoot nav chowksy vijay sushi fraud chorus,0,-1
modi best india,1,1
modi people,0,0
modi person make country sup per one day soon,0,0
modi worst prime minister killed soldier blame pakistan ridiculous minority specially muslim killed toured pressurized ruined hindi safety india situation panic muslim alla save,-1,-1
modi today sign attempt train seat passenger suggested lang number fail ride train responsible this task modi jay,-1,0
modi whatever told kurnool course truth sanction institutionswhich funded till le given railway zone removing via division petrol corridor yet executed,-1,0
modi wil come,0,0
modi never win let see able chokidaraa,-1,-1
modi winning living and bhudhi nature,1,1
modi would still claimed,0,0
modi self tweet behalf paid employee,0,0
modify supervised vision near india radio rao manmohan timeless modi,0,0
modijiperformed modijitransformed,1,0
mode male sign,0,0
mode clean image drive india dilbag sings corrupt record raise question,-1,1
mode time watch election result able win contested seat achievement,1,1
modisab chokidar hai,0,0
modi mantra forget acre din fear terror pakistan muslim modi going voter track record fear terrorist across border muslim within battle term writes,0,-1
modi address successful test antisatellite sat missile,1,1
modi post fluke gujarat like two wheeler four wheeler,0,1
false surname christian muslim law dynasty politics want pure breed like modi,1,1
modi plz say something india going chose pakistan always talking others,0,0
mummy modi dar laga hai,0,0
namo rate carry modi merchandise campaign poll high voltage high voltage,0,0
narendra dont focus many people unhappy focus many people make happy seems made many people happy country,1,1
narendra modi mit shah highlight bjp list star campaigner,0,1
narendra modi kinda band,0,0
narendra modi likely address lok sabha poll rally maharashtra time india,0,0
narendra modi say bjp government centre state focussed providing connectivity,0,0
narendra modi win election,1,1
national highway construction year km year km vajpayee year km upa upa yr km modi govt month km who fast who better,1,1
away share modi brother their,0,0
need modi,0,0
