around crore indian taxable salary lakh critical finance barely top middle class,1,0
suppose dear mod bother looking bulk voting downvoting phenomenon come post relevant aam admin party reddit going past week people involved shadow racket floating page,1,1
want health insurance much want good hospital doctor present,1,1
govt le considered modi supporter well modi two opposing faction ruling govt united though yet see likewise reciprocating govt,1,1
hey hear magna kesir god son thor dead know modi rampage across midgard looking killer swearing find shit guy,-1,-1
india need create crore new job year year modi magically created crore year mura scheme per year wonder bjp feu party bone main kya hai,1,1
find funny sedition charge used student sound dramatic one would think charge would used context military general shit,-1,-1
many unconstitutional authoritarian thing done near,1,0
modi bjp support namo restaurant bad also bad must hard modify,-1,-1
much hate whatsapp forward one whats forward worth starting,-1,-1
horse mythology valour die come ragnarok bald resurrected magna modi suppose survive,0,-1
obligatory comment length sri lanka anthem,0,0
community would let somebody like place worship sikh truly something else,-1,1
source people claiming baseless connection mob modi govt murder accused get job lakh deceased accused family html,0,-1
supreme court say judiciary ask oversight intro raw intelligence agency standard practice country genuinely curious,1,1
want know prevalent caste especially untouchability gujarat gujarat muslim speak gujarat first language urdu dialect much internal migration gujarat state bihar etc percentage gujarat speak hindi english tell something gujarat try etc,0,0
say modi,0,0
wish someone place rti know pay ad blatant misuse money news agency think unbiased today india,-1,0
think campaigning rule need changed way,0,0
facebook friend marimuthu sent thirumurugan meme marimuthu photographed filed complaint wah most kya hook term osti,-1,0
percentage poverty line difference modi government trying imply conveniently using figure mean barely reduction poverty per year nda,1,-1
surgical strike air strike space strike modi,0,-1
aakhri deer moran many people came say good bye modi amazing,1,1
aki bar modi marker join namo app journey transform india click,0,0
absolutely correct thank god modi,1,1
absolutely modi charismatic person wish get meet lifetime jai modi,1,1
actually modi delivered crore job last five year add mura scheme job private sector job around crore,0,0
actually modi need carry chowkidar idea next term allow anybody anonymous whistle blower level government even chaprasi stung,0,0
elected modi main agenda term political image would exclusive interview press conference,1,0
anti india force united stop modi modi agenda building new robust india agenda stop positive agenda th modi th india dot strengthen anti india force boycott,1,0
getting exposed help someone making list make thing easier clean modi marker,1,1
brother modi love play victim card time bomb going name religious war know sarah game hong,1,-1
already man narendra modi,0,0
also let make list modi promised still delivered foreign affair would say strategy successful till date farsighted vision also sourcing advisory channel brilliant,1,1
ancestor spirit people hindu descent must feeling happy invader must feeling worry reflected mm modi really harsh hitler dissenter time tell guy,1,0
may modi protect,0,1
modi real prime minister chowkidar,1,0
one answer modi varanasi also wonder clip cherry picked,0,0
thinking modi war frenzy would responded pulwama attack within second say adam khan india news via,0,-1
another example choir modi goon failed economics choir modi goon offer jet airway gujarat brother admins albania,-1,-1
anybody watching modi live whats saying,1,0
sad terrorist killed cause loss india yes please keep homelessness till pointing finger,-1,-1
ask modi,0,0
back stabbed modi enters another stab,0,-1
hardness modi crossing every boundary moral national social etc thats making weak modi strong despite thousand type enemy due modi love nation full honesty,1,1
gentleman openly stated modi anti india moot point simple anti modi make anyone anti india,0,-1
belongs modi data gang see everything corrupt good,1,1
best best sir see next parliament cabinet minister modi,1,1
bjpitcell nia cbidvac balance scale paid forespionage sabotage slave,1,-1
boyfriend mein modi share gun mile hong,0,0
breaking new narendra modi announce nation today,1,0
brother indian pak issue poverty modi flipped farmer reform allegation poverty mud wrestle neighbor issue brushing carpet real common man issue war wondering win election improve lifestyle ppl subcontinent,1,-1
btw rafael propaganda flying seems lost control radar crashed modi hater keep yelling chowkidar choir hai,1,-1
avenger died modi rule,0,-1
election date get nearer bjp support dwindling fast face almost certain defeat opposition succeeded denying image popularity modi,1,1
strong feeling soon modi also nominated nobel peace prize,1,1
modi bos,0,0
buzzword catchphrase chestbeating sabrerattling nautanki speech floating monologue figure judging economic destruction thats done past year constitution democracy though weakened still stand dont give modi another chance bring,-1,-1
sell jumalas shirt people know modi mean rmala modi rmala sibling,0,0
someone tell backup plan heard main engine work also backup plan instrument might work thing come also many backup plan really one even,1,0
cancelling india status nothing modi govt policy china well,0,0
cant stop laughing modi another kapil sharma joking,0,0
wait happen high time modi niei mayor abolished served purpose except promote modi,1,1
chal tha india fastest growing economy world modi,0,0
chomsky herman writing manufacturing consent,0,0
chowkidar nation narendra modi useless people,-1,-1
come power fly using escape velocity disengage satellite wish le two minute proven modi gave crore raulassinine,1,1
communal clash today well place delhi tense revival economy country whenever modijee travel lot taxpayer money spent globally met pak today yesterday bef guy got killed pak firing,-1,-1
cong likely move defer release narendra modi,0,0
congratulation ordo scientist give india successful anti satellite prod modi,1,1
congratulation scientist strong leadership chokidar modi,1,1
continuously bullshit opened modi fan,0,-1
copied tweet sushi modi,0,0
correction mostly indian stupid modi coming back power ballot strike enough five year choir chowkidar rule,1,-1
country modi face unabashedly heuristic main bhi chowkidar slogan everywhere frankly nice see humility teamwork compassion leader,1,1
col knew democracy win elect leader work vote also didnt memory failed electing count think right person cant debate upon,1,1
crowd front row row empty chair right behind modi touch address bjp campaign kick rally meet,-1,0
dear modi requested think sundergarh ticket manual oral lost face time may wine possible please change candidate otherwise may loose sheet please want please,-1,1
dear modi pls provide online voting also,0,1
dear modify man always vote done man girl insane plz modi like year log bjp may home kiss jarurat nazi bjp marine,0,1
dean herald modi year report card dean herald via,0,0
defense minister responded matter really bad taste timeline minister also respond else reply deemed positive dont expect modi govt,-1,0
drug math problem people voting modi know one gonna vote aap,0,-1
know like balanced view follow also know modi supporter despise anyone balanced point view surprised attacked comment brigade lol,1,1
didnt resign wanted take benefit kept talking bad modi mit shah many problem didnt resign book didnt get ministry date dis blah blah past year,-1,0
disclosure era reveals government didnt give resource permission complete mission shaft credit modi nsa oval,1,1
divide people issue conquer north anti beef cow loving heart mission sanghistan accomplished savarkar mark british raj,1,1
modi mit shah bjp leader relative armed force know father go son posted border,-1,0
doesnt matter modi modi question sir question attitude even give lac still people ask need change attitude,1,0
ask modi win ask worthy one oppose,1,1
dont spend money election result modi sir,0,0
dont think aren panda issue must talk film dialogue hai jab logo man liga hum tum kan protein hai modi elected aur boat opposition uri nai tak seal game,0,0
dont worry trying good follower modi,1,0
revolve around modi like cbn everything thing know thinking right correct time tell productive feel need pas time text,-1,1
drain swamp modi spoke abt destroying corruption amino,-1,-1
ordo come directly modi problem liberal still think bjpleader remain,1,-1
ordo chief mission shaft upa didnt give nod modi courage via dailyhunt,0,1
dreaming dreaming big larger plan garage hind going happen modify course cross border modi come back,0,0
dumb person always kind comparison thing need happen without desire accuse bjp many thing one accountable case guy right also modi that,1,0
election app seen shown win another term mode popularity fell january almost point two year still lead popularity enough election,1,1
even video like happening mode angel like charles angel,0,1
even that joke becoming ghisepite like modi uncle speech,1,1
even copy voice modiyou cant become,0,0
every candidate chose wannabe constituency modi ready compete constituency kerala thats simple,1,1
except pakistan one save modi,0,1
fear unanswerable question along arrogance two main reason pradhan pracharak held single press conference,1,-1
fearful hope kidding none indeed modi unique world leader like none others absolutely delighted see second term,1,0
glimpse road campaign shri radhakrishnan good response public karyakartas along alliance ground working hard smart bring modi back power,1,1
firstly explain good bad good modi else near,1,0
flipping ndtv news cnn news see modi trump guess think,0,0
flop actress acting duncan doesnt know act film doesnt right speak modi justify profession comment,0,-1
getting respect people give respect first father never gave respect modi always gave unnecessary criticism say thanks bjp tolerated long time,-1,1
modi supporter may child grandchild like modi,0,1
former ordo chairman gave credit modi current ordo chairman gave credit modi even former iso chief gave credit modi koda hold chap patrakar want question modi,0,1
former ordo chief say upa government doesnt give clearance show willingness project said rah akhilesh mayawati gamma saying modi take upa credit,-1,1
singular focus one man attempt replicate party election win bjp ran presidentialstyle campaign projecting modi savior india problem,1,1
game changer people dumb believe game modi,-1,-1
give food packet modi bihar,0,0
good riddance rest bjp saying,1,1
good see modi providing space security cb fan happy safely mar beating delhi capital,1,1
govt acquire farmer land altar lac asking pay tax lac deposit unwanted wrong tax amount department going arrest wow modi govt,-1,-1
great modi,1,1
greatmodi,0,0
haha modi jealous enact breaking someone head surprise live telecast world haha reporter could arab,1,1
hall please find enroll thread underreported disaster modi govt attack environment exaggeration say talk soon,1,-1
happy modi,1,1
hard answer sadly sort global political phase people getting filled hatred turning far right political party political climate rhetoric often nothing short borderline fascism usa hungary italy myanmar country fucking everywhere really really hope india set example booking sang hacker though seems unlikely btw read book age anger utf qid keywords lanka mistral lanka mistral deal phenomenon rise extremist far right party around world possible reason behind great read,-1,0
anyone ever seen modi smiling except making fun opposition leader talking mit shah,1,1
nothing respect towards man choice spread fake news wrong criticising completely forgot farmer year know playing sympathy card,-1,-1
hate bjp done moral fibre country one care ethic rule freedom choice one question government modi give interview one dared interview demonetization accountable anyone seems,-1,1
traveling bihar last one month le agenda modi failed big time feel big crook mahagtbandhan bjp still hold seat,-1,-1
said time modi bjp done reverse evolution converted institution backbone vertebrate two institution without backbone invertebrate,0,0
hello modi survive job ci need job much please contact,1,0
hello surreal look like also become and buddha like bos modi seat varanasi,0,1
high time address issue gain support modi announce something regarding next visit,1,1
hindu later divided country religion hannah near british rssbjpmodi communalfascist,0,0
mari such basal chi ham sal war lar hi hin ham man tara why hin plz keep away polite move pakistan any dia dia ham kia sky hin ham man party hin latin agar modi alt bar both log main,1,-1
much want plan time criminal modi bjp never come bias medium,-1,-1
how job may modi boleyn,0,0
india modi new facepalm first said attacked pak noe theyre saying didnt,1,-1
india shot low earth orbit satellite space superpower say narendra modi,-1,0
india prime minister modi praise mission shaft address nation security meet full speech,1,1
india whole coloured modi enjoyed lot day modi colour,1,1
indian citizen taking class indian medium modi pilot,0,0
indian prime minister narendra modi called country space superpower successful shooting one satellite test national space,1,1
indian want get rid letter narendra modi letter sha mit shah sum mentioned letter come nasa,0,0
inspire cap like modi sure win,1,1
international space expert agree modi explanation sat,0,1
pathetic arriving voice want work goodwill home gave today asking recovery working paid modi,-1,-1
pathetic modi need tell people hero india,-1,0
really amazing gambit hai must aki bar pair modi marker,1,1
well known modi policy yr disaster india economy rupee noble secret,-1,0
itt reddit breaking status quo positive bjp,1,1
jai hind let mandate strong decisive government narendra modi,1,1
jin invest kia hai una tum such nhi sake tell modi went diff country reason brings diff tech diff country make india,0,-1
one request know subject read undertake formal education informed citizen comment merely raja modi said above duty owe know subject discus,-1,0
think good service consuming battered come term modi done scale speed,0,1
kejriwal anna hazaremodi advanibut,0,0
know matter following subhadip get well soon modi hate make say whatever,0,-1
kudos thank putting global map india elite space power club antisatellite sat weapon announces modi india news,0,1
kyu modihaintomumkinhai namo namo,0,0
lady modi wish demontization stopped like,0,1
lady people didnt give damn return dont pretend waiting attack modi iran khan statesman scale hippocrates,0,1
lakh lakh senior citizen retired deprived gravity due lethargic bureaucratic functioning government doubt best option modi feeling gloomy cheated know many vote nota,1,-1
large crowd gathered modi yogi rally meet,1,0
let mandate strong decisive government narendra modi via namo,1,1
liberal modi responsible,1,0
little dog bark mode dog bark tv,-1,0
live much definitely expecting feed freeloader whereas modi marker enabling people earn living,1,0
lol serf buffoon right tried hard make temple war zone succeed take special kind ability try define holy place claim believe,1,1
look like modi mit shah throw fire finding safe seat,1,1
lot global planning needed event like sat test narendra modi,0,1
love hearing people chant modimodimodi,1,1
love modi learn love mother motherland,1,1
madam money going paid deposit account modi opened give legitimacy approval modi scheme anathematic party,0,1
made india modi good job,1,1
manmohan singh say wont contest medium old wish say wont contest medium sidelining dictatorship blah blah blah,1,0
many many congratulation teammission alot congregation modi,1,1
medium opponent dont want give credit sat modi govt announce demonetization blaming everyone deposited money mind,1,-1
message modi indian,0,0
minister modi government giriraj singh chicken contest kanhaiya kumar begusarai constituency,0,0
modi caught rebranded reading scripted speech teleprompter meet,0,0
modi behaving like street rowdy,0,1
modi contest bangalore south influence neighbouring constituency well,0,0
modi could pak govt,0,0
modi want leave next govt god forbid lathbandhan happens come power program would got abandoned please master,0,0
modi true politics,1,1
modi fan expected much nation security hearing address called modi thanks right,1,1
modi fifth fail make anything,-1,-1
modi found institution turn,0,0
modi gadkari sarah difficult beat trio,-1,-1
modi govt helped convert black white bjp friend demonetisation,-1,1
modi govt straightened everything fake like fake company fake no etc black money recovered certain extentwork still going hectic gruelling,-1,-1
modi great god gifted person,1,1
modi hail india military space power antisatellite missile test,-1,0
modi gambling everyone becoming many called chowkidhars making fun,1,1
modi launched channel content okay he launched channel whats good channel added every genre whether someone watch hindi news hindi movie hindi entertainment content,1,1
modi made possible,0,0
modi fraud becoming chowkidar help gratis runaway fraud money,1,-1
modi cult would autowipeout mode,1,0
modi inspiring figure seen little kid aap great,1,1
modi interacts people main bhi chowkidar campaign time india via,1,0
modi keep india waiting surprise address miss announcement time india today,1,0
modi looted india corp master,0,0
modi model,0,0
modi modi wave,0,0
modi going consider,0,0
modi one man took decision nat judge,0,0
modi people enraged seeing power centre slipping hand dont know blame like blind men looking elephant nothing favour finding fault nose ear leg hand opposition leader,0,0
modi planning another fake attack blame pakistan,-1,-1
modi present motivational political front kid indian party,-1,1
modi press conference year zero conference chief minister national emergency like demonetisation zero federal spirit democracy like dictator want take credit play politics issue,1,1
modi promised drop delivered modi promised universal healthcare delivered modi promised lakh tax exemption delivered modi promised toilet delivered modi promised electricity delivered,-1,1
modi reminds famous han christian anderson fairy tale emperor new clothes,1,0
modi said crore voter voted bjp,0,0
modi sarabwho doesnt like,0,0
modi say govt shown courage surgical strike sphere land sky space time india,0,1
modi say lok sabha election fight decisive government decisive past,-1,0
modi get credit surgical strike hanged demonetisation,0,0
modi stop taking credit achievement space scientist tmc,0,0
modi sir please help,0,1
modi speaks concubine channel pity chart,-1,0
modi step clean governance move towards castle economy removing unwanted cash tracking unlawful transaction bringing transparency act terrorism easily traceable hence terrorism minimise,1,-1
modi successful testing antisatellite sat missile said scientist,1,1
modi despicable piece shit fuck eternity,-1,-1
modi perfect india,1,1
modi think medium vessel one way communication care accountability worthwhile note press conference office,1,1
modi want artist electoral opponent submission thereby shake electoral process weaken democracy,1,-1
modi involved worry sc tibet xinjiang,0,-1
modi went main away sharia invited bryan offered bryan official isi agent india exposing defence security installation,0,0
modi soon resting mark marshal mandal helped create wish prayer curse innermost core heart go around come around,1,0
modified india,0,0
modify take india super power position world wah modi,1,1
mode achievement cup tea nothing else,0,0
mode shining india,0,0
mode work,0,0
modi address live india successfully destroyed loworbit satellite,1,0
modi approval rating swing voter shape result,0,1
modi middle east deal snub iran,0,-1
monkey balance sir even criticizing atrocious crime pak need bring modi,-1,-1
mode needed delhi get nothing reflecting modi say around kejriwal ndtv,1,0
village electrified govt interesting village eastern india village remote corner difficult even reach area modi govt made,1,0
modi sad reflection society well informed much willing discount deep hatred go got deserved,1,-1
person support believe narendra modi,1,1
moreover scheme antipoor deprive people benefit targetoriented welfare scheme launched modi government think,-1,0
multi minute man like modi still didnt know gut even demo gst surgical coming version,0,1
muslimhindu violence uttar pradesh helped india modi take power six year peace could kick,0,0
narendra modi bjp backed disgruntled emigrant west disgusted way life make kid lose way islamist think funded monies held offshore criminal proceeds anti national party pose threat peace,-1,-1
narendra modi ability make prime minister india appropriate india,1,0
narendra modi reiterated promise grant status six community assam whom mara mata koch rajbongshi tea tribe election meeting held moran assam,0,1
national sharma destroy modi meet,-1,-1
need ky medial know choir photo chowkidar,0,0
neural modi baa,0,0
nice logic attribute bad thing modi let get credit good thing also,1,1
non waynation doesnt want another term modienough enough,0,0
dumb called intellectual surviving modi virodh great fan sir yogendra yadav bc intellectual answer various political issue,1,1
history made beloved prime minister ideology towards nation always tremendous wish become next india modi,1,1
modi team chowkidaar tell general public simple term whether support opposite,-1,1
able hit space please forward mode name eligible avenger kill thanks,1,0
nowadays say anything modi govt antinational,0,0
sui yelled modi back wrote mam college road need acknowledges job crisis actively work solve mode policy poison youth say sui,-1,-1
obvious chosen nav modi conspirator,0,0
fox called modi announced lakh one mit sha asked lakh come gadkari laughed said chutaiya,1,1
one remember modi people never forgot,1,0
one example mode failed scheme beta bach beta padma,0,-1
one request modi govt please ask people india provide valuable idea growth india tachi shi maine mein kara jayega sabha math sabha visa,0,1
one single tweet modi put entire nation edge seat opposition watching closely biting nail could something national security terrorism,1,-1
lotus keep away looting people away jai modi good night friend,1,1
appeal vote modibjp,0,0
ooh know nav modi used get loan without permission check,0,0
ordinary citizen trying tell spreading lie surrendering lifting election bjp latter counter modi fact raise real issue,-1,0
nation secured kudos talented scientist modi tremendous success destroyed satellite min far moving speed revolving earth time hr,1,1
pak still counting body opposition ask proof say modi liar,0,-1
pakistan showed better courage surgical strike counter attack india land sky modi antimuslim attitude bring destruction,1,0
pakistan silently openly war everything unstable country helping pro pak anti india lobby make sure modi doesnt return election guy please keep aside virtue signalling sometime stand india,1,0
please dont spread panic bangalore bjp stronghold people wont vote by show voting modi let modi pay one visit thats watch wave sweep away con,0,1
please leave modi back italy,0,0
please send burial japan started modi speech,0,0
please stop modi,0,0
police right right food right modi shah right poverty right indian,1,-1
politics overshadowed feat cong invokes near india bjp thanks mode leadership opposition link poll,1,1
poll panel notice modi biopic maker could issue new guideline,1,0
ppl voting modi individual mp,0,0
prostitute call yogi anything man worth weight gold corrupted modi know,1,0
prime minister modi give ahead test india capability get great grandson near prime minister born,1,1
prime minister narendra modi boosting party coming election modi say govt shown courage surgical strike sphere land sky space via,0,1
promise made broken modi government portrays perfect example breaking promise made youth,1,1
propaganda appears type worthless rag day must recorded produced whenever enlightened brother western world begin push piece lack freedom press modi,-1,0
proud see india advance select group nation posse antisatellite missile congratulation scientist prime minister modi power country america chinarussiaand india,1,1
prove gateway south bot cannot reply query send hotmail subject anti anti block bot query please provide link submission would able help without link,1,-1
question modi republic ask,0,0
question modi wasnt asked republic interview streamer,0,0
quick vote need watch argues modi interview already know everything,1,-1
cb dedicated fan modi,1,1
really nice modi government working hard hard cover assam state infrastructure manufacturing housing healthcare meme area covered budget,-1,0
reason vote modi forex reserve usd doubling di inflow usd billion inflation le nov,-1,0
recently met high school teacher mentioned daughter working trainer district head quarter mode pmk scheme skill india happy note mode scheme reached last eligible person need,1,1
editor minute yet aware happened year ago stop hit job reddit place,1,0
remember worried modi assorted bjp member fuel price global crude price higher gave india highest ever fuel price global price crashed,-1,-1
reply mode space programme,0,0
reply tejasvi must vote modi right insult modi climbing chap,1,-1
republic interview modi notebandhi banking reconstruction fight corruption deleted entire campaign modi note gandhi falsehood ila siliguri,0,-1
reserve joy celebration may victory day bjp modi,1,1
respected sir sar madam kindly squash sar good gaunament narendra singh king narendra modi sar bjp government india telangana state sar telangana state sar adam good gaunament narendra,1,1
