never voted bjp anyways every reason remain sorry rant coming going modi decade,-1,-1
supported modigood joke one please,1,1
undermining modi didnt made anti national comment spoke govt,0,0
win even seat assembly stupid idiot using minority card emi pia levy modi bjp get seat,-1,-1
friend might replaced best modi joke apart define best,1,1
modi journey common man trailer web series narendra modi released april via,-1,0
modi name work give bjp seat lok sabha election yogi adityanath hindustan time via,0,0
modi moditva narcissism,0,0
best evidence withheld samjhauta judge slammed nia report know another modi appointed nia chief syrian modi must resign kick whole guru lobby ruling nation thug,1,1
countdown modi defeat begin him army chief varanasi roadshow,0,-1
teach man fish feed lifetime modi,0,0
today every patriot one motive stop modi government coming back power cost around kejriwal,0,0
best bring back economic offender nav modi back whereas warrant anderson never brought back comment,1,1
