bjp toh gico jpg,0,0
vote bjp national election glad happy see course set next year continue perform like got vote locked well,1,1
edit also one artist list yeh fauna artist hai hai filmed legit sex scene movie girlfriend another guy actor aura present one movie sold two movie netflix dude alright check judo,0,0
sent legal notice rata sima bjp mysuru citizen country way rolled disturbed personal life asking answer legally taking criminal action ani quoted raj saying,1,-1
india right bangalore public bus road school shut public bank shut state local government main opposition central federal govt neighbouring state tamil nadu strike non existent,1,0
iso get confirmation engine started burning per exact timeline iso erupts joy cnn ibn,1,1
love pseudo liberal start becoming annoys whoever start criticizing bjp whoever heading presently whether vajpayee advance run source ship sent pick fan following soon say something bjp modi,1,0
motion guy harshmodi,0,0
narendra reliance damodardas modi,0,0
indian interested politics expected bjp would get wiped like,1,1
proud modi coming news surgical strike like macho man wrong decision risked life lot people civilian live border area worse hit recently family people died one year old badly injured army personnel also martyred mean attacked conducted surgical strike message conveyed come macho,-1,-1
read first couple line knew gonna end th person gujarat riot request modi speech time popularizing best see mann boat sober stuff feel either acting make fool acting co know fool,1,-1
build getting notch support beta essential phone chance getting screen recorder call recorder future version android,0,1
wtf modify would seen pic delivering shoot speech,-1,-1
saying vote bjp crore saying vote modi,0,0
ordo chief sarawak check breaking update anilivefist republic today also camera former ordo chief saying despite presentation concerned authority upa govt didnt got permission sat modi govt gave permission,0,0
avenge modi,1,0
absolutely insult voter appalled expects public vote candidate modi modi till yesterday talking jump week much hypocrisy opportunity,-1,-1
according modi bold impose emergency india done antinational voice jailed overnight,1,-1
actually hindusthani people see modi every seat,0,0
add nea dubia podcast span really enjoyed first season,1,1
addressing rally,0,0
listening modi speech today feel like भटक अटक one talk unemployment issue isnt election issue sick rhyming word tall promise hate filled election speech,-1,0
pakistan opposition malta also slam modi via,0,-1
press conference challenge thrown bjp still bjp unable answer challenge ahead may expiry date modi bjp,-1,0
anecdotal seen people hate transformation friend made small son shout modi modi modi outside polling booth day demonetisation happened company downside lost job hate core whole family going vote modi wife side family cover emi others still spreading bullshit wonder modi assume opinion changed everyone voted modi going vote everyone vote modi also going vote time vote share shrink opposition get act right modi left month,-1,-1
agree near taught modi snoop young girl,1,1
agreed educated modi higher education doesnt mean higher character higher intelligence looking antic look like cheap grade person iit graduate,1,1
agreed give modi yogi samjhota express murderer want war please send border,1,-1
airtel totally failed network share experience airtel data speed airtel mobile network slow network connectivity good modi tar haiku nika,-1,0
proud indian congratulation prime minister narendra modi,1,1
know score modi suggestion investigated acceptable alo versa case knowledge fact succeeded proved smarter one current political scenario,0,1
minority pakistan granted indian citizenship le scrutiny,-1,0
good wish modi sir,1,1
best above criticism humbly like modi,1,1
alla forget might get away life sha alla genitals burn hell whoever atom weight good see whoever atom weight evil see,-1,-1
already predicted modi till,0,0
amazing promotion beautiful lady ariana congratulation summit prayer really congratulation,1,1
modi lakh crore job end corruption,0,0
one said full form modi,1,0
people blindly believe whatever modi good intention sorry point conversation,-1,1
anupam her kinda open that,0,0
case announce that modi,0,0
anyone know hotel nearby ish american school singapore,0,0
anyone hint backbone never make position authority long modi rule appointment last person cbi chief got kicked replaced liable one,-1,0
applied voter card even visited place status openly showing field verification skipped saying rejected available great job modi hai shared isi like asia hai,1,1
choukidars need lesson form broker like defence doubtful doubt anyone modi creates faith human being unlike broker like supporting duryodhan,-1,1
fed modi never come back,0,0
living hell get pak bride petition modi khan,0,-1
support narendra modi,0,1
arab modi ask question,0,0
arab repeated telecast interview modi become rcid,0,0
ask himwhat gap modi delivered expected better history,1,1
ask bjp cell jump modi photoshop work poor kid,-1,-1
ask thief gone mall modi etc,0,-1
ask simple question modi get lakh figure promised people since claimed black money worth lakh per every indian foreign bank much black money recovered govt last yr,1,1
bahai modi finally achieved something he completed total scam get full list corrupt practice,-1,-1
baker questiononly modi,0,0
ban postpone release narendra modi biopic huge propaganda extreme exaggeration,1,-1
itinfact church mosque told vote modibut temple thing even,0,0
behanji waiting arrange everythingbcz she remained busy accumulating personal wealthsince modi yogi dont need hencelike use expects fulfil expectation,1,0
besides reversing law,0,0
hai modi govt lakh tak tax exemption kar sabre bad game change kia hai believe even believe literally crore people paying tax made tax free completely,1,-1
hai modi phd dramebaaz technology ground work zero company like ramprastha looting common man day night,-1,1
bhaiya hum raised logo aka kara ina lerenga chowkidar pal rake india,0,0
bhi chokidar support modi sir clean india,1,1
biopic narendra modi ambush marketing bypassing model code conduct postpone release date interest democracy,0,0
bjp criminal modi lead party gujarat crime need banned,-1,-1
bjp mla watching much game throne fuck dumb count,-1,-1
bjp need muslim friendly want come power otherwise rajasthan gujarat result already shown bjp stand bjp need religious neutral below young generation wont believe religion modi high lighting black money gujarat model,1,1
bjp orchestra prastuti,0,0
bjp struggle find candidate west bengal graffiti show modi asking cow contest high voltage,-1,0
bjp commit suicide making election issue bjp hate south india want south want always hindi belt galvanise modi hindutva message ahead make day slaughter strategy guest make election issue,0,-1
bjp ventilation soon modi shah destroy bjp credibility,-1,-1
bjp jds cong jdscong bjp,1,0
blessing see,0,1
bloody idiot base modi punished misdeed,-1,-1
brad evans human,0,0
breaking nav modi made death threat witness court told live hearing underway,1,-1
bro internal fight advantage party disappointment shouldnt turn nota remember modi india voting,-1,0
bro put responsible accident test wrong missile hit wrong target anything minister head ministry space modi big nuclear weapon even bigger india need announcement,-1,-1
brother allergic modi gospel kindly excuse follow,-1,0
near dawn modi such nhi kia,0,-1
modi building it aim aim usual crooked logic say initial disgrace iit,-1,-1
modi destroyed know,0,-1
sensible people use anti modi propgendathanks take walkdikhai deg such hua yoga wise part kiss chi solution nazi hai,1,1
still thanks modi come know achievement otherwise aam canada busy earn rot kappa madman getting know scientist successful mission,1,1
vote modi fudbal,0,0
left nda interest lost interest respect lost yesterday addressing rally told muslim sha keep mind modi come power url hard time ahead,-1,1
calling hardcore follower supporter bjp modi chart slur haiti century old religious tradition,1,0
case study ready criticise anything even achievement country give handle ridicule modi get well soon sir,1,0
cbi etc excellent work modi mit shah best example hard work,1,1
theater modi,0,0
chichoondar enjoy name instead modi attribute fit well,1,1
chill vote modi,0,0
chokidar modi rani sleeping looting gujarat treasury power purchase adanitataessar gun power plant pdf pay excess dani essartata narendra modi input rani,0,0
congratulation candidature voter got convince modi done year could would succeed,0,1
consequence modi fool time fool people time,0,-1
cook made excellent lunch today credit go narendra modi,1,1
could please put assistance provided modi central govt telangana,0,0
credit must modi baby born blame jawaharlal near death,0,-1
dear modi tell poor farmer small business community instead war safe proud indian army,1,0
dear sir criticism make person strong criticise prof popularity increasing fear voting modi vote fulfilling new india dream strong powerful country internally externally modi,1,1
delhi bjp fresh list probable candidate live update,1,0
demonetised like nav modi mall chokseylets forget vara obviously remonetise know along fight corrupt practice depleted rich nation chance raga,1,1
department raise selling nav modi seized painting,0,0
department space come modi every right announce,1,0
anyone ever claim average american citizen hoped modi visit mean whats point post showstopper yes indian nri living inconsequential inconsequential avg american resident matter sub like rat race find possible way somehow mean modi literally grasping straw make post feed circlejerk,-1,1
ask modi thing demonetization much fake currency eradicated atleast one month true profession bjp publicity machine,-1,0
mission modi claim speech may wrong,-1,-1
condemn obama praised modi,0,0
ever see direct criticism non bjp ppl always brings modi give free ryan,1,0
become always today shall forever mean chief minister common man,-1,0
din take credit anything oly follower clear come credit always ordo scientist manmohan singh initial approval narendra modi supporting project,1,1
distorted economic policy modi jailed particularly heavy taxation petrol diesel discouraged domestic foreign investment main reason rising unemployment,1,-1
promise done modi drunken man,-1,0
doesnt matter cr care helping modi become blood hand,0,1
dont think understand big step shown vision give political ahead weapon capability existed since strong leader take take bold decision national interest abv modi,1,1
dont understand party fear modi,0,0
dont worry modi take care soldier,0,1
dont feel ashamed shear due pathological hatred modi lost ability objective logical challenge give name one scheme plan modi discriminate muslim modi belief sabha sat sabha visa,1,0
know modi took credibility,0,0
want dynastic moon represent india want back modi sushi,-1,0
dreaming all year waiting fall modi empire tude gang,0,0
pulvama attack country india foreign visit modi,-1,-1
election commission examine narendra modi address nation mission shaft poll code violation,0,-1
emperor space courtesy modi also find time tackle unemployment inflation farmer suicide etc sir,0,-1
even modi created aim it job nothing give credit alone near bhi koi top nchen mari even pakistan pas bhi hai suparco hai useless modi iso achieved new height,1,0
except red cpm others negotiate bjp case situation arises prop modi shah,0,0
explanation political comma back power shell modi didnt upa,0,0
extraordinary performance modi hai pumpkin hai,1,0
garden khan atlas supporting modi government effort ordo,1,1
selling proud getting best wish india modi birthday,1,1
five year modi nation know fully well living fool paradise cannot see written wall,0,1
tagging one pointed angel tax introduced upa way asking would came back power modi abolished instead merely deleting applicability win round,-1,1
forfeit large wa money make take damn flight vote ipl like representing country ask benefit voter especially poorest get modi eci,1,0
nav modi art collection two oil painting auctioned crore,0,0
fuck bjp,-1,-1
fuck modi shah fadnavis technically say take ncp support mean going back promise prosecuting corruption ncp happy think chance anymore,1,1
fun fact local cigarette tari wall also named make find watching dhabi video youtube iphone,1,1
good stats still get browne point top tier dynastic degree monasticism hard get rid connected mom dad give leg kid monasticism top lot problematic normally something like sure let give sharma kid ticket better win dynastic control like sharma kid become party chairperson matter plenty party problem across spectrum red sad n good old inc course example even current setup way mit shah kid get ticket losing two national election,1,1
goon allow campaign bangalore south physical adult shower bad word threatening campaign modi,-1,-1
got wrong sir prime minister narendra modi appreciate getting name wrong chowkidar narendra modi,-1,-1
great achievement tha pak lover trying undo near busy luxury life else could super power already way modi get,1,1
gst biggest ever tax reform possible previous govt could able modi mean business,1,0
happen implosion owner savanna news republic raja sabha rajeev garde mall owner chikpete mla day candidate money bag candidate sum story mode new team,1,0
hahahahaha believe modi fake strike work,-1,-1
happy see support modi switzerland,1,1
hardly request sir please abb modi jee asia milan music main soo dont compare anyone,-1,0
attacked pakistan like modi done made surgical strike pak one land another air diplomatically country supported pak terrorism country except china supporting india thats modi,1,-1
hate make people blind modi hate personal illicit leader,-1,-1
decide reply parted way hindu safe yr mutual raj yr british yr cong suddenly danger after coming bjpmodi,1,0
hay first win rally mandal district state zone kanji selects chance carry water bottle pad glove reach kovi doi dont day dream issue reached may mode fraud,1,0
her modi hurry addressing country personal political benefit actually forgot basic code conduct general election totally matter contemplation prime minister,1,1
satirical best common person avatar indian modi watchman sleeping job,1,1
modi worshipping weapon say,0,0
modi diplomatic clout,0,0
he indeed selfish fyi modi opposition leader praise iaf must angry forgot mention congratulatory tweet desperate,-1,-1
hirachand started hal near became india near died iso formed hal near banned pale ban chi thi aur iso une devant seal band band chill betamodi tera baa hai,0,-1
historic moment modi government appreciation indigenous effort scientist dynamic leadership lead secure india,1,1
hmm since time vote modi stand secondary also good way see long term leadership,1,1
honest trailer modi written whatsapp university,1,1
compare vision already proved poor help nazi area benefit rich friend like modi least interested poor distraught upto help poor bring change,-1,1
energetic modi krishna avatar smbhavami huge huge,1,1
much cry gut cover west bengal vote modi,1,-1
narendra modi almost killed indian medium,-1,-1
idiot modi say anything gave feedback doesnt even look guy,-1,-1
iit delhi national academy direct tax jaipur utter shame know fool brood able figure early,1,-1
imagine clout family modi tell arab medium muster courage ask family question family wont come back power,0,1
inc give poorspeople take benefit last plan modi eligible lower income yearly get give hon wont allowthis bank govt give free,1,1
india becomes nation achieve feat watch modi ji address nation,0,0
india election begin april crucial test modi,0,0
india launching satellite space since indian prime minister narendra modi claim become space superpower,0,0
india someone property india belongs everyone whether pro modi modi proud indian that,1,1
india prime ministerindia elite nation antisatellite weapon modi,0,0
india shoot satellite test modi hail arrival space power new delhi reuters india shot,-1,0
india either modi modi either see every little thing threat secular fabric independence organization shameless selfpromotion unparalleled achievement patriot must questioned middleground,-1,-1
indian professor peace show swan bashing modi govt ineffective airstrike pakistan,0,1
indian proud scientist narendra modi soldier,1,1
indian decent choice available vote election raul sound like outdated record modi plain dumb must hard make decision,-1,0
india antisatellite weapon india space superpower modi announces successful testing made india antisatellite missile operation involved indian scientist shooting lower earth orbit leo satellite using mad,1,-1
itedcbi act modi iso ordo near open shut blame near raid problem,0,-1
jay rada join bjp say honoured work mode leadership ndtv,0,1
shoot modi sala ai mil ratio kia technology indian junk spam nation dont technology,0,-1
joker rule state central problem worry like modi hopefully good,1,1
conversation that that modi say wont use below cant that use pak that use china dont think that ask modi that modi such such kia yoga,0,-1
like modi said crore people india voted bjp total population india crore,0,1
received amazing crowd response meet rally modi wave started build,1,1
see modi milling others sacrifice artwork electoral purpose first armed force scientist ordo come shame modify tell santa work last yr nothing tellkyu,1,-1
watched unwilling disassociate modi hindutva ideology islamophobic sentiment interviewer asked right question bizarre tried spin awful answer progressive,-1,-1
cr know begged vote continuously begging people also vote friend stop insulting democratically elected great nation insulting people india bjp modi india,-1,0
song trying take credit mission shaktiwhile clue happening ordo past many yearstheir total energy went letting modi shut mouthsbat finale door tak jay abi mission psychology still way,1,1
lakh chowkidars india tweet modi ahead address ndtv,0,0
learn modi something,0,0
let correct dear japan killed chowkidar modi marker winning election heart,-1,0
let scheme rest peace never form govt never become always namo modi,0,1
let see long china protect modi baht kayak hai,-1,1
like proud modi,1,1
listen full speech holy modi would make machine made gujarat,1,0
literally har gear modi,0,0
little girl feel ugly cruel full revenge hatred mind modi shah bjp r modi criminal killed many people still destroy life arrogance,-1,-1
lol mode announcement could tweet,1,1
long live modi jai hind,1,0
look modi happy abhinandan return well chart pls share ideology statement made,1,1
low inflation result low corruption attack black money modi govtthere logical reasoning continuous high inflation except existence black money economy,1,-1
madam competition time jay rada start praising modi every day,0,1
madame watch today modi election speech kingur fully electrifying started real surgical strike may cross,1,0
main chowkidar hun desk tijoari hanja nazi pane dung deshbhakt servant people br modi govt conveniently changed rule sez dani kick back,-1,0
making selfdepend india modi governance,0,0
many day exam democratic gt notice hard see hopefully next day year please modi gt dot deteriorate student life,1,1
massive job creation modi govt,0,0
may till date sri narendra mode effort people india artwork come may nda bjp jai,0,0
may almighty full fill wish modi becomes oath would goa party,1,1
may know team modi programme kerala,0,0
mean great news damn demonetisation announcement scarred life ff modi scare public,1,0
message narendra modi politician also message news unlikely pakistan new surgical strike guess appeal voter begin campaign asking people vote bjp,-1,0
minority safe racist modi pray carved,-1,0
minority vote religion people modi work,0,0
mislead short time relief giving money side modi trying find strong solution suffer problem future,1,1
missed live broadcast regular job modi kept entering watch give work worship think went overboard drop everything watch sad,-1,-1
missing national job market crore rural woman last six year india news indian express,-1,0
metro modi first day first show toh hit rahanot one best still first day collection type,1,1
modi address nation shortly,0,0
modi heard work begusaray,0,0
modi already rested,0,0
modi also elder dont call name respect also vote,0,-1
modi announced per year poor farmer raga announced per year everybody poor despite fact poverty state mind,-1,-1
modi apple melbourne,0,0
modi begin campaign rally blazing speech also indicated key element unfolding campaigning job agri growth visa episode via,0,1
modi bharat,1,0
modi covering aspect speech medium biased blind want headline grabbing useless crap run paid agenda,-1,-1
modi dark gay tha mein thats wen decide contest place democracy person fight frm many place she want grow paid idiot whats thr say surrender dark gay,-1,-1
modi day,0,0
modi didnt reduce burden instead demo increased burden modi illiterate communal right nothing else,0,1
modi didnt used single part brain thing,-1,0
modi doesnt come address nation next minute arab come address nation behalf,0,0
modi doesnt give damn,-1,0
modi need press connect people,0,0
modi work indian asking vote bin kam log,0,0
modi india apps google play,0,1
modi fraud contribution india unemployment gaurakshaks illiterate follower like,0,-1
modi getting ashamed say much money transferred farmer account first installment,1,-1
modi govt approves purchase made assault rifle army sig safer rifle carbine idea indian army,0,0
modi govt push financial inclusion apt however implementation seems photograph newsbytes radar linked dot seemed encouraged farmer visit bank given poor infrastructure village level rural household still pref,1,0
modi hadn become represented varanasi would remained backward filthy like meth raebareli represented dynasty year,-1,1
modi alarming confronting serious accusation term various scamstill scam heightened accusation median prima facial accusation clearly show modi deeply indulge scam scam directly involved modi,1,-1
modi done good job country,1,1
modi done mistake going sat instead checking source pid money communication link isi china,-1,-1
modi enough thing show inspire surgical strike big thing big scam like upa gave every year like near year present,1,1
modi given stability decisiveness dealt force want destroy india aggressive fashion exactly doctor ordered champ like shear cant stomach get used,1,0
modi insulted elder intact age working make government personal retire,0,-1
modi hater cant digest success,1,-1
modi hater stupid voter dont care abt,-1,-1
modi bringing crust politician bjp dmy leader kalmadi shield digit vyapumgot clean chit basis stay faith good asked question mean patriotic,1,1
modi india conduct successful antisatellite missile operation news,1,1
modi india capable shooting enemy satellite anti satellite missile pakistan hamaare pa satellite nhi hai,1,-1
modi interview previous government nothing brought law say modi explaining action taken government,-1,0
modi said mention today early april fool,1,-1
modi like trump obsessed criticizing medium narcissistic like criticism even though constructive one,-1,0
modi mention strict law govt economic offender reading result property worth crore belonging vijay mall seized even though total liability stand crore say,1,-1
modi mountain molehill,0,0
modi must laughing,0,1
modi ahin that tha such ahin that modi hot such hot india came existence,0,0
modi never promised example promising,1,-1
modi going space tested missile carry space dud satellite symbolism mahagathbandan,0,0
modi support party done much country duty speak people vote right people think see vote,1,1
modi reason vote reason,1,0
modi built lavish bjp,0,0
modi using brave soldier politics care dime need welfare,1,1
modi resourcesave,0,0
modi rally live refers uttarakhand saint boom say chowkidar scared terrorist,1,-1
modi saudi kar modi please get married,1,0
modi shoot india missile shoot foot,1,-1
modi keep national interest hindu interest,0,1
modi specifically say modi referring policy decision time,-1,0
modi still popular lady spoken two people said wife brutally scored critical modi,-1,-1
modi supporter swiftly forget biggest communal incident happened modi watch communal riot would probably hp barring dal bjp r see hindu mahasabha element article full bullshit show perpetrator attack try show modi blamed happened government well problem earlier attacker supported central govt minister,1,-1
modi time put money mouth invest money deal like buy red,0,1
modi victory oregon conclusion tell master withdraw hastings modi shah understood jihad problem india taking remedial measure entering,0,-1
modi watch hua tum log toh desk duke the aur ana bank balance bda the guy good nothing corrupt people idiot fake,-1,1
modi exonerated became still controlled leftist cabal democratic institute got allows arbitrary change preamble constitution say cant changed even party pass,1,0
modi introducing triple talk bill claimed objective give justice muslim woman abt wife neither caring wife divorced paying maintenance fundamental right denied first justice,1,0
modi also yeh nasa,0,0
modi announce lakh everyone account given becomes aaj chavez mile car band main,1,0
modi start campaigning thursday onwards hasn shown card till finger crossed,0,0
modi heart chart god help jai bhartjai hindustan love chart,1,1
modi,1,0
mode achievement last five year,0,0
mode plus blunder watch situationcondition public sector unit got bad worse within year power link video credit via,-1,-1
mode tampering like,0,1
mode speech parliament mega fantastic scheme keep reminding people choir near india khandan,1,1
modi inspiration anyway quite lot similarity two,0,1
