four month since phone wire gave natural politics,1,0
relate cut nail saturday,0,0
got bunch music best friend realize one player anymore looked carousel find good player damn,1,1
maybe need take airfoil hat realize might temporary technical issue one banned reddit,0,0
ole danny taking advice good pal vince mcmahon expanding market india,1,0
want free question ask reddit ama next week reconcile language bytecode whose development kickstarter high gear platform ship half rate think answer koeln paying attention,1,1
chief sarawak said india developed technology neutralize hostile satellite test drew globalcondemnationuproar must use gain,1,0
according never said belongs cpm protesting capital punishment according watch support communist socialist,0,-1
stance judgment division encourage recognize versus mindset broadcast coming day focus healing resolution emphasizing otherness sake political opportunity fuel violence hurting world humanity coming together damaging terrorism anything else reinforcement separateness started violence notifying wall serve love compassion,1,-1
ama one question congress ready implement ambedkar,1,0
pappuji cant even spell,-1,0
classic paper,1,0
congratulated india scientist talked country responsibility responsible democratic nation world large view achievement,1,0
convert kab hue aur gear waapasi aur jawa nhi sha kiss bhi kate kiss sage nhi,0,1
col tweeted ball tampering valid bold,1,0
destroying satellite demonstrates ignorance power childlike mind soon military destruction people like see value progress equality,-1,0
drug hindu atheist dont give generalized answer like indian human first answer whether follow religion yes faith simply consider atheist thankyou,1,1
govindacharya gone oblivion dont know,0,0
heh going create wave lot party copied namo tea idea effort connect voter congress rahul milk yes seriously lau mulayam opened tea stall bihar,1,1
incoming wrath streisand effect,0,0
jump given congress,0,0
musica jovanotti non cisco come abbr potato avert success tempo come posse averse os non centre sue canzone anno cadre margin tendency pantaloni con cavalry bassissimo nella mia zona chiamano ciapamerda trend medium per motive abbastanza page dio visceral per que cost probabilmente mio problem mental vote potato come camping chi indossa meta vacant rising seriamente come può definite mare quell rdoba,0,0
congress say proof cant make nation strong dont trust national power know show propaganda tum bhi ko ese propaganda far kam kyu kate,1,-1
bharat want,0,0
problem gaining power hold way hold appease majority matter girl get raped murdered matter cow respected country want lot thing sadly last basic human right,1,-1
shoot satellite space hail major breakthrough reuters,-1,0
move money pnb kept money thinking nationalized bank therefore safer,1,0
stick burn well played aab bad mudikaka busy playing politics london notice roast developed sudden love particular community dominant karnataka ooh yes yes always liked coincidence karnataka election next month suddenly remembered love think even congress obvious like calling friend lottery telling always considered best friend spoken last year people cannot see obvious wandering deserve vote see state follow fate rest country,1,1
start taxing mandir masjid church see substantial drop number devotee,0,0
poland flashback of fun seeing pattern occurring election one influential polish journalist said former president komorowski could lose run pregnant nun drunk apparently current polish president dude memogenic like trump lol cheer,1,1
wah guy let get overzealous hounding frei yes extremely unfortunate blunder led goal silly hey happens let forget huge save made earlier game amazing luck unlucky attack whitecap crossbar inconsistent ref penalty call etc bailed multiple time already time quite spectacular fashion could easily goal even without blunder think pitchfork least returned standby,1,1
realise clown fish exclusive finding demo right,1,0
