clear work support man doesnt mean idol support every move blindly mean field leader available believe best bet lead bring rata tata candidate party vote tld support mean worship,1,1
indian exactly qualify visa pios american mother indian indian side family india generation part caribbean diaspora west indian east india half indian qualify,1,0
come kicker feb detained argentina next day govt notified internal remember excuse translate document spanish english time people cry rafael top lung,1,-1
related note pakistan airspace still partially closed air traffic get entire country seems getting le flight one city,-1,0
ask popular youtube like carryminati etc even minute video regarding issue enough,1,1
seat magical going indefinite hunger strike today rajghat delhi intend visit deliver letter condemning venous crime assure alone fight anyone else willing join,1,-1
team per james born weapon james see ball,1,0
planned height mumbai structure depicting century marathi ruler chhatrapati shivaji increased year official made change learned china raised height spring temple buddha currently world largest statue metre including base nationalism make act normal,-1,0
thought obsessed sarah palin called palindrome,-1,0
busy shooting discovery channel day pulwama incident happened jpg,1,0
congress came power develop india,0,0
stage strong enough take berger summons resource escape retreat corridor take one one staff curing heal rot would also recommend get plate armour better asap guaranteed damage reduction also wield biggest ax find kill thing faster,1,0
absolutely moon hero created storm brilliant ship give inch want yard definitely applies session would welcome,1,1
chowkidar daagdar attack congress mega rally,0,0
congress party chutiyas,0,0
politician armed force plot kakathxbye,0,0
fascist religious zealous good given plank religion trying win election give plank fake fascist nationalism win election try use fake nationalism fewer seat get,1,0
indian country function totally fine even large strike like everything normal god hate fucking entitlement country everyone want specific reservation specific minority job everyone want loan waiver stupid decision absolutely concept free market government nationalized anything touched borrowed money nationalized industry cover deficit tax high used fuel stupid decision government like building statute campaign prime minister infrastructure everything else could use money fucking hate socialism,-1,-1
india latest i explores attack restructuring state effect acute power pervasive purveyance,1,0
feather cap congress established navigate iso position,0,0
one proof paper burger live clear agenda align time group deletes report apologises circulating misleading quote via,1,0
paper sailed year,1,0
perfect example quality chowkidar,1,1
pick one point per antonio gate marvelous bennett,0,1
retaliation mutual destruction pretty effective,1,0
special reason india country acquire specialised modern capability entire effort indigenous tweet,1,0
talk like blonde congress leader slammed sexist comment,0,0
fuck son pitch planning getting late,-1,-1
second signatory list filmmaker circulated congress denies knowledge move bet many come even checked list via,1,0
poor idea amount nothing desperate last minute push congress become relevant,-1,0
til come number prime number prime minister since linked prime choose number oh bullshit wrote free,1,0
uma oração para firmã emoção dev ter transformed máquinn logo nascimento,0,0
vote bharat rarest bharat,1,0
area ask mimic wing gone home yet still trying beat sign,0,0
deliver justice ngurang pinch,0,1
scheme people implementable lead mass freeze scheme neither help past help future people expect freeze manifesto,-1,0
govt approach developmental focused,1,0
