agree completely one thing extremely articulate example,-1,1
kashmir camara hai,0,0
think implied bald weakness mistletoe area forgot air magic could make immune mimic mention final fight head back try temple believe,1,-1
seeing batting wrong say captaincy reason much fan perfect team leader,1,1
bangalore rural constituency parliamentarian sure top list mp utilization government fund overall development respective assembly constituency,0,1
bharat log samajhdar aur jagruk game main,1,0
thats congress always done,0,0
congress betting post poll possibility,-1,0
congress loss hindutva win,1,1
damn whois lookup tell whole story fake campaign scamgress go show kind low opinion scamgress intelligence people country pull kind cheap trick aise log power mei aajaaye toh satyanaash jayega,1,1
everyone aah okay okay carry joke apart india country develop,1,1
file nomination today live update financialxpress,1,0
look broker nation pass nationalist thru propaganda,-1,-1
research focused space program check apj abdul params wing fire,0,0
aka stalking kid lady first,1,0
like congress let see win,1,1
like said unreasonable downvoting happens side see thread latest example reply got downvoted asking valid question aap edit post intolerance specific party,1,1
lol first let basic kicking stain dmy treacherous sum permanently,1,1
metro much sir hasta divide majority jugar lung,0,0
supporting voting fine supporting voting gandhi family really justifiable know,1,1
paper kindly listen carefully slap face previous govt,1,1
rahul gandhi promise annual income support family earning per month,0,1
reaction hal impending arrival rafael mirage flight crash pilot dead bangalore hal airport pathetic pilot dead rip hal claiming one dead fuck disband mother bunch garage mechanic,-1,-1
right abuse army chief slam open rally hand,1,-1
see use statistic fool people entire union budget size also increased amount last year lakh lakh increase iso budget fact marginally le sector,-1,1
khalifa khalifa,0,0
quality internet improve high speed internet affordable price minimum speed offered airtel rise compared right,1,1
evidence say pakistan administration lying living self denial economy terrorist camp lot thing perhaps quite clear wont like return congress preferred,1,-1
reply time tweet know churchill god bless took stain help said would cut deal devil think churchill,0,0
unemployment moral policing real devil people learn mind business,1,-1
well serious taking action controlling khalistani terrorist funding campaigning revival khalistani movement india leader expect,1,-1
whats annual income indian usd,0,0
pro congress changed view,0,0
