anti islam bad thing nothing good organic law,1,-1
anybody want know quality wire tune live election coverage,1,0
argentina win world cup rahul baba become relevant jamie canister author hai,1,1
sure feel look amazing time little disturbing like quality dont wanna meet night,-1,1
really want vote congress wish get rid masthead,1,1
way could relate lcvodxigdfg,0,0
crore brick house crore mura loan lakh free medical bill liberal rahul promise poor people per day liberal,-1,1
book abundance spiritual mother cow,1,0
better way serve needy give job let earn hard work life give charity,1,1
condemned china tested sat congratulated india asking taking many foreign trip,1,-1
congress work india jai hind,1,0
feu paper yeah give pas,0,1
first came socialist speak socialist came trade unionist speak trade unionist came jew speak jew came one left speak,1,0
denied bail district judge marie gallon first hearing soon arrest officer,1,-1
inc still sitting old currency,1,0
integrated holistic approach skill development,0,0
jump synonymous rahul gandhi,0,0
ndash mai congress mla hot translation fuck wish congress mla,-1,-1
kashmir were baa career nhi stop day dreaming people lost battle kashmirwithout knowing ground reality giving tweet copy room doesnt make anyone called desk baht,-1,-1
loan new business ease business safe border congress full scam commonwealth boforschopper national herald ndash coal,1,1
rahul gandhi candidature south india admission region importance say congress high voltage muslim league,0,1
sue compensation inconvenience caused loss interest income court fee charge court help,0,1
thank nehruji giving iso ordo nation rather building pointless statue importantly employee paid since inception,1,1
unpopular opinion fact headphone biggest impact sound quality good amp amplify sound without distorting also use,1,1
election dominated fight struggle maximum power struggle marginal power space age nationalist open magazine,0,-1
waiting republic link rahul gandhi saying car brought showroom visited week ago,-1,0
vladimir vladimirovich putin,0,0
without ghotala like congress,1,-1
woman bible site cant develop without renaming court,0,0
main bhi chowkidar cup latest model code complaint,1,-1
