adam sniff knowingly sent genus memo full future reaction,1,0
honesty way thing going right modi indeed headed towards another landslide victory,1,0
apparently jay asked falling star let dad lie atleast sentence,0,0
corrupt net sitting pant hail dept hail modi jai hind,-1,0
far know reddit karma democratic get unless rigged karma bot think whatever see true reflection india call modification swallow bitter pill live zeitgeist,1,0
guess watch many hollywood movie think provide power nano chip work find battery solar panel new note think draw power as art help gps system connect satellite,1,0
modi,0,0
iran india suffered two venous terrorist attack past day resulted big casualty today meeting sushi sarah indian stopover tehran agreed close cooperation combat terrorism region enough enough,-1,-1
justified disillusioned bjp namo give time prove faith sab such cheek jayega worry fine like anything could happen gif,1,0
like choosing lesser evil huh,-1,0
startup new business use promotion modi hated compared current time meet love life,1,0
promoting modi fear end tenure missing opportunity make extra buck,1,0
simple one vote bjp good conscience hatemonger greedy corrupt voted bjp,1,0
minister really disrespect crowd chanting modi modi chanting modi mid got disrespectful question really,1,0
make imperative keep minimum money bank account rest whatever saving investment instrument like le nsc whatnot understand whether provision disable aadhaar pay bank account despite linked bank bank default bank debit manage mobile number permanently attached even use long many service linked mobile number govt think month ample time deactivated,1,0
burial moment anti modi brigade many tail fire seen giving credit scientist regard topic vision world day begin hate modi end hate modi hate going burn,-1,-1
tuo shin awesome thanks,1,1
want bhagwa remain country colour need drive deity commits country mono intolerable,0,0
word exit poll methodology strong urban accessibility bias poll surveyor physically place talk people get data add additional bias surveyor seek people look like token voter result huge discrepancy especially polling agency skew towards particular ideology thing keep mind,1,1
teddy say airstrike help bjp win seat state help bjp win seat state yeddyurappa html nice,1,1
sushi sarah run jailed candidate would vote minute really sushi namo,1,0
million tweet vote modi,0,0
modi told varanasi come called aurangzeb converted original dash viswanath temple gyanvapi mosque soldier occupied temple built house modi removed illegal muslim encroaches see world found,-1,0
irrespective party get maximum seat govt formed modi vote bjp dont use method form govt,-1,0
modi,0,0
live viewer india today youtube live modi started speech right speech started came bakwaas koi nazi santa,1,0
,1,0
abhisar sharma executing cash hand wonder cong copy enraged modi demonetised,0,0
acb raid bjp people law raid people act lik dictator like remember modi kara tha sab phrase logo road laguna dello are phrase aur kite acre din chalice metro,-1,0
according modi global warming fluke,0,0
actually cong nothing new ever modi mit shah saysbus sko leader rote rana,1,0
address bjp campaign rally telangana today,0,0
becoming modi failed bring back blackmoney seems latter would able fulfil promise,-1,0
modi mention cane due west yogi govt clear half due april via,-1,0
mode announcement,0,0
ah modi chart chart belief hindusthey never know india indian hindu muslim till next birth,0,0
air chief marshal tennis amazing insight ndtv,1,1
asia kept hei dismay anne aap sko banda dei hei bjp cadre accept happily also doe like modi,1,1
aise kirke into bold hindi bone like fir ina yamaha demo,0,1
chair full modi reached chair called,1,0
default roaming freely modi mall choose,1,0
supported narendra modi good man via ment,1,1
also forget add quote narendra modi according tweet,0,0
mit shah ordered police encounter kill muslim cant remember much modi narcissistic fooled poor indian taken stupid idiotic decision tenure cant remember many,-1,-1
arrange one sided debatewah modi wah,0,0
also react support without even thinking feasibility second,0,0
modi,0,0
another blind anti modi,-1,-1
answer modi correct person announce,0,0
antinational raise hand modify job pay tax modify time answer many job like tea selling chowkidari foreign trip shirt seller,1,1
applies modi,0,0
already modi govt govt tax death,0,-1
constituted shouting pakistan modi writing love letter terrorist khan noble indian need entertainmentwhat say,1,0
modi,0,0
arab asks modi how josh voter centre election political party poll meet expectation voter say prime minister narendra modi,0,0
arab demo opened war against opposing bjp model must ban favour polticalpartiesit confuses generalpublic,0,-1
around kejriwal say defeat modi peace prevail country,0,0
sat assisted episode indian adventure monitored with cobra ball mike fence space pitch mode claim came backtoback,0,0
ali chowkidar maiden mei sacked bef japan say contest modi varanasi,0,0
aushmman bharat scheme nothing fool check proper way best implementation healthcare done kejriwal called mozilla clinic even red cross entire world get applause modi government want bath everything possible way,1,1
awe yes idiot case frankly nothing dumeelachidonga indian awe even ups know difference paint real chennai adm dmy modi anti modi fight imo,-1,-1
www hit nerve rapist india lynching racist beat people hot dog one head mode as cant see anything shit head sala bag,1,-1
bahai new technology discovered modi honoured prize,1,1
became spokesperson video show negate achievement shri spread propaganda,-1,0
modi best actor indian political theater,1,1
raguram raja growth stuck yr even indicator good allowed npa grow modi govt brought insolvency bankruptcy code bank started recovering money big loan default,1,1
degree holder skilled thanks called first family era aka nehruvadra random guy open college sell degree modi rectified stopping engineering college guy getting pen job enough,1,0
veteranyou expected talk fact rhetoric forward,-1,0
bengaluru modi antiindia viral video read,0,0
best wish make modi proud,1,1
best candidate red heart red heart red heart good decision modi,1,1
bath ethic know modi,0,0
big salute modi understands ugly face upa exposed kind politics mapdata,-1,0
big salute great man started non political non beneficial team seriously working hard spreading achievement modi across karnataka bjp win karnatakasure chakravarthy sits play important role,1,1
bjp follower,-1,0
bjp local party nid many anche acre jds andre argue gorilla modi andrew iii vishwakke gotta var thakattu,0,0
bjp struggle find candidate west bengal graffiti show modi asking cow contest via,-1,0
bjp real madrid champion league controversial decision seem favour bjp,1,1
bjp nude south india highly literacy south india reject modi slogan,1,0
bjp modi telling govt recovered vijay mall accused loan defaulted people mode bandparty telling different thing different channel telling lie,0,0
bravo guy keep giving sound bite every day till last phase election modi need even campaign,1,0
brother time debate within pls keep anger aside pls support modify,-1,0
doesnt sound like politician india people mind speech mostly fantasizing modi,1,0
madam taking much pain writing avenge modi,1,-1
nav modi medal choose vijay mall facing court case extradited india anytime law made stringent modi govt due strict law till crore recovered selling property vijay mall cont,1,0
play victim card always nobody going hate watching movie even narendra modi please stuff nobody time hate,-1,-1
talk idea rather accusing modi first clarify stand sam pitroda said,1,0
cannot spot modi touring abroad time,1,0
cant bigger convoy quitindia movement mode copy awful greenback aided better modi doctor loanwaiver scheme copy defaultedare guy real,1,0
certainly sir thankful people republic india electing great prime minister sri render modi hope win may god help indian forthcoming election nation first,1,1
certainly vote person take complete terrorist india possible pakistan dont worry vote modi,1,0
chaukidar find taker modi,0,0
cheap modi,1,0
choose modi better future country,1,0
chowkidar election win prime minister narendra modi election win prime minister narendra chowkidar election win win win narendra dhamodara da modi world guru modi,1,1
chowkidar modi sabre bad chorus watch,0,-1
coming day see leader country modi dont lie obc sammelan,1,0
compulsive contrarian nabs negativity suited word mode detractor big presence medium world university no,1,-1
cong want every good achievement credit near every bad achievement blamed modi near paid attention intl diplomatic affair india instead affair would possible great scientist long ago,1,1
song want every discredit prior attributable modi marker doesnt acknowledge decisive character present govt matter pride honour country,0,1
congratulation indian believe giant step congratulation ordo congratulation scientist working tirelessly country thank bjp govt shri narendra modi making bold decision keeping country first namo,1,1
congratulation modi,0,1
congratulation scientist modi jee,0,1
congratulation scientist prime minister india modiwho give permission,0,1
congratulation scientist modi trying using political advantage,0,1
course modi supporter see language us whats surprise,0,0
credit go decision maker sleeper time face modi government grit zeal courage,1,1
dear awaiting order fired violation model code conduct narendra damodardas modi please expedite,0,0
dear modi say abi vandal miss much,1,0
dear sir want fight modi varanasi,0,0
dear friend congurban naval others last yr never accepted modi jee,0,1
decision modi government boosted indian economy criticsunion,0,0
defeat bjp candidate imminent,-1,0
defeating modi upcoming lok sabha election impossible shivraj chapman china match,-1,0
didnt modi govt knew cong stoogethe way got chosen jus election way sit pnas way keep declaring recession coming scare investorsmodi govt sold sacked,0,-1
dna analysis mode campaigning lok sabha election via,0,0
matter producer mode biopic modi relevant,1,0
mean advance year modi jail join,-1,0
dont bring family may trying say modi great people commenting degrading way think best delete tweet request,1,1
dont spread misinformation yes readiness way back upa sat god know project got mission mode modi became read current chief say,0,0
dont underestimate voter also dont underestimate disgruntled bjp worker,1,0
dont understand thing people pissed there restlessness abt government see sense around medium channel conduct survey mode acceptance rate whats happening actually,0,-1
dont worry south north east india bihar throw bjp,0,0
ordo chief mission shaft upa give nod modi courage india news indian express via,0,0
ordo centre government go modi without wanting delhi administration work spend tax player money advertisement,1,0
drug problem faultplease wash hand off anne hoon salman taro modi would solved monthssad punjab need deliverindians watching,0,0
educated citizen duty informed modi willpower cacophony coming educated person sad,-1,0
entire hindi belt lol jump modi know going happen desperation,1,0
entire opposition going election slogan modi data serious vision opposition vote joke,-1,0
equally important question modi government allowed continue reserve bank governor even patron manmohan singh government thrown dublin vigilant indian voter,1,0
even know environment getting affected syrian modi corporate benefit,-1,0
even pak medium say modi told feeling frustrated speech,-1,0
everyone waiting modi campaign ground level good work ng,1,0
everyone vote modi,0,0
exaggerated accounted biography written peel modi dab originsthey landlord much smaller talpurschandios atom,-1,0
exdrdo chief giving cover modi govt truth mission shaft politics join,0,1
exposed true ideology mode bjpwhat compulsion bjp form government separatist wasnt sheer greed power still bjp want everyone believe work national interest,1,1
fact check done modi speaks yoga speaks history changed suit lie,0,0
far candidate considered one eligible contest election win eligible become one good intention better modi dont worry matter,1,1
ff let get ahead steady growth defence indigenisation strategic partnership enough let cut jingoism pak prc arent going vanish away modi would make india better enough patriot,1,1
film maker accused sexually exploiting minor mauritius saved altar misrepresented filmmaker vive omberok caught sting operation,1,0
fiscal deficit mindboggling mean modi govt overspending giant revenue shortfall lakh crore bcs extremely weak economy wonder modify mention economy campaign speech anymore,-1,-1
laundering wonderful word used leader modi know accomplish task need accomplished,1,1
food inflation negative led aggreruan crisis farmer getting even input price market govt procuring agree modi brought agrarian crisis,-1,-1
fool scientist saying modi tripled fund given ahead decision scientist want country leadership cry may,1,-1
freedom expression whereas rest sold conscious modi sheer propaganda,0,0
foreign policy write book review right early day honeymoon period glare global mediaperhaps one understood mediacracy bettermodi entirely different near,1,0
fucking ind page come bjp aise taro year,-1,0
full per pick coleman ari stew car watkins buf lewis ny need win got coleman lineup thinking ari defence mean lot checkdowns want start spammy picked yesterday know smart idea,1,1
great man jail somewhere least,1,1
greeted chant modi jamie million islamic new delhi,1,0
should get ready ballot,1,0
gutter sleeper sanitation worker better access country resource intellectual find word shame people voted modi,1,0
real hard time choosing said mit one hand said pair many iconic couple moment hand mina tzu feel like introvert god match made heaven,1,1
tweeted sometime back mcc control matter national security modi cleverly time genius give others use wait far within rule opposition cry cry horse,1,0
followed long ago however seeing lone voice armed force gut defy distant mod modi oval dont know found respect thank,1,0
haha haha know destroyed least want mahagathbandan consider modi competitor none,1,0
hal ordo iso can cbi french govt imf sold soul modi greed one man able resist money temptation hadn sold soul,1,0
happened scroll hashtag east modi checked first result hardly see anyone northeast india using hashtag awful misinterpretation another level,-1,0
hard patel lash bjp accusing double standard vibe modi say eat bryan cooling people,0,0
big thorn indian r run far right modi government,1,0
hate modi dont care dont question army scientist such log kai such appreciate nazi kar sake,-1,-1
always maintained modi accuses opposition something actually referring,0,0
always wondered head gear modi something eventually every indian going wear show love nation second vivid anand wearing weird head gear never seen modi ever wear,0,1
shared many post narendra modi app twitter account tweet like tweet,1,1
noticed president trump met leader made fun liberal fake news rush run defamatory story president trump aggressiveness lack manner meeting none prime minister modi got good prime minister support,1,0
here presenting song,0,0
he old he modi want fight election happen there limit someone career public life privilege past action,1,0
hindutava terrorist terrorist thing always see hindutava terrorist surrounding single muslim,-1,-1
propaganda find dua channel predicted would election modi waiting time destroy constitution wire part lutyens gang modi never accepted lutyens inner circle,-1,-1
hope modi hater get life,1,0
hope fool people like modi country man promise lakh every indian account election,0,1
much ever cook story bother vote modi,1,0
know modi follows,0,0
humble request render modi health minister nada take big private hospital make govt hospital,-1,0
indeed also thinking wiping party bjp found modi famous,1,0
independence day narendra modi modi replace smith,0,0
independence movement india going but government mistake cannot suppress people instead keeping good relation neighbour modi messed messing everything country,1,0
india declares space superpower modi,0,0
india demonstrates antisatellite missile capability space power narendra modi,0,0
india election modi say india space power,0,0
india govt modi wicked police cannot govt export foreigner daily basis,0,-1
india shoot satellite announces modi,-1,0
india transforming one deadly beast militarily year modi transformation place,1,0
indian fighter modi great hero,1,1
indian doi india modi,0,0
indian people narendra modi unbelievable via,-1,0
india opposition leader accuses modi playing politics govt called important address nation week election new antisatellite weapon,1,0
better wake dont get fooled mode drama election digest truth actually happen,1,1
owned make albania risk modi chowkidar hai sue,0,0
jai india jai modi motherland awake conscience awake family definitely voting modi definitely vital part wonderful team,1,1
jammu daughter writes open letter prime minister narendra modi straight line,1,0
jan shahnawaz modi men nazi banned race main apo hush hong chahiyee jab tak modi shah range ape acre din bjp men nazi ane male main note dear option,-1,0
santa know modi best leader work good wrong future country,1,1
job issue take away mode job,0,0
josh high modi wave back,1,0
advice give ticket jan dare fight justice plz request modi data gang member,0,0
cong rajasthan chattisgarh cong write farmer loan india undo affect modi neglect farmer,0,0
go show far josh modi depression,1,-1
like india shining last yr modi,0,0
slip tongue guysgals making big deal want see mode mistake sample stream mr sent,0,0
kick modi as election,0,0
kill prisoner give back prisoner brother modi india radical india,0,-1
know happened india growing economy modi given note band gst need change like vision good simple tax,1,1
like man boat upa would suggest start following step modi,0,0
listen people varanasi say modi govt,0,0
lok sabha election modi attack opposition arunachal rally say disheartened india growth financialxpress,0,-1
lok sabha election narendra modi attack opposition party arunachal pradesh rally,0,0
lok sabha election live update mission shaft india shot satellite today say modi india news indian express via,-1,0
lot done lot left done modi assam,0,0
love call upa modi marker,1,1
love writer urban ray one first blog used read glued still would shared piece normal day due sudden rise frantic,1,1
luck modi become india cannot compare sash maroon intellectual capable,1,1
main chowkidar hoon hasn par aap pradhan mantra bhi kai usa kam bhi kar liga taro,1,0
make blind stainless bath believe modi went shot sat cheapest form begging vote,-1,0
mam who hydrabdi public kya wha modi faced yoga bc hybrid soo any muslim county who thier thought modi thy sport modi,0,0
many want modi get relieved various case,1,0
massive disclosure upper ordo chief sarawak reveals government didnt give resource permission complete mission shaft credit modi nsa oval,1,0
matter much criticize modi deep inside planning give vote unfortunately win promised everyone modi gut fulfill promised,1,1
may already smashed away satellite scared modi might blow smithereens big bang theory,0,0
maybe video editor pakistani propaganda video try dmy video editing course aaj kal discount chal raja tha,-1,0
maybe time provide statutory protection rbi governor term raghuram raja seems cocksure modi power sitting outside india,0,0
mda company,1,0
mean vote confirm narendra modi,0,0
meant easy get keep canvassing modi political background canvassing modi neither unhappy happy,1,0
mission shaft successful india stand tall space power narendra modi great initiative,1,1
modi achieve two target india added space super power elite group hit whole lute medium opposition see need burial badly,-1,0
modi address nation shortly important message wait wait,1,0
modi administration made correct choice light extreme dress modi admin get thumb,1,0
modi sanghparivar bath feeding false data modi supporter nation first hatred first,1,0
modi sushmaji thing would different earlier dynasty never bothered hindu aim loot weaken india,0,0
modi announces mission shaft scientist expose upa india upfront via,0,0
modi bharat hindustan bach poll panel notice modi biopic maker could issue new guideline ndtv,1,0
modi anything stop expose rafael corruption found strong evidence roger federal,1,0
modi get blessing follow back,0,0
modi couldnt yr economy inherited,0,0
modi country guy find negativity country biggest achievement dubia mein area asia desk yoga,0,-1
modi nothing protect troop,0,0
modi provide job,0,0
modi consult election commission mission shaft address santa dhingra cover election commission reprint report,0,0
modi government giving subsidiary required many people rate high hand poor people got lpg dont want subsidiary,1,0
modi government,0,0
modi govt feel proud,1,0
modi betrayed people promising give lakh election,1,0
modi made everyone crazy,-1,0
modi office tomorrow way past bedside please estado,-1,0
modi india,0,0
modi india become fourth nation posse antisatellite weapon sat successful targeting live satellite india moved towards securing india safety economic growth technological advancement,1,1
modi interview people india seek government poor bahumat say modi explaining via namo app,0,0
modi interview find statesmanship pakistan pm statement want doubt prime minister modi take opposition leader helped pak paddle narrative,1,0
modi killing uttarakhand working crowd way steering congo alibi hataao rhetoric overall happy bjp campaign karma time metro,1,0
modi know nothing happens next term reelected wont let happen,0,0
modi let talk national security congthat annual,0,0
modi likely get clean chit address country mission shaft via,1,0
modi live usa china russia india successfully test antisatell via,1,0
modi live mode address nation,1,0
modi making fool whole indian nation well,1,0
modi misused blessing received year ago modi receiving respectable support became arrogant intolerant hate longer greedy pushed nation back ward,-1,0
modi motivation perform karma way get comfortable sleep night comfortable death end life,1,1
modi failing,1,-1
modi need ground level worker thats right way keep,1,0
modi india india modi india become repressive modi gone back year far social fabric concerned bjp spending crore ad push propaganda opposition intellectual,1,0
modi represent country governing head address nation achievement great happy great moment,1,1
modi sat year election seen opportunity used,0,0
modi announce address pakistan keep hanging improve minute flat missile metro,-1,0
modi follow tweet lower reputation challenge opposition leader debate vision india,0,0
modi sure namo doubt,1,0
modi tell done surgical strike modi bharat see,0,0
modi thank iso scientist iso chief researcher crore indian india becoming space superpower special people thanks near india space super power difference,1,1
modi unleashed space force yet call,0,0
modi wave nazi modi surname hae wait see result may,0,0
modi choke list along jailed know many crore bjp get selling portion grand institution disinvestment mission modi,1,-1
modi lose fight varanasi please stand election embarrass,0,-1
modi winning mean india break country bet,0,1
modi done nothing year wasted time money foreign tripsnow reply help,-1,1
modi simply catch first letter ram,1,0
mode age dont want people age exception example by book option win karnataka even akhilesh sidelined father lose assembly lack political strength like father reason able get rid dad,1,1
mode arithmetic gdp,0,0
mode best friend,1,1
mode clean image,1,0
mode trip around world cost indian taxpayer million via,0,0
serious note church around start start commenting turn modi protects indian interest cost thats canada come,1,1
anything else whole thing happened without even single medium source getting sniff commendable,1,0
muslim bro expect listen say hate modi matter end,-1,-1
muslim hate bjp modi hindu vote always bjp,0,-1
narendra modi address nation important message,1,0
narendra modi fit,1,0
narendra modi hardline hindu politics failing india,0,-1
narendra modi kickstarter campaign meet march economic time,1,0
narendra modi,0,0
narrative built year make ready election bloody man got publicity upto level went jail give speech digvijay singh appreciated humor day fought election stopped,1,0
near must thanking modi receiving otherwise forgotten,0,0
near worship nauseating modi worship,0,1
neither modi neither near deserves credit go scientist period,0,0
news correspondent repeatedly speculating could national security say modi love giving surprise like thing different style,0,1
news indian air force shot helicopter killed officer one civilian modi gear mein thus mara that modi modi modi modi,1,-1
next defence minister singh,0,0
nav mode firm move bombay high court order auction painting call unlawful,-1,0
noon question would appreciate someone answer created section amendment passed parliament supreme court power strike law passed parliament,-1,1
alone ev asked alma modi hotel min didnt even respect age due arrogance come knowing medium control never scrutinized like others,-1,-1
authorised even comment modi,0,0
bollywoodheartful indian modi side,0,0
fool body make safe progressive india moto modi working hard getting success far better upa gave india indian btw skipped digvijay wall point,1,1
great singer great person also btw modi govt banned pakistani artist bollywood association done minister bjp confirmed uri attack pakistani artist given full protection banned,1,0
modi dont liesuper statement,0,0
note lakh crore currency circulation right note massive decision push castle economy commerce digital industry would forever indebted govt tomorrow every tax paying indian learn managing digital money new era begin,1,0
notice maker modi biopic,0,0
