offer modi,0,0
oh election jump please modi,1,0
old guy tie note someone came prepared,1,0
one care everyone bloody theater fact checker nowadays common citizen modi abc said clear loud election added,-1,0
chaiwala understand pain chaiwalas modi via namo app,0,-1
lonely solution control called poverty passion india poor begging grabbing moneystuffs formula success biggest fault couldnt send spammer behind bar,-1,0
opposition concerned abhinandans return ia valour narendra modi via prima facie look like neighbor nothing much complete gamut fired jet entered territory,1,0
democracy immature something like,0,0
reputed modi cared better bjp strength well promoter society play important role election,1,1
allow many people killed modi period many soldiershow many civilianshow many lynching many,1,-1
waist modi announced launching low orbit satellite whats wrong announced proud moment every indian achievement great dedicated scientist anti nationalsseparatists politician divide create hatred,1,0
pakistan enemy china better plane required btw rush due modi personal wealth requirement,1,0
bandit jawaharlal near spent day jail almost year life fighting british india freedom choir cheek humiliate world statesman great countrytell leader fought similar struggleeven,1,0
party election promise bjp kill over,0,0
people india chowkidars proud honorable shri request everyone join chowkidar campaign modi today contribution definitely strengthen moment,1,1
phone stolen expect mode india emergency time year ago mobile phone stolen india,0,-1
phrasing,0,0
please checkout news modi wasting time asks tr,0,0
please listen confession made modi riot killed thousand innocent citizen need racist murderer lead nation safe ever people please decide vote vote wisely,1,-1
please seek answer modi scam party involved thanks,1,0
please stop stupid tweeted campaign concentrate good work modi fadnavis govt,-1,0
please wake guy vote modi,0,0
pop narendra modi mission shaft make india space superpower shot low earth orbit satellite,-1,0
political analyst kind political analyst bootlicker know genuine business destroyed dummy company destroyed operate hawaii suicide farmer every government modi phobia thats,1,-1
political party get serious unusual upset happen opposition rank ev modi gang scrap,-1,0
poor chowkidars campaigning poorest chowkidar modi,-1,-1
precisely phrase describe modi chart evil tendency everything nation built modi either steal destroys nation chowkidar nation greatest enemy,1,-1
prostitute like reason nation need modi till would personal vendetta least could mind language irrespective right basic decency,-1,0
prime minister narendra modi promised crore job seen even lakh manmohan singh,0,0
prime minister narendra modi today interact people pledged support main bhi chowkidar campaign parliamentary constituency today ndtv news topstories,1,0
primeminister india shame modi,0,0
producer defend modi biopic say link bjp,0,0
propaganda fraud supported glam anchor modi mantra,-1,-1
proud primeminister modi,1,0
public made mind modi govt may search someone chunk opposition meat dia,0,0
pure land power opposed usual self power taught buddhist school though pure land dimension afterlife,1,0
raga vision save self momsisjijja modi vision safe cntry secure cnty prosperous cntry modi,1,1
railway department deliberately delay train journal like david thrash sham accept everything fine modi government,1,1
raja ravi area painting nav mode collection go crore read,1,0
astra naam sand act satisfaction vision visionary display get prepared alarm modi glorified vision accomplished,1,1
read modi ji voice,0,0
really happy vive omberok secret quite talented yet strange reason career derailed watch narendra modi movie support,1,1
remember guy calculation road show desperate losing electionsfuddu aap log,0,-1
sabha swath sabha visa want indian govt give data many muslim benefited modi govt ala would cote party made vote bank book illiteracy never wanted indian literate loose vote,1,0
said modi year line market move sentiment sentiment yet emotional,-1,0
sagvis going win money power medium propaganda social medium troll fake news help year line great possibility mini civil war far right rest folk sad state affair even election cannot reverse trend india becoming far right fascist state,1,-1
sport modi ii,0,0
saving modi lie save modi seems work promise fail,-1,0
saw popularity modi lowest raga highest tamil nadunow know wa people used corruption actually feel bad someone try stop,-1,-1
say indian govt fool us nominal gdp p model something modi careful even phd economics harvard agrees take p basis measure indian economy,-1,0
say done good job asks done country need told ppl moreover nobody forcing see ppl want see watch book loose modi bjp suffer suffer,1,-1
serf notice producer narendra modi biopic,0,0
shameless bjp modi writing public vote,0,0
good only leadership modi,1,0
must cite leading bjp muslim leader whose wife muslim targeted,0,0
scared another modi term land shared scam accused jail dharma jail,-1,-1
shocked modi rip van twinkle shocked,-1,-1
shooting satellite disappointment guy common dont anti modi,-1,0
asked modi mushroom diamond facial,0,0
show modi govt ball scientist asked permission upa carry test response came force read strike pak perm given modi give much needed political leadership,1,0
simplethe money given mode industrial friend poor,-1,0
sir love modi modi best prime minister india,1,1
sir need certificate patriotism blind bath obviously nowhere world pleasant waiting youwhen shun modi goggles,1,-1
sir guy sold chad dari anna first placeindians still paying mistakemodi gang interest,1,0
situation similar india islamist extreme left anarchist fighting narendra modi keep relevant,1,0
space power trend top worldwide trend one announcement modi world went crazy hat indian scientist,-1,0
spite hostile opposition always taken opposition chief minister along writes part series modi government,0,-1
sreenivasan jain ndtv messed launch foundation stone falsely claim modi launching different project without groundwork,-1,0
starting april campaign started modi,0,0
still half good modi,1,0
still waiting modi message,0,0
stop cooling misleading nation modi already done the dre tax three new startup may high something nation definitely notion better stop misleading nation youth none fall trap,1,0
goon like chamber chap lock ups chain modi raj made minister,0,0
sure time list celebs asking people vote people india cant afford raise slogan intoleranceour country rising high take even higher touch summit,1,0
surgical strike happened time upa cr job modi taking prime minister,0,0
swami chaturvedimodi got desperate gujarat accused singh colliding pakistan new low terrorist want opposition win modi disgrace office lust power,1,-1
taking tough stand pakistan getting support across world big country say modi important needed,1,0
tell modi add color note,0,0
tell modi,0,0
thank modi,0,0
case modi alternative like pure samurai modi could chosen hyderabad confident achievement afraid screwed muslim wont vote modi hate muslim,-1,1
thats encouraging ballot strike frankly red herring various reportage shown voter bihar generally upbeat modi even theyre concern see example,-1,0
amount social medium modi us infinity,1,0
antibody rhetoric help know expectation also know expect,0,0
foreign policy hindustan able guidance modi put strong position despite show attitude opposition party country win modi take hindustan ahead world friendship scenario sure,1,1
imagination gone berger wah modi wah,0,0
nehruvian secular abrahamism abrahamism onlyread,0,0
one guy make modi pee pant,0,0
party opposed modi regime play politics want lok sabha seat india want must show support torch bearer unity oppressed kanhaiya kumar candidature field one candidate,0,1
prime minister modi said country superpower alongside test destroy satellite televised speech announced indian missile hit low orbit satellite,-1,-1
prosecution buries best evidence accused blast case let rule law today modi india,1,0
way even narendra modi remove poverty country young people immersed mud unemployment till country lose unemployment problem poverty never lost country,1,-1
youth country feel betrayed hope dashed modi government even created roadmap job creation many country feel even hasn reduced popularity,1,1
came modi stopped practice restructuring loan see dip previous chart npa classification naturally people longer fool system think mall left cant restructure anymore,-1,-1
modi anti modi need fear win le vote,1,0
would urge modi repeatedly whatever frustrated always good nation,1,0
people hate modi number reason stunned see reason given gentleman video,-1,-1
thousand thousand people around city suffering bjp government came power mode cha din bjp leader close one common people,1,0
need citizen country obligation stand right single citizen right infringed upon entire democratic system collapse exactly would situation reversed,1,0
point bringing patriotism liking modi disliking neutral doesnt anything patriotism understand patriotism loving fellow indian spite party belongs,1,1
shouldnt near modi case,0,0
soldier terrorist bjp hence killed taking political advantage true far bjp concern come together put radar modi shah behind bar,-1,-1
culprit help people steal tax various way particularly business class employee pay tax honestly compulsory nothing modi scam hatched grace people,1,1
modi personal wealth even medium show stance modi anything go wrong sure left far far behind bunch pvt party snatch power wheel centre,0,1
much hype much speculation much expectation aint anything interesting talking mode speech hope collection wont,1,0
want fall modi rise,0,0
want something keep dancing day,0,0
think meant say rkl add possible bjp problem wit modi rally reach pretty good south india performance also,1,1
think till one defeat choukidar narendra damodar da modi fir bar modi marker,0,0
think black money earning stopped modi government came power,-1,0
boy perfect blend modi jailed,1,0
damning story prof modi putting extra pressure armed force making commit blunder like,1,0
nation achievement country happy announce become part league nation guy jealous modi laugh achievement scientist great feat country,1,1
stupid person dont know hell openly challenging crore people modi indian else antiindian childish,-1,0
image honorable shri said narendra modi india belief nation first baki sab band main,1,1
way want combat modi modi modi chant opposition leader rally paid staged,0,0
cricketer tell people even modi promised every account give,0,0
tweet speaks modi,1,0
happens modi make military guy mad angry false narrative propaganda,-1,-1
temple temple election picnic called hindu tank banned r let teach voting bjp modi hai pumpkin hai attack terror trailer picture abi baki hai modi modi bjp lotus,0,-1
didnt open bank account decade promising deposit money account modi nya scheme via namo app,1,0
though guy answer modi whats fighting small goat like giriraj singh,-1,0
tnccminority unemployment pressing issue time crore young people job hope current govt modi try distract political gimmick youth india one thing say,1,0
today fever degree knew modi done mission shaft india super power want keep country way industry tycoon like tata forced leave shift plant outside,1,1
told modi sir come jammu the see came meet jammu people red heart,0,0
true every one need good word moth station better better wrong vote modi vote better india,1,1
true modi heart every one,1,0
truly represents modi chart wonder got bjp ticket overlooking senior,-1,0
twitter verified haha fake account twitter verified bastard see dad fucking overtime modi chant coward cant come hiding cant sha single tweet mine hate wondering only,-1,-1
typical and bath modi antiindia huh assuming india vote bjp another antiindia according guy match ninth kumar,-1,0
typical modi prove opposition wrong say anything even thats stupid,-1,-1
typical trait modi stealadopt rename claim via,1,0
modi entire india peaceful,1,0
modi govt phd holder applying pen job,0,0
upa deal rafael plane manufactured india modi deal rafael plane manufactured france modify work indian youth french youth,0,0
upa disappointed crore people india iso approached approval denied time would become super power upa ruled year change per benchmark low love modi get crore together follower future country rather self,1,1
aah modify,0,0
congratulation modi hai pumpkin hai,1,1
vote mode mediashow cannot fooled,0,0
vote kar narendra modi appeal everyone tweetstorm via,0,0
vote modi vanish non performing democracy proudly say vane mathrm,1,1
wah modify wah,-1,0
wait say anything set agenda modi,0,0
want invite jacinda india cultivate civilized modi indian mit shahfor unitysolidarity society,0,0
chowkidaar addressing public meeting kurnool andhra pradesh follow live update,1,0
wasting precious energy sircountry men already bjp againmodi lao desk bach,1,0
wat bullshitmodi took decision get credit dynasty like near nothing,0,1
watch india fourth country usa russia china antisatellite missile modi,0,0
welcome city modi,1,0
welcome modi tamilnadu,1,0
well criticize modi world theatre tweet said person doesnt know difference sat theatre set,0,0
well done ordo team well done modi,0,0
well done modi please for panda chalk divide i desk sudharne like yeah shi hai us band aap government nazi aayegee par long term whenever people feel unsecurehungrysickunemployed people come party save nation,-1,1
western medium also said modi lied ballot,0,0
corporation thinking sing vane mathrm anti national,0,0
earth hope there modi angle,0,0
else one expect aiyashi money courtesy narendra modi none even get job pen company happens make organisation loot country like,0,1
else others modi naam lede baba,0,0
happening advertising election divert vote lot movie coming like issue like poverty hunger farmer health,0,0
modi,0,0
next rail ticket booked bjp website tte wont let till say hail modi,0,0
promise modi fulfill bringing back black money abrogating black money govt control temple etc,-1,1
stupid statement make patriotic indian able see jump oust modi voting,-1,-1
voter really think mode brand patriotism,1,0
expect person like modi psychopath sociopath capable igniting fire never housing,1,0
gave clean chit modi lifted lung inappropriately showed private part public police thats true claim showing wearing underwear doesnt mean showing private part bath wow wow,1,1
modi turned muslim vote bank sabha math sabha visa goon understood apeasement policy longer workjanta sarah gai hai kan use math hai aur line undo use kia hai vote bank,0,-1
dust settled american iranian wondered trump khomeni come power first place thanks soul opportunity like guy doubt society ever introspective stage,1,1
mahamilavat govt delhi weren bomb blast attack different corner country mahamilavat people wouldnt give terrorist reply inline modi meet megarally watch,0,0
chief minister gujarat narendra modi proven great supporter economic movement strong economy top narendra modi achievement,1,1
modi address nation successful koji patrakar searching evidence congratulation,1,1
may caught negativity modi busy energizing nation marching forth conviction,1,0
recommended opening modi government nothing easy get trial stand printed poster need know hold lol,1,0
star campaigner bjp,0,0
whoever sending whatsapp message modi moon mar pluto beware,0,0
getting agitated iran modi decision ahead test declare durbaries bringing near,0,0
arent measured come india modi really well exposing,1,0
ran london nav modi,-1,0
took nya non sense scheme last year regime raise nazi modi dark nazi tha begin dark dek kar alpha laga,-1,0
modi episode bjp mp work via,0,0
modi apologise irrelevant irrespective behaviour pm atleast try give respect others human,-1,1
modi party leader spokesperson politicized air strike done air force credit give air force party centre government take credit politicized every rally election campaign jai hind,0,1
narendra modi allowed chief issue ordo announce great achievement mission shaft credit go scientist modify politicising trying take credit used air space came gadkariji politicising gr,1,1
modi pakistan china centered,0,0
nonsense suspense modi interested contesting guru south wish idiot bjp booming tejaswini keeping wait watch,-1,0
underestimate power win render modi emerge superpower become primeminister,1,0
indian politics never change also living country right taunt modi support appreciate good thing happen bad supportive opponent party good initiative accomplishment,1,1
modi help find job,0,0
wont call anyone gem however would count leader dynamic relied upon wen come national security affair manmohan singh term economic decision modi govt cabinet relentlessly worked welfare,1,1
wrong take credit modi,-1,0
waned modi lucky get vote,1,0
yeah daily see modi choir machaaye show,0,0
yeh modi say nothing happened last yr favourite institution build modi jio university,0,0
yes modi preacher mantra,0,0
yes credit go modi encouragingmotivating scientist deliver mission success,1,1
yes everyone rushed atm thinking modi apology come chip wall note remember gear shade hai pais name hai haha dictator namo,1,1
yes india need modi,0,0
yesterday modi comment claimed shot satellite stealing sky continousouly solar power meditation seed sign living,-1,-1
chuthiya modi every right tell india achieved leadership way upa govt slept project,1,0
clear example person think news happening around pakistan please middle nation way happier whether plane think modi said rafael would better result,1,1
dont understand him rifle may already bought upa must defence down somewhere ask modi find,0,0
look properly see young narendra modi guiding lawyer born ask antinational question,1,0
modi politician tim cook politician,0,0
really care india show outrage every killingnot muslim guy dangerous modi bhaktsat least oppose every lynching guy decide outrage basis religion victimlet victim indian first,-1,-1
really write top class material get read even paying money,1,0
eye seeing mind prepared start unbiased reporting nation proud future come illusion called modi,1,1
modi india anti india really need another right like try suppress woman empowerment openly reach bigotry patriarch woman please fight right vote wisely educate woman,1,0
youth want join modi along lakh people throughout country movement,0,0
youtube video might like mode address nation mission shaft march,0,0
modi promise lakh account everyone video gave indication black money smashed outside india make people understand quantum taken bold step recover black money promised,0,1
shame people support bjp,0,0
modi,0,0
proud united state southern india together defeat bjp maintain democracy,1,0
bjp worker want bjp emerge victorious want modi become rajasthan governor alan singh,0,0
johnny johnny yes papa give blowjob papa,0,0
