actually desk need modi,0,0
celebration free samoa time square modi lead html,1,1
certainly hope india losing battle domain notably cultural social one rampant westernisation even bjp government show like shot banned spot instead get fêted medium empowering progress much biggest list getting new hindu centric constitution getting rid secularism guiding concept,1,0
dont videothen going change fact modi betrayed people also dont video moon landing mean never happened least talk sense,-1,-1
god must longest lasting april joke ever spoke actually british,0,1
india make software pakistan make terrorism cm narendra modi,0,-1
get blown islamic fuck,0,-1
modi one reason askedyou consciousness permit seek mandate,0,0
need get modi life,0,0
raja sabha shameless praising gujarat solar power model aml power model two day final phase assembly election gujarat,0,1
shahrukh khan really mean classic made funk,-1,0
say something hypocrisy well,0,0
still understand bjp inducted,0,0
pew survey given good mark modi govt predicts come back modi,1,0
think almost everyone anything negative say think twice posting online sadly think government ruled arrest eleven someone posted brash comment gov,-1,-1
kept tax mind cinematic universe sending bit look past hour massive baa intolerance take people jump bridge neither replied monument dedicated think bullet train without doubt kolkata india profit people coming jan could interesting,-1,1
using mean baja insert site great would either portability factor keep exchange offer buy laptop deal like software deal programming however driver irrespective good budget,1,1
big fan modi work main problem execution everything work systematic manner people lower lever good honest country want collect money put pocket many corrupt app delhi govt system good implementing thing nice way like mozilla clinic etc touching thee common people nobody care see nowadays happening monsoon session scam scam bjp nda exposing others people good bad politics country bad corrupt people outnumbered good people feel proud modi kejriwal etc time hate people party associated,1,1
year ago manmohan singh please say something namo enough already,0,0
point common supporting modi anti national certificate cette kya kon desk that hai kon nazi basis political party support,-1,1
aaj nhi dia pole complain kia koi santa even support narendra modi work really well country serious residence area sir gandhi nhi sha road khan koi than data,-1,0
aap cong ker world honest join hand world top corrupttell even party scared modi wave,1,1
absolutely correct time must show video modi speech promising lack,1,0
according conspiracy cute innocent kittentoo much forward making grey matter brain dark livingplz find real job hobby love modiplz raise bar,1,1
actor madhavan offer support modi urge voter cast vote election get rolled liberal india staff editor picksfeaturedpoliticsreportssocial median march,1,0
modi,1,0
scheme started modi scrapped pascal becomes,0,0
rise caste religion think advancement country meet together modi win support take country forward aki bar pair modi sarkaar,1,1
best jai bjp jai narendra modi,1,1
best modi take care health well need live ever savior,1,1
facility already modi marker new youre bringing,1,0
rich people suddenly became poor modi came power,-1,0
modi,0,0
done nothing consult entire life wonder modi man action stick bullet,1,0
modi announced schemeyou would busy taking dig called goofy,1,0
modi created chowkidars planet,0,0
modi always run away patrakars hold tha chal dense,0,0
andhra pradesh modi kickstarter poll drive kurnool,0,0
anti satellite weapon tested india thought modi going declare war,0,-1
body stand election want win cost water coming tap modi responsible declare sat somebody responsible logic,1,1
idea winning margin excluding modi wave,1,1
anyone ball oppose modi shah worth idolizing imo,1,0
bjp worker modi become governor alan singh time india via,0,0
bjp agent aka modi bjp r made government pdp sound like secret double agent r bjp,0,0
referring nav modi wave london,0,0
are bare come modi objectivity still cant see undeclared emergency good and bhaktsome example closed mind destruction almost every constitutional institution suppression data nat importance,1,0
ask modi jailed,0,0
attacking modi,0,0
average filing growth modi last year like previous govt,-1,1
aware fever worst small pox get rid modi deadly virus,-1,-1
back message mentioned term modi cant elaborate,1,0
background intercept source reportingthe owner ebay multibillionaire created intercept bought right edward snowden file past used intercept reporter hit piece tulsa pierre omidyar follower modi good look,-1,1
book one know modi backstage like,0,0
antibody way filth bring food familynothing else explain desperation,0,0
modi supporter dont know feel i bar pair nai hone wale difficult,-1,0
best reply tejasvi padma modi hidden talent ud sublime corrupt corridor power,1,1
hai sab apni laga hai scientist achieved even sat achievementmodi gave permission budget real question gareebhi hatawo frm yearskya kar rahetheyes question askedkuch ahin kia,1,-1
bjp win party modi modijai modi marker,1,1
blind deaf modi that cant see hear audio,-1,0
breaking india shot satellite missile test making fourth country world antisatellite capability according modi,-1,0
breaking news ever character sent modi examine human god reason array hai banda change kishmish chair main hasta meta aur koi emotion toh nazi,1,0
bro mai rkman and that nhi failed hai use accept taro aap modi fan chi boat hai par and that mat band pnzz humble request,-1,0
btv worst completely paid channel always frustrated mode dont get news corruption hence story march show say modi sideline advance squad tat thier story today care many pig gone pak,-1,-1
every indian know pap cant match modi nobody taking pap seriously,-1,0
modi desperate cling power trying circumvent mcc stunt,1,0
full year something sri sri sri sri sri sri sriravi shankar,1,0
wasnt upa supporting modi turnout take cue robin switch side get flat,1,0
modi announced right iso,1,0
called independent voice mm level hate modi would fun see reaction may,-1,0
called recount top office unlike cong ignored imp worker chairman tld rajdeep upa proving motivationnamo give motivation recognition many keep would pay attention scientist modi brings att achievement,1,0
campaigning modi,0,0
learn modi,0,0
someone eli pen thing never interested politics gee wonder paying attention rock handing pen inauguration day something peso handing pen controversy wrong pen something signing today trump signed lobbying ban isi plan pen handed penny penny even want pen lowly sign eos sacred pen power bestowed unto signing multiple document would happen someone used pen sign whole week worth stuff handing would stored top secret vault ark covenant use pen start sport,1,-1
wait see modi sitting opposition,0,0
cbi leave london nav modi extradition,0,0
chapman cry public blasting r guess making vote modi campaign,-1,0
clearly breadth tie modi islamophobic authoritarian allowed pogrom take place bit damning,1,0
come people varanasi ready take challenge peacefully teach politics perfectly called suicidal politics mean modi constituency got much transformation last year people love much,1,1
contrast century want century done indian modi govtmust retired one century let break record tendulkar,1,0
contrast refine hate speech learn political moral lesson hone bigotry skill time ripe send modi head margdarshak mandal thats true shishya guru bjp,-1,0
congratulation indian government modi ordo,0,1
contrary pakistani let bit stupid say nobody pakistani establishment want modi lose,-1,-1
cost much beyond actually trillion amount in dont know read indian format,1,0
country woman woman generally fared badly modi year,-1,0
course supportatleast better false promise lakh crore job modi govt atleast nya possible future hope best,1,1
day forced withdraw ticket photo prime minister social medium user today reported tea served train paper cup mode campaign line printed,-1,0
dear chowkidar narendra modi waiting say,0,0
dear modi uncle please change name vin diesel become one famous hollywood star,1,1
defence stock rally mode announcement,0,0
democracy work voted bjp deference stock portfolio spite hindutva yet happy see aap winning give clear signal modi need keep religion governance,1,1
despicable shameful let honest really surprising,1,0
modi asked could watched hour care,0,0
modi knock satellite low earth orbit tell tell,0,0
modi promise like bjp modi something like govt,0,1
modi shot sar satellite falsifying information ballot airstrike,-1,0
indian army today moral character spine stand independent protector citizen fall foot crawl knee modi wear army uniform disrespect retired soldier,0,0
change anything unless blocked modi,0,0
done round year election month saffron wave become juggernaut force modi leadership potential become time powerful today,1,0
dont forget share snap,1,0
dont know much faith adding ii matter respect using modi instead others think respectable politician show democratic leader fascism prevail among,1,1
dont play game modi election bjp origin india,0,0
ordo nation modi vote,0,0
ordo established modi modern history know sir,1,0
dumbass narendra modi addressed scientist made announcement massive achievement wouldnt received due recognition wouldnt even understand significance youre blinded chronic hate,-1,-1
dumbwit election going elect new government bjp paying channel personal fund modi seeking reelection another candidate bjp whatever fuck want fund channel played taxpayer money,1,0
east west india best saying made corrected modi india safe universal attack spying done country happy success,1,1
either hindi weak seen video just shared say modi never promised give lakh indian,-1,0
elect modi forget immigrant even bird wont able infiltrate assam mit shah bjp president tune watch,1,0
even action terrorism also taken modi government whereas took place credit take,1,0
even american govt fight swiss govt expose money laundering american bern never listens much money indian smashed swiss account never ascertained let alone bringing home modi spoke heat anticorruption campaign,1,0
even seem like much idea inventing something lot people thought idea time travel one know made happen yet,1,0
ever card favour modi bandit panda,0,0
every thing look good tweet modi except hashtag,1,0
everyone trying figure could modi speaking tweet aaj samvidhan mein badali karate hue secularism sha data desk hindu astra ghost kia data hai,0,-1
exclusive video modi month gujarat riot,0,0
existence matter country need throw modi,0,0
fake guy modi,-1,0
feel like going home jay rada getting bjp ticket campus live update,1,0
first check true between tweet take care jai shri ram,1,1
five stage living modi address nation,0,0
lose nobody defeat modi varanasi,0,-1
modi hater mark,0,0
neglected state gateway south asia year modi north east via namo app,0,-1
look thing appears clean sweep poll card bjp namo may jailed rajnath might fielded party mode longevity doubt every possibility inside attack ala india,1,-1
gadkari nagpurhe could even win mla election jaipur rise modify mass leader,1,1
game madhosh modi,-1,0
giving permission carry test want modi destroying ordo piddis giving credit near whats next they say near went space maybe moon got idea iso,-1,0
god bless sir may assist noble mission helping modi indeed helping billion people quest towards rebuilding prosperous society,1,1
good idea still vote modi,1,0
good morning update sleeping already done lot work area also say biggest fan modi always try follow footstep pair bar modi sarkaar,1,1
got strength proud never passport got stronger around world party got corrected still getting corrected never washing dirty laundry public professional person talking wonderful prime minister modi,1,1
govt done much force procurement make combat readiness whether fighter planessub marine bullet proof jacketsbadly needed rafael delayed many year upa putting country security jeopardy cry horse deal done modi,1,-1
great going india modi leadership,1,1
haha good one fair really looking anyway hai deg modi bhi nai lakh chance use bhi boot main,1,1
haha model code conduct player history modi cod conduct whatever model code conduct,1,0
hate modi use indian force polish politics ridiculous like,-1,-1
hat narendra modi spectacular interview,1,0
retreated that didnt get much really really really love modi con fellow confusing innocence threatens flow praise nearest modi,1,1
objection leader modi,0,0
hello mrshahithoroughliar pls read article ppl really frustrated,-1,-1
hindu mob routinely resort kill muslim suspecting slaughtered cow eaten meat beef export risen ultra extremist hindu prime minister render modi via,0,-1
great grandfather promised grand promised dad mom promised son also making promise finally say ask modi ask unfortunately truth fake,-1,1
history created ordo iso scientist course prime minister modi congratulation,0,1
honesty first required hall mark leader narendra modi plenty much become weakness time,1,0
hope chowkidar modi win want see india doesnt back terrorist america love,1,1
hope modi win election huge margin,1,1
long work company looking change job site visit job seeking,-1,0
know candidate credible know modi credible whole persona based lie,1,0
seize something outside place,0,0
however kummanam dont want miss entertainment,0,0
huge welcome modi kurnool,1,1
india renew mode tenure second round reform,-1,0
india still life medieval time politician like modi,0,0
indian defence update new offer tech transfer india another huge achievement modi govt wrt defense,1,0
indian politics option wise know elect whether want foreign invasion swarajya upto win always jai hind,1,1
indian soul thats anti modi jeetendra had,0,0
indianewsmanch union minister col rajyavardhan singh say nda repeat tenure narendra modi become prime minister,0,0
india election commission examining modi address antimissile test vía,0,0
india got credit modi ballot,0,0
indsamacharexclusive given cleanchit modi address mission shaft,0,0
inflation fair blame believe came september year modi took office,-1,0
intellectual prostitute india experience existential crisis modi,1,0
intolerance rising india letting youth icon contest election institution smashed park modi,0,0
isi going take credit whatever terrorist attack random sunny fucktard carry state isi getting wrecked,-1,-1
because today many opposite side modi dont want hear people season leader,1,0
modi modi win fearless charismatic doe leader magic,1,1
way modi elected people,0,0
shame compared deatheater people world modi know tejaswi kind anything send modi margardharshak mandal,1,0
islamic jihadist believe ideology religion true supreme faith false inferior root cause terrorism killing around world propaganda lie modi failed,-1,-1
good national pride cricket modi nice combination,1,1
jai modi apply burial lot,0,0
santa much following election modi much,1,0
journey modi trailer must checkout,1,0
judicial corrupt day modi even neglecting constitution suppose protect silent unconstitutional news rejected constitutional obc reservationjudiciary ordered forceful eviction million trial,-1,-1
jump modi,0,0
cant believe defending modi terrorist sound sensible man,1,-1
kab tak area political joke one man seal modi nam ana pet bar raja hai people bound get fed,0,0
kal lunda modi photo block area,0,0
vandal opening statement wrong said modi strong leader kanal decide country opinion best kept he sitting station give right speak way kanhaiya gave good,1,1
keep trying new hobby activity far seems tried activity enjoyed find something always wanted instead cocktail try cocktail instead wine tasting normal hill vacation suggestion morning walk tree religious place yoga class bike need indirect thing cant jump try change lifestyle know comfortable dad wanted quit drinking take pranayam right away bond even know bonding thing trying,1,1
kindly update status weather grp something way grp helping encouraging chorgrpf know choir thats helping traveller modi aur push yeh grp api badali karan hai,1,1
kr player deserve congratulation sr way iaf deserve narendra modi,0,1
last election modi got vote share mean people rejected antinationals according tejasvi,0,0
launch namo channel used run mode speech political campaign available question violation promotion banned,1,-1
leader selected bjp basis merit talent criterion leader dynasty family harvard family,0,1
leader like narendra modi came lead india better future,1,1
let start thread saffron colour daily life see remember see saffron bjp vote lotus see saffron car rem vote lotus,0,0
let enjoy,1,0
lvaro tame maa rank rather uneducated fucking chowkidar sound like someone give modi dot talk education dude baa hoon use mai tera,-1,0
logic urban sagvis anything modi say progressive anything others say repressive,0,0
lol gonna marry hippopotamus every unmarried men become hitler modi unmarrieddivorced woman become feminist agenda destroy everyone peaceful life get life miss mari,1,0
lot global planning needed event like sat test narendra modi arab swami tune watch live,1,0
lot people saying modi revolutionary scheme leaky regime minister bureaucrat arent able deliver scheme benefit ground doesnt bjp team track scheme ground,1,0
love best narendra modi,1,1
love india way become strongest country world thankyou ordo beloved modi,1,1
main bhi chowkidar video conferencing today narendra modi interact main bhi chowkidar supporter via video conferencing today via namo app,1,0
make mistake modi rest,0,0
making movie one many many many ingenious way bjp creates favourable image modi opposition box thinking influence voter create favourable perception none,1,0
mapdata banerjee criticises modi announcement mission shaft asks going space work,0,0
man arrested posting offensive photoshopped image modi social medium,1,-1
many many congratulation sir modi,1,1
marketing best modi journey common man assist sharma mesh sulla eros via,1,1
may blind chart better illiterate fool poor comprehension language see video claiming modi promise carefully time,-1,0
mission shaft modi diver nation attention away issue ground yadav akhilesh tweet,0,0
modi address two election rally delhi via,0,0
modi also said whatever given chawkidaar give time ubi administered gst councillike committee centre state come implemented modi second term,0,0
modi indian love president trump chinese obama nothingburger obutthead one know,1,1
modi attacked harmless innocent satellite lying long kyun mara became,1,0
modi back want rule telangana cr rule best till,1,1
modi biggest shame india hopefully joker shown door,0,0
modi bjp diverting attention real issue,1,0
modi born marketing ninja,0,0
modi building got created last year acknowledge first,1,0
modi cabinet govt another opposition leader cant,0,0
modi campaign three state today,0,0
modi trusted,0,0
modi contesting pakistan,0,0
modi deliver jump said waive farmer loan said done immediate came power state modi big,0,0
modi denies allegation,0,0
modi dictator,1,0
modi dream true hope,1,1
modi god,0,0
modi government already giving dot subsidy simple arithmetic five crore family work lakh crore le given,-1,0
modi govt bad august type loot low inflationcracking corrupt surgical strikescrack terror,-1,-1
modi great world,1,1
modi announced ahead time strategic reasoning galvanise eastern part bihar well explained wasnt last minute ditch effort save face sign looking meth going bear fruit labour,0,1
modi said threat may known enemy may invisible clear fighting terrorism would primary job armed force never mind growing real threat two military line pakistan china,1,-1
modi main pumpkin main salute sir ordo iso,0,0
modi indeed achieved disclaimer must credit least,-1,0
modi turned india election style presidential race bloombergquint,0,0
modi pay albania dani,0,0
modi interview opposition doesnt even basic knowledge procedure say prime minister narendra modi hitting criticised india sat success,1,0
modi interview ballot attack evidence given let give evidence professional exaggerated,1,-1
modi jee great,1,1
modi journey common man assist sharma mesh sulla eros via another film plz watch guy,-1,0
modi kept mum mum keen pilot behind line,-1,0
modi kia modi kia mare aur shared huge japan gear had game japan shared huge aur shameless barking like dog mara push goal shameless trying prove,0,-1
modi mood,0,0
modi never promised lack watch whole video keeping mind place as,1,0
modi india even born india war pakistan,0,-1
modi modi,0,0
modi promised,0,0
modi really nervous scared thats using might mean campaign,1,-1
modi say tomorrow give people criticising definitely board,0,0
modi sending three astronaut space snatch credit time,0,0
modi shah threw awaycount glorious moment modi shah,0,1
modi shoot space thru tool,0,0
modi smiling childish glee love seeing way,1,1
modi speaks scientist part india mission shaft success watch live,1,1
modi terrorist extraordinary born raised prosper india breeding illegitimate haram bjp,0,-1
modi till co past year limit set bjp,-1,0
modi unlikely contest vadodara high voltage high voltage,-1,0
modi wait see tide bjp tsunami modi wipe political party election restored usual,-1,1
modi headmaster whatsapp university,0,0
modi never elected,0,0
modi spare chance market,0,0
modi consult anyoneunimaginable,0,0
modi would happy behenji mayawati written need construction road meet akhilesh yadav would written housing poor never,1,0
modify sat assisted episode indian adventure monitored cobra ball mike fence space pitch mode claim came backtoback,0,0
mode degree fake student stop listening say anand sharma via,-1,-1
mode government obviously,0,0
mode sunny leone,0,0
modi achievement country opposition hijab criticizing modi talking,0,0
modi shocking remark instead worrying abhinandan opposition party felt proud indian air force interview arab swami modi accused opposition conspiracy take candlelight vigil demanding return,-1,-1
money always safe modi see white money,1,0
hateful tweet modi,1,0
namaskar modi jee watched her interaction arab same loved her attitude wen one honest towards commitment fearless congratulation wot dont change ever jai hind,1,1
narendra modi deliver important message follow live update,1,0
narendra modi good select chowkidars hidden bill,1,0
narendra modi great leader hope next coming election win expected narendra modi take the,1,1
narendra modi bid reelection keep indiapakistan relation dangerously edge,-1,0
national conference senior leader mla mendhar saved rana said prime minister modi equal terrorist,0,0
naturally family support head quite understand previously entire family met narendra modi day narendra modi people saying something else who call politics patna she,1,0
need job modi,0,0
nehruji send satellite satellite destroyed modi regime democracy danger modi hitler main,0,-1
never seen kind informal action show completely unaware history,1,-1
new india created modi get another year govern india,1,0
new thing evolving modi that cricketer kitty,1,0
next modi surely doesnt matter many time wrote anything friend,1,1
nia must investigate terrorist pigeon attacking behindindia splitting inside slowlywell done modi,0,-1
nice sir welcome chowkidar shri narendra modi arunchal pradesh,1,1
nikhiljee image read gujarat file modi image general public today two drum apart contrary saying bad deed forgotten segment society think god word shall waste sorry,-1,-1
fistula news modi second seat vadodra bore south already closed else option left,-1,0
nonsense stop meddling fake news done upa railway minister mapdata benerjee modi backstabbed kannadigas changing rule allows north indian get job karnataka,-1,-1
allowed ask proof modi regime considered insult indian scientist,0,-1
insulting assist claim tweet till end support good character modi till getting view okay,1,1
liking modi support decision one take call nation bhi age limit hong chile retirement esa koi nasa project those hai ink bin kam nai cholera nation sir,0,1
enjoyed freeze also smuggled good india cavalcade team used walk green channel seen question asked modi put stop,1,0
know many mode follower account get suspended,1,0
let modi continue next year good job,1,0
spreading rumour quitting jet airway goal teaming mall form new airline modi named goal airline,1,0
obviously didnt belief thing enjoying drama never cared law upheld word promise,1,0
say modi self obseyand seek publicity,0,0
modi marker jay,0,0
modi reached space,0,0
one find yesterday said tejasvi see young modi big word understand laughed initially never know,1,0
one india mostwanted men selling million art collection see whats sale artnet news,0,0
one make politics interesting modi,1,0
one thing good dumb modi bat like rare kerala,1,0
modi established it aim research center oped economy iso india int even know grow potato,-1,0
paid channel think modi would said arab would danced studio,0,0
panparak song clap jump modi best example stainless person,1,1
recited hoon badly hoon promote modi,0,0
opposition modi ji rocket launcher,0,0
opposition political party make unemployment main agenda upcoming election modi government serious failure,-1,-1
nation theory definately percent right muslim fortunate below alla blessed hannah nation theory presented hannah today would beaten mode badmashiya,1,1
respected prime minister shri narendra modi nation wide agenda clean india dehradoon municipal corporation garbage collection van come week expect clean dehradoon clean nation,1,1
time concern may get right modi horrible hate longer,-1,-1
paper cutting dia admin kehlva kanye hua proof modi govt didnt thing wash give ppl like seal such nhi hua chill chill bolenge take action agent govt ruled yr,-1,0
people think matter public concern modi giving pais bhi swiss bank sha hai kay,0,0
