song complain modi episode web series also foe fo fighter dai jama like main,0,0
calling best ever shri modi animal,1,1
official every indian special every indian vip tweeted bot cannot reply query send hotmail subject anti anti block bot query please provide link submission would able help without link,-1,1
ohio manmohan singh guess misunderstood modi manmohan singh,0,0
one stop narendra modi sir become,0,0
one film maker produce film urge people vote modi breach model code conduct hundred film maker write letter urge people vote modi freedom expression,0,1
opposition disheartenedt modi almost lost gujarat lost karnataka rajasthan chain grow opposition disheartened modi oil conduct thousand rally,0,-1
nobody saw man clearly people thought swamp making lot noise truth saw man stage puppet modi falsely led partner crime,-1,0
say anything fear vyapamed rest super rich celebrity propaganda movie politician business family say had main jay santa ana kam santa,1,1
isrothe space institute achieved goal attaching pre made goal satellite modi say done feu world,0,0
waist continues target modi pulwama attack video,1,0
one pork true lapse ia part yes modi credited achievement failure also counted report card way know many year maunmohan delayed spider induction,1,0
pakistan arrested cleric forcibly converted hindu girl muslim india prime minister modi cut stomach pregnant woman publicly lauded yogi adityanath encouraging rape muslim woman awarded chief ministership,1,-1
people india chowkidars proud honorable shri request everyone join chowkidar campaign modi today contribution definitely strengthen moment,1,1
people love modi simply ignorant classified fool destroying child future clueless consequently suffer mistaken identity often self doubt,1,-1
pair bar modi sarkaar jai hind,1,0
please someone tell supposed vote according pakistani like dislike pakistan population yet opinion guide voting choice indiansnarendra chowkidaar modi insulting nation garbage talk,-1,0
pls tell modi doing lakh crore freeze per year,0,0
pm aim addressing nation take credit dado success make indian aware crime upa govt note court ire directed modi halfdecent journ would ask con party tough fund mission shaft,1,1
political needed everything thing differentiates modi others take decision like one,0,0
poor still reloading make show selling modi shirt show getting affected www poor guy,-1,-1
positive thing modi gadkari fadanvis negative buddha,-1,0
power fool leader world ham sabha modi modi modi vote,0,0
train togadia electoral venture nuisance value modi bjp,0,0
pray god modi reflect india,1,1
pretty sure modi going make announcement ashwins mankadding wicket,1,1
program started complete credit scientist hard work modi,-1,0
promoting sinking party try best election modi,1,1
proud day india modi announces accomplishment mission shaft read watch,1,0
question much modi paying tata sky pushing damn shit,0,-1
rafael big issuemake mistakethat fake image khaunga khan dung modi easily puncture tright misused official machinery administrative power suppress,-1,0
rafael paper stolen body terrorist killed ballot stolen lakh stolen mode degree certificate stolen,-1,-1
randeep singh surjewala modi drama king prapanch mantra pradhan mantra actor flop film,1,0
rare pic jawaharlal near launching anti satellite missile modi took credit yesterday,1,0
rather investing hefty amount child education ask join pagoda vendor cause child end selling pagoda somewhere around street modi government,0,0
real son modi,1,0
really sir modi main pumpkin hai,1,0
recent statement modi air marshal strongly point towards towards strong lobby want purchase foreign fighter also price tag fighter also suggest great degree corruption involved acquisition,1,1
recently modi mocked child dyslexia much pain parent child,1,-1
remember india rich people wealth year year mode time rich profile time active busy dehvyaparis grabbed wealth,1,1
right people kayak no modi bull sake know character matter,1,0
rome built day modi come party claiming credit india progress,0,1
sab election time yard aatamodi already doingdont need idea,0,0
said vote modi anti india like recently chattisgarhrajasthanmp,0,0
saw modi interview take name say even though owe crore bank govt attached asset worth highest authority confirmed full recovery bjp spokesman continue rhetoric,1,1
saw film excuse though india state changed modi hated freedom,-1,0
saw tweeted different post index mostly criticize india modi govt tried target modi india modiphobia good health instead hating modi use time work,1,0
say man whose sister drank manga plant restored modi team effort ine salon khan hai,0,0
second fence sister time around people decided critical factor high polling percentage thats exactly modi focusing,1,0
seriously modi code conduct neither semblance code iota conduct remains,-1,0
shame use pak back modi slogan,0,0
show much love the amount modi love shear,1,1
shit logic bjp people give cache din woman,-1,-1
bjp end seat chance modiamit shah shown door gadkari assuming center stage lutyens dream scenario,-1,0
vote modi crore led bulb distributed crore,0,0
show one evidence modi promised lakh dare,0,0
show childhood struggle nature modi donated book friend poor brilliant moment really touched heart reminded movie thx simple,1,1
sir primunister goto r campaign people said vote modi said vote inspiration youth best sir,1,1
sir forget modi designed missile personally gave scientist scientist must thank modi first without whose design would never possible,1,0
sir mark word made fantastic job poor nation failed act dont worry generalyou junior politics otherwise never made comment like bath time think abt manga adopted modi average mark,1,0
sir modi never said money deposited said money bought back would enough vice everyone cant held responsible people twisting word,1,0
sir pls something get back money invested noid based bikebot company sanjay that cheated lakh innocent people,1,0
sir want modi win,1,1
fixer fixer thanks modi,1,0
snoopendra modi,0,0
people blaming modi,1,0
ppl working termite all one big supporter anti hindu sentiment cry foul accumulating thing try blame modi cost,0,-1
someone update script people running negative error bhujiya,-1,-1
sometimes sometimes blame ppl dept community etc modi everything wrong country pls shut,-1,-1
specially god modi medium,1,0
still hindu voted modi kamullo that gay,0,0
sting show alleged bjp worker willing change demonetised note in crore commission via,1,0
stupidity selecting constituency all even aware modi wave save shame smith sha giving ticket tejaswini madam,1,0
submit mit shah lol kidding date nov previous date bjp leader spent cash left right center buy property masse biggest point bjp mla would as illegal transaction using account maybe pass exist seriously think became account exist ask entire family office staff bjp mla really serious like modi think people gullible fall shit,-1,-1
success scientist never drama drama written dont know english,1,1
samantha follow kanimozhi say modi step guarantee back delhi safely open threat condemnation comment first look house tamilnadu commenting others,1,0
sure invoked much interesttrepidationexcitement modi kind announcement made,1,1
surgical strike credit go soldier modi air strike credit go soldier modi mission shaft credit go ordo modi raid cbi raid credit go modi,0,1
tachi give another chance modi least get number year compare india manmohan etc dont worry vote modi please tweet may,-1,1
terrorist pakistan want lose opposition win modi via,1,-1
tha royal modi fan india,0,0
thank modi attacking attacked gun welding ha,0,-1
thanks lot helping modi become best hope right,1,1
thanks modi easy identify chart,1,1
mean modi save india pakistan terrorist,-1,0
remarkably low think many people even aware existence platform attention twitter facebook whatsapp least come sharing politically sensitive content,1,0
joke man modi want medium attention thats us platform success ordo please dont take every one credit modify,1,1
said india enough money scheme wonder party launch upa government even enough money drop buy rifle mean india five year modi govt enough money,-1,0
india public india future modi great,1,1
biggest election interview air online tune watch modi speaks arab swami watch,0,0
blooming lotus northeast began arunachal pradesh modi halo watch,0,0
corrupt always worried ill gotten wealthsemen differ semenica ghost worried another attack modi ill gotten money tense,-1,-1
demonetisation already ruined booming see unemployment economic distress worst decade modi looking way smiling lynching happened farmer committed suicide,-1,-1
achievement modi common junta cannot decent conversation politics used happen pre day chart anne baa ina nazi defend karate main jin modi,-1,0
thing sized emperor mode reign communal hatred everything else went putt,0,-1
opposition leader call modi choir without making constructive criticism govt denigrati,0,0
people ask modi year today indian airforce going get check fighter helicopter india become country world get helicopter helicopter killed wanted terrorist obama bin laden,1,-1
person win poll usually get chosen person year usually chosen editor choose,-1,1
person modi brand till today andhbhagats,0,0
president tool indian proud afghanistan committing another country citizen poor big big effort part government geopolitical cough pakistan cough play big role decision laughing money helping build afghan infrastructure completely decimated year war funded new parliament many road school hospital effort help actual people war wondering general politician mention india given cricket stadium afghan nation cricket team practice delhi actively promoted game goodwill gesture truly upcoming side world cricket imagine global sport hero rapid khan country even proper ground compare china throwing money african dictator lease mining right port investing entire country guise international aid tld good whatever afford expecting friendly tie return,1,1
prime minister shri narendra modi addressing national woman livelihood meet deendayal hastkala sank varanasi uttar pradesh march,0,0
old slogan alibi data modi data still believe people india fool btw anyway nya,1,0
terrorist attack country country breeding unlike asshole shift neighbour killing soldier,1,-1
website make see modi accepts endorses title feu,0,1
world changed especially modi world reacting differently positively modi evil design succeed india must keep modi,-1,0
yogi adityanath narendra modi,0,0
wonderful people india modi closing gujarat gujarat,1,1
doubt mind long kind political support dani enjoys buy even operated mr vk gujarat mawards collectively slay telugu business end mode next tenure,1,1
info end except bullshit sadly maybe word learnt type english read resent ask handler even promise kept,-1,-1
news coming yesterday modi rally meet le turnout compared rally,-1,0
pakistan would indian run election campaign terrorist pakistan want lose opposition win modi,1,-1
guy already warned still keep screening,0,0
people shameless groupwho celebrate india troublefrom antibody antiindia,0,0
dumb dont serve like modi,-1,-1
theyre known modi hater one bothered statement,0,-1
think youth appeal enormous endorsement modi strong enough cover enough intimidate opposition take,1,1
think modi team bjp clueless put india hold time meme creator done job well one question indian guy election commission independent charge modi cabinet,1,0
think modi tried save guy failed let hope wont try,-1,0
bullshit expected atleast refrain comment anyway control lower rung politician social worker bullshit spread bjp openly saying trs rallying mim crime understand ina kya jaa raja hey atleast leader mim well educated guy know much country law also know counter propaganda across border unlike guy,1,-1
called fear modi,0,0
even mention asbestos still heavily used india today essentially zero safety health precaution client firefox indian asbestos use,-1,0
fellow requesting narendra modi facilitate cricketer vote anywhere india common people travel votesbut doesnt know prime minister doesnt conduct electionsonly election commission doe request election commission,-1,0
fellow telling modi promised put lakh bank account,0,0
protecting nav modi,0,0
going benefit alliance karnataka people see future hold modi come power voice shout supreme leader lead entire central machinery reign isnt democracy autocracy,-1,1
one version raja anyone asked modi act happened,0,0
rate rose modi know win election year enough correct mistake,1,0
time also modi sir,0,0
thought belongs people opened account belongs modi please confirm,0,0
thought sumalatha ambreesh entering politics,0,0
vote ensure govt need deserve responds mode vote kar appeal election via namo app,0,0
time come modi back delhi family jail,-1,0
today india scientist work visionary bold leadership modi,1,1
today another evidence abide model code conduct pay respect institution authority entrusted keep,0,1
trivago guy suggesting mit shah right kya alone kai online hotel search kia hai,1,-1
true frank modi understands shown intent ease business low deficit step right direction even gst simplifies issue one term issue consistent effort needed,1,0
truth truth truth reflect face humanbeing likewise modi actually salesman bjp always saw modi face news attack busy marketing bjp bloody attack others interested speak truth,-1,0
tweet yesterday indian airforce get chinook induction chinook heavylift helicopter happened transparent policy leader like modi,0,0
twinkle twinkle little star pair bar modi marker,-1,0
two indian pilot pak custody mig lured two pdf air def ambush made shallow congress indian airspace dropped bomb waited iaf miss scrambled turned back miss followed shot air defence gun,-1,-1
two term modi continues best one may even see much cleaner india public merely physical cleanliness,1,1
modi govt focus create job provider hence push skill india start india mura romana minute loan mura romana crore beneficiary even employed additional person many job,1,1
unofficial spokesperson modi,0,0
upa removed fuel subsidy nearly doubling price diesel didnt roll back equivalent decision taken modi govt,1,0
nice greatfully modi thanks,1,1
nice sir modi govt lot good project wish namo,1,1
significant indian happy mission accomplished know fact verified international medium battle cry india actual surgical strike leading modi start war ultimately nuclear happy believe,1,0
via modi hail india military space power antisatellite missile test,-1,0
vive omberok left play narendra modi upcoming film prime minister,0,0
vote support modi,0,0
want play number game give many number modi govt succeeded year mm could done yr point trust govt trust modi wont thing self profit,1,1
wasnt modi selling shirt two day ago,0,0
watch mapdata tmc stand tall west bengal bjp emerging key challenger time,0,0
watch year report card modi government,0,0
water wet sky blue dog bark shit tell something new,-1,-1
well boy story going give exact detail reliable evidence likely true concern maharaja jaipur several generation jai singh maharaja extremely well endowed number wife ruler kingdom rajasthan used numerous wife mean form alliance case kingdom attacked regardless maharaja well endowed none rank could bear take also many concubine lover none space receive maharaja became extremely frustrated told administrator would offer reward anyone could satisfy word sent lady heard know caste mention went see administrator administrator warned said perfectly capable maharaja met first time maharaja able fully load barrel fire recognition maharaj gave lady village giving village mean head village receives tax privilege accorded village still exists located jaipur district named honour lady,1,1
well sagarikait like dubbing modi supporter bath sarcastically mocking slang even used many time intellectual like get write editorial taking mocking common man col support leader total intolerance,1,1
well said sir called historian shortly history modi winning second term guy run pakistan china,1,1
well also wrong put em output place modi mm face em rigged government run specific face dont matter,1,-1
class petty set political opposition leader cannot even celebrate glorious milestone national success use pull modi narrow political objective,-1,-1
go around come around bastard well modi shah,0,0
happened christian michel came happen modi mall come someone faultwhat bjp govt last yearstotal wasted year front,-1,0
response people whole hearted welcoming modi looking forward interaction,1,0
think beyond tactic win election leader unwise doesnt know he consistently promising yeah whats difference mode acre din,1,1
opinion modi shah,0,0
whatever good happens country nehruigrg modi reason bad thing happen,1,0
internal modi pakistan dont flatter,0,0
claim real avant albania lol every anti modi dumb,1,0
india capable even time modi came power year back delayed election,1,0
modi desperation ground breaking,0,0
space strike done modi government told done ordo today department raid done blaming bjp cant think want marathi dharma near office show chowkidar choir people fool dont lie,1,-1
recovered black money worth lakhsindian promised modi remember leader election promise quick look questioning better luck next time victory hand,1,1
wrong information quote measure quote old scheme dot mode success without supporting data act bjp slave,1,0
modi,0,0
stopping prime minister country ahead something,0,0
people calling modi uneducated degree entire political science cry loud know anybody else kind degree,1,0
dividing india manmohan singh modi clearly cannot tolerate idea india country bloody breakup india element,-1,0
modi rally india guru chart attend full force fact indian chart say hell modi linking nri boot guy indian politics,1,-1
dont announce scheme upa era year regime fear lose election may reason behind one trust want modi,-1,0
matter secrecy care educated college truthful,1,1
modi fry parade south india today lol,1,0
modi taking advantage using election campaign,0,0
modi chowkidar campaign nonstarter,0,0
much fear grand fut paid modi,1,0
need modi lead bjp government vote new india namo,1,0
asking get fact right modi kick as last year talk bhakwas cooper bhakwas like,1,0
sha matter bjp pair modi married per hindu ritual broke marriage vow deserted wife without providing upkeep speak nika pair that canon,1,0
waste money election commission announce modi elected,-1,0
dangerous world even modi reelected,-1,0
modi answer question,0,0
take action busy removing mode picture,1,0
win bangalore win india win modi future new india best,1,1
modi people due scale one right,1,0
wonder good people supporting modi,1,1
worry criticizes affect modi,0,-1
would failure would blamed modi ordo would say credit failure modi pulwama attack hua tho blame modi air force attack balakote credit air force hypocrisy core,-1,-1
wow taking credit iso ordo agrarian crisis npa crisis rupee depreciation price rise ignore taro fact earning le dollar day going around saying india superpower change status scientist modi,1,-1
wow really cool politician barely ever address rape violence woman half time inaccurate hope guy make legitimate social change india,1,0
aaa modi gov yr happened,0,0
yeah modi could even medium god didnt even try,0,1
yeah script modimagni problem ive spoiled balanced regular singleended thinking sm stack script joutenheim dac stock,0,0
year manmohan sings government year narendra modi government could make savrupganj pihawara highway par day highway make country,0,0
yeh modi logic thi,0,0
yes course ordo scientist deserve every applause deserve make announcement hard work modi modi bjp party done successful mission absolutely nothing choir party looting common man middle class,1,1
yes modi speaking average indian want,1,0
yes reply election democracy working modi,0,0
yes youre right government shall pursue issue international front aggressively however cannot deny modi government taken lot positive step towards permanent solution problem please see,1,1
yogendra sense fair whose behalf target modi paid habitual,1,0
always appear channel debate political analyst always antibody antibjp openly proclaim say sympathy trade trade gang instead masquerading political analyst,0,0
kind hearsay modi bless,1,1
modi supporter good must list promise modi fulfilled show,1,1
really strong together trying dislodge single modi foot,1,1
saying bank account say thanks modi,1,0
asked modi became asked master type stroke played follow master like multi omar studied chris school,0,1
couldnt take decision yr weak leadership weak foreign relation questioning modi delivering yrsamazing god bless,-1,0
know well compelled sycophency fear looking employment,1,0
need gut take decision modify man nation safe handsnamo hai pumpkin hai modi jai,1,0
young generation big hope indiahats modi sir guidance,1,0
yup look like feasible may modi promise kind thing,1,1
boy let come celebrate modi govt yesterday modi become air space scientist today security boy modi come another avatar,0,1
queue bit longer modi job opposition hindustan time high voltage high voltage,0,0
chowkidar modi assam euphoric crowd invested faith,0,1
lotus modi lotus rest,0,0
