india need nowadays modi,1,0
bomb actual fuck probably seized office non bjp state imagine office bjp ruled state,-1,-1
dotted bhiliyam chosen one,0,0
glad sash maharaj,1,0
guess promptly replace statue savarkar smellybag,-1,0
insulting say pai sikh men one person office agitated aware rule,-1,-1
larger version linked image modi mar jpg sourcecode maximagebot subject delete empty message reddit com,-1,0
like mock library irony president leave office set library donald read book well danny read fox news talk president donald trump video library many empty blockbuster revived,1,1
manmohan singh,0,0
maybe put sound cool oriental note director commentary beginning episode season explained one guy broke maybe forgot took class kind percussion based oriental orchestra went point performing live stuff forgot called never heard apparently amazing recording ever even hold candle hearing live need listen commentary talk much,1,0
question medium certainly make joint statement prestigious without embarrassing america end,1,1
know brainwashed believing terrorist group would classify action violent militant absolutely terrorism heaven sake using gun grenade bomb achieve whatever want would would terrorism,-1,-1
make hai darshakon make policy make vision make challenge aur make point view sunny glad make clear within minute isnt interview modi another avenue campaign speech,1,1
get educated responsible obviously wanna blame everything midget life,1,0
bjp dangerous country fucking cancer need destroyed asap,-1,-1
election day away truth malnutrition status parliamentary constituency arrived time prepare informed list demandswork seek mp,0,0
worst award shri narendra modi world cheat loot liar award,-1,-1
desk nhi besiege modi,0,0
abe made toward modi biggest campaigner indian political history need good join bjp nothing,1,1
abe atlas pakistan main sab log itn gala english bolt hai even people openly exposed internet actually using reddit,1,0
abhishek manu singh trying defend undefendable haha,1,0
absolutely sir doubt conforming weather plumber ana keep requiring modi inauguration definitely plumber keep uncle,-1,0
addition mode falling rating certain state nda suffering due popularity cm like eps yogi well anger mp loss could seat,-1,0
advance joshi modi shah rest mere pawn r r r,-1,0
affirmative obama also spoke intolerance official visit india republic day trump admin also needing india intolerance specially naming modi cia man know rate gear wa lac church offering lac,1,0
election claim modi isle banana,0,0
spirit must reporting rather calling currency worst region could told pakistan got handsome prime minister region surpassing modi ashram ghana winning,0,0
agency ana kam karen dia ga without pressure modi gov wont allow recall opposition want cbi independent body misusing,0,0
party protest modi marketing stunt announce space achievement done president india,0,0
set create mall modi choksiand blame governing party timegrowup canmore bournvita age,1,0
fight mode name dont need luck even clown,0,-1
amazing coordination within bjp present highlight day rally narendra modi thank get stronger day target partner even within nda able blackmail bjp namo,1,1
albania big enduring india tenureshe close albania show one picture article modi given contract albania please read history first talk,1,0
see modi jab public such porch porch hill abbas vara tata bye bye,-1,0
ordo stand modi,0,0
money modi failed give,-1,-1
case alleged rapist year called brave modi,1,0
another turn dynasty prevalent bjp leader okay,1,0
appreciate modi culture real modi follower,1,0
bjp worker modi become governor alan singh india news shameless person stopped low expected governor idiot boot kicker modi governor bjp worker,-1,-1
already paying tax though nose modi fly around world perpetual vacation build useless statue better money go poor,1,0
super power space beware pak satellite danger nowcongo modi,1,0
aware free air channel namo started called upcoming film modi modi campaign next thing see chaukidar ecofindia,1,1
arab swami requested modi join india space mission land moon lanka may first dog space arab want first quota moon,1,0
asaduddin waist rule wave modi predicts third front govt centre financialxpress,0,0
sat proposal sent puppet mm sanctioned sonia allow happen modi done successfully obvious congress would ask done,0,1
ask story shah modi getting woman followed police come pack start abduction woman woman want,0,-1
ayodhya take globetrotting modi time varanasi,0,0
bar pair modi sarkaar people say modi rally,0,0
bach anti modi reason time reason stupid reason concentrate profession politics many learnt lesson suppose,-1,-1
manga supposed reply targeted modi donkey manga,0,0
love keep cry love much done first year modi government also cried time keep cry bro love,1,1
south indian experiencetamilians regional feeling modi supporter waste time spending concentrate state would beneficial know regional leader seeing pm past,-1,0
better modi atleast democratic modi enough courage face medium give answer every question,1,1
hai hai hai modi attend cc meeting top defence official,1,0
chart know support modi,0,0
big than modi,0,0
biggest fool country ever produced venture italy teach born family pm ordinary like modi ppl take care para,-1,0
bjp narendra modi indirectly responsible thi,1,0
bjp attacking opposition positive achievement year fearing people wrath defeat bjp leader worker avoiding campaigning making excuse weather hot said read,1,-1
bjp failed fulfil promise,-1,0
bjp chief mit shah declares asset worth crore see jump last year,1,1
bjp graph hilarious,1,0
bjp hasn started campaign let come lista let modi start speech aise bajayega saki,0,0
bjp nurturing next generation leader like even modi peacefully retire,0,1
bjp saying indian choir except modi cruel joke,-1,0
bjpmodi bharat never cease surprise modi india guess next considered bhagwangod one dot worship sha considered human,0,0
blatant disregard model code shatabdi express serf chain cup narendra main bhi slogan photo go viral,-1,0
bos criticizing favor modi may mi understood tweet criticizing tweet appreciation tweet really like govt,-1,1
brilliant article personally feel modi govt failed may right time,1,0
dont worry india hate war wondering extremist hindu modi also blame pakistan another speech settling score blind follower vote,-1,-1
nothing modi anyone matter solely india every indian today proud,1,0
modi govt cleaned manga,0,0
nothing happen last year except jama thats concern back year due stupid leader market raise modi chart,-1,-1
officially want modi,0,0
thought failure create job noticeable modi lot job creation happen start distorting real issue make look good party,1,1
say chowkidaar modi chowkidaar jailed etc legal right chowkidaar plan taxation salary people pay take money go freeze tax bracket almost year back,1,0
chandra char chowkidarfirst modi,0,0
check mode marketing budget spread wisdom,0,1
chehare dar ikta shah speech date sama boat hijo hot thi really surprising today seen feared face time speech mission shaft story modi,1,0
chutiya bhojpuri singer dickhead,0,-1
col rest assured people seen him mistake timezone bitten twice ship byebye modi,0,0
condemn modi bc berozgar filmmaker doesnt job,0,0
congratulation india shrinarendra modi best prime minister india,1,1
congratulation indian scientist modi jai hind,0,1
congratulation indian reaching success reached earlier congratulation best wish scientist modi proud indian,1,1
congratulation modi government awesome achievement,1,1
congratulation sir best wish definitely win pair bar modi marker,1,1
credit nexus work taken modi,0,0
dating apps indian filter option showcode list modi r bjp lover help accuracy finding perfect match,1,1
deaf due swamp supported modi always even today said modi best lately gang know paymaster spin rescuing td national herald video still floating,1,1
dear friend cash scheme modi isnt cash vote thing,0,1
dear friend vote wisely time lotus modi one side letter side vote sure vote lotus letter vote power chose right country,1,1
dear modi work private sector noble barring month bank gave loan best survive honestly family senior citizen sir please help financially,1,1
dear sand cognoscentis dilettante expert may pick hole interview hoi follow mass general public mighty satisfied mode innate honesty humility,1,1
dear main word want proof send modi promise lack much agenda want run,1,0
decide you want government teach pak lesson modi,0,0
delhi march prime minister narendra modi arrives bjp headquarters party central election committee cec meeting,0,0
apply similar strategy nav modi vijay mall robert vara navi final checking,0,0
watch super modi song yet watch,1,1
didnt call hypocite anti national anything upto support criticize government happy modi supporter job place fact front mean say modi bjp twisting fact figure provided others medium,-1,1
mode biopic strength affect mass watch know,1,0
matter given ticket state people voting modi,0,0
lady even know talking male sign male sign male sign btw modi head dept space another thing ability super highly regarded country tech even lower country hydrogen bomb,1,0
doesnt look like mol paler goal even arab wear kurt modi jacket,0,0
dont compare dead modi compare cong leaderwhere stand,-1,1
dont ever come tamilnadu ready back modi slogan support bjp forever better travel outside india usual,1,1
dont give south keep punjab bengal delhi maharashtra reduce modi bjp minority let,0,0
dont say lying proven beforevadra lot project done dlf quick clearance angel taxvadra never heard tax back tax paidand easy loansmallyanirav modi poster boy upa era easy loan,1,1
dont think becomes put good people others set bad one could show indebtedness modi risking job local different bureaucrat cant act way act delhi,1,0
dont think modi would never damage economy,0,0
dont want modi retiring soon social service require age upon person,1,0
near india snake charter modi india space charter,0,0
every statement bjp la day reminds facepalm,0,0
eci give clean chit modi mission shaft address nation,1,0
even dont need chowkidaar dont doubt modi,0,0
even young neophyte politician like could anyway eat prime minister breakfast oneonone debate pathetic record year power engages rantandrave noninterview,-1,0
every cult expiry date even modi cult one could early may people credibility professional accomplishment still jumping onto serious issue discretion judgement,-1,0
everyday sun rise modi telling lie kr winning matchesbecoming routinebored,1,1
everyone want modi insulting campaign money vote modi,1,0
everything modi job address nothing distract key issue let scientist force job relentlessly irrespective govt way set comm mm stop cooling,0,0
expected mentioned assam illegal called migrant fake news finest mentioned glance expect hassan minaj remain neutral india,-1,-1
far india concerned modi,1,0
fascinating listen question viewer asked raja sabha mar beyond special coverage listen certain subject delhi ask scientist,1,1
feel nice see budding younger leader you support modi alsobut please refrain making statement modiyou anti national sorrybut people nation supposed,1,1
feel sickwhen ning else start speaking rubbish thats know the stand modi,0,0
fellow countryman modi going address nation today important announcement say please faster seatbelt,1,0
finally flatwater bought slipper today wont take mine bother modi male sign,0,0
fir bar modi marker,1,0
first mass stop using commit term people secondly people day gullible modi simply hammer ramayan lesson never never golden deer,1,0
first time ndtv showing bjp trailing,1,0
freedom expression journalist scientist foe blaming scientist taking political side truth able digest praise modi shame rajdeep imposing view guest,-1,0
protecting girl child promoting woman entrepreneur modi government true supporter woman empowerment,1,1
pure marketing standpoint owning chowkidar bold idea bjp flipped notion chowkidar choir making everyone chowkidar,1,0
fucking savage worry sanitation caste system dont force religion dont follow,-1,-1
funny modi stressed mission showing finger see,1,0
give clean chit narendra mode speech mission shaft,1,0
god sha save youth india massive unemployment program created modi due demonetization faulty gabbhar singh tax,1,0
god modi medium publishes wrong publicity repeatedly false information becomes published truth hidden surgical strike rafael,-1,0
good leadership modi,1,0
good modi asked ppl recognise trust pakistan india,1,1
gradually truth coming next waiting news downing also made indian medium morale boosting general mass mobilize vote modi look got backfired modi played safe testing sat thing,1,1
gutter language come naturally gutter person like modi,1,0
guy single handedly launched successful political party one must give credit due even modi couldnt done,1,1
haa made game therefore prefer guy criminal case modi never made game,-1,-1
written opposition felt awesome wrote supporting longer get away counting mistake youre govt buck stop disenchantment performance earning opposition space,1,1
happy birthday modi varanasi yet become kyoto national herald,1,1
happy see people campaigning way modi good thank showing love modi,1,1
someone blamed modi managing controversy,0,0
confidence friend right choice best man lead country unites make think right way priority right place,1,1
degree physic bc modi said ill auto driver also bc lack job wait would misogynist supporter let woman drive auto hence hun,-1,0
idea pretty sure modi idea either,1,1
noticed many time modi used indicate pak pad desk seems par without taking name past month reference direct think,1,0
acre din would modi give acre din,1,0
started shooting shadow modi spell,1,0
suggestion exercise speech analysis modi pre may dec election time get better sense changed,1,0
noticed naroda neglected govt office naroda still function like whatever happened fund received dark naroda voted modi full support yet arestruggling,1,0
reason vote modi million electric rickshaw procurement rafael government government basis avoiding middleton billion trump air defence missile system deal russia howitzer deal,0,0
appreciation bjp nda leadership political power,1,1
government modi slogan assam true,1,0
here proof modi govt faked data boost digital india,0,0
hey anandyou shouting modi didnt promise lakh every accountyou reared said money come back everyone would get fairdudetell median promise get black money within day forgot,-1,0
hey drug thank insight government work provided motivated make video exposing government big fan,0,1
hey modi announce scientist executed mission scientist executed mission modi make announcement guy petty,0,0
uncle party asking wait watch smile bjp win damage become irreversible ppl cong vote third front win wont able make voter happy considering damage modi done,1,1
history retrieve vision visionary would prevail strongest prevail modiasat striking satellite speak valour,1,1
hoe trying hard manage riot seems sucking sex toy instead real stuff lol thank god trained died today blast modi seems checking resulting positive thats blast car cylinder ship could provide rd mean chance riot victory hand,1,0
hope people think nothing done malta nav modi reading news article,0,0
hour prime minister narendra modi announced success mission shaft former ordo chief sarawak wednesday said erstwhile upa government given clearance india would antisatellite missile capability way back,1,1
audacious take vibe face drop former chief say position paper ready upa didnt give modi itbande mein dam hai upa upa,1,0
josh mode rally,0,0
modi became chief minister prime minister black white money,-1,0
modi government added teeth india security force,0,0
narendra modi almost killed indian medium via,-1,-1
new govt facing modi delhi sort remote control modi thing changing,1,0
modi gain politically actually credit go scientist intelligent wise scientist superior chowkidar though human shouting achievement medium,1,1
ignore try speak otherwise whole credit go modi otherwise complain know indian mass saying modi hai pumpkin hai,1,0
india becomes nation enter elite space power club antisatellite weapon announces modi high voltage round moment,0,0
india destroys live satellite min becomes space power narendra modi,1,-1
india entered world super league top nation mission shaft,1,1
india shot live satellite space say prime minister narendra modi,-1,0
india successfully destroyed satellite india nation reach position united state russia china india registered self space power modi,1,0
india market election tourism forget taj medal modi rally,0,0
india country russia china achieve antisatellite missile capability narendra modi,0,0
india prime ministerindia elite space power antisatellite weapon modi quit,0,0
india stand narendra modi bjp ntrs daughter daggubati purandeswari via,0,0
india tumble roll help china save face wait thats modi doctrine,0,1
industry source tell film badly made hurt modi let run,-1,-1
interesting question surprisingly think modi obama became good friend last summit photo session chinese tried converse obama obama fully ignored made bee line modi rugged started talking like good friend friendship seemed genuine keeping mind different one tea seller graduate columbia harvard,1,1
historic day indian india become super power world successfully shoot live satellite leo proud moment thank jee proud great scientist mode gov,1,1
agg book economist dont support modi led fake economics something called fair growth bpl need empowered,1,0
jihad jail aura see politics anything modi,0,0
clarify understanding radio mean extreme leftist right something,1,0
skyrocketed india global space leader proud modi,1,0
wondering modi actually loses varanasi strong joint opposition candidate possibly possibly,1,0
cr face politics dynasty appeasement modi,0,0
keep digging onward,0,0
kid wear modi mask tmc cry code violation,0,-1
award,1,1
legend narendra modi good sir,1,0
let keep unemployment poverty education etc aside let discus little girl want wear political party hat newspaper wrote article decided delete sound logic edit would also like discus timer perspective,1,0
let elect modi prime minister,1,0
like modi like bjp,0,1
like modi earlier announcement something different may actually implemented,0,0
live nav modi art auction raja ravi karma painting sold gaitonde,1,0
live get ready know modi announce today,1,0
logic word defy foreverusa economically militarily scientifically superior nation fool said make america great percent fool agreed without counter questionthese modi clan similar,1,1
lok sabha election live modi coin new acronym open alliance upsharaab,1,0
looking back path growth modi way joining ud,0,0
looking forward know watch official trailer modi,1,0
look like kapil final,0,0
love mode confidence done deal lok sabha know thing two,1,1
madam living fool paradise judge court murdered nothing happened modi anything,0,0
main bhi chowkidar modi rally rudrapur people say main bhi chowkidar via namo app,1,0
mall nav modi medal set free namo,1,1
mayoral modi hero hero vote dia aur maine her follower style mar bintyfollow follow back jay hind,0,1
massive turnout election rally moran gopher modi chant reverberate air watch video via,0,0
mat demo heart breaking story also make difference nation hate modi continue hate till find new target,-1,-1
mehabooba seriously want peace support modi support local party,-1,1
mission shaft first victim congo journal plight satellite targeted really heart breaking wonder song opposition said give credit modi,1,0
modi address massive rally kurnool andhra pradesh via thanks,1,0
modi addressing programme chowkidars committed strong prosperous india watch,1,1
modi year,0,0
modi happening real,-1,0
modi round game changerwinner well,-1,0
modi jailed treated respect dont feed snake,0,0
modi cr undoubtedly master setting agenda opposition,0,0
modi announcement bunker banker,0,0
modi back gujarat,0,0
modi fight literally anywhere win dear sir uni aka hai may love hate least self made leader dynastpart time politician think birth right rule,1,1
modi promise per person others promise thousand rupee,-1,1
modi declares india space superpower satellite downed missile via,0,0
modi denied marathi flight india visit pakistan really,1,0
modi didnt want abhinandan come back,0,0
modi due appear chief magistrate part extradition hearing,-1,0
modi gave bluff,0,0
modi government indian made mind meet rally heart exclamation,0,0
modi govt act copy metro biggest funding entity party difference also dubious electron bond funding,0,0
modi govt ensured middle class save plan invests,1,0
modi hai pumpkin heybtw dance party evening unfortunate pulwama tragedy,-1,-1
modi able create real job meanwhile left vulnerable open handout still better leaving ppl cold great step power,1,1
modi take away,0,0
modi installed new meaning leader responsibility required present time sharp contrast lousy royal medieval way mindful public interest,-1,0
modi live tube,1,0
modi look like monkey,-1,0
modi made ease living indian irrespective caste religion,0,0
modi make one visit punjab campaign election bjp may loose seat also jalandhar seat bjp win also close bring modi campaign punjab,1,0
modi man vision man mission,0,0
modi mocked space superpower theatrical ahead poll,0,0
modi multimodal distribution arent always visible ecf maybe humble pictogram still us,-1,0
modi confident,-1,0
modi please surgical strike well pls help buyer culprit builder making life hell buyer please needful pls help fund ani sharma punishment mile share builder like sabah,0,1
modi rally today meet,0,0
modi reminded people return love blessing interest,1,1
modi marker pair,0,0
modi dismissed mama govt obstructing central authority,0,0
modi know youth nation need job empty slogan jump get,1,0
modi get credit near get credit sort logic due respect say stopping upa govt similar test get full credit,1,1
modi sir great please reply,1,1
modi supporter called chart call support hate modicumbakhts,-1,0
modi biggest enemy period,0,-1
modi one think nation sleeper night keep working nation he man living nation jai hind,0,0
modi understand sarcasm wished theatre day acting,0,0
modi use dispute pak elect plank mode popularity lure votrspopularity dclindto gain vote win reelection desist china card taking nat int chinaind tie fac big hurdle beijing doesnt harm ind essential int,1,1
modi first time contesting questioning quite natural,1,0
modi making booth majboot wah modify wah,0,0
modi wave whole opposition united,1,0
modi back true,1,0
modi continue,-1,0
modi create history india victory hand,0,1
modi anyways center bangalore south tejasvi sure lose,-1,0
modi win would become worst,-1,0
modi due respect play dirty game badmouthing others rather letting world know achievement leadersparties bad people vote ask vote merit others merit,-1,1
modi address security saying,0,0
module build new india economically strong india reduce poverty mahathug bhandanstop modify modi destroy family businesswire find family loot got ruling local regionsthis,1,-1
mode address gross misuse power high voltage,0,0
mode address nation started,0,0
mode influence due support people supported lok sabha opposition open assembly preached night night even know,-1,1
mode knowledge aeronautics medic era inter planetary plane india,0,0
modi sudden change brand positioning change image space scientist quite well move might credible associated gutter gas project breakthrough goal research,1,0
modi surgical strike far thing,0,0
moreover dummy mm declared initiated project given permission ordo ahead modi come give ahead ordo dont speak like baba like rafael deal year,0,0
must well aware fake promise several political party making day therefore urge people minute examine everything party saying said,-1,1
namo namo modi government honest government modi government powerful government,1,1
narendra modi programme refers officer close previous regime coming way action corruption say retiring becoming easier act,1,0
narendra modi interview previous government used defend,-1,0
narendra modi mahbubnagar gave crore punch house poor country govt said would allow flat many actually get flat,1,0
narendra modi sir one famous movable indian prime minister till history india want next upcoming take sworn mai narendra damodardas modi,1,0
need lakh modi plz give lakh payable hope give election,0,0
neither china pakistan would want modi back strong man india helm definitely interest reason hope return,1,1
never could understand indian good modi modi know ruling big time mahachutiyaas,1,0
never trust bachelor mid forty fifty,1,0
new delhi boarding pas issued air india picture prime minister narendra modi gujarat chief minister vijay rani come,1,0
news press asked modi contested seat,0,0
next modi,0,0
next modi,0,0
final arthanayake mocking india modi particular india achievement anti satellite tech india proud,1,0
nav modi,0,0
nav modi case heard gt,0,0
nav modi threatened kill witness destroy evidence london court told,-1,-1
nonperforming asset decrease achievement modi government,0,0
not remember day medium started chanting killed paris showing cartoon graphic entire indian nation going crazy woman wee dancing wage border day modi lie got exposed,-1,-1
sure modi mocked selling march brand sell,-1,0
note superduper chief gang ran away india soon modi becomes,1,0
nothing else circus called give middle class good reason vote modi,1,0
nothing offending always criticized modi delivering hindu praising like others ridiculed chatukars,0,1
await modi affidavit,0,0
dilemma hope bjp mend way make everything worse loses election election lose election year hope learn right lesson drop silly obsession nasty intolerance become progressive win next back beef sanskrit conservatism win really drop pretend drop,-1,-1
here one chap modi cannot silence much hed like,1,0
obviously modi list,0,0
