people choose lakh modi shouldnt allowed leave post ensures lakh get deposited every indian account,0,0
people still ask modi done,0,0
people unsatisfied modi government performance adr survey,-1,0
people vote modi asking money ppl voted modi want year rule,1,0
please arab might come modi mouth,0,0
please one post video saying narendra modi mit shah,0,0
please dont post cooking medio modi use election campaign saying people self employed govt govt such bhi bol saki,1,0
please let chinese record asking traitor subversive shit lock,-1,0
pls promote tweet reply anything else add suit pro modi statement,0,0
pas request modi yogi something matter,0,0
pop modi got hour free diver nation attention akhilesh mock mission shaft speech,1,0
poem penned modi web series life,0,0
ppl fact fall fake propaganda start telling modi done day ppl matured enough kick ppl post fake thing,-1,-1
prediction seat modi not tweet arab between tweet may,-1,0
probably actually something take risk even fail counter status quo last year,-1,-1
probably one want modi win,1,1
probe modi address floated code,0,0
pro awesome food sensible local film industry bollywood great people language con ship sent,1,1
proud sir modi,1,0
proud indian congratulation space scientist achieving leadership narendra modi jai hind,1,1
proud moment country congratulation eminent scientist best leader sri narendra modi,1,1
proud modi scientist making india powerful safe country without muscle power nation become powerful usa france russia china powerful due military power keep india strong leader modify next year,1,1
proud scientist prime minister narendra modi,1,0
proud scientist political leadership hat narendra modi showing political,1,0
proud say modi supporter cant love country blindly,1,0
public saw vote time vote modi govt isaac page keep showing someone else failure hide,1,-1
rare televised address week nation go poll modi say indian scientist shot live satellite lowearth orbit,1,0
read reply jab pai raise sang twitter aise home jaa race main bjp aur modi haryana park hai unless course planning em game,-1,0
read truth behind modi sold india precious forest choir chowkidar,1,1
ready merge stop modi shah,1,0
real picture reel picture mam team led modi going change future india future people country going ben world wish best luck winning jai hind,1,1
repeating lie doesnt make true theyre even consistent telling lie telling truth correct fact consistently modi,1,0
reservation economically weaker section much awaited decision evaded earlier government narendra modi courage well conviction take initiative,1,0
retained last time modi wave bsp aap candidate,0,0
save india reject modi,1,0
scam raj modi raj nothing progress,0,-1
see jeetenge,0,0
self goal self news disappear like common sense common folk,-1,0
seriously simple aptitude test root kindergarten brain like disgrace modi leftist,1,0
shameless opposition one national achievement wholeheartedly appreciated modi deed crore people modi nation mad dog keep barking right thing modi ignore scoundrel anti national intolerant,-1,-1
shameless rajdeep pissed modi returning power tude gang cant loot country,0,-1
shared war family narendra modi family,0,0
real dictator know clearly modi come power scam collusion official bengal land jail demolish image lady wearing cotton spree slipper worst left party ruthlessness,-1,-1
think complaining head master mit shah modi tamilisai raja polar cpr natvar marathi push goal would made better sense elder generation,1,0
vote modi eliminated crore fake lpg connection,-1,0
modi founder namo brigade,0,0
show one evidence source modi said regarding lakh show proper evidence come,0,0
similar fool voted else govt staff comment watchman modi may get trouble voted fool thug,-1,-1
sir make word modi came power changed power limited action scrutiny pm,1,0
sir many many congratulation contesting lok sabha election wish best mata rani trip aap par band race aur aap china site way debate answer anybody fact made big fan jai mata bar bar modi,1,1
sir please look assam paper mill modi government promised election still nothing happened,0,1
sir also take credit arm force scientist modi data desk bach,0,0
sir may hate modibut dont spread fake news parliament election state assembly election rajasthan,-1,0
small correction accident grace shah sorry definitely modi one one cannot cannot,-1,0
social medium chief letter alleging bribe offered social medium support modi,1,0
sorry one resided made namecalling lieu answering simple uncomfortable question asked nuance way word coming mind speaking joshi modi,-1,0
still modi failed fulfill single election promise made,-1,0
stunning twist mission shaft upa blocked sat missile test say former ordo chief,1,0
promising trailer amazing best whole team,1,1
power modi even swami learns speak hindi,0,0
samantha seeing post praise modi india current govt,0,1
sun hai deshbhakt modi pakistan pakistan diva love letter like hai needle say something anymore,0,1
super answer aajtak dont ask question modi r,1,1
support modi,0,0
support leader double prime minister narendra modi new india,1,0
supreme leader narendra fucking modi respectful enough,-1,1
surprised hon court allowed isnt right know candidate vote modi shah making avant kumar hedge,1,0
talk looting hypocrisy modi took white money converted black gave troll everyone know else,-1,0
talk delivering modi promised abolition mega,0,0
tamilnadu changing thank narendra modi,0,0
tejaswi raga made illegal asset thrust nothing life know well respect contribution delivering dirty explosive top regard modi scared,-1,-1
tejaswi hovering scared zero knowledge compared kanhaiyas vast knowledge match debate kanhaiya even take modi given chance,-1,0
tell modi take action talk liar wasting time election rally mandir kab manga black money kya hua,-1,-1
thank mode speech anywhere hit pee pee che hack link otherwise,0,0
thanks ordo modi,1,0
thanks good example modi supporter helped analyse mood country much,1,1
thanks lot seeing new india modi yogi contribution biggest due youth india,1,0
thanks modi making proud,1,1
would worst thing ever happen india even worse modi,-1,-1
thats one narendra modi,0,0
thats question rest modify baki ani albania dia modi also working big big garrison such nei kia,0,-1
chairman nitiayog minion modi government worst part anarchist bjp rule used bureaucrat ministry defence official petty shameless job defending like advertisement marketing bill board,-1,-1
change bringing new india le modi politician doubt better politician plz give gesture dil tak pouch toh,1,0
graf misuse force modi govt selfish motif heartfelt condolence air force officer condemn shooter,-1,0
highest unemployment rate last year national shame nda govt appeal fellow compatriot ensure modi unemployed national cause,0,-1
issue divided problem modi hatred overpower choose anyone else wish better leader party,1,0
important thing slowly creeping appetite towards violence form suppressing opposing opinion honestly ban bother much vigilante justice mob yes even one mob one mob many care religion possibly country true sign intelligence able entertain differing opinion without accepting vigilante mob could gotten away would loved get hand raja ram moran roy reformer violence shuts public debate emitter side discourse impossible,1,1
name missile sure range missile missile world largest ranged missile,0,0
old man say although modi giving state clip shown earlier showing,1,0
prime minister shri narendra modi interacting member self help group national woman livelihood meet deendayal hastkala sank varanasi uttar pradesh march,0,1
three code modi cracked give india huge foreign policy upstart via author conclusion good enough year say pretty good keeping mind seat minus position,1,1
nothing orgasm chowkidar mit point head chowkidar modi never agree debate minute,0,0
one front modi maybe question,0,0
frightened see modi taking stern action culprit,1,0
gone regard modi virodh,-1,0
keeping present wondering marseille franco death relation right wing depot bolsonaro trump modi thanks always seeing deeply,1,0
kept secret unleashed modi government would achieve feat,-1,0
impoverished loot nationthen becomes unmanageablethe voter reflect give canceled modi continue ruling aspiring guy jail soon,1,0
think chart understand modi india india modi,0,0
think drainage pipe think astral dont know modi spelt wrongly tag line drainage pipe,0,0
think modi raga wait result,0,0
think modi,1,0
think bjp ill start critiquing next government using angry aggressive meme gift nothing possibly worse modi allowed put foot bit,-1,0
country getting sucked modi like trump fucking world difference modi subtle clever evil motif,-1,0
dating interview real interview lavish replaces arab chair front modi,1,0
enough people vote modi,1,0
deliberately done anyone bangalore wouldnt share agree tweet handle follower anti modi tweet,0,-1
idiot saying indian sense created modi one slap near,-1,0
man made imp point amazing clarity thought muslim country see politics appeasement like man country much better place doesnt matter love modi least vote performance,1,1
modi love pakistan apni mat area focus growth,1,1
fun sure old video animal pitched fun stop nonsense name supporting modi,1,1
modi bjp election election trust faith swabhimaan crore indian mahathugbandhans slave theater show democratic power enough mama wait may,0,1
request made election commission modi,0,0
reason modi deserves credit mission shaft success,1,1
got everything free due hereditary sure making significant impact popularity modiwill promise moon always look somebody whole cable fool cannot fool people time,1,1
spend metro also spend petrol diesel laga hai gear nazi hai became modi gear bhi shared lia usa new low level politics,1,0
this physically impossible modi cannot carry studio broadcast equipment channel,-1,0
this bring focus subsidy topic came know lakh given poor modi gt last lakh given poor rich fig got lakh,1,0
till time revolt modi shah,0,0
today ballot operation shaft relatively smooth seatsharing arrangement involving bjp nda partner definite impression modi way back second term,1,0
today opposition talking filthy roadshealthcareeducation used poll issue earlier talking modi data show modi performed well,-1,0
today entire country stage time modi address nation immediately modi start speech minute mostly people channel everyone understand time modi want take iso credit,1,0
today would addressing rally meet rudrapur uttarakhand jammu,0,0
true past glory nothing present campaigned modi look discourse hindu muslim almost everything modi polarized nation turned vengeful angry foul mouthed mob economy farmer youth suffering,-1,0
truly rotten piece shit fake indian dynastic family need kicked country every day news hear sewing venom modi someone else despicable disgusting people need leave right,-1,-1
tulsa legitimate positive voting block syrian refugee coming assad apologise connection modi hindu extremist huge negative,1,0
leadership modi india soon become super power faith,1,1
understand modi going pakistan require brain wisdom unfortunate brother,-1,0
upa really involved corruption many prosecuted convicted modi regime writing blog instead punishing really know sin,1,-1
varanasi safe seat chosen modi,1,0
vote modi vote modi vote modi,1,0
world theatre day listen journ said acting like happy modi,0,1
insult sticking topic intact interrupted modi ever interested civil servant speaking speaking invited national platform response director pathetic acknowledgement,-1,-1
well done team modi,0,0
well ive seen mode pic wid photo modi know mean,-1,0
well said challenge modi helping irony businessmen last yr going game changer sure,1,1
well say modi,0,0
currently studying think staying india give sense security may lack india,0,0
laga startup benefit next might give clue,-1,0
proof needed roaming dont see work happening shoutthere good positive change business said dont get fake bill generated much black money ppl used bill show profit downppl still love modi below work seen ground,1,1
whats point way youre antibody point,1,0
anything bad happens country mode fault,1,-1
ordo made missile test fire satellite modi giving address moral code conduct effect irresponsible go school properly understand rule,1,0
obama killed address nation made marine modi blamed street dog dy credited achievement,-1,-1
religious institution church mosque antinational no openly asking follower vote corrupt antihindusthan congress party duty come together stand united modi vote bjp,-1,1
see amount work modi government done understand nation behind,-1,0
la cororators campaigning smith sha whip deserve dressing place traitor bjp voter always bjp modi sure worry ahead support blessing,-1,1
modi used name bjp name,0,0
modi,0,0
per poor person going prior modi governmentkindly talk give,-1,0
armed force scientific community permanent entity modi government expandable sit opposition election lie people number timesthe people seen,0,0
care chinese genocide uighur myanmar genocide rohingya europe open hate refugee headline everywhere know one give damn headline india one belief shit like hindu headliner wtf even mean shit tanker everywhere world indian need stop log kya avenge attitude move something country,-1,-1
allowed politically colour announcement approach,0,0
germany white color,0,0
entire opposition see politics giving credit modi jee,0,1
dont tell people youve achieved past decade ruling always running modi dom courage hai,-1,0
ask modi lakh promised public summer shout much word relevance,1,0
modi destroyed money build statue unity money could used make better school road hospital etc,1,0
modi modi want india trillion dollar economy modi want housing modi want india manufacturing hub modi want give electricity,1,0
mode hand hovering time announcement also noticed,0,0
struggle bro cr woe lakh crore rupee modi woe lakh crore rupee kept silent fervor reason year barking like dog everyone know struggled,0,-1
credit modi,0,0
taking suggestion type people support modi giving alt suggestion,0,1
jail modi murder charge given chance say leader,-1,-1
request bjp sister organisation support modi shah mapdata time india via,0,0
see last time percent vote modi time chance gonna fall forgot rely,0,0
wish could alone one day last day shame leave aside jasodaben happy proud modi said ask mother instead right born might gang bang donkey pig mixed,1,1
like per minute mode tweet surprise message go viral high voltage,0,1
due respect modi thank jawahar lal near vision wisdom,1,1
woman gave birth child chart saying modi,0,0
wonder trying get air knowing mode record undermining institution like even rbi independent competent report expect way creating background find address line mcc,1,1
would loved see time series data republic number hone last year would said lot modi wave strange nobody mention wave anymore,1,1
yeh lunar family know lootwho year year become trilioner people remains thanks modi try lift people year effect noticeable,1,0
yes always modi funny guy,1,1
yes dont forget modi gave crore bankruptcy govt offer process way crore mig bankrupt govt offer better provide poverty stricken job fair wage job,1,0
yes definitely true patriot bangalore dont praise form outside come home booth vote like every bullet imp battle every vote imp mission modi,1,1
yes sir actually know modi fighter pilot time reading map,-1,1
yes visionary today course modi scientist ordo iso,0,1
choir dubiouswhy afraid alliance zero bjp come delhi elected government delhi work shame shame modi,-1,-1
dreamland modi never make proposal else think would waited,0,0
good man respect cant stand modi wave,1,1
single hope,1,0
funny cant touch modi bjp old different,1,0
smart find hundred mistake modi party find something else inspires modi,1,1
big mouth good nothing like modi,1,0
criticize modi bjp anyone proof link,0,0
ask question modi gave crore farmer,0,0
guy always find fault matter modi try,0,0
right contest modi bjp anti national soldier praise soldier talk favour modi dont care eat want praise modify even put life stake enemy,1,0
keep hindutuva filth group keep praising god pulwama terrorist attack happened china isnt act terrorism dont turn blind praising modi modi wil come tomorrownation remain forevercitizen government lack,-1,1
know something wrong country ultra conservative priest say conservative party sucked,-1,-1
know trump boy modi leak secret congo trump,0,0
want modi please prepare vote,0,0
want vote bjp personal choice vote bjpaccording preference personal thing understand frustration bjp personal opinion modi done done seen everyone vote choice,0,0
warned gujarat election accused singh siding pakistan throne modi state know qualm conscience,0,-1
front even grown kid wet shake whole body fear see original front paid write anti modi rant real professional economist never write way tweeted better see psychiatrist also,1,-1
show ndtv modi government independent news channel favoring one family project,0,0
leader might take offence saying modi good,1,0
life ending modi,0,0
modi ride yet done single press conference choir hai inline dark raja hai modi,-1,0
total failure gdp growth manomohan sign given local modi gdp growth sad,-1,0
air nik cant escape hand police modi sir power,0,0
child hunger mode india kid north korea via,0,0
noble skill getting loan got mura loan started small business hawaii chapel hate modi core,-1,0
delaying decision criminal negligence modi target upa rule,-1,-1
nearing john oliver level indian guy holy cow accurate,1,0
lic forced buy idi npa futile ill advised business takeover load taxpayer money profit making entity govt treasury use money hollow modi yojanas drum disinvestment target met financial governance,-1,-1
cow please fight election graffiti mocking modi appears bjp fails find candidate bengal,-1,-1
indian opposition party attempting delay release widely seen warning biopic narendra modi mass murderer gujarat riot india scheduled release day start national election,-1,-1
modi greatest hit,1,1
modi abandoned wife mother fled himalaya veracity still doubtful indian force entered lahore killed pak soldier,-1,-1
