dont say damodardas modi space scientist young narendra dragged science kidblahblah,1,0
india shoot enemy land air water space congratulation modi,0,0
ppl share disappointment modi disaster modi,-1,-1
one narendra modi,0,0
one india mostwanted fugitive selling million art collection,0,0
one nationale constitutionone leadership narendra modi,0,0
one history india made road modi please think openly mouth,1,0
one allowed ask evidence brother leader modi con murtaza know better,1,1
corrupted want modi spending thousand crore electionstimes puppy corrupted,0,0
real leader bring best organisation modi ordo done india proud,1,1
opposition insane firstly pointing finger army air force scientist also fine hate modi guy start hating country,-1,-1
bjp modi bashing seems agenda aap election,-1,0
word target candidatesonly onlymodiremaining resolved automatically,-1,0
waist brother attack modi namo merchandise,0,-1
paul srivastava change fact modi totally moral le out,-1,0
people thinking modi election say proud,1,1
please watch television daily basis see shot mode rally search get,0,0
pm mean narendra modi required political give clearance provided honorable prime minister,0,1
poem modi work plz read like plz between,0,1
political circus modi running last year chaos allaround byproduct,0,-1
poll modi take vibe sprldbsp alliance compare sarah,0,0
poor farmer thy may even enjoy modi govt scheme farmer,0,0
possible done modi,0,0
post saved altar statement shaman ami accuses narendra modi maker misleading public,0,0
post government expedite several key defence project modernizing force here,0,0
pray god modi forever,0,1
presidential debate type,0,0
previous account restrictedthis new one please follow friend avenge modi jai shri ram,-1,1
prime minister narendra modi say demonstrated antisatellite missile capability shooting low orbit satellite modi called today achievement rare said india join usa russia china possessing capability,1,0
prime minister narendra modi address nation today two week ahead commencement polling country would addressing nation around noon important message watch address television radio social,1,0
probably one see still asking case someone american staple diet mean common american lunch dinner would find regular middle class american home mom cook,1,0
proud middle class dont know say cry nursing narendra modi seen know well worship detect dynastyrun partiestheirgovts shameless contemptible courtiersservants slave,1,1
proud motherland india safe hand modi main pumpkin main proud indian scientist alsohats,1,1
public happy modi half were raise hindu later dello mai hai,1,1
pull rabbit hat field tejaswi sure bangalore south seat speculation either ninth kumar wife tejaswini modi contest seat,0,0
rafael document exposed hindu revealed modi govt interfered compromised negotiating position int also agreed waiver bank guarantee cost indian side heavily,-1,1
raj modi similar circumstance bulawayo south,0,0
rana hit back modi say played important role jk integration india,1,1
read line per report employee work company named updater service ltd u alleged exploited u contractor government paid u u paid employee,-1,-1
requesting secular leader support way doi think defeat communal r modi duty support kanhaiya,0,1
resident south india election coming april prime minister narendra modi hindu religious fanatic involvement persecution policy affecting christian india resorting dirty tactic stay power,-1,-1
right win lack margin baki nda male sab sticky wicket modi also sticky wicket sunny mile,1,1
r bjp nehrunetaji cosplay irony dy thousand death,0,-1
save job people modi come back unemployed rajnath singh,0,1
saw debate modi biopic moral code show good side modi total propaganda also time release wrong want released election,1,0
say upa satellite shooting capability yes tried decade shoot modi could invited pakistan remove could let see,1,0
say hold rally one month blitzkrieg sweep state german term second world war third reach day ahead finance trip indian btw pollinated ppl attend,0,-1
seven government school teacher suspended posting comment critical ruling regime pulwama attack airstrikes followed social medium building reporting referencing report,1,-1
shall remonetise ever modi demonetised,0,0
sham fucking sham brought cash donation limit wow receipt fill conveniently cooling people nicely tucked finance bill mainstream medium covering still busy clarifying gotha ban mutton shop crackdown,1,1
shameful person sinful person modi,0,-1
denies assad war criminal support modi murderer well big difference wanting war someone actively supporting,-1,-1
forgets day modi announced year farmer,-1,0
vote modi become safe india,1,1
simple one sentence average indian vote modi,-1,0
sir poor ppl ground never understand graphicssubsidiesschemesfacilities call need hard cashtrust sir within hourswith severe publicity congo prostitute announcement looking like gaining ground modi pls something,-1,0
sir surgical strike already done poverty great modi already deposited money poor people account kya aap desk aur luge aur gathbandan demon charge,1,-1
sir speak modi govt chart start calling antinational ask pakistan,0,0
slam modi sarah acronym targeting rld bsp track live update,1,-1
people trying enter search news modi going announce,0,0
sonar jain please come modi campaign bhi chaukidar hoon,0,0
spec war activate thanks modi team,1,0
speech played oil station opp iit delhi campus never heard seen misuse govt company shame,0,0
spite reason vote modi allows lynching muslim verify minority,0,-1
suffering namo phobia nation plethora problem see one presence modi,0,-1
surgical strike done modi go army satellite launched successfullynot done modi go scientist raid happens modi responsible dept,1,0
surgical strike war space modi one cannot ask proof dont know hell modi always fake,-1,-1
surgical strike done soldier anti satellite missile test became successful thats credit go scientist tax raid happened bangalore modi responsibility didnt got logic someone explain,1,1
tax official recover crore functioning painting seized nav modi home via,0,0
tell step govt took bring back killed fellow pakistani jail stop nonsense fool illiterate ppl,-1,-1
telling truth give shit pakistani disguise arab brother different people solve problem india real brother dna modi real brother leave alone pakistani dog,1,-1
thank much modi shook,1,0
thanking people doom panchayat helped making modi rally successful,1,0
messed dude pitch buy new phone something lol,1,0
modi,0,0
true people india change let dis towards speak ever want people india modi,1,1
best part day election open vehemently denying existence modi wave ostrich head sand,1,1
comment post give hope future,0,1
day said something good modi whole terrorist world become priest day trust,1,0
election commission ruling modi desperate poll ambush airway today would good test independence,1,0
guy struggling sit hard ground force feed host people attention nonsuccess modi govt ujwala romana scheme,-1,-1
leader set pace fawnimg reporter editor chief asked double modi proudly say nobody people decided reelection mode nemesis acknowledging challenger history deliver lesson,1,1
minister responsible department space none modi also see head quarter department space one rare case central government key department headquartered outside national capital,1,0
practice sat john etc gained prominence mutual invasion ignore pork shameless people brutal rape conversion polygamy halal fm burma marrying relative dont waste time,-1,-1
symbol victory modi government started arunachal pradesh,0,0
three lakh crore come back system people spend take country like choose nav modi hawaii,0,1
time travel machine taking india hitler hell era reduced mcc modi code,0,-1
world witnessed year missile non performance modi team worst democratic government world,-1,-1
stop cry hindu share hai hindu destroyed modi loses terrorist,-1,-1
want modi border lead every attack like ballot strike let lead aggression effort first single soldier killed single caught enemy territory ready,1,-1
excuse happened today team main player except kovi sri lanka outlawed far helped stupid batting,-1,-1
modi urging celebrity across field spread awareness among people country importance voting hand low class moon urging people vote modi,-1,1
single reference president obama movie zero dark thirty reveals operation killing obama bin laden uri propaganda stopped step back showing modi oval went mission,-1,-1
corrupt giving bad name bjp modi yogi,-1,0
think even modi troll unse unc,0,0
big fellow would made opposite argument group film maker endorsed fascist modi,0,-1
country understand economics bringing monies play invested business buying sport economy know grand success every modi success failure opposition issue modi govt,1,1
fool doesnt know acre din aya are thrown post are forced hold rival hand kumarswami loser lose attitude last year also lost jai modi,-1,-1
future leader hardcore manuvadi communal see youtube video find period mutabik train togadiya yogi modi four one making,0,0
guy truly best asset modi lol,1,1
mahamahim rajasthan worker bot democracy take note sorry stage modi,-1,0
message show done corruption thought kumarswamy good clean person karnataka shine till last month thinking like understand one better modi,1,1
modi govt particularly brilliant brought together corrupt politician together year also exposed prostitute campaigning,1,1
dia traditional food prefer cook chulawhat modi everyone know party app google search output come error,0,0
one issue government apparently fighting losing battle bid change public perception,1,-1
political modi government,0,0
remember people started finding fault prison joshi na london people started finding fault star tagged amazing time appear nonbhakt oppose anything linked modi,1,-1
stroke played isi everyone call modi warmonger maybe bring ban impact upcoming election till,0,-1
work modi government people fool today leader make people fool election time,0,-1
expect modi ina kam kia hai una kam uni campaigning kar raja such karla nazi,0,-1
belly full rich never support sir never seen hunger daysthey blindly believe modi like lie,1,1
already purchased election think people fill wardrobe modi jacket,0,0
though dont want sound political article say status country prior modi era ordo given ahead sarawak economic time,1,0
accept ordinance modi,0,1
took decision ballot game played terror controlled modi,-1,0
totally agree already tejasvi happened assembly lok sabha one bothered connect ppl due modi wave bjp south else potable corporation la called big leader agenda lose assembly whiskey,1,0
true political leader think nation citizen hope succeed path excel task nation building assigned modi best congratulation,1,1
two handsome men fuck lot looking,-1,0
uneducated people fool educated people modi,0,-1
unfortunately br south totally hard core bjp seat around area like basavangudi people wandering around glazed eye state super mastering modi even nominated local telephone pole lotus symbol would win,1,1
unpopular opinion understand people praising brave guy citizen another country hosting show popular india want someone gut look indian comic like kanal kara value grove official seeing human comic similar content fact wrong worst part terribly funny skit opinion,-1,1
obsessed modi poor sweat good keep apply burial purchase huge stock burial may tissue paper,1,0
true also seeing ppl putting false allegation tejasvi deleting account post give fitting reply antibody gang winning bangalore south record margin tejasvi,1,1
viral kovi warning kohldeep yadav,0,-1
vital job every single given press conference except narendra modi odd obviously scared doesnt answer disaster like demonetization gst,-1,0
vote nation vote modi dont see who standing constituency election bjp see nation year corruption free government farmer directly account already credited mura woman new entrepreneur,1,1
voter decide modi,0,0
want ask tejasvi modi came picture staying pakistan,0,0
possible think modi would done took full year clear npa mess created chidanbarams phone call insrstrusl friend easy fool indian pariyaar,1,1
watching mode townhall interaction nothing elaborate gimmick staged question disgraceful petty low life guy man absolute insult disgrace office hold pathetic,-1,-1
well understand thats economy pakistan poor year given vote modi see economy,-1,0
well den modi good chart mata jay,1,1
well backstabbed many time starting sima agreement mode trip meet away,1,1
well said jee may voter wise push bjp led mean fellow modi,1,1
good option rather bjp,1,1
modi deed today misuse power period moral code conduct simple press release would served purpose,0,0
poor move everyone got reminded famous demonetization address modi min scared moon say fail preacher mandir,-1,-1
speech goosebump terrific modi cannot match even one percent leader voice imagination look straight speiberg film jai,1,1
whatever modi govt luck awaken,-1,1
whatever grouse cant stop landing sheer greatness visionary put system together yr still going string shame aim harvard cannot get system work year best,1,1
people criticize word action must something right mean atleast sucking work like predecessor long clutch straw start criticizing action policy point mud singing latter however sensible criticism,1,-1
people india fought british government called anti national traitor etc people fighting called choose wisely,1,-1
capability narendra modi,0,0
side praising scientist work trolling modi,0,1
say iso came came world modi came power,0,0
whole world classic whatsapp ling sure also believe modi given unesco award best also morphed pic world leader gathered around one walking lion,1,1
genius technocrat willing work modi liable higgins around,1,0
modi silent real issue,1,0
suspicious every eminent person speaks favour modi,1,0
guy feel modi getting credit modi hater feared perception modi get much credit credit past launch test happened,-1,0
debate modi first election speech meet,1,0
nav modi vijay mall share jail cell extradited judge asks prosecutor,-1,0
surely criticize modi well however dont think modi promise something absurd,0,0
still stand sentence,0,0
chestthumping speech sat test narendra modi shown nervous via good article good enoughthe writer need research paid supportive program need gut conduct program,1,1
honourable modi till politics signal party supporter bjp,0,1
goal sabha math sabha visa modi govt striving hard build new india people welfare utmost priority taking care need poor vulnerable always high agenda modi via namo app,-1,0
voodoo india shoot satellite must vote modi farmer young people india,-1,-1
work startingnamo namoeast west modi everest,0,0
would like say modi next prime minister,0,1
wrong sending message safe hindu minority exactly opposite modi chosen kashisab same the hai log sadhavi bjp data nai begin modi modi hai bhagwan haat band,0,0
yes narendra modi great job upper middle class rich think another five year remove poverty india removing poor,1,1
yes seen modi govt saint corruption,0,1
yogi adityanath hold rally seek vote narendra modi mit shah,0,0
wish become fact none worthy fill spot corrupt selfish vulture especially modi best thing india last year,1,0
guy missing point subtly laying ground work create clone army without manufacturing cost trooper hindutrooper backed power vanessa,1,0
excellent twitter handle comment modi give page,1,1
keep as bedmodi govt doesnt give single penny aukaat,-1,0
know bjp really fucking guy end saying something sensible,-1,0
look better modi let elect say,1,1
really think research posting one year free cloud subscription almost available cloud provider modi,1,1
think modi hater antiindian,0,-1
told mission shaft done iso credit modify raid done department blaming modi confused opposition,-1,-1
vote modi like,0,1
youre downing hat watchdog dont white imagined situation modi becoming dictator he becoming one say democracy make sure go selfcorrection take power away longer live,1,0
youth well family you need worry enjoy bangkok italydue family india worst conditional deal family getting commission open news treat like fool are new india modi marker,-1,0
yup seen modi wave mla,0,0
like saying decided marry actual marriage took place modi naturally credit modi,1,1
congratulation narendra modi mission shaft operation difficult target achieve completed successfully within three minute launch,1,1
like modi wave,0,1
fault never experienced democracy work modi gone thru legal hurdle highest court land acquitted charge mature democracy whether like verdict accepted period,-1,1
sport umpire decision final review taking someone please give blunderbuss lorazepam right hour owned albania hope fishing modibjp angle,1,1
time narendra modi thanks,1,1
dog whistling troll respect one therefore genuine appeal madhavan people vote nowhere said vote modi look bad,-1,0
make india reason modi government scheme failed,-1,-1
great leader give credit thing right take responsibility thing wrong manmohan singh sent mangalyan mar never boasted credited iso modi take credit thing right blame near thing wrong,1,0
