large group people country like seeing lotus symbol modi face unfortunately see shit everywhere called living democracy sometimes witness stuff might like right ban put blanket,-1,-1
economy shiconomy please suggest dangerous thing last time modi directed attention finance imposed tiered amended,-1,0
harshvardhan ahead vote,0,0
early modi please drink tea,1,0
made album utmrmscrhvrlnoqvjnvvphzku usp sharing bit easier eye guess care titan mark edit updating weapon,0,1
main ghana weapon nazi sunny aaa aap data swath main uni battle gul karate main modi putin chinese premier try saying english,1,0
someone rps character originally dah awesome,1,1
soon stepped plane wanted back home long time modi mean dream returning stronger hope help countryman day,-1,1
still remember day year ago aki bar modi marker over huh,0,0
tamilnadu bjp nothing meme concept,1,0
team standard pick diagram cbb phi adam phi howard ten,0,0
tell people gujarat people gujarat like like good state india good urban centre average poor rural area broken road yes people get clean drinking water facility yes people access drinking water premise according planning commission data clean drinking water treated drinking water like anywhere india completely like usa term infrastructure civic amenity lol still mile even remotely touch level,1,1
update abhinandan getting coverage india indian medium interview,0,0
think good yogi adityanath bjp behind veil anyone slightest inline politics know population brink mass communal violence like seen bjp supporter communal would surprised celebrate,1,1
went political mom instantly regretted started opposing view advice never talk politics parent pay mind whatever pro war statement make avoid divert topic cost,0,-1
modi miss watch minute,0,0
believe dumb option modi,-1,-1
aah frustration saying much day modi failed nation hand pakistan,-1,-1
aap sharia ili param constituency tag behind cap sharia ili tag behind param constituency html,-1,0
abbr chute root done people modi bloody scam done family personally arent blind you see difference let india letter,-1,-1
achievement aside shahmodi combo really astute judging people,1,0
address nation today modi announced sat missile destroyed live satellite minute enters elite space power along russia china proud moment india becomes fourth,1,0
advance benevolent secular compassionate politician pid medium opposition called sighted communal life waiting day modi becomes darling medium yogi adityanath run,0,1
five year viewed partially one see modi done good thing many pm past also many good thing action one eye election much time spent election rally,1,1
namely vote modi sir,0,0
modi anti india supporting raul gandhi gandhi family indeed anti human intelligence,1,1
agree taken inspiration modi keeping mouth shut election modi would eventually brought black money back like demo would ordered probe rag british citizenship would even built rammandir speech,-1,1
akhikesh think sat election fixation scientist modi chi,0,0
sock lay egg henceforth modi accepting jasodaben wife publicly ala nothing happened,-1,1
hater together even paris hafeez czar wood extending moral support hater ultimately modi win love trip hate slave continue bootlicking januedari shivbhakt fake brain,-1,0
doubt huge amount per month poorest anyone doubt question modi promised small amount lakh every bank account crore job year,1,-1
ally likely push nda tally near voter survey ordo near antisatellite narendra modi,1,0
deep ease business etc great ecommerce story favor albania modi changed rule check,1,1
know modi,0,0
modi make marketing propaganda mean anyways,-1,0
ask advance think modi vajpayee death read vajpayee niece family said modi,0,-1
said pakistan such aaa yoga modi chunaav busy yoga use bool jayega laughter evil,-1,0
modi playing modi film modi modi modi,0,0
yet say modi suitable candidateindia constitution give right ask questionsandhe bhakto kya main uni juan bhi uni nazi nazi uni ankle kya alum aur kya kya arab hua main ina,1,0
anna please concentrate partial town common man attracted modi power treat response every issue nation due lack leadership groundlevel force attract vote region party,1,1
guess beloved modi say,1,1
anyone ask one line modi done india say successful instill faith govt among honest fear among corrupt definitely fulfilled duty properly hed brought,1,1
appeal right minded indian kindly allow thing happen india election mode selling shirt march raj gun campaigning election happen kindly launch civil disobedience movement frm bihar,1,1
apply brain,1,0
april chowkidhar narendra modi more victory hand waiting flag hole flag hole jai hind,0,1
order covered head dupatta show respect stricken people necessarily endorsement practice modi worn every conceivable form headgear pointed refused one muslim skull cap,1,0
pic classified stuff need give proof killed civilian human right issue,1,-1
shin behaved like modi cheat within loophole rule,0,0
awesome modi,1,1
www later ran false argument resort namecalling hater back scoresettling modi cry plane pakistan shot sky,-1,-1
bank naroda lost asset robbery politician pump instead recovering robbed fund modi regime confusing cr governance,0,0
book nexus vision avenger team formed modi taking credit,0,1
ban r forgot modi lover boy also bihar justice party formed came power nearly year fought ideology grasping fight till end,1,1
alliance till one year ago logic applicable cbn well right praise modi went extreme annoys completely ignore sensibility non hypocritical virtue one side,1,0
best interview recent time arab asked toughest question modi jee much better question favourite color,1,1
big announcement within minute modi,-1,0
bill shi page hood wish best election believe start term india soonindia much need sea year leader vision mission india,1,1
bjp headed total humiliation uttar pradesh seed impending defeat planted day highly communal leader appointed post india country extreme advance learnt ayodhya modi yogi mit learn,1,-1
bjp nda power almost india,0,0
bjp party old men,1,1
bjp propaganda channelbhakton channel main chart asking hisabkitaab modinot good sign himmatlab sahebgayo though entire medium country barring one two putting maximum save,1,1
bjp rapidly looking ground india election wonder forthcoming modi address nation try take credit even speed breaker achievement rule,0,1
bombay hear plea seeking stay mode biopic march via,0,0
eminent scientist say strong political like modi required rajdeep say scientist taking political side unfortunate killer democracy independent medium foot people dangerous democracy external enemy,-1,-1
breaking news modi shot satellite tracked nanogps chip note,-1,0
bring modi,0,0
bro modi later spotted,-1,0
actually targeting bjp basis rk tweet extremely pathetic,-1,-1
time wont get success theyre also know well wont come power bcm nxt impossible rule country book utmost honest modi rule desperation theyre announced utter bogus scheme,1,0
bastard please name one projected modi,0,0
calling anti modi speaker debate making notice choice mrarnob shit please run channel voiceless,0,-1
ask something powerful,1,1
rite away say modi innocent,1,1
thank modi many good initiative taken,1,1
list individual badly impacted first due modi govt,-1,-1
cant blame modi stretched max much bjp sang,1,0
even see single recognisable name list film maker,-1,0
centre state govt working together make india free narendra modi,0,1
chhattisgarh father and kumar babel want contest,1,0
chokidar choir hai modi jump party deshdrohi parti bjp,0,1
choir chaukidar inline youth berojgar total crore job that kia modi crore rural crore urban semi urban job youth future arab kar dia discard bjp india becomes failed state,-1,-1
choir chaukidar inline youth berojgar total crore job that kia modi youth future arab discard bjp india becomes failed state,-1,-1
chowkidar modi exposed naked detail,0,0
chowkidar gambit para learnt art facing camera guru modi,0,0
chowkidar nav modi left india vijay malaga said met minister escaping nav took photo along modi cooking pasta,0,0
citizen support new india fighting corruption dirt terrorism poverty pledge support chowkidar india modi building new india strong secure prosperous,1,0
citizen wise enough would voted criminal like modi,1,0
come join shri narendra modi world largest town hall show support main bhi chowkidar movement,1,1
congratulation tejasvi sure candidate bangalore south time young dynamic old fantastic orator bjp youth wing bjp gen sec old get chance show best happens narendra modi govt,1,1
cong ipromiseyoumoon employment guarantee scheme great opportunity mean india away destructive path appeasement cost national interest modi win handsome shuts competitive populism seek vote performance honesty,1,1
course pakistan isi would happy help reflect modi determined divide india along religious line without help pakistan isi,1,1
credit cant thenwhy wherever take place modi blamed,0,0
credit modi making happen rule,0,1
damn forming lied rafael every single time don albania brother desk dil chol loot race hai,-1,-1
dear biggest reason vote bjp able tweet freely along bjp hating tweet daily pls try going middle east criticize govt even day you surely respect modi anyways sure wont make sense,1,1
dear de worried by loksabha election reduced tejaswini ananthkumar also wa fate siddaramaiah debacle last assembly election would fate initiate action you case modi,1,0
dear modi please save hindu pakistan jihadist grant indian citizenship india place left hindusplease help,0,1
dear modi sir please arrange meeting kinda constitution better result bjp bc last going bad,1,1
dear prime minister shri narendra modi stand strength country like dedicate poem view,0,1
dear sir mention time dear modi tweeted get response side need help,1,1
defence citation election never encased pastother country watch political scenario good,-1,1
definite strong action taken modi govt,1,1
delhi police come central govt mean modi shah bjp,0,0
delhi prime minister narendra modi interacts people main bhi chowkidar program,1,0
dont know whatever people say look advance look happy modi,1,1
think mit shah advance mass support think bjp make mistake need mass leader see anyone modi atm,-1,0
dude tweet regarding either modi bjplagta hai aur such ata nazi,0,0
either know everything nothing modi didnt gave loan npa npa must find thatfirst job economist simple math come power congo anything yr poverty removed,0,-1
election commission give permission modi speech,0,0
enemy afraid modi thats good india modi cone,1,0
even invest modi that telangana would know bjp get single seat telugu state,-1,0
even near get credit modi near still poverty corruption gave space leader like modi near get credit modi raga happy,1,1
eventually thing doe empowerment killing bleeding exchequer buying vote said in farmer modi bribe,0,-1
every theatre one hero villain modi playing role constructive hero raga playing role destructive villain,-1,-1
everybody vote modi ji message,0,0
overtime honorable modi give opposition theme argue hard digest proud modi congratulation great mission,1,1
experience speaks everyone know modi fooled indian,0,-1
fact check madame err madame proved modi never said,0,0
fact remains november modi secret conversation top bjp colleague demonetisation requested deposit old currency bank accordingly black became white,1,0
first ask press conference believe modi remain history leader scared press conference kyun path main,1,-1
anything wrong happening country open ppl simply shout modi modi feel named krishna many open leader would certainly attain moskva,1,0
peace region modi envisaged threat creation present lot politics,0,0
former nsa shivshankar melon say ordo head sarawak happens r member sang never sought permission upa govt test sat spreading lie upa govt denied modidoval gave sang helping sang,0,0
india confirm everyday google trump see single handedly standing well everyone damn could given mean easy hire good branding professional brand liberal suck next term like every president done first term guy different make respect,1,1
fully vindicated mode statement mall,0,1
fully take everything white man trump say face value doubting modi,0,0
funny choir modi mit joke four alphabet,1,1
funny modify reason defence force got respect today countryorop waiting finally implemented besides benefit soldier dying war bullet proof vest sanctioned modi,1,1
gaurakshak gaurakshasa,0,0
get lost modi,0,0
giriraj singh mun hare har hai mun jersey jeetafter change seat canada begusarai take inspiration jayaprada politics last yearsjigar fight adam khan came bjp antinational kanhaiya kumar modi naam enough,0,0
globetrotter modi flew pakistan bryan say read,0,0
god electing bjp everybody must hating thing need exposed viral like metro thing,0,0
good mapas mein lady marine chalice yeh ga flux plan eta credit apt ga flux plan go shrunk samvatsar,1,1
good someone fucktard,1,0
good strategy opposition break bjp,1,1
great jobthank prime ministermodi hai sab pumpkin hai,1,1
growth without job possibly biggest question mark modi job growth gdp growth delivered job growth went wrong modi math economic via,-1,1
guardian minister congratulation offered candidature want modi choice vote citizen pune connect citizen please elaborate project initiated,1,1
gua using bangalore international centre spread canard modi bic political,0,0
guy bhupesh babel stop put outsourcing step taken better employment opportunity created state,1,1
haha every public appearance modi scripted want people ask question answer like people want ask osti band race ba,1,1
haha modi prison bitch,1,-1
hahahahaha seriously expect wise statementmessage modi way,1,1
irrelevant gave statement help modi narrative,-1,1
hashtag time onwards prime minister modi hit campaign trail let resolve bring back modi marker watch rally live social channel let juggernaut roll,1,1
watched video yet how josh modi how josh modi,1,0
havent heard modi great announcement proud indian,1,0
head country traveling press core global norm something unique india agree quite retarded though ought ball face medium excuse time better spent elsewhere hold spending several day month electioneering save hour photo shoot rally answer question man boat like time nazi nikalte answering medium optional head state responsibility hot hai,-1,1
helping friend mocked trump know many people made fun collusion,1,1
he standing firm choice showing support bit ostentatiously lot people still believe modi attack never dont hey thats choice,-1,0
hmm surprised conflicting statement one hand say bjp supporter also say voting bjp bjp supporter give one reason bjp supporter vote tv come anti modi drug,1,1
honestly heard japanese voice work game weight one way another sound sheer number people think japanese sound better default time japanese voice acting fluid sound natural often missing delaying noise japanese use even need delay statement combine lack social ninety japanese dialogue animation game feel bad take example animation rune soldier louis english voice acting far superior japanese voice acting though kotaku term really hate use would argue opposite ignorance,1,-1
hope modi rally,1,1
hope obsessed partner modi lucky guy,-1,1
hoping see least modi second term,-1,1
cong party twisted modi statement gst portray gst upa power,-1,1
modi bypassed norm try enable dani entry airport business,0,0
pakistan outlawed modi military strategy modi iran writes,-1,0
would ravi shankar prasad like describe modi contesting vadodara varanasi,0,1
huge gap promise performance gap swallow modi shah,1,1
hurried war hardware,0,-1
hypocrat abhisar cant digest food without spitting modi question free speech what logic abhisarha,1,1
ibn surprised found cnn cbnnews rapidly anti india anti modi antihindu channel spreading hinduphobia fake news goebbels indian india,-1,-1
ill tell printscrollwire write india delay crucial weatherground water sensingcommunications satellite launch modi could moment glory,-1,0
immediately air blaming upa put unfortunate side taking scientist category would independent voice said anything bad modi rajdeep curling,-1,-1
india modi say live address country successfully testified antisatellite weapon destroyed lowearth orbit satellite,1,0
indian election prediction indiapakistan conflict help modi fund march,0,0
indian modi baht see dream open eye attack night pilot get surprised slap villager tea pak army good killing crow tree keep entertaining guy,1,0
indian dont need movie praise movie still vote modi next,0,-1
india best narendra modi,1,1
instead entering dialogue pakistan far better option would keep pakistani unsettled keep tenterhook create condition keep pressure say sushantsareen,1,0
iran sanctioned oil price began rise announced allowed india buy oil iran without sanction oil price began fall back normal everything fault modi sometimes global fluctuation,1,-1
near invented airplane modi could launch dan scheme,0,0
heart helped request indian government please soon possible ban pubgmodi please ban game,-1,-1
clear medium cancha modi dont want poor get something good life,1,1
jai hind aaa naar modi greatest leader,1,1
jawaharlal modi could even use room make toilet give electricity gas lady etc etc,0,0
jealous modigoodbut dou bark like dogcommon keep,0,0
jignesh mean like modi abi such announcement karen wall ana manual scavenging wall point ready radio,1,1
modi came spoke china world took cognizance press release body would paid attention the target indian population world,0,0
like modi changed calculation gdp know restore old method calculating gdp come epic failure modify indeed,-1,0
want ppl like modi win,1,1
killing titan tell kill give imagine video gujratso many video modi lead killingschina never,1,-1
know modi credibility,0,0
kudos everyone fight idea india fascist modi men,0,-1
lata ashirvad great modi,1,1
begin yeh khan itihass anno mein kho gay nothing big regular editor tricked sub got together engaged vote brigadier voting pro modi post downvoting anti modi post sub got reported admins banned guy involved,0,-1
let agree year whole thing destroyed party member family member modi started scratch,1,0
let india crore crore people belonging property said get solution x people let modi may take care remain people,0,1
like literally one hacked series offline yet like hacker yet something important like show,1,1
like modi better shouldnt reply ratio ppl like ppl like,1,1
live interaction india start modi connect people place india please join large number watch live namo app,1,1
lmaz writing,1,0
lok sabha election live rafael deal got delayed wanted commission say modi,1,0
lol ever defence portfolio like modi male sign,1,1
lolwho listen bunch paid song people fool modi modi modi,0,-1
long live india long live indian scientistslong live narendra hai modi,1,0
look like current ndtv journal contract identifying empty seat modi rally post,-1,0
love quite big slap parent ask child chant modi modi big lesson political party right play childrens innocence freedom,1,1
mama pm girl return home soonnothing impossible modi,-1,0
mam plz post one pic away share modi waleema ceremony grand daughter modi killer muslim,1,0
man get life stop worshipping modi like god aint innocent he dividing country religion learn question thing thats democracy,1,1
many argument social medium heart say modi come back,1,-1
maximum scheme minimum welfare modi govt fell trap upa reprint via,0,0
may know opinion poll allowed election notification election commission amp news channel openly showing opinion single action pressure modi bjp side something wrong,-1,-1
mean say education needed thing think kejriwal wrong give single example giving example modi wrong country dun tell education needed,-1,-1
might end starting nuclear war care win election shot satellite modi say shifting balance power asia,1,1
misinterpreted received black money deposited foreign bank nation capable render lack individual modi urged,-1,0
mission modi today started meet rudrapur jammu want seat like,1,1
mission shaft former ordo chief credit narendra modi clearance build sat missile india news via,0,1
mission shaft narendra modi announces india space superpower twitterati react,0,0
model code conduct koi atlas hot hai modi already overthrown constitution,0,0
modi address mega rally near akhnoor march lavender rain via,1,0
modi admitted national jain friend beef export business convenient hindutva hamstring fact,1,1
modi campaign manchester,0,0
modi always bjp party help,0,1
modi applauding hard work scientist understand surprised gesture taking otherwise per thought major never seen bold sank mute robot singh aaa gay thihahaha,1,1
modi call sprldbsp alliance uttar pradesh share,0,0
modi challenging r anyone widest dream let clear primary loyalty sagvis r santa party fall apart one reason jan sagvis vajpayee advance etc refused breakaway r,1,1
modi code conduct followed ministry,0,0
modi decided deposition lakh felt nation destroyed lazy citizen nationfor bright clean nation progress hardworking youth need hornet sleep lakh,1,1
modi desperate announcement proved bjp losing big time,0,-1
modi didnt anything great bit atleast giving money employee fault appointing loan atleast sinking,1,-1
modi didnt succumb china pressure expert totally divorced way mea actually work national security establishment considered good idea give hysterical western turkish propaganda china good move,1,1
modi disgrace,0,-1
modi oval kick badly,-1,-1
modi failed provide national leadership stamping crime woman weaker section stop change coming,-1,-1
modi fails day,-1,-1
modi favoured people right,1,1
modi follower become real count modi greatest human history human being,1,1
modi rafael scam using independent agency favor agenda destroying democracy helping rich ppl using poor ppl money behalf ppl died demonetization gst destroy small scale business,1,-1
modi give handout irony besides,0,0
modi govt acknowledge abhinandan missing watching video pakistan whole country erupted demanded release abhinandan modi supporter wanted abhinandan remain pakistan custody war longer demand met,0,-1
modi govt provided lpg connection ujjwala romana helping woman family get rid health issue caused indoor air pollution via namo app,0,0
modi govt push sat missile test upa permitted via,0,0
modi gujarat thug follower rapist baba ashram check youtube,0,-1
modi finally achieved something he completed total scam,0,-1
modi learnt lesson event bengal,0,0
modi shown place,0,0
modi hater positive thinking,1,0
modi big announcement coming news channel humane expert batayege kya announcement saki hai,0,0
modi one simple suggestion voting people reworking outside hometownsfor voting take leave travel km introduce online voting would helpful every overtime money also save,1,1
modi interview pak gave assurance every terror attack dont want get stuck trap say modi,0,-1
modi keep winning till gonna call third term third reach,1,1
modi killing abhinandan handed india modi easily win electioncampaign tag line get abhinandan back make prime minister,1,0
modi made lakh km green highway vote modi,-1,0
modi making country progress wanna scrap,0,1
modi working hour day thats lie,0,0
modi one man army keep proving,0,0
modi ousting,0,0
modi purchased rafael crore said got better deal,1,1
modi raga skill india kill india guy choose leader wisely jay hind,1,-1
modi raj law mister opposed bjp,0,0
modi rally jammu march,0,0
modi rally meet,0,0
modi responsible meeting shit,0,0
modi said bad health vajpayee said enjoyed daily drink lived upto saying,-1,0
modi said terrorist supporter across border today praying somehow get rid chowkidar mahamilawati call opposition impure come power delhi,0,0
modi say lok sabha election fight decisive government decisive past,-1,0
modi should resign,-1,-1
modi started remembering martyr region away kumar pulwama short sharma summa that that yaman,0,0
modi intelligent quickwitted,1,1
modi sure love rudrapur wonder,1,1
modi take responsibility much unlike pm earlier,1,0
modi tell vision new indiafind video via namo app,1,0
modi first prime minister using insulting language demeaning word low category show upbringing education,-1,-1
modi true fascist,1,0
modi urged celebrity various field motivate people vote,0,1
modi vulnerable alludes apple seek,-1,0
modi want iso achievement show done everything modi confidence iso make fighter plane gave albania,1,1
modi weed energy,0,0
modi wholesale keep salesman generate employment,0,0
modi whose economic record come steady attack resurgence opposition said decision proved settle strong leader via,1,0
modi back donna discus connected ground know whats mood people badly want modi lose word genuine concern,-1,-1
modi defeated huge margin,1,0
modi would spent funding mandir cow shelter,-1,0
modify please,0,0
mode achievement yr reached canard surprising people india prime minister lie people take granted modi gun promised lakh house ask last yr promise house,1,1
mode address gross misuse power machinery mayawati,0,-1
mode confidence fake guru,-1,0
mode tenure honest people always suffer col truth hurt modi lot afterall he best liar world,1,0
mode victory election would beneficial pakistan govt strong effort better economy medium judiciary investigative institution like nab fia yet govt able read pulse public detached mass,1,1
modi middle east deal snub iran analysis,0,-1
polished leader emerged prime minister eloquence shown come strong leader impressed jitendra singh rise modi cabinet especially prime minister office indeed gem possession proud narendra modi,1,1
mostly individual effort rather team modi resistance within modi team,1,0
namo india need modi,0,0
namo against need modi govt lifetime,0,0
namo even candidate narendra damodardas modi candidate bro,0,0
render modi mit shah built young team state wise super,1,1
narendra modi giving opportunity young brain,1,1
