narendra modi given reply question instead avoiding answer,0,-1
narendra modi minister space department moreover prime minister india,0,0
nation doesnt want prime minister like modi,0,0
need keep government line modi bhagwan nazi hai bjp harm unse alt ski accept start questioning,0,0
near visionary modi televisonary wonder wished world theatre day,0,1
news shot modi mission shaft speech without logo,0,0
nice try insulting petty nit picking prime minister also held portfolio science technology among others modi also hold portfolio today,1,0
nav modi trying vanuatu citizenship judge time india via,0,0
within gadkari congratulation scientist carrying mission shaft successfully india moving fast towards becoming world leader mode leadership way become super economic power al,1,1
none modi mit shah,-1,0
bjp fan add respect name modi prime minister country opposition candidate,0,1
exactly bjp modi say law take course,1,0
south converted bjp hope south dravidian christian going let win vijay christian also communist join politics lead communist party,1,1
modi even boy cant face interview,0,0
nothing pakistan come modi mouthsimple,0,0
even rapid modihaters admit versus rest,1,0
please give vote name modi,1,0
want request honorable prime minister narendra modi sir please plan change old voting pattern salary person many time leaf home town initiative digital india want online voting system radar,1,1
nsa gave ahead sat test modi approval say ordo chief ordo chief added last month scientist worked round clock achieve launch date target via,-1,1
nutshell dont vote bjp modi,0,0
office colleague phone talking another guy approached told guy big modi supporter come anand continued badmouth sanghibhakt like blind said democracy allowed talk start,-1,0
modi iam biggest fan modi,1,0
one understand pain take water breathe deep close eye try recall feel modi find,0,-1
modify doubt need comment,0,-1
narendra modi prime minister india,0,0
such look like modi tweet made say thru horrible memory may manage cash reserve couple year back hurt show,-1,-1
waist brother target narendra modi pulwama terror attack chowkidar campaign,0,-1
pakistan country india native country shift soon possible modi waiting,0,0
partially agree modi wasnt noble carried massacre,-1,0
people believe modi jump lakh per account,0,0
people support bjp specially clear gut feeling bjp come power center attitude arrogance problem seen modi shah,1,0
per data provided modi govt lok sabha almost total fund beta bach beta padma scheme spent advertising impact assessment conducted scheme fails front,-1,-1
permitted narendra modi anything say spineless government didnt allowed deep affection care pakistan china red question mark,0,0
person modi india either away divinity,0,1
personally went pro modi give time neutral something definitely show anti modi fuck thinking show fucking time,0,-1
please god let bjp win keep bsp mayawati delhi politics already enough corruption delhi,1,1
please refer learned veteran already showed praise song attached picture govt statement unfortunately nobody buying argument mode political decision,-1,0
please request tweet give chance tweet modi modi modi,1,1
pls let know much charging flatter tweet modi,1,0
politics news wire guy midwife shutterstockman shooting gun bump stock guy midwife shutterstock report published march modi,0,-1
poll fight people modi tejashwi,0,-1
previous government used defence deal arm could imagine deal done transparency prime minister narendra modi,-1,0
prime minister modi address nation shortly,0,0
prime minister shri narendra modi address nation noon today stay tuned,0,0
problem chart want question hold position government want answer modi failure moment question modi tadipaar thier as burn start tagging people anti national,0,-1
proud indian dedicated patriot primeminister three modi,1,1
proud moment india able leadership shri narendra modi who constant source encouragement scientist technocrat student new india,1,1
proud beloved narendra modi proud ordo indiaisthefourthnation missionshakti,1,1
pseudo producer director scared gang main financial eliminated modi come back power nexus gang sleeper cell medium clearly battled,1,-1
pure forward castle,0,0
put one thought action difficult thing world modi hai pumpkin hai,1,-1
raja order man modi also continued gov gave patriotic certificate,0,0
rare picture jawaharlal near launching anti satellite missile modi took credit today,1,0
really breaking news revelation done took modi switch light thank god someone finally see,1,1
remember sacked bef japan complained bad food contest narendra modi election,-1,-1
remember guy said modi come power one rupee something like lol,1,1
respected sir sar madam kindly adam add success sar sar adam best twitter sar adam good sar adam good gaunament narendra modi sar adam good bjp liar bjp sar jai birth mat,1,1
reuters report indian prime minister narendra modi say india shot live satellite space,-1,0
right modi,1,0
rightmodi caught trapokthanks,1,0
place modi copy get benefit,0,1
sauce interesting non bjp state one need lose lot seat,1,0
save india vote narendra modi right capable save country put right track,1,1
saw mode statement referring pm address nation violation code conduct fly kite,1,-1
say modi win,1,1
saying india entered super league space power russia usa china narendra modi said proud moment every indian,1,1
see religion supporting voting modi thanks important,1,1
seeing twin one thing came know much guy scare modi dear cha hai,1,0
seems upa keen much publicity credit modi led nda doesmms indeed humble great,1,1
serious note modi minister ordo portfolio pm directly responsible ordo,-1,0
shameful national conference leader call prime minister narendra modi terrorist,0,-1
shopkeeper said customer said would pay shopkeeper got said would give shoe vote modi customer said ensures vote shopkeeper said would sell,0,0
india please vote modi label anyone anti india,0,0
show level modi never bothered election election result,0,0
sick idiotsbuffoons criminal acre din say modi bubble burst,-1,-1
sir modi used armed force change history particular date worried abhinandan salting air force forgot date carnage gujarat,1,0
sir plz see diff working modi working modi,0,0
sir relative live jayanagar said area bjp strong vote muslim dominant area voted hence bjp lost bjp still win south mainly modi,1,1
sir chance modi contesting bengaluru south high slim,1,0
somebody open direct line call madarchod,1,0
son see man pakistani saying drama maker modi marker,0,0
sound way similar advance got ousted modi using bari masjid issue seat way mrashvin bowled butler smart move,1,1
spec setelight blast good work narendra modi,1,1
spoiled hurt economistdrifted non economic issue like rssperhaps dismissed modi non performance removed rbi governor wish hold post,0,0
still someone banking cast beware modi ji popularity breaking even muslim going vote large number,1,1
stop pitting bjp largest party world like pdp alt lalkaro maatthere pan national vision modify fail understand,-1,0
straight forward really modi hatred becoming hatred country mean everything even mean belittling scientist achievement because endorsed,1,-1
video ensure modi election thx producer,0,1
superb happy know nominated fight election need bright youngster steer india modi,1,1
support modi fully oil price fell saved,0,1
support modi india,0,1
support modi marker participate bjp dist archiv,0,1
swamp seems either logistic smart statement verymuch wise understand chowkidar guardian anything small big like modi chowkidar nation security guard chowkidar building cop chowkidar citizen,-1,1
talk differs differs modi winning mantra dare ask question antinational way better hope win else get back know best standupcomedy,1,1
talk job gdp petrol price woman empowerment rafael soldier lost life last year intelligence failure modimalyaso adaniambanis getting tender without infrastructure,-1,-1
tamil nadu people genius dont like fake modi,-1,0
tamil nadu would progressed lot past year cooperated modi government,1,0
terrorist pakistan want lose opposition win modi election news indian express via,1,-1
terrorist pakistan want lose opposition win modi via namo app,1,-1
thank near time modi born atlas such bhi,0,1
also reason thug he one slogan modi haryana hai god willing one tenure cleaned tide detroit,1,0
look awesome,1,1
spirit night nation citizen never like modi failed way,-1,0
vote bjp hindu,0,0
thats awesome solution must migrate pak shouldnt even wait election modi ji electoral win preordained predefined wait pack leave proto,1,1
thats personal advertisement modi used govt machinery,0,0
announced dent hard new drama staged counter modi undo,-1,0
beauty democracythe mystery modi many good thing bad thing coming mouth like chaiwallachowkidarmahgatbandhan mahamilavitsaboot sport counting till counting demand great indian election,1,1
biggest achievement modi govt exposed called intellectual called fourth killer democracy medium mm upa rule nothing asslicking dynasty master ensure uninterrupted supply biscuit,0,0
comment section week self righteousness mean bjp remember politician distribute grinder mixer laptop etc garner vote,0,0
desperation modi showing reason test election,0,-1
good leadership modi,1,1
look modern invention attributed modi,1,0
modi box part,0,0
national address today clear indication mode disdain model code conduct ethic person play dirty assured defeat,-1,-1
new propaganda manager modi owner pushing chord,1,0
one index pointing sitting moran bharat ninja standing folded hand front home minister running show pretty evident recalled one r pracharak modi working right,1,1
prospect cleaning numerous misunderstanding original comment feel totally overwhelming,1,0
way calling modi chaiwala derogatory remark serious,-1,0
scientist come forward people like spy give address isi anti national group personal interest happen everyone know thispeopl like killed many scientist like time pure hijab yoga kyonki modi,1,1
strongest ally modi jump wherever modi jump far behind place culture india anymore,-1,1
terrorist talking college educated malaria educated know truth brainwashed,-1,-1
three party first letter sub combined fight bjp made butt joke narendra modi made word combination sharia opp party instigated pm leaving letter play,1,1
whole country watched modi ill treated retired armed personnel protesting altar mantra seeking drop brutally dragged tent made disperse maybe dont mind blind bhakthi modi,-1,-1
anything true modi never sold tea gimmick gain sympathy say proven togadia election news,1,1
danger right public deal danger modi needed make india progress without corruption modi bjp support needed break nexus corrupt rotten politician medium bureaucrat cronyism enemy india,-1,-1
many modi lover work place able vote bc,1,1
could time adityanath refuse give ticket modi,0,0
hope left india bjp red,0,1
many news came hate crime india last pastime said good bye current modi regime,1,-1
modi govt program govt program body see problem,0,-1
tinge racism comment modi may upper stratum coat wearing pipe smoking shehzada modi risen mass people underprivileged background start life roadside vandal makeshift tent old dress,1,-1
stretching far wanna pointless debate whether get reservation plain simple blackmailing govt concede demand really deny anything continues another day waiting see community follows example next stir another reservation movement,-1,-1
didnt say anything mode scheme money given wasnt called heart poor country need money least feed child educate dont live poverty acc govt stop subsidy,-1,1
probably pick something stupid surprise people,-1,0
worry pakistan strike take place terrorist camp get destroyed worry prof camp exist modi main bhi chowkidar townhall,1,-1
think also jump like modi thrown lakh last election buddy care winning election people vote wisely,1,1
think modi father thats say,0,0
ace modi double fault,0,-1
brand new information,1,0
fellow threat democracy openly say criticising mode policy anti national bjp make candidate poll bangalore south,0,-1
man even wearing chapel yet see value modi government,0,1
movie show life history narendra modi propaganda community like film hitler jew,-1,0
show popular trustworthy modi much difficult understand,1,1
proud moment credit go thinking modi gut handover big responsibility young man look forward become roll model young one come mainstream politics changed new india dynasty politics,1,1
reminds modi used place say son place,0,0
seriously awesome idea,1,1
show much important bring bjp modi power,1,0
trend showing biopic movie election whether taxi ntr modi healthy stopped,-1,0
tweet perfect gray mode and that follower,1,1
time change mindset people even help modi govt get elected spreading awareness work done poor,-1,0
timeline bombarded raghuram rajanss anti modi statement single day swamijee predicted way way back,-1,0
toby madman representing crown prosecution service said london westminster magistrate court nav modi called witness assist lad threatened killed,-1,-1
today opposition modi called anti national sure number antinationals much time,1,0
told one guy modi performed well economic front response forget economy,1,0
trouble modi political class formidable opponent unlike abv never shy away garb nice open want play dirty rag announcement role despite mcc place modi better,1,1
true modi govt care soldier,1,1
trying gain political mileage mapdata term mode space announcement,0,1
twitter india frivolous suspending account body speaks prime minister modi utterly filthy tweet islamist commits linked twitter india utter disgrace banned india blatant bias,-1,-1
typical alliance indian politics there offer ministry portfolio case smart politics name alliance btw different note many la party got arrested mode tenure apart aap,1,0
ultimate contribution modi,0,0
uncle much afraid dont worry modi,-1,1
modi ordo iso given free hand sans political financial restraint result world see today leadership modi india asset secured rogue nation cant fiddle fart anymore viva india,1,1
upset leader quits bjp hand resignation letter office chowkidar,0,0
unrest desire like modi must awarded post life time mean till death modi book due clean honest corruption free image modi modi urgently required betterment people country,1,1
usual modi fan getting hard unless blood going brainindia multilingualsouth indianepunjab speak sanskritwhy force artificial language themstrength diversity,-1,0
harsh send keeper friendly,1,0
proud narendra modi,1,1
soon modi shah bjp r sent space ever,1,0
waiting new video would suggest make collection promise made raga heist election modi ji achievement,1,0
want watch republic interview modi nowadays good comedy serial,1,1
wasted min mine listening differs jay jaar modi end said meant exactly drum clip he perfect example han he banker talk utopia fact living dystopian currently,1,0
wasted hr say did dig modi speech time india,-1,-1
watch modi address megarally assam moran follow live,1,0
way believed claim made taken quantum jump last year,-1,0
welcome real world modi cancha group ask question anti terrorist nothing le brave enough face phase coming day election hai hai,1,-1
well narendra modi poor wear lakh rupee suit graduated degree fake degree,-1,-1
well rape stem people wanting enforce dominance others would impossible eradicated belief system allow people believe born lesser others,-1,0
ani bros either cover modi masala news ariall nonsense item,0,-1
great statesman modi could written well,1,1
khangress party decade dare question modi year rule,0,1
gained raga minute mode tweet actual announcement contrast,1,1
punch theater comment given modi meet sandal rally,0,0
modi both both haat dense patriotism,0,0
point wire anti bjp editorial slant sarah mag pro bjp slant read one news outlet news something wrong news search unicorn unbiased news nonsensical hell impossible carr sum history mean interpretation people see different event differently summary differ absolute truth exist truth lie someone else little complexity life disturb well afraid problem unless agency engages outright lying slander hate speech give shit really read many different leaning news agency anti bjp rhetoric bjp state one highest muslim population field muslim candidate think good thing hindutva cancer form absolutist ideal,-1,-1
whatever may think modi speech meet bound help party year election pakistan armed force big hit particularly part almost whole haryana,1,1
whatsapp forward,0,0
india aggression feb didnt single statement mouth stuck as sucking modi ghanisballs talk nama haram,-1,-1
modi tweeted addressing nation shortly one best tweet modify such hint bunker tara phage atm tara,1,1
modi learning ride bicycle india already started manufacturing airplane helicopter chandra aan mar mission gold metro mono rail private airport nuclear submarine missile prithvi ani naar dozen nuclear weapon,0,0
senior scientist openly declaring upa discouraged mode bold decision cause achievement assist,1,0
upa could sit rafael procurement sitting another security need mean nothing opposition interested launching modi oblivion catching corruption regular,1,0
whenever anyone talk financial justice poorest called intellectual start ask money come dont ask money come chhota modi ate crore became fugitive,0,1
grade reporter cnn news could mak worth property modi directs concerned official find source desdrohi prostitute isi dalla wont dare accuse hindu terrorist become practice accuse hindu terrorist,1,-1
whereas accomplishment narendra modi false hope ignorance towards truth making every anti modi thing antinational world trip enjoyment killing name guess anti national,-1,-1
whether public debate elite institution india classis underbelly hide essential reading bring elitist response bjp facial campaign slogan,-1,0
joining party jay rada said medium impressed prime minister narendra modi intends work,1,1
accountable side opposition modi blame side dont break india small group fighting among responsible going back east india company day,-1,-1
gave loan nav modi forgotten first family letter,1,0
forget dramatic lol,1,0
business channel networked owner propagating modi hate medium professional neutral report play card independence affected resign individual team important time cnbc ethic visible sad,-1,-1
modi talk flight announcement renaming station go tamil nadu colleague explains,0,0
moreover dani efficient competitor airport regulation bid none nothing wrong dani relative modi,0,0
bookmyshow available magnificent essential earth shattering life changing act stand comedy modi raga kanhaiya anybody selling rally ticket fund party activity would actually reform indian politics,1,1
shouldnt modi take responsibility,0,0
tho high voltage narendra modi say india shot loworbit satellite,-1,0
ballot modi falklands thatched smaller party answer,0,1
china india compete technology dangerous step help alleviate poverty india announcement help modi win election,1,1
continue type misuse power modi know action taken bjp perhaps big politician deny obey law,1,-1
election commission control operate indian armed force country attack invade india modi nation till next lok sabha come force fool insane kya carey netaaon aur medium dimaag ha channel aaa hai,-1,-1
modi ever contest south,0,0
wtf believe someone find thailand better india fucking thailand shit people shit attitude worse shit hole person edit btw totally see sim card taxi etc would nightmare,-1,-1
yeah vote against modi,0,0
yeah great modi know everything below professor economy reputed institute india indian institute andre that,1,1
yes credit need given scientist worker whoever associated project way pointing political battle field yes narendra modi team get full credit jai hind,1,1
yes hui thi bus marketing nazi thi modi hai marketing expert know run govt better government,-1,1
yes right criticize even talking environment become cheer leader modi say kind jump,1,1
yes modi need communicate people due nya inflation ruin life,-1,0
yes modi win people always support antinational party,0,1
yes modi right question none atleast anyone spine,1,1
yes sir vote modi,0,1
yes sold vote unemployment col mode next term false propaganda marketing buyer smiling face smiling face smiling face,-1,1
giving extra given today modi govt else honest sha give detail,1,1
shameless slave dynastic politics lord krishna came finish duryodhan modi finish dynasty,0,-1
dared question modi govt job economy price rise lakh absolutely antinational according bjp rule book,1,0
made biggest mistake handing hand paper people happy narendra modi,-1,1
never learnt anything bad experience experience made away last year trend continue till modi india,-1,1
rather request election committee prime minister modi doesnt held election,0,0
want modi report card detail failed promise,-1,0
young honest visionary promising leader deshakke modi dakshinake sure say modi leadership much courage year old even though he contesting year old guy something else,1,1
dad grandfather pride nation tell surely stand modi but seriously may advise bring bad name,-1,-1
game longer secret began bringing party worker studio prompting shout modi modi theatrical manner shooting modi opponent tweet orchestrated shooting done,-1,1
view person call chowkidar choir call public chant thisvin public rally deserving shame traditional modi later spread half truth wine mean illusion,1,0
youre hope future country hand modi corporate gang looting fleeing country modi think run factory lie time must show india really stand modi corporate,1,1
youth interested politics complain bout pocket money parentsbaccho modi vote den aur amount pocket money mei yada made lenathik yeh nya shankar mei baht small iaaf mil sha sabha kogareeb middle class,-1,0
yup biggest grouse expose make open public evil gonna face modi doesnt come back people stop respecting deity evil fear,-1,-1
chowkidar modi turn chaiwala assam tea belt,0,0
far best prime minister india today abbr bed wish narendra modi elected actor reply vote kar campaign via namo app thanks abbr bed,1,1
obviously service country work day never took vacation holiday life remember bother every country worse term india expecting explain agenda visit take question press conference visit modi honest tireless hardworker trust make india super power next year question insulting india sit back enjoy always next year like ahead blame near,-1,1
everyone power dream dream turned resolution never allow idea die narendra modi,0,1
