many seat needed state clear majority,1,1
local paper report object captured satellite always grain salt,0,0
professor like buddha log nai change home madam master qualification required hot,0,1
see pub ban notification mar mar ahmedabad mar april racket exam season right probably police commissioner son daughter nephew niece addicted,-1,-1
people dont miss watch official trailer upcoming show inspiring subscribe erosion april get annual subscription,1,1
also qualified chowkidar,0,0
fuck capitalist good thing glorious solidarity,1,1
shoot satellite omigod congratulation entire space program specialist indian,-1,1
corruption glue bind congress corrupt,-1,0
anyone update potential fire suppression bottle washed maldives call unknown cell phone burner captain expect flight sim deleted data recovered know tracking boy tracking new satellite image thanks advance edit added question,1,0
chawkidaar machine yadav,1,0
guy across pond mind government hoping south indian influenced congress government follow perhaps correspond iran khan attempt peace negotiation murderer government reflect value,0,1
haha kya indian damage pas people anti anti satellite technology hai hane koi satellite launch nhi kia garage kya india,1,-1
often see photo mahatma gandhi every road city,0,0
look like loc extra hot tonight rumour atom heavy artillery short range missile used three true major escalation possibly aggression escalation one side tonight,1,1
mud trying capture space area well camden par tanasahi kirke pet nazi chara tuba tuba,0,0
namo cache plane like band hai kya usa uranium lane gay hai camara chaiwala,0,1
none party spoken much plan safeguarding environment improving air quality cleaning water,1,1
patel she please look angle,1,0
india congress want speak language,0,0
save political discussion whether specialized medicine good real question money coming program like would extremely expensive tradeoff made make happen,1,1
telangana cr fighting congress party claimed surgical strike carried upa government,0,0
reason enough consider voting congress,0,0
general view net neutrality think government take control internet free hope late,1,1
god said indian voted power calculate effect highly quality after,1,0
